,all_awardings,allow_live_comments,author,author_flair_css_class,author_flair_richtext,author_flair_text,author_flair_type,author_fullname,author_is_blocked,author_patreon_flair,author_premium,awarders,can_mod_post,contest_mode,created_utc,domain,full_link,gildings,id,is_created_from_ads_ui,is_crosspostable,is_meta,is_original_content,is_reddit_media_domain,is_robot_indexable,is_self,is_video,link_flair_background_color,link_flair_richtext,link_flair_template_id,link_flair_text,link_flair_text_color,link_flair_type,locked,media_only,no_follow,num_comments,num_crossposts,over_18,parent_whitelist_status,permalink,pinned,post_hint,preview,pwls,removed_by_category,retrieved_on,score,selftext,send_replies,spoiler,stickied,subreddit,subreddit_id,subreddit_subscribers,subreddit_type,thumbnail,thumbnail_height,thumbnail_width,title,total_awards_received,treatment_tags,upvote_ratio,url,url_overridden_by_dest,whitelist_status,wls,created
0,[],False,MortgageSlayer2019,,[],,text,t2_qmgi47e,False,False,False,[],False,False,1651503546,i.redd.it,https://www.reddit.com/r/terraluna/comments/ugrjay/echelon_chain_is_choosing_terra_ust_over_usdc/,{},ugrjay,False,False,False,False,True,False,False,False,#dadada,[],773e7b1a-be27-11eb-a721-0eb5d708beb5,Terra Ecosystem,dark,text,False,False,True,0,0,False,all_ads,/r/terraluna/comments/ugrjay/echelon_chain_is_choosing_terra_ust_over_usdc/,False,image,"{'enabled': True, 'images': [{'id': 'O8Pv_mSOnBLtHvX9fzL85hEuB9eyKmbdesKNvDN0itc', 'resolutions': [{'height': 124, 'url': 'https://preview.redd.it/s0mk63ifu2x81.jpg?width=108&amp;crop=smart&amp;auto=webp&amp;s=309a54594406066d31c67335009e10b93b0a55d5', 'width': 108}, {'height': 248, 'url': 'https://preview.redd.it/s0mk63ifu2x81.jpg?width=216&amp;crop=smart&amp;auto=webp&amp;s=04bf787f042080f4193d0fdb46900f0fd673dbcc', 'width': 216}, {'height': 368, 'url': 'https://preview.redd.it/s0mk63ifu2x81.jpg?width=320&amp;crop=smart&amp;auto=webp&amp;s=9876424f91b02afc81fbed132c4c7478d798a327', 'width': 320}, {'height': 736, 'url': 'https://preview.redd.it/s0mk63ifu2x81.jpg?width=640&amp;crop=smart&amp;auto=webp&amp;s=90d41d36ab33ceae6404dbdee2770e5d7001d28b', 'width': 640}, {'height': 1104, 'url': 'https://preview.redd.it/s0mk63ifu2x81.jpg?width=960&amp;crop=smart&amp;auto=webp&amp;s=ec26a3d451c549d1639f39b9bc783bfb978e693e', 'width': 960}], 'source': {'height': 1235, 'url': 'https://preview.redd.it/s0mk63ifu2x81.jpg?auto=webp&amp;s=cbae6a861567698cde0b2e288759747335319380', 'width': 1073}, 'variants': {}}]}",6,reddit,1651503556,1,,True,False,False,terraluna,t5_2y4t5,39567,public,https://b.thumbs.redditmedia.com/PCs_TP8-T8UP22ul9bpRmnbRiVpx5GzAjWZKuLBDySQ.jpg,140.0,140.0,Echelon chain is choosing Terra UST over USDC. More and more adoption coming for UST,0,[],1.0,https://i.redd.it/s0mk63ifu2x81.jpg,https://i.redd.it/s0mk63ifu2x81.jpg,all_ads,6,1651474746.0
1,[],False,Born_Slice_7809,,[],,text,t2_8be7txlg,False,False,False,[],False,False,1651492298,coinavalon.io,https://www.reddit.com/r/terraluna/comments/ugnvfy/how_to_use_anchor_protocol_save_lend_and_earn/,{},ugnvfy,False,False,False,False,False,False,False,False,#dadada,[],773e7b1a-be27-11eb-a721-0eb5d708beb5,Terra Ecosystem,dark,text,False,False,True,0,0,False,all_ads,/r/terraluna/comments/ugnvfy/how_to_use_anchor_protocol_save_lend_and_earn/,False,link,"{'enabled': False, 'images': [{'id': 'odit301aH4o0Y_PB8c73JI-Mez0vyX3f54A5r3Qc0vQ', 'resolutions': [{'height': 72, 'url': 'https://external-preview.redd.it/opuiH3u7OMIENLQpckG7eAsjLFHsnbsab37YZ1zgIAE.jpg?width=108&amp;crop=smart&amp;auto=webp&amp;s=052c6e77c4efc31749fecff6cc855b8f4130397e', 'width': 108}, {'height': 144, 'url': 'https://external-preview.redd.it/opuiH3u7OMIENLQpckG7eAsjLFHsnbsab37YZ1zgIAE.jpg?width=216&amp;crop=smart&amp;auto=webp&amp;s=2cc66cbf3d2a4830d3a35ca797cee66dbe2ff32d', 'width': 216}, {'height': 213, 'url': 'https://external-preview.redd.it/opuiH3u7OMIENLQpckG7eAsjLFHsnbsab37YZ1zgIAE.jpg?width=320&amp;crop=smart&amp;auto=webp&amp;s=60f0c54b1bc9c551c0f998700b80766c59dee7fb', 'width': 320}, {'height': 427, 'url': 'https://external-preview.redd.it/opuiH3u7OMIENLQpckG7eAsjLFHsnbsab37YZ1zgIAE.jpg?width=640&amp;crop=smart&amp;auto=webp&amp;s=77e19db1f128fe9f78f6921d7b7e9ddd5374b07e', 'width': 640}, {'height': 641, 'url': 'https://external-preview.redd.it/opuiH3u7OMIENLQpckG7eAsjLFHsnbsab37YZ1zgIAE.jpg?width=960&amp;crop=smart&amp;auto=webp&amp;s=5f16b142f82a048a9dec405482a464078ad6184d', 'width': 960}, {'height': 721, 'url': 'https://external-preview.redd.it/opuiH3u7OMIENLQpckG7eAsjLFHsnbsab37YZ1zgIAE.jpg?width=1080&amp;crop=smart&amp;auto=webp&amp;s=b4d19e2097ff87f9d7186ea6d20176766726d1bf', 'width': 1080}], 'source': {'height': 1026, 'url': 'https://external-preview.redd.it/opuiH3u7OMIENLQpckG7eAsjLFHsnbsab37YZ1zgIAE.jpg?auto=webp&amp;s=905ed624947ec4185f4f0e5eaf8795b1c1d255b6', 'width': 1536}, 'variants': {}}]}",6,reddit,1651492309,1,,True,False,False,terraluna,t5_2y4t5,39555,public,https://a.thumbs.redditmedia.com/MzXhQp8cGsD_FM3fFavXdrqjp4e6YHG2b5w8PXltdE4.jpg,93.0,140.0,"How to use Anchor Protocol – Save, Lend and Earn",0,[],1.0,https://coinavalon.io/blog/how-to-use-anchor-protocol-save-lend-and-earn/,https://coinavalon.io/blog/how-to-use-anchor-protocol-save-lend-and-earn/,all_ads,6,1651463498.0
2,[],False,leomets,,[],,text,t2_rwnvg50,False,False,False,[],False,False,1651491930,self.terraluna,https://www.reddit.com/r/terraluna/comments/ugnrz9/struggling_to_understand_how_this_ecosystem_is/,{},ugnrz9,False,False,False,False,False,False,True,False,#7193ff,[],844cbda8-be27-11eb-b4ba-0e4cc1e38c35,Discussion,dark,text,False,False,True,0,0,False,all_ads,/r/terraluna/comments/ugnrz9/struggling_to_understand_how_this_ecosystem_is/,False,,,6,reddit,1651491940,1,[removed],True,False,False,terraluna,t5_2y4t5,39554,public,self,,,Struggling to understand how this ecosystem is sustainable.,0,[],1.0,https://www.reddit.com/r/terraluna/comments/ugnrz9/struggling_to_understand_how_this_ecosystem_is/,,all_ads,6,1651463130.0
3,[],False,dostagram,,[],,text,t2_5zk2n3bd,False,False,False,[],False,False,1651490166,self.terraluna,https://www.reddit.com/r/terraluna/comments/ugnbb8/issue_with_offramp_ust_busd/,{},ugnbb8,False,True,False,False,False,True,True,False,#ea0027,[],e2e89fae-d1ae-11eb-ac7c-0eaa7b7dd161,Support,light,text,False,False,True,1,0,False,all_ads,/r/terraluna/comments/ugnbb8/issue_with_offramp_ust_busd/,False,,,6,,1651490177,1,"Hey guys,

I've just tried to withdraw my UST from Anchor via the following Binance Smart Chain off-ramp route: 

1. Anchor (UST) -&gt; Terra Station (UST)
2. Terra Station (UST) -&gt; Terra Bridge (Wormhole) -&gt; MetaMask (UST)
3. MetaMask (UST) -&gt; BiSwap -&gt; MetaMask (BUSD)
4. MetaMask (BUSD) -&gt; Binance (BUSD) 

This is basically the opposite of the on-ramp which I have been using for months now, without fail.

The problem I have encountered is at step 3, where I cannot convert my UST to BUSD as somewhere during the bridging process it has been converted to Wormhole UST??

&amp;#x200B;

Does anyone know how I can convert Wormhole UST to BUSD on the Binance Smart Chain?",True,False,False,terraluna,t5_2y4t5,39553,public,self,,,Issue with Off-Ramp UST -&gt; BUSD,0,[],1.0,https://www.reddit.com/r/terraluna/comments/ugnbb8/issue_with_offramp_ust_busd/,,all_ads,6,1651461366.0
4,[],False,Pleasek89,,[],,text,t2_joloy66i,False,False,False,[],False,False,1651487505,self.terraluna,https://www.reddit.com/r/terraluna/comments/ugmmzq/you_guys_are_insane_beyond_insane_to_buy_into_the/,{},ugmmzq,False,True,False,False,False,True,True,False,#7193ff,[],844cbda8-be27-11eb-b4ba-0e4cc1e38c35,Discussion,dark,text,False,False,True,0,0,False,all_ads,/r/terraluna/comments/ugmmzq/you_guys_are_insane_beyond_insane_to_buy_into_the/,False,,,6,,1651487515,1,"This smells pyramid scheme so much the government in Egypt started to do their own research. Anyone with an IQ higher than 30 already figured out this ponzi months ago and it was all about picking the right moment to short. There is a reason everybody calls you ""Lunatics"".

Indices down with a major global crisis looming, Bitcoin heavily down and will probably break 35k soon and you figure it's a good idea to go long on Luna. LOL I'm shorting this coin to the ground without leverage just in case your ponzi king decides to do a last minute pump and dump. 

Calling 50$ or less until the end of this or next week. Lunaconneeecccct",True,False,False,terraluna,t5_2y4t5,39549,public,self,,,You guys are insane beyond insane to buy into the hype,0,[],1.0,https://www.reddit.com/r/terraluna/comments/ugmmzq/you_guys_are_insane_beyond_insane_to_buy_into_the/,,all_ads,6,1651458705.0
5,[],False,atlonglastALI,,[],,text,t2_5i3c8d06,False,False,False,[],False,False,1651487059,self.terraluna,https://www.reddit.com/r/terraluna/comments/ugmj6a/what_effects_does_lunas_price_have_on_ust/,{},ugmj6a,False,True,False,False,False,True,True,False,#7193ff,[],844cbda8-be27-11eb-b4ba-0e4cc1e38c35,Discussion,dark,text,False,False,True,0,0,False,all_ads,/r/terraluna/comments/ugmj6a/what_effects_does_lunas_price_have_on_ust/,False,,,6,,1651487070,1,"Hey, obviously the market has been underperforming to say the least. It's pretty clear that it's markets as a whole (incl. stocks), not just crypto. Personally I think LUNA has held up relatively well.

&amp;#x200B;

What effect on UST does a continual fall in price of LUNA entail? Taking into account the changes in Anchor, and therefore *potentially* lessening the burning of lunas 

&amp;#x200B;

Thanks in advance.",True,False,False,terraluna,t5_2y4t5,39548,public,self,,,What effect(s) does LUNA's price have on UST?,0,[],1.0,https://www.reddit.com/r/terraluna/comments/ugmj6a/what_effects_does_lunas_price_have_on_ust/,,all_ads,6,1651458259.0
6,[],False,FanOnMedium8492,,[],,text,t2_39lx6r4q,False,False,False,[],False,False,1651473352,self.terraluna,https://www.reddit.com/r/terraluna/comments/ugjf1d/alice_finance_referral_code_for_app/,{},ugjf1d,False,True,False,False,False,True,True,False,#8844f6,[],58bcf2d4-be27-11eb-8d50-0e227113ea6b,Alice,light,text,False,False,False,0,0,False,all_ads,/r/terraluna/comments/ugjf1d/alice_finance_referral_code_for_app/,False,,,6,,1651473363,1,"Hi guys, does anyone have a referral code I could use for Alice? Any appreciated. Feel free to DM me.",True,False,False,terraluna,t5_2y4t5,39537,public,self,,,Alice Finance Referral Code for App,0,[],1.0,https://www.reddit.com/r/terraluna/comments/ugjf1d/alice_finance_referral_code_for_app/,,all_ads,6,1651444552.0
7,[],False,TopBridge6057,,[],,text,t2_3tp6t49i,False,False,True,[],False,False,1651472173,self.terraluna,https://www.reddit.com/r/terraluna/comments/ugj4yh/would_love_an_extra_alice_referral_code_if_anyone/,{},ugj4yh,False,True,False,False,False,True,True,False,#7193ff,[],844cbda8-be27-11eb-b4ba-0e4cc1e38c35,Discussion,dark,text,False,False,True,0,0,False,all_ads,/r/terraluna/comments/ugj4yh/would_love_an_extra_alice_referral_code_if_anyone/,False,,,6,,1651472184,1,,True,False,False,terraluna,t5_2y4t5,39535,public,self,,,would love an extra Alice referral code if anyone has one!!,0,[],1.0,https://www.reddit.com/r/terraluna/comments/ugj4yh/would_love_an_extra_alice_referral_code_if_anyone/,,all_ads,6,1651443373.0
8,[],False,Silvasbrokenleg,,[],,text,t2_5h9rqp3z,False,False,False,[],False,False,1651472145,self.terraluna,https://www.reddit.com/r/terraluna/comments/ugj4pl/would_anyone_be_able_to_share_alice_finance/,{},ugj4pl,False,True,False,False,False,True,True,False,#8844f6,[],58bcf2d4-be27-11eb-8d50-0e227113ea6b,Alice,light,text,False,False,True,0,0,False,all_ads,/r/terraluna/comments/ugj4pl/would_anyone_be_able_to_share_alice_finance/,False,,,6,,1651472155,1,Hello All! I had just found out about Alice Finance but was told I needed an invite code. Would any kind soul be able to share? Thank you in advance!,True,False,False,terraluna,t5_2y4t5,39535,public,self,,,Would anyone be able to share Alice Finance Invite Code?,0,[],1.0,https://www.reddit.com/r/terraluna/comments/ugj4pl/would_anyone_be_able_to_share_alice_finance/,,all_ads,6,1651443345.0
9,[],False,Low_Whilee,,[],,text,t2_99osnk78,False,False,False,[],False,False,1651466511,self.terraluna,https://www.reddit.com/r/terraluna/comments/ughq9v/terra_luna_elastic_supply_question/,{},ughq9v,False,True,False,False,False,True,True,False,#dadada,[],773e7b1a-be27-11eb-a721-0eb5d708beb5,Terra Ecosystem,dark,text,False,False,True,0,0,False,all_ads,/r/terraluna/comments/ughq9v/terra_luna_elastic_supply_question/,False,,,6,,1651466522,1,"Terra Luna supply

Is it appropriate to compare the concept of Luna and UST elastic supply, with the mechanics of LP AMM, where the similarity is in the price determination mechanism. And the difference is that instead of swap, there is an algorithmic generation of the calculated number of tokens, and burning of the opposite currency?",True,False,False,terraluna,t5_2y4t5,39527,public,self,,,Terra Luna Elastic supply question,0,[],1.0,https://www.reddit.com/r/terraluna/comments/ughq9v/terra_luna_elastic_supply_question/,,all_ads,6,1651437711.0
10,[],False,0verview,,[],,text,t2_37qgsk20,False,False,False,[],False,False,1651465526,self.terraluna,https://www.reddit.com/r/terraluna/comments/ughgsj/best_ada_to_ust_pairing_exchange_looking_for_best/,{},ughgsj,False,True,False,False,False,True,True,False,#7193ff,[],844cbda8-be27-11eb-b4ba-0e4cc1e38c35,Discussion,dark,text,False,False,True,0,0,False,all_ads,/r/terraluna/comments/ughgsj/best_ada_to_ust_pairing_exchange_looking_for_best/,False,,,6,,1651465537,1,,True,False,False,terraluna,t5_2y4t5,39527,public,self,,,Best ADA to UST pairing exchange? Looking for best options to trade between them.,0,[],1.0,https://www.reddit.com/r/terraluna/comments/ughgsj/best_ada_to_ust_pairing_exchange_looking_for_best/,,all_ads,6,1651436726.0
11,[],False,jspark971,,[],,text,t2_1s02q88n,False,False,False,[],False,False,1651464315,self.terraluna,https://www.reddit.com/r/terraluna/comments/ugh57b/anyone_also_has_alice_beta_code/,{},ugh57b,False,True,False,False,False,True,True,False,#8844f6,[],58bcf2d4-be27-11eb-8d50-0e227113ea6b,Alice,light,text,False,False,True,0,0,False,all_ads,/r/terraluna/comments/ugh57b/anyone_also_has_alice_beta_code/,False,,,6,,1651464325,1,"I am looking for alice ramp code, if anyone has extra code they can share, pm me!

Thank you for reading my post and have a nice day!",True,False,False,terraluna,t5_2y4t5,39526,public,self,,,Anyone also has alice beta code?,0,[],1.0,https://www.reddit.com/r/terraluna/comments/ugh57b/anyone_also_has_alice_beta_code/,,all_ads,6,1651435515.0
12,[],False,RevolutionaryMood471,,[],,text,t2_f054z9mg,False,False,False,[],False,False,1651459701,self.terraluna,https://www.reddit.com/r/terraluna/comments/ugfvef/dex_for_erc20_luna_to_erc20_dai/,{},ugfvef,False,True,False,False,False,True,True,False,#7193ff,[],844cbda8-be27-11eb-b4ba-0e4cc1e38c35,Discussion,dark,text,False,False,True,0,0,False,all_ads,/r/terraluna/comments/ugfvef/dex_for_erc20_luna_to_erc20_dai/,False,,,6,,1651459712,1,What’s the best way to change from ERC20 Luna to ERC20 DAI?,True,False,False,terraluna,t5_2y4t5,39524,public,self,,,Dex for ERC20 Luna to ERC20 DAI,0,[],1.0,https://www.reddit.com/r/terraluna/comments/ugfvef/dex_for_erc20_luna_to_erc20_dai/,,all_ads,6,1651430901.0
13,[],False,djhomeless,,[],,text,t2_4di03,False,False,False,[],False,False,1651459511,self.terraluna,https://www.reddit.com/r/terraluna/comments/ugftbr/anyone_with_extra_alice_invite_codes/,{},ugftbr,False,True,False,False,False,True,True,False,#8844f6,[],58bcf2d4-be27-11eb-8d50-0e227113ea6b,Alice,light,text,False,False,True,0,0,False,all_ads,/r/terraluna/comments/ugftbr/anyone_with_extra_alice_invite_codes/,False,,,6,,1651459521,1,"It anyone has an extra Alice code to share please let me know. I don't want to pay for one and I know about kash.io, will be happy to see pay the other codes forward. Please no chat requests/scams.",True,False,False,terraluna,t5_2y4t5,39524,public,self,,,Anyone with extra Alice invite codes?,0,[],1.0,https://www.reddit.com/r/terraluna/comments/ugftbr/anyone_with_extra_alice_invite_codes/,,all_ads,6,1651430711.0
14,[],False,-Elboddarb-,,[],,text,t2_3gi34dj4,False,False,False,[],False,False,1651445350,self.terraluna,https://www.reddit.com/r/terraluna/comments/ugbhom/error_code_404_on_wormhole_help_please/,{},ugbhom,False,True,False,False,False,True,True,False,#ea0027,[],e2e89fae-d1ae-11eb-ac7c-0eaa7b7dd161,Support,light,text,False,False,True,1,0,False,all_ads,/r/terraluna/comments/ugbhom/error_code_404_on_wormhole_help_please/,False,,,6,,1651445360,1,"I am using wormhole to send ETH to Anker Protocol, I have sent the ETH, but when it comes to redeeming it on the other side all I am getting is error code 404. Anyone know how to fix this?",True,False,False,terraluna,t5_2y4t5,39517,public,self,,,Error code 404 on wormhole? Help please,0,[],1.0,https://www.reddit.com/r/terraluna/comments/ugbhom/error_code_404_on_wormhole_help_please/,,all_ads,6,1651416550.0
15,[],False,owenphillips_,,[],,text,t2_8mz0ww3h,False,False,False,[],False,False,1651444524,self.terraluna,https://www.reddit.com/r/terraluna/comments/ugb7q7/terra_station_to_alice_finance_minimum/,{},ugb7q7,False,True,False,False,False,True,True,False,#8844f6,[],58bcf2d4-be27-11eb-8d50-0e227113ea6b,Alice,light,text,False,False,True,0,0,False,all_ads,/r/terraluna/comments/ugb7q7/terra_station_to_alice_finance_minimum/,False,,,6,,1651444534,1,"Hey guys,

I have been trying to send just under $55 of UST from Terra Station to Alice Finance, however, I keep receiving the error message 'failed to execute message; message index \[amount\] is smaller than \[amount\]: insufficient funds'.

I'd imagine I am trying to send too little across, has anyone come across this issue, and if so what is the minimum? 

Thanks. 😀",True,False,False,terraluna,t5_2y4t5,39515,public,self,,,Terra Station to Alice Finance minimum?,0,[],1.0,https://www.reddit.com/r/terraluna/comments/ugb7q7/terra_station_to_alice_finance_minimum/,,all_ads,6,1651415724.0
16,[],False,antelopejackfruit,,[],,text,t2_8kseb6in,False,False,False,[],False,False,1651440383,self.terraluna,https://www.reddit.com/r/terraluna/comments/ug9tz3/alice_vs_anchor_protocol_apy_difference/,{},ug9tz3,False,True,False,False,False,True,True,False,#8844f6,[],58bcf2d4-be27-11eb-8d50-0e227113ea6b,Alice,light,text,False,False,True,0,0,False,all_ads,/r/terraluna/comments/ug9tz3/alice_vs_anchor_protocol_apy_difference/,False,,,6,,1651440394,1,"I'm seeing the APY is 16.5% in Alice but it's 18% in Anchor.

Anyone know why this is? Did Alice start keeping some of the interest for themselves?",True,False,False,terraluna,t5_2y4t5,39516,public,self,,,Alice vs. Anchor Protocol APY Difference,0,[],1.0,https://www.reddit.com/r/terraluna/comments/ug9tz3/alice_vs_anchor_protocol_apy_difference/,,all_ads,6,1651411583.0
17,[],False,Belmont_the_IV,,[],,text,t2_3945r6ha,False,False,False,[],False,False,1651434278,self.terraluna,https://www.reddit.com/r/terraluna/comments/ug7p05/3_drop_in_apy_on_anchor_protocol_on_first_day_of/,{},ug7p05,False,False,False,False,False,False,True,False,#7193ff,[],844cbda8-be27-11eb-b4ba-0e4cc1e38c35,Discussion,dark,text,False,False,True,0,0,False,all_ads,/r/terraluna/comments/ug7p05/3_drop_in_apy_on_anchor_protocol_on_first_day_of/,False,,,6,reddit,1651434289,1,[removed],True,False,False,terraluna,t5_2y4t5,39504,public,self,,,3% drop in APY on anchor protocol on first day of voted proposal....,0,[],1.0,https://www.reddit.com/r/terraluna/comments/ug7p05/3_drop_in_apy_on_anchor_protocol_on_first_day_of/,,all_ads,6,1651405478.0
18,[],False,Dazzling-Ad-2913,,[],,text,t2_h0egx04m,False,False,False,[],False,False,1651434257,csnmining.us,https://www.reddit.com/r/terraluna/comments/ug7oqr/if_you_are_looking_for_crypto_miners_here_is_the/,{},ug7oqr,False,True,False,False,False,True,False,False,#ab912b,[],692c7f0e-e7cb-11eb-a117-0ed30301aa27,News,light,text,False,False,True,0,0,False,all_ads,/r/terraluna/comments/ug7oqr/if_you_are_looking_for_crypto_miners_here_is_the/,False,link,"{'enabled': False, 'images': [{'id': '9N8oM3v4MKCU-ofvKJCGtpCHyBzFfgRKQQxlFXYQeL4', 'resolutions': [{'height': 64, 'url': 'https://external-preview.redd.it/_geN6OkigBA8uaRtmt6i4mGlBz17fcqW9Vu1Z3oJwLI.jpg?width=108&amp;crop=smart&amp;auto=webp&amp;s=12750e03233f70d2cc45ea33110244aba9a9f5f1', 'width': 108}, {'height': 128, 'url': 'https://external-preview.redd.it/_geN6OkigBA8uaRtmt6i4mGlBz17fcqW9Vu1Z3oJwLI.jpg?width=216&amp;crop=smart&amp;auto=webp&amp;s=a4083d4137f7f5065e7906ec433e6e7e8b94b8e8', 'width': 216}, {'height': 190, 'url': 'https://external-preview.redd.it/_geN6OkigBA8uaRtmt6i4mGlBz17fcqW9Vu1Z3oJwLI.jpg?width=320&amp;crop=smart&amp;auto=webp&amp;s=3f4d0c1ffc1e7d491c8a4362885abb91809fff20', 'width': 320}, {'height': 380, 'url': 'https://external-preview.redd.it/_geN6OkigBA8uaRtmt6i4mGlBz17fcqW9Vu1Z3oJwLI.jpg?width=640&amp;crop=smart&amp;auto=webp&amp;s=ff18dc1b3b52d79bc848d26d694bb8fb3dff8b94', 'width': 640}], 'source': {'height': 530, 'url': 'https://external-preview.redd.it/_geN6OkigBA8uaRtmt6i4mGlBz17fcqW9Vu1Z3oJwLI.jpg?auto=webp&amp;s=036bc7d8156c490d025a5efd7600ff0938060e87', 'width': 892}, 'variants': {}}]}",6,,1651434268,1,,True,False,False,terraluna,t5_2y4t5,39504,public,https://b.thumbs.redditmedia.com/Qq_vrmYfe3VuqBQnSoMI6zYJHdi86cBEptIk2jO_r9w.jpg,83.0,140.0,"If you are looking for Crypto Miners, here is the best place",0,[],1.0,http://csnmining.us,http://csnmining.us,all_ads,6,1651405457.0
19,[],False,owenphillips_,,[],,text,t2_8mz0ww3h,False,False,False,[],False,False,1651432839,i.redd.it,https://www.reddit.com/r/terraluna/comments/ug7778/is_there_a_minimum_you_can_send_from_terra/,{},ug7778,False,False,False,False,True,False,False,False,#8844f6,[],58bcf2d4-be27-11eb-8d50-0e227113ea6b,Alice,light,text,False,False,True,0,0,False,all_ads,/r/terraluna/comments/ug7778/is_there_a_minimum_you_can_send_from_terra/,False,image,"{'enabled': True, 'images': [{'id': 'NT4USzXa1FP--fJpq3fHOOFaU3HEBTtIyioG7Ioo3jk', 'resolutions': [{'height': 91, 'url': 'https://preview.redd.it/7n5ecuk60xw81.jpg?width=108&amp;crop=smart&amp;auto=webp&amp;s=c36b1e4980c1f515292599a97171ef9c7100a965', 'width': 108}, {'height': 183, 'url': 'https://preview.redd.it/7n5ecuk60xw81.jpg?width=216&amp;crop=smart&amp;auto=webp&amp;s=b44a51e37d167f8b6722db5ccdc4c5acfbb13667', 'width': 216}, {'height': 272, 'url': 'https://preview.redd.it/7n5ecuk60xw81.jpg?width=320&amp;crop=smart&amp;auto=webp&amp;s=c34fb5a569a31e1e6a1f7d9e2123287bc37e2166', 'width': 320}, {'height': 544, 'url': 'https://preview.redd.it/7n5ecuk60xw81.jpg?width=640&amp;crop=smart&amp;auto=webp&amp;s=b685c6f7cd6e212bd84bec68198e899f2c5a965b', 'width': 640}, {'height': 817, 'url': 'https://preview.redd.it/7n5ecuk60xw81.jpg?width=960&amp;crop=smart&amp;auto=webp&amp;s=ad3c962f6a1389474c177aa7a4d6b1ead975b35c', 'width': 960}, {'height': 919, 'url': 'https://preview.redd.it/7n5ecuk60xw81.jpg?width=1080&amp;crop=smart&amp;auto=webp&amp;s=c746a9b5f17f4f22e8f90337305880a80f42d700', 'width': 1080}], 'source': {'height': 996, 'url': 'https://preview.redd.it/7n5ecuk60xw81.jpg?auto=webp&amp;s=1deb03d9629b27c96d4bbb35a603f43353c6bf43', 'width': 1170}, 'variants': {}}]}",6,reddit,1651432850,1,,True,False,False,terraluna,t5_2y4t5,39503,public,https://b.thumbs.redditmedia.com/FNn_e8WK1l1qy9RiNlZLSyATka3t8oZLgSxmxQqalDs.jpg,119.0,140.0,Is there a minimum you can send from Terra Station to Alice Finance?,0,[],1.0,https://i.redd.it/7n5ecuk60xw81.jpg,https://i.redd.it/7n5ecuk60xw81.jpg,all_ads,6,1651404039.0
20,[],False,ChampionSonBLCH,,[],,text,t2_czjkdlo6,False,False,False,[],False,False,1651431571,/r/terraluna/comments/ug6r0x/g999_is_rising_to_new_heights_with_demand_grows/,https://www.reddit.com/r/terraluna/comments/ug6r0x/g999_is_rising_to_new_heights_with_demand_grows/,{},ug6r0x,False,True,False,False,False,True,False,True,#ccac2b,[],ae46bbfe-b189-11eb-9bf3-0eb4caf9eebf,Airdrop Update,dark,text,False,False,True,0,0,False,all_ads,/r/terraluna/comments/ug6r0x/g999_is_rising_to_new_heights_with_demand_grows/,False,hosted:video,"{'enabled': False, 'images': [{'id': 'jnN4lSwcAO52aWx8IfDRB_H82jIk1Wne-8SvGTXwjQQ', 'resolutions': [{'height': 191, 'url': 'https://external-preview.redd.it/J1nV5BTIWz-aaRBkXSDF6xQWrNdguDk8ylkF_aw04P8.png?width=108&amp;crop=smart&amp;format=pjpg&amp;auto=webp&amp;s=4fab228a70ee6641fb55707140baa49ee74de62f', 'width': 108}, {'height': 383, 'url': 'https://external-preview.redd.it/J1nV5BTIWz-aaRBkXSDF6xQWrNdguDk8ylkF_aw04P8.png?width=216&amp;crop=smart&amp;format=pjpg&amp;auto=webp&amp;s=3e93bea14d812ff987d6f7a1f0c3c00eafcdb474', 'width': 216}, {'height': 568, 'url': 'https://external-preview.redd.it/J1nV5BTIWz-aaRBkXSDF6xQWrNdguDk8ylkF_aw04P8.png?width=320&amp;crop=smart&amp;format=pjpg&amp;auto=webp&amp;s=e23d0a50440a6ff600a4f69a99267f484a8ea283', 'width': 320}, {'height': 1136, 'url': 'https://external-preview.redd.it/J1nV5BTIWz-aaRBkXSDF6xQWrNdguDk8ylkF_aw04P8.png?width=640&amp;crop=smart&amp;format=pjpg&amp;auto=webp&amp;s=70deac6fbb1fb467325f519e49d8ed6af330d865', 'width': 640}], 'source': {'height': 1136, 'url': 'https://external-preview.redd.it/J1nV5BTIWz-aaRBkXSDF6xQWrNdguDk8ylkF_aw04P8.png?format=pjpg&amp;auto=webp&amp;s=5a5405641f833d9f586ff3001dc27776f330859b', 'width': 640}, 'variants': {}}]}",6,,1651431581,1,,True,False,False,terraluna,t5_2y4t5,39501,public,https://b.thumbs.redditmedia.com/WiMw7HLCM8UsYFamstQQgxos8KvzvzYK77KUBX-2loA.jpg,140.0,140.0,"G999 Is Rising To New Heights with Demand Grows Utility for its White Label Technology and NFT Marketplace and more all inside its Own Metaverse and On it’s Own Exchange. Get a account today and start an NFT portfolio collection as low as $28 to trade, hold, or invest your NFTs however you choose.",0,[],1.0,https://v.redd.it/fliresicwww81,https://v.redd.it/fliresicwww81,all_ads,6,1651402771.0
