,all_awardings,allow_live_comments,author,author_flair_css_class,author_flair_richtext,author_flair_text,author_flair_type,author_fullname,author_is_blocked,author_patreon_flair,author_premium,awarders,can_mod_post,contest_mode,created_utc,domain,full_link,gildings,id,is_created_from_ads_ui,is_crosspostable,is_meta,is_original_content,is_reddit_media_domain,is_robot_indexable,is_self,is_video,link_flair_background_color,link_flair_richtext,link_flair_template_id,link_flair_text,link_flair_text_color,link_flair_type,locked,media_only,no_follow,num_comments,num_crossposts,over_18,parent_whitelist_status,permalink,pinned,post_hint,preview,pwls,removed_by_category,retrieved_on,score,selftext,send_replies,spoiler,stickied,subreddit,subreddit_id,subreddit_subscribers,subreddit_type,thumbnail,thumbnail_height,thumbnail_width,title,total_awards_received,treatment_tags,upvote_ratio,url,url_overridden_by_dest,whitelist_status,wls,created
21,[],False,brianmedia,,[],,text,t2_qytkm,False,False,False,[],False,False,1651423736,self.terraluna,https://www.reddit.com/r/terraluna/comments/ug3yzn/lesson_learned_from_buying_luna_on_cdc/,{},ug3yzn,False,True,False,False,False,True,True,False,#7193ff,[],844cbda8-be27-11eb-b4ba-0e4cc1e38c35,Discussion,dark,text,False,False,True,0,0,False,all_ads,/r/terraluna/comments/ug3yzn/lesson_learned_from_buying_luna_on_cdc/,False,self,"{'enabled': False, 'images': [{'id': 'CRCsePS2U5hRdpWnGOUwszx1WMeeHS503nZw_a5UK-8', 'resolutions': [{'height': 56, 'url': 'https://external-preview.redd.it/h4CRA-D8mOjch58T5aIXlIKJfR6cE-h7W5rQml1uVuU.jpg?width=108&amp;crop=smart&amp;auto=webp&amp;s=7a2bfd99c71705498a15d5a7d9f464e771c5f458', 'width': 108}, {'height': 113, 'url': 'https://external-preview.redd.it/h4CRA-D8mOjch58T5aIXlIKJfR6cE-h7W5rQml1uVuU.jpg?width=216&amp;crop=smart&amp;auto=webp&amp;s=b35c038e37ba9b0b86ceb453fb198d074c23437f', 'width': 216}, {'height': 167, 'url': 'https://external-preview.redd.it/h4CRA-D8mOjch58T5aIXlIKJfR6cE-h7W5rQml1uVuU.jpg?width=320&amp;crop=smart&amp;auto=webp&amp;s=a748c38b9385d201aad3b7988055cacc20eafd87', 'width': 320}, {'height': 335, 'url': 'https://external-preview.redd.it/h4CRA-D8mOjch58T5aIXlIKJfR6cE-h7W5rQml1uVuU.jpg?width=640&amp;crop=smart&amp;auto=webp&amp;s=3c64cb4a20c574df26a87e92e28472e2fcb39b96', 'width': 640}, {'height': 502, 'url': 'https://external-preview.redd.it/h4CRA-D8mOjch58T5aIXlIKJfR6cE-h7W5rQml1uVuU.jpg?width=960&amp;crop=smart&amp;auto=webp&amp;s=cc4f1940aa85d5526cc1f5afed4b31b7a0ed6ccd', 'width': 960}, {'height': 565, 'url': 'https://external-preview.redd.it/h4CRA-D8mOjch58T5aIXlIKJfR6cE-h7W5rQml1uVuU.jpg?width=1080&amp;crop=smart&amp;auto=webp&amp;s=f59c6af39e811baac00a6f91eb0a27946780e2b1', 'width': 1080}], 'source': {'height': 1309, 'url': 'https://external-preview.redd.it/h4CRA-D8mOjch58T5aIXlIKJfR6cE-h7W5rQml1uVuU.jpg?auto=webp&amp;s=1fee0c77cf11fc65eee9c7c33839daf5f9c94923', 'width': 2500}, 'variants': {}}]}",6,,1651423747,1,"I've started to explore more and recently decided to put a lot of my portfolio on Terra, so I can stake ,LP, Yield, etc. I used to just have a Gemini and Coinbase account (next came desktop and hardware wallets). Wanting to get into Terra/Luna taught me a lot of lessons. the first was how the heck to I get LUNA, UST into my terra wallet, without juggling thru all kinds of hoops. 

My biggest mistake was buying LUNA on [crypto.com](https://crypto.com) app. I 'funded' my fiat wallet (several thousand), waited for it to clear my bank. after I saw the funds clear (2 days later), the next day I bought LUNA, knowing I was going to transfer it to my terra station wallet, swap half of it for UST, then stake, LP, etc. 

Well I'm now going on day 3 from CDC saying I can't transfer/withdrawal by LUNA yet. My thoughts were my fiat deposit cleared my bank days ago, so my purchase is in limbo until CDC 'allows' me to move it. 

If I would have know it would take so long AFTER it clears my bank, I would have waited until I was able to purchase then directly move it to wallet. Reason being I bought at $87 with the idea I would convert it immediately to UST in wallet, then figure out how to disperse it. Well if I would have waited and known it took this long I could have got it at $80 instead. 

Chalk up the loss to educational cost :D

Moving forward I think I will wire money into Kraken (no wire fees on both ends) and purchase from that when dips happen using KPro, since they offer all the tokens I'll need personally (which I can move around, swap for other stuff later). Any other ideas for US based users?",True,False,False,terraluna,t5_2y4t5,39493,public,self,,,Lesson learned from buying LUNA on CDC,0,[],1.0,https://www.reddit.com/r/terraluna/comments/ug3yzn/lesson_learned_from_buying_luna_on_cdc/,,all_ads,6,1651394936.0
