63,[],False,Candlestick_,,[],,text,t2_ysttm,False,False,False,[],False,False,1652528189,self.CryptoCurrency,https://www.reddit.com/r/CryptoCurrency/comments/upfesr/this_may_be_a_shot_in_the_dark_but_some_hope_may/,{},upfesr,False,True,False,False,False,True,True,False,#7193ff,DISCUSSION,"[{'e': 'text', 't': 'DISCUSSION'}]",87049662-0882-11e5-82e1-0e9d1a9f7761,DISCUSSION,dark,richtext,False,False,True,0,0,False,all_ads,/r/CryptoCurrency/comments/upfesr/this_may_be_a_shot_in_the_dark_but_some_hope_may/,False,6,,1652528200,1,"
 I first would like to send my condolences to the members of the Terra community that were heavily affected by the current state of Luna and UST. I knew the power of the ecosystem but only had little financial exposure to it at the time of this event. To public knowledge, there is a ""Terra recovery plan"" in place but the stark reality of it is any proper recovery plan would require a fork of the native coin; essentially abandoning the Luna/UST algorithmic capabilities for a safer approach such as 1:1 fiat backing or by providing an over collateralized stablecoin such as Dai. Unfortunately, that leaves Luna and UST sister ships destined to sink.

All that being said I believe there is a plan that may help even just a few people in the short term. If you are convinced Luna and UST will inevitably reach zero and you have the capabilities to short on your trading platform of choice then try and short the two. At the time of posting, I was monitoring the price of Luna and saw it had incredible buying pressure leading me to believe 1. New people with less exposure are buying Luna assuming it will return to a reasonable state while simultaneously being blissfully unaware of the ripples it left across the broad crypto space currently and for years to come and 2. The multiple bitcoin reserves deployed by the Luna Foundation Guard (LFG) are still providing some liquidity to allow time for people to get out. I know of and also agree with the sentiment that the bitcoin reserves weren't enough to save UST, but that is evident in the price of UST never reestablishing its 1$ peg. So I believe it isn't truly over to make a profit until UST reaches zero and that is due to the 1:1 burning mechanism of Luna and UST. 

I know I suggested in the aforementioned paragraph trying to scrape profits off of new people entering the market, which I believe is a predatory practice and shouldn't be a part of any financial space. But on the contrary, I believe everyone should do their  research before buying anything such as securities, technology, housing, etc. but especially with something as volatile as Cryptocurrencies. I wanted to ape myself when I was checking prices and saw Luna surging 500% overnight and wanted to go long thinking that its price was going to recover and that I would be able to recoup some losses due to my previous exposure and I even went as far as entering a long position myself betting on price recovery, but that future is unrealistic without a hard fork due to Luna's tokenomics while simultaneously being the mindset of aforementioned new buyers exposed to the *flashy* price believing Luna will return to ATHs and it's their rocket to the moon. So I proposed the idea to short the tokens instead, even though it won't make you rich I believe it's an easy-to-manage alternative to watching your investments fully deplete to 0. I acknowledged there is more than one way to make money off these tokens at this point and I wish to motivate during this time because in times of great volatility there are trade opportunities to be made but whichever solution you choose fully commit to it. There is more than plenty of liquidity left in the ecosystem to produce enough profit to help the ones most affected because for the individuals who lost everything 50$ is a meal, transportation for aid, or even a room to sleep in. 

I say everything with a grave tone because this is a serious event affecting multiple communities and all this happened on top of market correction and liquidations overall financial sectors as well as unmanaged inflation and raised interest rates on the USD. In my personal life, I recently lost my aunt, someone who stepped in for me after the passing of my mother only a couple of months prior. I am also affected by general loss in markets the same way you are, but as I try to hold my head high and I write this to try and shine a light in the dark for people who have lost hope because their lives drastically changed in less than a week due to the collapse of Luna/UST. So please DYOR, try and avoid unnecessary FUD, and check on friends and family because a warm gesture can go a long way. Once again I am sorry to the ones affected and I wish you all the best of luck. 

Additional thoughts and points to consider

1. Despite the current price of Luna/UST, the underlying value of the Terra ecosystem is high due to the amazing protocols native to their blockchain.
2. Protocols primarily using UST reserves such as Anchor and Mirror could switch to another stablecoin, but would require development time for proper deployment. 
3. There are plans in motion to recover the ecosystem, but understand those plans are tentative and will require time and bonus outside resources for a ""true recovery"" to take place.
4. Any token or protocol integrated with Luna or UST will see incredible volatility until recovery and or death. There is a lot of money moving back and forth so be careful in the Terra ecosystem.
5. I'm just some guy

Additional resources:

1. Terra updates: [https://twitter.com/terra\_money](https://twitter.com/terra_money)
2. LFG Twitter:  [**https://twitter.com/LFG\_org**](https://twitter.com/LFG_org) 
3. [https://www.cnbc.com/2022/05/05/luna-foundation-guard-bolsters-stablecoin-reserve-by-raising-1point5-billion-in-bitcoin.html](https://www.cnbc.com/2022/05/05/luna-foundation-guard-bolsters-stablecoin-reserve-by-raising-1point5-billion-in-bitcoin.html)
4. [https://www.cnbc.com/2022/05/05/luna-foundation-guard-bolsters-stablecoin-reserve-by-raising-1point5-billion-in-bitcoin.html](https://www.cnbc.com/2022/05/05/luna-foundation-guard-bolsters-stablecoin-reserve-by-raising-1point5-billion-in-bitcoin.html)",True,False,False,CryptoCurrency,t5_2wlj3,4851929,public,self,"This may be a shot in the dark, but some hope may remain",0,[],1.0,https://www.reddit.com/r/CryptoCurrency/comments/upfesr/this_may_be_a_shot_in_the_dark_but_some_hope_may/,all_ads,6,1652499389.0,,,new,,,,,,,,,,,,,
64,[],False,whatyoumeanbih,,[],,text,t2_2krvss63,False,False,False,[],False,False,1652527335,self.CryptoCurrency,https://www.reddit.com/r/CryptoCurrency/comments/upf77r/where_are_people_buying_selling_luna_right_now/,{},upf77r,False,False,False,False,False,False,True,False,#7193ff,DISCUSSION,"[{'e': 'text', 't': 'DISCUSSION'}]",87049662-0882-11e5-82e1-0e9d1a9f7761,DISCUSSION,dark,richtext,False,False,True,1,0,False,all_ads,/r/CryptoCurrency/comments/upf77r/where_are_people_buying_selling_luna_right_now/,False,6,moderator,1652527345,1,[removed],True,False,False,CryptoCurrency,t5_2wlj3,4851856,public,self,Where are people buying / selling LUNA right now?,0,[],1.0,https://www.reddit.com/r/CryptoCurrency/comments/upf77r/where_are_people_buying_selling_luna_right_now/,all_ads,6,1652498535.0,,,,,,,,,,,,,,,,
65,[],False,ccrrr2,Warning-level2-2,"[{'e': 'text', 't': 'Tin'}]",Tin,richtext,t2_b8b2zdor,False,False,False,[],False,False,1652527283,self.CryptoCurrency,https://www.reddit.com/r/CryptoCurrency/comments/upf6qy/luna_is_pumping_back_once_while_i_was_complaining/,{},upf6qy,False,True,False,False,False,True,True,False,#cc8b00,SPECULATION,"[{'e': 'text', 't': 'SPECULATION'}]",ebb30328-94d1-11eb-94d6-0e7d4f551e2d,SPECULATION,light,richtext,False,False,True,0,0,False,all_ads,/r/CryptoCurrency/comments/upf6qy/luna_is_pumping_back_once_while_i_was_complaining/,False,6,,1652527293,1,"I know people lost their life savings in LUNA crash but let me tell you something. Nobody put the gun on their head to invest all they have, nobody told you that's the good investment advice.  I feel for them. But hey! Follow the wise man words. THIS IS A CASINO SIR!

I didn't have any LUNA before crash, but yesterday I bought so low that today my gains are covering for all my previous losses.

LUNA is coming back, not to previous highs but it will come to pennies which is enough to gain huge profits.

While rest of the internet was complaining some people saw an opportunity. 

Some said don't try to catch falling knifes, but those knifes turned into a dollar bills. 

Until one see the darkness another one won't see the light!

Some said it's dead coin.

As of this writing gains are 1000%

Don't try to catch falling knifes they might turn into gold bars. 

I wish I can find that guy who wrote the comment but from now on, I'll always follow a wise man words!

THIS IS A CASINO SIR!",True,False,False,CryptoCurrency,t5_2wlj3,4851853,public,self,"LUNA is pumping back! Once, while I was complaining about my losses a wise man replied to me and he said: This is a casino sir! So... Welcome to casino boys and girls!",0,[],1.0,https://www.reddit.com/r/CryptoCurrency/comments/upf6qy/luna_is_pumping_back_once_while_i_was_complaining/,all_ads,6,1652498483.0,,,,,,,,dark,,,,,,,,
66,[],False,Apprehensive_Loan776,,[],,text,t2_501i3usm,False,False,False,[],False,False,1652527012,self.CryptoCurrency,https://www.reddit.com/r/CryptoCurrency/comments/upf4b5/luna_pulls_a_13x_in_one_day/,{},upf4b5,False,False,False,False,False,False,True,False,#46d160,MARKETS,"[{'e': 'text', 't': 'MARKETS'}]",1a657c8c-e48d-11e5-a215-0e374d550989,MARKETS,light,richtext,False,False,True,1,0,False,all_ads,/r/CryptoCurrency/comments/upf4b5/luna_pulls_a_13x_in_one_day/,False,6,moderator,1652527023,1,[removed],True,False,False,CryptoCurrency,t5_2wlj3,4851831,public,self,Luna pulls a 13x in one day,0,[],1.0,https://www.reddit.com/r/CryptoCurrency/comments/upf4b5/luna_pulls_a_13x_in_one_day/,all_ads,6,1652498212.0,,,,,,,,,,,,,,,,
67,[],False,DaredewilSK,Warning-level1-1,"[{'e': 'text', 't': 'Bronze | QC: CC 16 | Unpop.Opin. 17'}]",Bronze | QC: CC 16 | Unpop.Opin. 17,richtext,t2_hqm2l,False,False,False,[],False,False,1652526889,self.CryptoCurrency,https://www.reddit.com/r/CryptoCurrency/comments/upf38m/if_you_think_about_gambling_on_luna_right_now/,{},upf38m,False,True,False,False,False,True,True,False,#ffd635,REMINDER,"[{'e': 'text', 't': 'REMINDER'}]",c71c0ff8-94c9-11eb-8a95-0e0f28a36a09,REMINDER,dark,richtext,False,False,True,0,0,False,all_ads,/r/CryptoCurrency/comments/upf38m/if_you_think_about_gambling_on_luna_right_now/,False,6,,1652526899,1,"I see people all over the place speculating that they could buy a few thousand LUNA for some spare change in their back pocket and hit it big ""when"" it hits 1USD or even crazier, to the price before the crash. 

I am not sure some of you people realize that with the current supply of 6,907,376,873,295 the market cap upon reaching 1USD would be that. 6,907,376,873,295USD. That's 6.9 trillion. Can you even comprehend that number in USD? That's currently Apple, Microsoft, Tesla, and Alphabet (Google) combined. You can't possibly think that's even remotely possible.

And I am not even mentioning the absolutely mental situation of LUNA reaching 100USD. That would be like 7 times the estimated market cap of all publicly traded companies in the entire god damn world (2020 estimate).",True,False,False,CryptoCurrency,t5_2wlj3,4851816,public,self,"If you think about gambling on Luna right now, just consider the current supply and how market cap is calculated",0,[],1.0,https://www.reddit.com/r/CryptoCurrency/comments/upf38m/if_you_think_about_gambling_on_luna_right_now/,all_ads,6,1652498089.0,,,,,,,,dark,,,,,,,,
68,[],False,unitys2011,Warning-level2-2,"[{'e': 'text', 't': 'Tin'}]",Tin,richtext,t2_5n3vz,False,False,False,[],False,False,1652526645,cointelegraph.com,https://www.reddit.com/r/CryptoCurrency/comments/upf18s/cryptocom_unblocks_users_reverses_glitched_luna/,{},upf18s,False,True,False,False,False,True,False,False,#0aa18f,NEWS,"[{'e': 'text', 't': 'GENERAL-NEWS'}]",f170aab2-246f-11ec-8143-429a193c9848,GENERAL-NEWS,light,richtext,False,False,True,0,0,False,all_ads,/r/CryptoCurrency/comments/upf18s/cryptocom_unblocks_users_reverses_glitched_luna/,False,6,,1652526656,1,,True,False,False,CryptoCurrency,t5_2wlj3,4851794,public,https://a.thumbs.redditmedia.com/ia9F0h78rv_hl0uTs-9pmvFna3NxXaohToAS3s1d4J0.jpg,"Crypto.com unblocks users, reverses glitched LUNA trades that made 30-40x",0,[],1.0,https://cointelegraph.com/news/crypto-com-unblocks-users-reverses-glitched-luna-trades-that-made-30-40x,all_ads,6,1652497845.0,link,"{'enabled': False, 'images': [{'id': 'cBv8UeCV_Vn5nQDK5AZHmoMa_Orv8Jm1Rt0e2rJRiD8', 'resolutions': [{'height': 71, 'url': 'https://external-preview.redd.it/Y1lQnfiffBupSVnwhK0oyX-_TrbsgIlcxEHphk_Rz6k.jpg?width=108&amp;crop=smart&amp;auto=webp&amp;s=f55f80c450945e8688499e888c432ef4f159de26', 'width': 108}, {'height': 143, 'url': 'https://external-preview.redd.it/Y1lQnfiffBupSVnwhK0oyX-_TrbsgIlcxEHphk_Rz6k.jpg?width=216&amp;crop=smart&amp;auto=webp&amp;s=3d503dec7c3fa383837b58605089590f7430cb32', 'width': 216}, {'height': 213, 'url': 'https://external-preview.redd.it/Y1lQnfiffBupSVnwhK0oyX-_TrbsgIlcxEHphk_Rz6k.jpg?width=320&amp;crop=smart&amp;auto=webp&amp;s=ece870930eb299c301cfd28a912fbebb9f4ee02d', 'width': 320}, {'height': 426, 'url': 'https://external-preview.redd.it/Y1lQnfiffBupSVnwhK0oyX-_TrbsgIlcxEHphk_Rz6k.jpg?width=640&amp;crop=smart&amp;auto=webp&amp;s=57e81782905350868d803073e8ad8be06ba9de12', 'width': 640}, {'height': 639, 'url': 'https://external-preview.redd.it/Y1lQnfiffBupSVnwhK0oyX-_TrbsgIlcxEHphk_Rz6k.jpg?width=960&amp;crop=smart&amp;auto=webp&amp;s=5938a2187b54845641bd0fcd049dca49ba2aea45', 'width': 960}, {'height': 719, 'url': 'https://external-preview.redd.it/Y1lQnfiffBupSVnwhK0oyX-_TrbsgIlcxEHphk_Rz6k.jpg?width=1080&amp;crop=smart&amp;auto=webp&amp;s=489b0d5d4e74210ea37d8433304eef223a7ce1b0', 'width': 1080}], 'source': {'height': 773, 'url': 'https://external-preview.redd.it/Y1lQnfiffBupSVnwhK0oyX-_TrbsgIlcxEHphk_Rz6k.jpg?auto=webp&amp;s=f30005925ca4c504bdbe5adc5727005f7a50ed6c', 'width': 1160}, 'variants': {}}]}",new,93.0,140.0,https://cointelegraph.com/news/crypto-com-unblocks-users-reverses-glitched-luna-trades-that-made-30-40x,,dark,,,,,,,,
69,[],False,Ka1ruu,,[],,text,t2_85i8tv2c,False,False,False,[],False,False,1652526594,self.CryptoCurrency,https://www.reddit.com/r/CryptoCurrency/comments/upf0sy/supply_and_demand/,{},upf0sy,False,True,False,False,False,True,True,False,#7193ff,DISCUSSION,"[{'e': 'text', 't': 'DISCUSSION'}]",87049662-0882-11e5-82e1-0e9d1a9f7761,DISCUSSION,dark,richtext,False,False,True,0,0,False,all_ads,/r/CryptoCurrency/comments/upf0sy/supply_and_demand/,False,6,,1652526605,1,"NOOB QUESTION

Since everyone's been buying the dip LUNA (like a ton of it) assuming it has recovered, wouldn't the value of it will still be low? If everyone sells it at one point because when it raises and there are much less buyers, how will it recover its ""stable value"" before? 

Let's say there was a sale of apples from 5 dollars now its 0.1 cent. Everyone bought and expects the price to rise. Now since almost everyone bought apples, the value of it is still low. 

Is this correct or its different? 

I'm sorry for bad english.

I'm not a crypto guy, just have some little ideas on it.",True,False,False,CryptoCurrency,t5_2wlj3,4851790,public,self,Supply and demand,0,[],1.0,https://www.reddit.com/r/CryptoCurrency/comments/upf0sy/supply_and_demand/,all_ads,6,1652497794.0,,,new,,,,,,,,,,,,,
70,[],False,No_Dog_7969,Warning-level1-1,"[{'e': 'text', 't': 'Bronze'}]",Bronze,richtext,t2_9ruyrw99,False,False,False,[],False,False,1652526559,self.CryptoCurrency,https://www.reddit.com/r/CryptoCurrency/comments/upf0i4/why_is_luna_mooning_like_that_on_binance/,{},upf0i4,False,False,False,False,False,False,True,False,#46d160,ADVICE,"[{'e': 'text', 't': 'ADVICE'}]",e9570888-9c2a-11e3-809c-12313d1661cc,ADVICE,dark,richtext,False,False,True,1,0,False,all_ads,/r/CryptoCurrency/comments/upf0i4/why_is_luna_mooning_like_that_on_binance/,False,6,moderator,1652526569,1,[removed],True,False,False,CryptoCurrency,t5_2wlj3,4851785,public,self,Why is Luna mooning like that on Binance?,0,[],1.0,https://www.reddit.com/r/CryptoCurrency/comments/upf0i4/why_is_luna_mooning_like_that_on_binance/,all_ads,6,1652497759.0,,,,,,,,dark,,,,,,,,
71,[],False,tryM3B1tch,,"[{'e': 'text', 't': 'Silver | QC: CC 318 | VET 22 | MiningSubs 17'}]",Silver | QC: CC 318 | VET 22 | MiningSubs 17,richtext,t2_14gv9p,False,False,False,[],False,False,1652526544,self.CryptoCurrency,https://www.reddit.com/r/CryptoCurrency/comments/upf0dd/remember_that_do_kwonalgodtrading_1mil_usdt_bet/,{},upf0dd,False,True,False,False,False,True,True,False,#7193ff,DISCUSSION,"[{'e': 'text', 't': 'DISCUSSION'}]",87049662-0882-11e5-82e1-0e9d1a9f7761,DISCUSSION,dark,richtext,False,False,True,2,0,False,all_ads,/r/CryptoCurrency/comments/upf0dd/remember_that_do_kwonalgodtrading_1mil_usdt_bet/,False,6,,1652526554,1,"Just a reminder for you guys, here the [catch up post](https://www.reddit.com/r/CryptoCurrency/comments/tduu55/founder_of_terra_do_kwon_just_entered_into_a_1_m/)

TL;DR:
&gt;Do Kwon bets USDT 1Mil against Algod who thinks Terra system is a scam
&gt; Both send 1 mil USDT to CryptoCobie (0 clue why him but guess he's just a neutral player) and holds it in escrow
&gt; On 14th March 2023, if Luna's price is below $88, Algod wins

Then, 12 hours again as of writing, AlgodTrading [tweeted again](https://twitter.com/AlgodTrading/status/1525246091154931714) asking Do to release the funds as Luna won't ever get back up but Luna v2 that they're definitely releasing has a shot

Do you reckon Do will pull some BS about the bet to win?",True,False,False,CryptoCurrency,t5_2wlj3,4851785,public,self,"Remember that Do Kwon/AlgodTrading $1mil USDT bet? Safe to say, Algod has won",0,[],1.0,https://www.reddit.com/r/CryptoCurrency/comments/upf0dd/remember_that_do_kwonalgodtrading_1mil_usdt_bet/,all_ads,6,1652497744.0,self,"{'enabled': False, 'images': [{'id': '2mscJaW0bicF7ExpwHLGOwif_KjBcTlYezmSAitWnls', 'resolutions': [{'height': 108, 'url': 'https://external-preview.redd.it/3vNt-1cOv6YFTooqKlEZGMN1WTWlou1V8GASfruTBiI.jpg?width=108&amp;crop=smart&amp;auto=webp&amp;s=e457671960eab5901ea3cd7eb5bb222405ad0ad4', 'width': 108}], 'source': {'height': 140, 'url': 'https://external-preview.redd.it/3vNt-1cOv6YFTooqKlEZGMN1WTWlou1V8GASfruTBiI.jpg?auto=webp&amp;s=859b4f38540356c51ef1ac19bc9000379f2f29ad', 'width': 140}, 'variants': {}}]}",,,,,,dark,,,,,,,,
72,[],False,Fun-Weekend-5944,Warning-level2-2,"[{'e': 'text', 't': 'Tin'}]",Tin,richtext,t2_bxoa5wmb,False,False,False,[],False,False,1652526393,self.CryptoCurrency,https://www.reddit.com/r/CryptoCurrency/comments/upez5h/why_is_luna_going_up_on_bitfinex/,{},upez5h,False,False,False,False,False,False,True,False,#46d160,MARKETS,"[{'e': 'text', 't': 'MARKETS'}]",1a657c8c-e48d-11e5-a215-0e374d550989,MARKETS,light,richtext,False,False,True,1,0,False,all_ads,/r/CryptoCurrency/comments/upez5h/why_is_luna_going_up_on_bitfinex/,False,6,moderator,1652526403,1,[removed],True,False,False,CryptoCurrency,t5_2wlj3,4851763,public,self,Why is Luna going up on Bitfinex?,0,[],1.0,https://www.reddit.com/r/CryptoCurrency/comments/upez5h/why_is_luna_going_up_on_bitfinex/,all_ads,6,1652497593.0,,,,,,,,dark,,,,,,,,
73,[],False,Azulskid,Training,"[{'e': 'text', 't': 'Redditor for 2 months.'}]",Redditor for 2 months.,richtext,t2_bge90d3z,False,False,False,[],False,False,1652526333,self.CryptoCurrency,https://www.reddit.com/r/CryptoCurrency/comments/upeyns/can_luna_reach_one_dollar/,{},upeyns,False,False,False,False,False,False,True,False,#ff66ac,DEBATE,"[{'e': 'text', 't': 'DEBATE'}]",5b762856-d7c9-11e4-822a-22000b2300b2,DEBATE,light,richtext,False,False,True,1,0,False,all_ads,/r/CryptoCurrency/comments/upeyns/can_luna_reach_one_dollar/,False,6,moderator,1652526343,1,[removed],True,False,False,CryptoCurrency,t5_2wlj3,4851761,public,self,Can Luna reach one dollar ?,0,[],1.0,https://www.reddit.com/r/CryptoCurrency/comments/upeyns/can_luna_reach_one_dollar/,all_ads,6,1652497533.0,,,,,,,,dark,,,,,,,,
74,[],False,Le_Rekt_Guy,,[],,text,t2_nt6s2,False,False,False,[],False,False,1652526173,self.CryptoCurrency,https://www.reddit.com/r/CryptoCurrency/comments/upex57/luna_is_up_1400_in_the_past_24_hours_its_not_dead/,{},upex57,False,True,False,False,False,True,True,False,#add2e2,ADVICE,"[{'e': 'text', 't': 'ANALYSIS'}]",c1034ee6-9c2a-11e3-a8c4-12313b0e8e20,ANALYSIS,dark,richtext,False,False,True,0,0,False,all_ads,/r/CryptoCurrency/comments/upex57/luna_is_up_1400_in_the_past_24_hours_its_not_dead/,False,6,,1652526183,1,"**- The coin dips 99%**

**- People buy a metric crap ton of it for literal percentage of pennies on the dollar**

**- wait a day...**

**- [Profit?](https://imgur.com/a/g7Fb226)**

**Just go to coinbase or any other broker that has it. [LUNA has more market volume than BTC as we speak](https://imgur.com/a/cmvwEpt)**

And that's basically it. Do what you want with this information. 

---

I guess while I'm here I'll also talk about what this crap does other than go up.

&gt;[LUNA Price Live Data](https://coinmarketcap.com/currencies/terra-luna/)

""The live Terra price today is $0.000516 USD with a 24-hour trading volume of $5,895,240,536 USD. We update our LUNA to USD price in real-time. Terra is down ,308.92% in the last 24 hours. The current CoinMarketCap ranking is #205, with a live market cap of $3,371,590,020 USD. It has a circulating supply of 6,530,849,796,379 LUNA coins and the max. supply is not available.

If you would like to know where to buy Terra at the current rate, the top cryptocurrency exchanges for trading in Terra stock are currently Binance, OKX, BTCEX, FTX, and Bybit. You can find others listed on our crypto exchanges page.
What Is Terra (LUNA)?

Terra is a blockchain protocol that uses fiat-pegged stablecoins to power price-stable global payments systems. According to its white paper, Terra combines the price stability and wide adoption of fiat currencies with the censorship-resistance of Bitcoin (BTC) and offers fast and affordable settlements.

Development on Terra began in January 2018, and its mainnet officially launched in April 2019. As of September 2021, it offers stablecoins pegged to the U.S. dollar, South Korean won, Mongolian tugrik and the International Monetary Fund's Special Drawing Rights basket of currencies — and it intends to roll out additional options.

Terra's native token, LUNA, is used to stabilize the price of the protocol's stablecoins. LUNA holders are also able to submit and vote on governance proposals, giving it the functionality of a governance token.
Who Are the Founders of Terra?

Terra was founded in January 2018 by Daniel Shin and Do Kwon. The two conceived of the project as a way to drive the rapid adoption of blockchain technology and cryptocurrency through a focus on price stability and usability. Kwon took on the position of CEO of Terraform Labs, the company behind Terra.

Prior to developing Terra, Shin co-founded and headed Ticket Monster, otherwise known as TMON — a major South Korean e-commerce platform. He later co-founded Fast Track Asia, a startup incubator working with entrepreneurs to build fully functional companies.

Kwon previously founded and served as CEO of Anyfi, a startup providing decentralized wireless mesh networking solutions. He has also worked as a software engineer for Microsoft and Apple.""",True,False,False,CryptoCurrency,t5_2wlj3,4851754,public,self,"LUNA is up 1400% in the past 24 hours, it's not dead yet",0,[],1.0,https://www.reddit.com/r/CryptoCurrency/comments/upex57/luna_is_up_1400_in_the_past_24_hours_its_not_dead/,all_ads,6,1652497373.0,self,"{'enabled': False, 'images': [{'id': 'cOQnHCXG8OVihRSDeA_o3BwIhGig7XEwIdVIQCf85SI', 'resolutions': [{'height': 82, 'url': 'https://external-preview.redd.it/NHkBtXoINLcCYtK-SXtgO9TKv6zeTJ4w70KV4UcMqCc.jpg?width=108&amp;crop=smart&amp;auto=webp&amp;s=313fae47db35b72fc72bea373f2bd65be335ea40', 'width': 108}, {'height': 164, 'url': 'https://external-preview.redd.it/NHkBtXoINLcCYtK-SXtgO9TKv6zeTJ4w70KV4UcMqCc.jpg?width=216&amp;crop=smart&amp;auto=webp&amp;s=83f02951ec6cf277cd2e02073ef6117279dc8579', 'width': 216}, {'height': 243, 'url': 'https://external-preview.redd.it/NHkBtXoINLcCYtK-SXtgO9TKv6zeTJ4w70KV4UcMqCc.jpg?width=320&amp;crop=smart&amp;auto=webp&amp;s=b44e23fb5871927c84a8882ab55489fe62abfc65', 'width': 320}, {'height': 486, 'url': 'https://external-preview.redd.it/NHkBtXoINLcCYtK-SXtgO9TKv6zeTJ4w70KV4UcMqCc.jpg?width=640&amp;crop=smart&amp;auto=webp&amp;s=24c636d78876e8229173f92d7fdb2394223323ea', 'width': 640}, {'height': 729, 'url': 'https://external-preview.redd.it/NHkBtXoINLcCYtK-SXtgO9TKv6zeTJ4w70KV4UcMqCc.jpg?width=960&amp;crop=smart&amp;auto=webp&amp;s=d663fedf4129389d3dd5edfca4c4d63ebcce8612', 'width': 960}], 'source': {'height': 816, 'url': 'https://external-preview.redd.it/NHkBtXoINLcCYtK-SXtgO9TKv6zeTJ4w70KV4UcMqCc.jpg?auto=webp&amp;s=0bd9b9901f9194f58a9f61ad2322882484b16395', 'width': 1074}, 'variants': {}}]}",new,,,,,,,,,,,,,
