,all_awardings,allow_live_comments,author,author_flair_background_color,author_flair_css_class,author_flair_richtext,author_flair_text,author_flair_text_color,author_flair_type,author_fullname,author_is_blocked,author_patreon_flair,author_premium,awarders,can_mod_post,contest_mode,created_utc,domain,full_link,gildings,id,is_created_from_ads_ui,is_crosspostable,is_meta,is_original_content,is_reddit_media_domain,is_robot_indexable,is_self,is_video,link_flair_background_color,link_flair_css_class,link_flair_richtext,link_flair_template_id,link_flair_text,link_flair_text_color,link_flair_type,locked,media_only,no_follow,num_comments,num_crossposts,over_18,parent_whitelist_status,permalink,pinned,post_hint,preview,pwls,retrieved_on,score,selftext,send_replies,spoiler,stickied,subreddit,subreddit_id,subreddit_subscribers,subreddit_type,suggested_sort,thumbnail,title,total_awards_received,treatment_tags,upvote_ratio,url,whitelist_status,wls,created,media,media_embed,removed_by_category,secure_media,secure_media_embed,thumbnail_height,thumbnail_width,url_overridden_by_dest,media_metadata,author_flair_template_id,crosspost_parent,crosspost_parent_list
0,[],False,rs06rs,,Warning-level2-2,"[{'e': 'text', 't': 'Tin'}]",Tin,dark,richtext,t2_54cjwzyl,False,False,False,[],False,False,1652628639,self.CryptoCurrency,https://www.reddit.com/r/CryptoCurrency/comments/uq8hok/after_the_ust_debacle_will_the_copycats/,{},uq8hok,False,True,False,False,False,True,True,False,#7193ff,DISCUSSION,"[{'e': 'text', 't': 'DISCUSSION'}]",87049662-0882-11e5-82e1-0e9d1a9f7761,DISCUSSION,dark,richtext,False,False,True,0,0,False,all_ads,/r/CryptoCurrency/comments/uq8hok/after_the_ust_debacle_will_the_copycats/,False,self,"{'enabled': False, 'images': [{'id': 'oh8X59zWhM7_qTJXW49c1Dm38xcRyS-lf5IoFOHtjXc', 'resolutions': [{'height': 60, 'url': 'https://external-preview.redd.it/sS9wEIDCaj2Y83xsxeQ8o-CNcHAU1n2wN6mxexOLZj0.jpg?width=108&amp;crop=smart&amp;auto=webp&amp;s=f1b7cb582f51e8a4cdd4f175b4b14339e0459104', 'width': 108}, {'height': 121, 'url': 'https://external-preview.redd.it/sS9wEIDCaj2Y83xsxeQ8o-CNcHAU1n2wN6mxexOLZj0.jpg?width=216&amp;crop=smart&amp;auto=webp&amp;s=b0d86bcfd89eb6222dfd6a2c597db64bc0f97f83', 'width': 216}, {'height': 180, 'url': 'https://external-preview.redd.it/sS9wEIDCaj2Y83xsxeQ8o-CNcHAU1n2wN6mxexOLZj0.jpg?width=320&amp;crop=smart&amp;auto=webp&amp;s=f0ab8ad4b9b3aa2699853d6f16a52451ad4fe31f', 'width': 320}, {'height': 360, 'url': 'https://external-preview.redd.it/sS9wEIDCaj2Y83xsxeQ8o-CNcHAU1n2wN6mxexOLZj0.jpg?width=640&amp;crop=smart&amp;auto=webp&amp;s=2e3b6b3037ed472bc0b8d44e0528752ecdce0e2b', 'width': 640}, {'height': 540, 'url': 'https://external-preview.redd.it/sS9wEIDCaj2Y83xsxeQ8o-CNcHAU1n2wN6mxexOLZj0.jpg?width=960&amp;crop=smart&amp;auto=webp&amp;s=fd043318eac5fdafd4be0f5a63d55f26f092c7f3', 'width': 960}, {'height': 607, 'url': 'https://external-preview.redd.it/sS9wEIDCaj2Y83xsxeQ8o-CNcHAU1n2wN6mxexOLZj0.jpg?width=1080&amp;crop=smart&amp;auto=webp&amp;s=dd180aef1c993233e6602a6f9861c672d54acc98', 'width': 1080}], 'source': {'height': 1080, 'url': 'https://external-preview.redd.it/sS9wEIDCaj2Y83xsxeQ8o-CNcHAU1n2wN6mxexOLZj0.jpg?auto=webp&amp;s=6c2e240185592978100f6fb0cefa3b0db759208d', 'width': 1920}, 'variants': {}}]}",6,1652628649,1,"Near and Tron created a lot of buzz not so long ago when they released that they'll try and replicate the success of UST with their own versions of UST as USN and USDD, respectively. The Block's [article](https://www.theblockcrypto.com/post/145231/trons-new-stablecoin-usdd-goes-live) from 10 days ago confirmed both already went live by then.

Algorithmic stablecoins were a big craze in the crypto community and people saw it as a way to access dollar liquidity without worries of any kind of US govt. censorship/regulation.

What do you think happens now? Will people still tout it as a better alternative to actual asset-backed and regulated USDC, USDP/BUSD? Or a better mechanism to achieve censorship-resistance will need to emerge?

Until someone's able to make these in a bulletproof manner, with no risk of a death spiral like UST, I don't think I'm gonna trust these so called stablecoins or any project that's trying to copy UST.",True,False,False,CryptoCurrency,t5_2wlj3,4861119,public,new,self,"After the UST debacle, will the copycats (algorithmic stablecoins) Near's USN and Tron's USDD see any adoption or not?",0,[],1.0,https://www.reddit.com/r/CryptoCurrency/comments/uq8hok/after_the_ust_debacle_will_the_copycats/,all_ads,6,1652599839.0,,,,,,,,,,,,
1,[],False,Pseudonymous100419,,Warning-level2-2,"[{'e': 'text', 't': 'Tin | CRO 8'}]",Tin | CRO 8,dark,richtext,t2_3yin4wvt,False,False,False,[],False,False,1652628261,self.CryptoCurrency,https://www.reddit.com/r/CryptoCurrency/comments/uq8d3t/luna_risks/,{},uq8d3t,False,True,False,False,False,True,True,False,#cc8b00,SPECULATION,"[{'e': 'text', 't': 'SPECULATION'}]",ebb30328-94d1-11eb-94d6-0e7d4f551e2d,SPECULATION,light,richtext,False,False,True,1,0,False,all_ads,/r/CryptoCurrency/comments/uq8d3t/luna_risks/,False,,,6,1652628272,1,"With all the gambling in luna recently, I feel the need to explain why the luna rugpull is not over. As of the time of this post, the validators and Do Kwon have banded together to shut down the ability to mint Luna coins by burning UST. This is why the supply of Luna is not increasing.

There is no mention of this being a permanent change. These people turned off the function without any voting and at their own discretion without consulting other Luna holders so they can easily turn on this function as well. When that happens, 11 trillion of UST coins will be converted to Luna and we can watch Luna marketcap collapse again.

UST is currently trading at 0.15 at Kraken. These people could easily purchase large amounts of UST. Turn on the swap function then swap their UST for Luna and make a 5x profit on their USTs.",True,False,False,CryptoCurrency,t5_2wlj3,4861071,public,,self,Luna risks,0,[],1.0,https://www.reddit.com/r/CryptoCurrency/comments/uq8d3t/luna_risks/,all_ads,6,1652599461.0,,,,,,,,,,,,
2,[],False,big--if-true,,Warning-level1-1,"[{'e': 'text', 't': 'Bronze | 4 months old | QC: BCH 17 | Stocks 32'}]",Bronze | 4 months old | QC: BCH 17 | Stocks 32,dark,richtext,t2_hmkqn1ou,False,False,False,[],False,False,1652626011,self.CryptoCurrency,https://www.reddit.com/r/CryptoCurrency/comments/uq7m75/if_usdt_did_the_same_scam_as_ust_and_backed_their/,{},uq7m75,False,True,False,False,False,True,True,False,#add2e2,ADVICE,"[{'e': 'text', 't': 'ANALYSIS'}]",c1034ee6-9c2a-11e3-a8c4-12313b0e8e20,ANALYSIS,dark,richtext,False,False,True,2,0,False,all_ads,/r/CryptoCurrency/comments/uq7m75/if_usdt_did_the_same_scam_as_ust_and_backed_their/,False,self,"{'enabled': False, 'images': [{'id': 'yOcZTiz25tMKCN-HEAb6r_kusWbt0RJ15UBaN9CmyTM', 'resolutions': [{'height': 108, 'url': 'https://external-preview.redd.it/r2T_AIs2YyblrOyk-RsyD5LLqlUSWKZjfafI-lnSN2o.jpg?width=108&amp;crop=smart&amp;auto=webp&amp;s=d90b788508a97fd2e78fb66dca7d664d22568ff0', 'width': 108}], 'source': {'height': 200, 'url': 'https://external-preview.redd.it/r2T_AIs2YyblrOyk-RsyD5LLqlUSWKZjfafI-lnSN2o.jpg?auto=webp&amp;s=fe820b985b7330763a96ec1907a80fe6ed3395a6', 'width': 200}, 'variants': {}}]}",6,1652626022,1,"USDT is redeeming a lot of tethers recently. They are definitely not fully backed as historically they never were fully backed by dollars, so if large holders try cash out and dont get their cash , the peg between USDT and USD may break as people run for the exits. Alternatively if they did the same scam as UST and backed their token with Bitcoin they may be forced to sell off their holdings and crash BTC.

Historical, along with current data can be found here: https://coinmarketcap.com/currencies/tether/historical-data/

As we know, Tether is supposed to be backed by 1:1 to the USD by Tether’s reserves. Tether allegedly has fiat, bonds, and other assets to do this (will address this a bit more below). Even though Tether is near its’ peg, the change in market cap shows an overwhelming amount of redemption.

This is concerning for a few reasons, for one because the overall market is down. Meaning, the assets in Tether’s reserve also most likely are down as well. I’m not just talking about the crypto market, either. Since we do not have full transparency in Tether’s backing, many have speculated it’s tied to assets like BTC, which is also way down as well. Meaning, their backing “power” may be lower than it was previously and not exactly at 1:1.

As an example, for arguments sake, let’s say that BTC was bought and fully backed the USDT. Their average price for backing was when Bitcoin was at 30k. Now let’s say the market dips, and bitcoin goes to 27k. At the same time, many start redeeming Tether to cash out to fiat out of fear of the market conditions. This means that the backing of Tether is no longer 1:1 and since people are redeeming, Tether would have to sell off its bitcoin reserves for a loss of 10% to cover the redemption.",True,False,False,CryptoCurrency,t5_2wlj3,4860817,public,,self,If USDT did the same scam as UST and backed their token with Bitcoin they may be forced to sell off their holdings and crash BTC and USDT in the process.,0,[],1.0,https://www.reddit.com/r/CryptoCurrency/comments/uq7m75/if_usdt_did_the_same_scam_as_ust_and_backed_their/,all_ads,6,1652597211.0,,,,,,,,,,,,
3,[],False,olihowells,,,"[{'e': 'text', 't': 'Silver | QC: CC 222 | NANO 200'}]",Silver | QC: CC 222 | NANO 200,dark,richtext,t2_q0u7v43,False,False,False,[],False,False,1652625706,self.CryptoCurrency,https://www.reddit.com/r/CryptoCurrency/comments/uq7irw/is_tron_the_real_threat_to_usdt/,{},uq7irw,False,True,False,False,False,True,True,False,#7193ff,DISCUSSION,"[{'e': 'text', 't': 'DISCUSSION'}]",87049662-0882-11e5-82e1-0e9d1a9f7761,DISCUSSION,dark,richtext,False,False,True,0,0,False,all_ads,/r/CryptoCurrency/comments/uq7irw/is_tron_the_real_threat_to_usdt/,False,,,6,1652625717,1,"Is Tron the real threat to USDT?

I only found out today that 38 billion USDT is held on the Tron blockchain (you can see that [here](https://tether.to/es/transparency/)), the largest of any blockchain and about half of all USDT in existence.

I’ve also been hearing about how Tron has an algorithmic stablecoin called usdd that works almost identical to the way Luna/UST did.

There are concerns about whether Tron is centralised as well, with the ex co founder claiming the project was centralised after leaving.

What impact would this have on USDT if something were to happen to Tron? And why would Tether even choose to do use Tron to mint USDT onto?",True,False,False,CryptoCurrency,t5_2wlj3,4860787,public,new,self,Is Tron the real threat to USDT?,0,[],1.0,https://www.reddit.com/r/CryptoCurrency/comments/uq7irw/is_tron_the_real_threat_to_usdt/,all_ads,6,1652596906.0,,,,,,,,,,,,
4,[],False,Legal-Committee7064,,Warning-level2-2,"[{'e': 'text', 't': 'Tin'}]",Tin,dark,richtext,t2_aoytarnw,False,False,False,[],False,False,1652623916,twitter.com,https://www.reddit.com/r/CryptoCurrency/comments/uq6ylp/some_hope_for_ust/,{},uq6ylp,False,False,False,False,False,False,False,False,#7193ff,DISCUSSION,"[{'e': 'text', 't': 'DISCUSSION'}]",87049662-0882-11e5-82e1-0e9d1a9f7761,DISCUSSION,dark,richtext,False,False,True,0,0,False,all_ads,/r/CryptoCurrency/comments/uq6ylp/some_hope_for_ust/,False,link,"{'enabled': False, 'images': [{'id': 'pt2RPc81vnDiNYOnJ3jHCbhkcHzpyjLLQwEbXzcIcKE', 'resolutions': [{'height': 108, 'url': 'https://external-preview.redd.it/ll3iVlQ80nv2icL_xGfiUc6e8v6JG85vNnscpNIZGfc.jpg?width=108&amp;crop=smart&amp;auto=webp&amp;s=6ad9cc7a74310d2e43efa877faf1e0a103837100', 'width': 108}], 'source': {'height': 140, 'url': 'https://external-preview.redd.it/ll3iVlQ80nv2icL_xGfiUc6e8v6JG85vNnscpNIZGfc.jpg?auto=webp&amp;s=7249188a57244a59c2cf0a0dacc1a4619cc0d0c0', 'width': 140}, 'variants': {}}]}",6,1652623927,1,,True,False,False,CryptoCurrency,t5_2wlj3,4860599,public,,https://b.thumbs.redditmedia.com/5dgq2Rx1r8iHPb9xaETvP6V49hZ0AgE_I2LkcYSxQkI.jpg,Some hope for UST,0,[],1.0,https://twitter.com/persiancapital/status/1525226153304199168?s=21&amp;t=jSCThR7IzaLiNDqlIxjuIA,all_ads,6,1652595116.0,"{'oembed': {'author_name': 'PersianCapital 📖', 'author_url': 'https://twitter.com/PersianCapital', 'cache_age': 3153600000, 'height': None, 'html': '&lt;blockquote class=""twitter-video""&gt;&lt;p lang=""en"" dir=""ltr""&gt;Some interesting data on &lt;a href=""https://twitter.com/search?q=%24UST&amp;amp;src=ctag&amp;amp;ref_src=twsrc%5Etfw""&gt;$UST&lt;/a&gt; and Terra&amp;#39;s Anchor Protocol:&lt;br&gt;&lt;br&gt;- There are 256K Anchor wallets&lt;br&gt;- The top 1000 Anchor wallets own 82% of all UST&lt;br&gt;- The poorest wallet in this top 1000 has 955K UST&lt;br&gt;&lt;br&gt;This is great news for &lt;a href=""https://twitter.com/search?q=%24UST&amp;amp;src=ctag&amp;amp;ref_src=twsrc%5Etfw""&gt;$UST&lt;/a&gt; / Anchor depositors. &lt;br&gt;&lt;br&gt;Why? Let me explain..&lt;br&gt;&lt;br&gt;1/&lt;/p&gt;&amp;mdash; PersianCapital 📖 (@PersianCapital) &lt;a href=""https://twitter.com/PersianCapital/status/1525226153304199168?ref_src=twsrc%5Etfw""&gt;May 13, 2022&lt;/a&gt;&lt;/blockquote&gt;\n&lt;script async src=""https://platform.twitter.com/widgets.js"" charset=""utf-8""&gt;&lt;/script&gt;\n', 'provider_name': 'Twitter', 'provider_url': 'https://twitter.com', 'type': 'rich', 'url': 'https://twitter.com/PersianCapital/status/1525226153304199168', 'version': '1.0', 'width': 350}, 'type': 'twitter.com'}","{'content': '&lt;blockquote class=""twitter-video""&gt;&lt;p lang=""en"" dir=""ltr""&gt;Some interesting data on &lt;a href=""https://twitter.com/search?q=%24UST&amp;amp;src=ctag&amp;amp;ref_src=twsrc%5Etfw""&gt;$UST&lt;/a&gt; and Terra&amp;#39;s Anchor Protocol:&lt;br&gt;&lt;br&gt;- There are 256K Anchor wallets&lt;br&gt;- The top 1000 Anchor wallets own 82% of all UST&lt;br&gt;- The poorest wallet in this top 1000 has 955K UST&lt;br&gt;&lt;br&gt;This is great news for &lt;a href=""https://twitter.com/search?q=%24UST&amp;amp;src=ctag&amp;amp;ref_src=twsrc%5Etfw""&gt;$UST&lt;/a&gt; / Anchor depositors. &lt;br&gt;&lt;br&gt;Why? Let me explain..&lt;br&gt;&lt;br&gt;1/&lt;/p&gt;&amp;mdash; PersianCapital 📖 (@PersianCapital) &lt;a href=""https://twitter.com/PersianCapital/status/1525226153304199168?ref_src=twsrc%5Etfw""&gt;May 13, 2022&lt;/a&gt;&lt;/blockquote&gt;\n&lt;script async src=""https://platform.twitter.com/widgets.js"" charset=""utf-8""&gt;&lt;/script&gt;\n', 'height': 200, 'scrolling': False, 'width': 350}",automod_filtered,"{'oembed': {'author_name': 'PersianCapital 📖', 'author_url': 'https://twitter.com/PersianCapital', 'cache_age': 3153600000, 'height': None, 'html': '&lt;blockquote class=""twitter-video""&gt;&lt;p lang=""en"" dir=""ltr""&gt;Some interesting data on &lt;a href=""https://twitter.com/search?q=%24UST&amp;amp;src=ctag&amp;amp;ref_src=twsrc%5Etfw""&gt;$UST&lt;/a&gt; and Terra&amp;#39;s Anchor Protocol:&lt;br&gt;&lt;br&gt;- There are 256K Anchor wallets&lt;br&gt;- The top 1000 Anchor wallets own 82% of all UST&lt;br&gt;- The poorest wallet in this top 1000 has 955K UST&lt;br&gt;&lt;br&gt;This is great news for &lt;a href=""https://twitter.com/search?q=%24UST&amp;amp;src=ctag&amp;amp;ref_src=twsrc%5Etfw""&gt;$UST&lt;/a&gt; / Anchor depositors. &lt;br&gt;&lt;br&gt;Why? Let me explain..&lt;br&gt;&lt;br&gt;1/&lt;/p&gt;&amp;mdash; PersianCapital 📖 (@PersianCapital) &lt;a href=""https://twitter.com/PersianCapital/status/1525226153304199168?ref_src=twsrc%5Etfw""&gt;May 13, 2022&lt;/a&gt;&lt;/blockquote&gt;\n&lt;script async src=""https://platform.twitter.com/widgets.js"" charset=""utf-8""&gt;&lt;/script&gt;\n', 'provider_name': 'Twitter', 'provider_url': 'https://twitter.com', 'type': 'rich', 'url': 'https://twitter.com/PersianCapital/status/1525226153304199168', 'version': '1.0', 'width': 350}, 'type': 'twitter.com'}","{'content': '&lt;blockquote class=""twitter-video""&gt;&lt;p lang=""en"" dir=""ltr""&gt;Some interesting data on &lt;a href=""https://twitter.com/search?q=%24UST&amp;amp;src=ctag&amp;amp;ref_src=twsrc%5Etfw""&gt;$UST&lt;/a&gt; and Terra&amp;#39;s Anchor Protocol:&lt;br&gt;&lt;br&gt;- There are 256K Anchor wallets&lt;br&gt;- The top 1000 Anchor wallets own 82% of all UST&lt;br&gt;- The poorest wallet in this top 1000 has 955K UST&lt;br&gt;&lt;br&gt;This is great news for &lt;a href=""https://twitter.com/search?q=%24UST&amp;amp;src=ctag&amp;amp;ref_src=twsrc%5Etfw""&gt;$UST&lt;/a&gt; / Anchor depositors. &lt;br&gt;&lt;br&gt;Why? Let me explain..&lt;br&gt;&lt;br&gt;1/&lt;/p&gt;&amp;mdash; PersianCapital 📖 (@PersianCapital) &lt;a href=""https://twitter.com/PersianCapital/status/1525226153304199168?ref_src=twsrc%5Etfw""&gt;May 13, 2022&lt;/a&gt;&lt;/blockquote&gt;\n&lt;script async src=""https://platform.twitter.com/widgets.js"" charset=""utf-8""&gt;&lt;/script&gt;\n', 'height': 200, 'media_domain_url': 'https://www.redditmedia.com/mediaembed/uq6ylp', 'scrolling': False, 'width': 350}",140.0,140.0,https://twitter.com/persiancapital/status/1525226153304199168?s=21&amp;t=jSCThR7IzaLiNDqlIxjuIA,,,,
5,[],False,NikkiMyCat,,,"[{'e': 'text', 't': 'Platinum | QC: CC 79'}]",Platinum | QC: CC 79,dark,richtext,t2_pgg2qkk,False,False,False,[],False,False,1652622805,self.CryptoCurrency,https://www.reddit.com/r/CryptoCurrency/comments/uq6lqk/whats_the_next_scam_waiting_for_us/,{},uq6lqk,False,True,False,False,False,True,True,False,#7193ff,DISCUSSION,"[{'e': 'text', 't': 'DISCUSSION'}]",87049662-0882-11e5-82e1-0e9d1a9f7761,DISCUSSION,dark,richtext,False,False,True,2,0,False,all_ads,/r/CryptoCurrency/comments/uq6lqk/whats_the_next_scam_waiting_for_us/,False,,,6,1652622816,1,"I had expected the moment when NFT blew off because I sincerely believed NFT was the biggest scam in this past bull run just like ICO in the bull run of 2017.

Obviously I was wrong. It turned out to be UST/LUNA. The voices of those big influencers promoting Sol/Avax/Luna are still vivid. “The Sol/Avax/Luna index has beaten Eth by x ….”. Don’t remember how many profound analysis posted in Reddit. It’s been in top 10 in the space. How could it possibly go wrong?! 

Please don’t simply blame us, the average small investors, didn’t do our own research. We had worked hard not to be greedy. We had worked hard to try understood the technology and token economics behind Terra Luna. We had put our faith into the innovation of this industry. 

Now we are like standing in the middle of nowhere trying to figure out which way to go. Is it time for us to quit? Will the scammers take any consequence? Will our loss be taken care of ever?

If we stay in this space, an immediate question will be what’s the next scam waiting for us?",True,False,False,CryptoCurrency,t5_2wlj3,4860497,public,,self,What’s the next scam waiting for us?,0,[],1.0,https://www.reddit.com/r/CryptoCurrency/comments/uq6lqk/whats_the_next_scam_waiting_for_us/,all_ads,6,1652594005.0,,,,,,,,,,,,
6,[],False,Atsoc1993,,Warning-level2-2,"[{'e': 'text', 't': 'Tin | SHIB 24'}]",Tin | SHIB 24,dark,richtext,t2_66usqhg6,False,False,False,[],False,False,1652622418,self.CryptoCurrency,https://www.reddit.com/r/CryptoCurrency/comments/uq6hew/opinion_from_hell_xxnx_xxmx_may_rise_from_the/,{},uq6hew,False,True,False,False,False,True,True,False,#94e044,PRO-ARGUMENTS,"[{'e': 'text', 't': 'PRO-ARGUMENTS'}]",11935244-a248-11ec-b773-8a67bbaa00f3,PRO-ARGUMENTS,dark,richtext,False,False,True,0,0,False,all_ads,/r/CryptoCurrency/comments/uq6hew/opinion_from_hell_xxnx_xxmx_may_rise_from_the/,False,,,6,1652622428,1,"*Post has been deleted four times already, I am determined to have it stick. Four letter token, third letter ‘N’—if you don’t know the token I’m referring to this will be even more confusing.*

My fiancé and I’s pet cat almost died (pyometra) — her name is similar to this four-letter token except the third letter, ‘N’ is actually an ‘M’.

20-30% survival rate, and she’s still hanging in there. She’s eating well (so far), and smells like hell although we can’t bathe her properly aside from wet wipes because of her recently closed incisions. She can barely let out a faint meow, and we can’t even use regular kitty litter anymore—every morning we rip up some newspaper after cleaning her litter box.

Anyways, it gets more dark and graphic. Not sure if I could even post videos/images if I wanted to, if I ever even dared to share something like what she went through. Her vet went as far as to say it could be feline covid (tinfoil hat moment for him). Although this sounds like rambling nonsense and a possibly drunken, incoherent comparison of my cat ‘xxmx’’s current recovery to ‘xxnx’’s potentially imminent demise… I have one thing to say.


Buy. At. Least. A. Little. ‘Xxnx’. JUST. In. CASE. (Not financial advice)

Anything can happen, not financial advice, especially coming from someone who just lost a $30,000 loan @ 25% APR without disposable income (see my post history) trying to long Algorand at .68 cents with a 4x margin.

If it goes to 0, it goes to 0, but I’m hearing from some who had ‘Xxnx’ who bought a few million at .000006 and are sitting on a generous couple thousand as it’s ‘recovering’ to quadruple 0’s. If it can go $100+ to $0.000006 in a few days, anything can happen in the positive direction. 

Could it go to 0? Maybe. It might even go negative at this point.

Do I know this 20 year old Kwon guy or why people hate him so much? No.

Do I even know what the project entails? No.

Will exchanges do whatever they want in case they decide to fork or split of some sort to compensate new buyers? No idea.

Was I a long-time holder? No. But if I was I wouldn’t sell at a loss. I would buy the dip, like the imbecile that I am. Again, not financial advice. At this point though… it’s just whatever. 

Do I want people to not give up on something I know nothing about because I think they can turn this around for everyone and because I made a tiny profit and I am greedy? Yes.

Do I understand the UST mechanics? No, and I don’t care much for technicals either, as long as the project has a name for itself at this point.

Idk about you but I’m going to bet on the moon boys. Life’s short. I will succeed or go broke trying. Most likely the latter.

(Also, please no toxic comments about my cat ‘Lxma’, you will seriously hurt our feelings, she’s less than a year old, thank you)

**Anything.Can.Happen**

**My condolences to those sitting on heavy debt/loss and trust me although I wasn’t in this ‘Lxnx’ business earlier trust me I’m right there with you due to previous series’ of events**


*P.S. “Un.popular Opinion” in the title of your post is a blacklisted word here that will auto-delete your posts in this subreddit.*

Edit: I threw $200 in at .00003 which is now 4k, it can go down or up I will leave it there for a few weeks.",True,False,False,CryptoCurrency,t5_2wlj3,4860450,public,,self,Opinion From Hell: “Xxnx” (“Xxmx”) May Rise From The Ashes,0,[],1.0,https://www.reddit.com/r/CryptoCurrency/comments/uq6hew/opinion_from_hell_xxnx_xxmx_may_rise_from_the/,all_ads,6,1652593618.0,,,,,,,,,,,,
