56,[],False,FriendshipPlastic128,,,"[{'e': 'text', 't': 'Silver | QC: CC 34 | TRX 58'}]",Silver | QC: CC 34 | TRX 58,dark,richtext,t2_a6amy0he,False,False,False,[],False,False,1652555725,finance.yahoo.com,https://www.reddit.com/r/CryptoCurrency/comments/upo7y7/justin_sun_shares_his_thoughts_about_ustluna/,{},upo7y7,False,True,False,False,False,True,False,False,#0aa18f,NEWS,"[{'e': 'text', 't': 'GENERAL-NEWS'}]",f170aab2-246f-11ec-8143-429a193c9848,GENERAL-NEWS,light,richtext,False,False,True,0,0,False,all_ads,/r/CryptoCurrency/comments/upo7y7/justin_sun_shares_his_thoughts_about_ustluna/,False,link,"{'enabled': False, 'images': [{'id': 'pBS5TE7fHz5FXC_VcFCK-qbf7y11mmKRtxaySrBD7SE', 'resolutions': [{'height': 81, 'url': 'https://external-preview.redd.it/oTRLUOaOk1nBRFVW_v-v1D8-qZEVXGeqhk0jLQ5WEUI.jpg?width=108&amp;crop=smart&amp;auto=webp&amp;s=550cc149823cd1af55eccfdf646c18a233eb1e46', 'width': 108}, {'height': 162, 'url': 'https://external-preview.redd.it/oTRLUOaOk1nBRFVW_v-v1D8-qZEVXGeqhk0jLQ5WEUI.jpg?width=216&amp;crop=smart&amp;auto=webp&amp;s=48db39b0baea489de710939f1443035cfd14a39c', 'width': 216}, {'height': 240, 'url': 'https://external-preview.redd.it/oTRLUOaOk1nBRFVW_v-v1D8-qZEVXGeqhk0jLQ5WEUI.jpg?width=320&amp;crop=smart&amp;auto=webp&amp;s=d2864d55b5df9f37cdb6318f66744615e8a38e3f', 'width': 320}, {'height': 480, 'url': 'https://external-preview.redd.it/oTRLUOaOk1nBRFVW_v-v1D8-qZEVXGeqhk0jLQ5WEUI.jpg?width=640&amp;crop=smart&amp;auto=webp&amp;s=d812fd4edbec839a098d1d728368c689dede1fcb', 'width': 640}], 'source': {'height': 600, 'url': 'https://external-preview.redd.it/oTRLUOaOk1nBRFVW_v-v1D8-qZEVXGeqhk0jLQ5WEUI.jpg?auto=webp&amp;s=5c490a6f490a93e213a69eb77926957ef5401106', 'width': 800}, 'variants': {}}]}",6,1652555735,1,,True,False,False,CryptoCurrency,t5_2wlj3,4854673,public,,https://b.thumbs.redditmedia.com/RrbI59LsX2gD7pJBlSuH7eatdqJHcWmb5brr7-znDhY.jpg,"Justin Sun shares his thoughts about UST/LUNA, algorithmic stablecoins, and how it relates to Tron’s USDD. A rather interesting read.",0,[],1.0,https://finance.yahoo.com/news/justin-sun-talks-usdd-stablecoin-170320724.html,all_ads,6,1652526925.0,,,,,,105.0,140.0,https://finance.yahoo.com/news/justin-sun-talks-usdd-stablecoin-170320724.html,,,,
57,[],False,throwaway300650,,Warning-level2-2,"[{'e': 'text', 't': 'Tin | CC critic'}]",Tin | CC critic,dark,richtext,t2_9hg87wme,False,False,False,[],False,False,1652555608,self.CryptoCurrency,https://www.reddit.com/r/CryptoCurrency/comments/upo6iu/eli5_why_wasnt_all_trading_on_ustluna_suspended/,{},upo6iu,False,False,False,False,False,False,True,False,#7193ff,DISCUSSION,"[{'e': 'text', 't': 'DISCUSSION'}]",87049662-0882-11e5-82e1-0e9d1a9f7761,DISCUSSION,dark,richtext,False,False,True,1,0,False,all_ads,/r/CryptoCurrency/comments/upo6iu/eli5_why_wasnt_all_trading_on_ustluna_suspended/,False,,,6,1652555618,1,[removed],True,False,False,CryptoCurrency,t5_2wlj3,4854666,public,,self,ELI5: Why wasn't all trading on UST/LUNA suspended as soon as it depegged?,0,[],1.0,https://www.reddit.com/r/CryptoCurrency/comments/upo6iu/eli5_why_wasnt_all_trading_on_ustluna_suspended/,all_ads,6,1652526808.0,,,moderator,,,,,,,,,
58,[],False,ConfusedDK,,Warning-level2-2,"[{'e': 'text', 't': 'Tin'}]",Tin,dark,richtext,t2_14fnjw,False,False,False,[],False,False,1652555575,self.CryptoCurrency,https://www.reddit.com/r/CryptoCurrency/comments/upo64n/about_to_end_it_all/,{},upo64n,False,True,False,False,False,True,True,False,#f08f1a,LEGACY,"[{'e': 'text', 't': 'LEGACY'}]",118ffec0-a22f-11e5-a5a1-0ef58894b98d,LEGACY,light,richtext,False,False,True,0,0,False,all_ads,/r/CryptoCurrency/comments/upo64n/about_to_end_it_all/,False,,,6,1652555586,1,"So it happened. The one thing I feared the most.

I have lost it all. Wife, kids, everything. I can not see any reason to hold on anymore.

5 years ago I found the love of my life, she being in my country on a limited residence permit, I choose to go with her to her home country. I left my job and started a new life in a new country. Us being stupid in love, with no jobs, we decided to marry and have kids. A little daughter came.. The only money we had was my life savings. Those came short, and I put the small amount I had left, into UST, hoping for a better future. Then the depeg happened. Had a hard time telling my wife, who is now filing for divorce, taking our daughter with me.

Here I am, tired, sleepless, with nothing more than myself and a small apartment that I can no longer pay for. I dont see any purpose of life anymore. I have lost it all, and no sign of light. I might just end it now. Then atleast it was my own choice. 

To anybody who wants to know, I have lost about 10k, as seen by my wallet terra15qwulea6ln7kg39u8m3tmsx7ljqwpv8udxathd I know many have lost more. Hope they will go through this, though i wont.

Learn from my mistakes. Take care. Bye.",True,False,False,CryptoCurrency,t5_2wlj3,4854664,public,new,self,About to end it all.,0,[],1.0,https://www.reddit.com/r/CryptoCurrency/comments/upo64n/about_to_end_it_all/,all_ads,6,1652526775.0,,,,,,,,,,,,
59,[],False,tondas69,,Warning-level2-2,"[{'e': 'text', 't': 'Tin'}]",Tin,dark,richtext,t2_ox0q5,False,False,False,[],False,False,1652555551,self.CryptoCurrency,https://www.reddit.com/r/CryptoCurrency/comments/upo5tf/what_is_next_for_ust/,{},upo5tf,False,False,False,False,False,False,True,False,#7193ff,DISCUSSION,"[{'e': 'text', 't': 'DISCUSSION'}]",87049662-0882-11e5-82e1-0e9d1a9f7761,DISCUSSION,dark,richtext,False,False,True,1,0,False,all_ads,/r/CryptoCurrency/comments/upo5tf/what_is_next_for_ust/,False,,,6,1652555562,1,[removed],True,False,False,CryptoCurrency,t5_2wlj3,4854662,public,new,self,What is next for UST?,0,[],1.0,https://www.reddit.com/r/CryptoCurrency/comments/upo5tf/what_is_next_for_ust/,all_ads,6,1652526751.0,,,moderator,,,,,,,,,
60,[],False,tondas69,,Warning-level2-2,"[{'e': 'text', 't': 'Tin'}]",Tin,dark,richtext,t2_ox0q5,False,False,False,[],False,False,1652555183,self.CryptoCurrency,https://www.reddit.com/r/CryptoCurrency/comments/upo1f6/what_is_next_for_ust/,{},upo1f6,False,True,False,False,False,True,True,False,#7193ff,DISCUSSION,"[{'e': 'text', 't': 'DISCUSSION'}]",87049662-0882-11e5-82e1-0e9d1a9f7761,DISCUSSION,dark,richtext,False,False,True,0,0,False,all_ads,/r/CryptoCurrency/comments/upo1f6/what_is_next_for_ust/,False,,,6,1652555194,1,"As the days come through we haven't seen any clear procedure to drive things well. 

VC's and large investors lost all their money which was used during the development of Terra Luna which sucks. People are gambling on Luna and old hodlers are getting excluded from something they invested hardly in, i'm not gonna lie, i was on the two sides and gambled LUNA during this days.

Do Kwon play does not seem efficient for all parties (old and new hodlers, CEX and DEX etc) therefore i wanted to hear your thoughts on the future of UST as it seems they initially tried to get the peg and now its probably forgotten for good and the plan is to control LUNA supply. This is a literally FU\*\*\* You investors.",True,False,False,CryptoCurrency,t5_2wlj3,4854632,public,new,self,What is next for UST?,0,[],1.0,https://www.reddit.com/r/CryptoCurrency/comments/upo1f6/what_is_next_for_ust/,all_ads,6,1652526383.0,,,,,,,,,,,,
61,[],False,ImaFreemason,,,"[{'e': 'text', 't': 'Platinum I ImaCryprohodler Investor, Trader'}]","Platinum I ImaCryprohodler Investor, Trader",dark,richtext,t2_4i7fj94m,False,False,False,[],False,False,1652553895,benzinga.com,https://www.reddit.com/r/CryptoCurrency/comments/upnlub/terras_do_kwon_heartbroken_over_ust_collapse/,{},upnlub,False,True,False,False,False,True,False,False,#46d160,MARKETS,"[{'e': 'text', 't': 'MARKETS'}]",1a657c8c-e48d-11e5-a215-0e374d550989,MARKETS,light,richtext,False,False,True,0,0,False,all_ads,/r/CryptoCurrency/comments/upnlub/terras_do_kwon_heartbroken_over_ust_collapse/,False,link,"{'enabled': False, 'images': [{'id': 'yrzCxRAw7_ihlRX-EOC-564krsT4vkjYY6qrnroe1cQ', 'resolutions': [{'height': 72, 'url': 'https://external-preview.redd.it/Gss0vSMyhUWVSJ6lNrdEMXqVH-LmhecsjawlSVj2Au8.jpg?width=108&amp;crop=smart&amp;auto=webp&amp;s=c6d6096c65478d3dc2fa705d352197788d741899', 'width': 108}, {'height': 144, 'url': 'https://external-preview.redd.it/Gss0vSMyhUWVSJ6lNrdEMXqVH-LmhecsjawlSVj2Au8.jpg?width=216&amp;crop=smart&amp;auto=webp&amp;s=93c074a42605050af9af857c9d78438484e36799', 'width': 216}, {'height': 213, 'url': 'https://external-preview.redd.it/Gss0vSMyhUWVSJ6lNrdEMXqVH-LmhecsjawlSVj2Au8.jpg?width=320&amp;crop=smart&amp;auto=webp&amp;s=0276c43325d3d484d0618b896c1b8b71f54c0445', 'width': 320}, {'height': 426, 'url': 'https://external-preview.redd.it/Gss0vSMyhUWVSJ6lNrdEMXqVH-LmhecsjawlSVj2Au8.jpg?width=640&amp;crop=smart&amp;auto=webp&amp;s=812702bc29d6b45e02f870c8592780358acfa4eb', 'width': 640}, {'height': 640, 'url': 'https://external-preview.redd.it/Gss0vSMyhUWVSJ6lNrdEMXqVH-LmhecsjawlSVj2Au8.jpg?width=960&amp;crop=smart&amp;auto=webp&amp;s=a4d48d3fd13f87af15653e23cea29799c388cb2f', 'width': 960}], 'source': {'height': 716, 'url': 'https://external-preview.redd.it/Gss0vSMyhUWVSJ6lNrdEMXqVH-LmhecsjawlSVj2Au8.jpg?auto=webp&amp;s=1f17cab17d04bedf76d0cc73e4b83db9ea8bd103', 'width': 1074}, 'variants': {}}]}",6,1652553906,1,,False,False,False,CryptoCurrency,t5_2wlj3,4854490,public,new,https://b.thumbs.redditmedia.com/LNCo7ybydKwf4ngdNDB8KGDR2K7X5pickkJkJawXMqc.jpg,"Terra's Do Kwon 'Heartbroken' Over UST Collapse, Doge's Billy Markus Tells Him To Leave The Industry - Benzinga",0,[],1.0,https://www.benzinga.com/markets/cryptocurrency/22/05/27206777/terras-do-kwon-heartbroken-over-ust-collapse-doges-billy-markus-says-he-should-leave-the-i,all_ads,6,1652525095.0,,,,,,93.0,140.0,https://www.benzinga.com/markets/cryptocurrency/22/05/27206777/terras-do-kwon-heartbroken-over-ust-collapse-doges-billy-markus-says-he-should-leave-the-i,,,,
62,[],False,ReedB04,,Warning-level1-1,"[{'e': 'text', 't': 'Bronze | r/WSB 12'}]",Bronze | r/WSB 12,dark,richtext,t2_9pjy3gc0,False,False,False,[],False,False,1652553509,medium.com,https://www.reddit.com/r/CryptoCurrency/comments/upnhag/terra_usd_ust_is_terrausd_a_better_alternative/,{},upnhag,False,True,False,False,False,True,False,False,#ff66ac,DEBATE,"[{'e': 'text', 't': 'DEBATE'}]",5b762856-d7c9-11e4-822a-22000b2300b2,DEBATE,light,richtext,False,False,True,0,0,False,all_ads,/r/CryptoCurrency/comments/upnhag/terra_usd_ust_is_terrausd_a_better_alternative/,False,,,6,1652553519,1,,True,False,False,CryptoCurrency,t5_2wlj3,4854460,public,new,default,TERRA USD (UST): Is TerraUSD a better alternative for Tether (USDT)?,0,[],1.0,https://medium.com/@Technophile30/terra-usd-ust-is-terrausd-a-better-alternative-for-tether-usdt-114977fa9495,all_ads,6,1652524709.0,,,,,,,,https://medium.com/@Technophile30/terra-usd-ust-is-terrausd-a-better-alternative-for-tether-usdt-114977fa9495,,,,
63,[],False,Tirafior,,,[],,,text,t2_54rhu7ng,False,False,False,[],False,False,1652553323,i.redd.it,https://www.reddit.com/r/CryptoCurrency/comments/upnf9l/so_i_tried_to_withdraw_my_ust_and_they_burned_it/,{},upnf9l,False,True,False,False,True,True,False,False,#7193ff,DISCUSSION,"[{'e': 'text', 't': 'DISCUSSION'}]",87049662-0882-11e5-82e1-0e9d1a9f7761,DISCUSSION,dark,richtext,False,False,True,1,0,False,all_ads,/r/CryptoCurrency/comments/upnf9l/so_i_tried_to_withdraw_my_ust_and_they_burned_it/,False,image,"{'enabled': True, 'images': [{'id': 'HNCc_Tx7PRPUnXu7fY3kygRmKpE-NlP5F-GM4puO5Pw', 'resolutions': [{'height': 12, 'url': 'https://preview.redd.it/lasagagyjhz81.png?width=108&amp;crop=smart&amp;auto=webp&amp;s=1ab67c286e621217e0acc5f7c5ca6c2196fbf5ea', 'width': 108}, {'height': 25, 'url': 'https://preview.redd.it/lasagagyjhz81.png?width=216&amp;crop=smart&amp;auto=webp&amp;s=e416340b738cfa00f9436414bd97aef5494997c0', 'width': 216}, {'height': 37, 'url': 'https://preview.redd.it/lasagagyjhz81.png?width=320&amp;crop=smart&amp;auto=webp&amp;s=d23fdbdb3f9d5531a38805097ffaa2cf4b84dd3f', 'width': 320}, {'height': 74, 'url': 'https://preview.redd.it/lasagagyjhz81.png?width=640&amp;crop=smart&amp;auto=webp&amp;s=96c29217e6ca716ee8c1393f998f1d3da8072d60', 'width': 640}, {'height': 111, 'url': 'https://preview.redd.it/lasagagyjhz81.png?width=960&amp;crop=smart&amp;auto=webp&amp;s=050f84eb419dadb72aa00efa1ed0abe4eb71a9ad', 'width': 960}], 'source': {'height': 117, 'url': 'https://preview.redd.it/lasagagyjhz81.png?auto=webp&amp;s=39f64eab605c6523a4bb9c4ab255b167b8af04a3', 'width': 1003}, 'variants': {}}]}",6,1652553333,1,,True,False,False,CryptoCurrency,t5_2wlj3,4854448,public,new,https://b.thumbs.redditmedia.com/WmOA5TtpkhYCHhulhauKmXSQgRDKAvG8GH1iRRJUDWA.jpg,So i tried to withdraw my UST and they burned it??,0,[],1.0,https://i.redd.it/lasagagyjhz81.png,all_ads,6,1652524523.0,,,,,,16.0,140.0,https://i.redd.it/lasagagyjhz81.png,,,,
64,[],False,BillySheldy,,,[],,,text,t2_a0ydjmuu,False,False,False,[],False,False,1652553238,self.CryptoCurrency,https://www.reddit.com/r/CryptoCurrency/comments/upne95/blackrock_and_citadel_are_behind_the_crypto_fall/,{},upne95,False,True,False,False,False,True,True,False,#ff66ac,DEBATE,"[{'e': 'text', 't': 'DEBATE'}]",5b762856-d7c9-11e4-822a-22000b2300b2,DEBATE,light,richtext,False,False,False,0,0,False,all_ads,/r/CryptoCurrency/comments/upne95/blackrock_and_citadel_are_behind_the_crypto_fall/,False,,,6,1652553249,1,"how to kill a stableCOIN  ... the story behind TerraLuna implosion:

""Blackrock and Citadel borrowed 100K BTC from Gemini (Gemini have just denied apprently on twitter… ). They swapped 25K of that BTC into UST; this was all done quietly in anticipation of the attack.
When the time was right, they called up Do Kwon at Terra Foundation and said they wanted to sell a lot of BTC for UST. As it was a large trade they told him they didn't want to move the market and asked if he would like to buy their large block of BTC at a discount for UST. Do Kwan took the bait. He gave them a huge chunk of UST, thus lowering the UST liquidity significantly. At that point, Blackrock/Citadel dumped all of the BTC and UST causing massive slippage and triggering a cascade of forced selling in both assets. The real problem was Blackrock/Citadel knew that Anchor, which holds a lot of LUNA , was a Ponzi scheme (they offer 20% staking APY for Christsake) and this crash would trigger more withdrawals than Anchor can repay. These forced withdrawals and selling would trigger a massive selloff in Luna, thus further breaking the $1 peg and wrecking the market further.
Blackrock and Citadel can now buy the BTC back cheaply to repay the loan and pocket the difference. Meanwhile, billions of longs and Bitcoin VaR were wiped out.""

At this moment the road to defi is VERY far away .. and it's also a very stupid idea to use bitcoin as an underlying asset for a stable coin...",True,False,False,CryptoCurrency,t5_2wlj3,4854440,public,new,self,Blackrock and Citadel are behind the crypto fall but why?,0,[],1.0,https://www.reddit.com/r/CryptoCurrency/comments/upne95/blackrock_and_citadel_are_behind_the_crypto_fall/,all_ads,6,1652524438.0,,,,,,,,,,,,
65,[],False,Serious-Row7621,,,[],,,text,t2_a84hewe8,False,False,False,[],False,False,1652553057,self.CryptoCurrency,https://www.reddit.com/r/CryptoCurrency/comments/upnc38/ust_and_luna_loss_how_to_report_irs_tax_loss/,{},upnc38,False,False,False,False,False,False,True,False,#46d160,ADVICE,"[{'e': 'text', 't': 'ADVICE'}]",e9570888-9c2a-11e3-809c-12313d1661cc,ADVICE,dark,richtext,False,False,True,1,0,False,all_ads,/r/CryptoCurrency/comments/upnc38/ust_and_luna_loss_how_to_report_irs_tax_loss/,False,,,6,1652553068,1,[removed],True,False,False,CryptoCurrency,t5_2wlj3,4854424,public,,self,UST and LUNA loss - how to report IRS TAX Loss,0,[],1.0,https://www.reddit.com/r/CryptoCurrency/comments/upnc38/ust_and_luna_loss_how_to_report_irs_tax_loss/,all_ads,6,1652524257.0,,,moderator,,,,,,,,,
66,[],False,whiteyfisk46,,,"[{'e': 'text', 't': 'Platinum | QC: XLM 267, CC 24, BTC 19 | MANA 12 | r/WSB 18'}]","Platinum | QC: XLM 267, CC 24, BTC 19 | MANA 12 | r/WSB 18",dark,richtext,t2_a2askruj,False,False,True,[],False,False,1652552954,coinnounce.com,https://www.reddit.com/r/CryptoCurrency/comments/upnarv/a_singaporean_lunaust_investor_files_lawsuit/,{},upnarv,False,True,False,False,False,True,False,False,#0aa18f,NEWS,"[{'e': 'text', 't': 'GENERAL-NEWS'}]",f170aab2-246f-11ec-8143-429a193c9848,GENERAL-NEWS,light,richtext,False,False,True,0,0,False,all_ads,/r/CryptoCurrency/comments/upnarv/a_singaporean_lunaust_investor_files_lawsuit/,False,link,"{'enabled': False, 'images': [{'id': 'a4rWoALieNCx3ayNis_unDib9PSP5tGq4Uz6aedhBps', 'resolutions': [{'height': 60, 'url': 'https://external-preview.redd.it/XtGlKRtSpuS2QzUvp8Wc5TAJDV3rX6OWW3gLJ1XKX74.jpg?width=108&amp;crop=smart&amp;auto=webp&amp;s=dd7fefa25eb129103d7c31634f8c494dc3de557a', 'width': 108}, {'height': 121, 'url': 'https://external-preview.redd.it/XtGlKRtSpuS2QzUvp8Wc5TAJDV3rX6OWW3gLJ1XKX74.jpg?width=216&amp;crop=smart&amp;auto=webp&amp;s=4c99176748b026c0f045e8db77e94b4f1742c2f6', 'width': 216}, {'height': 180, 'url': 'https://external-preview.redd.it/XtGlKRtSpuS2QzUvp8Wc5TAJDV3rX6OWW3gLJ1XKX74.jpg?width=320&amp;crop=smart&amp;auto=webp&amp;s=c83d566e75a32dd4be1a7bafc1680665ad71edcb', 'width': 320}, {'height': 360, 'url': 'https://external-preview.redd.it/XtGlKRtSpuS2QzUvp8Wc5TAJDV3rX6OWW3gLJ1XKX74.jpg?width=640&amp;crop=smart&amp;auto=webp&amp;s=f08d196817dda4a2fe4e30cd39ce4f32f15cb66d', 'width': 640}, {'height': 540, 'url': 'https://external-preview.redd.it/XtGlKRtSpuS2QzUvp8Wc5TAJDV3rX6OWW3gLJ1XKX74.jpg?width=960&amp;crop=smart&amp;auto=webp&amp;s=a02ca8fde4c0a5fa4e8f3d37a6950bc0572914a7', 'width': 960}, {'height': 607, 'url': 'https://external-preview.redd.it/XtGlKRtSpuS2QzUvp8Wc5TAJDV3rX6OWW3gLJ1XKX74.jpg?width=1080&amp;crop=smart&amp;auto=webp&amp;s=6e4220ffa4106d71af5423269a961e05e3fd32ba', 'width': 1080}], 'source': {'height': 675, 'url': 'https://external-preview.redd.it/XtGlKRtSpuS2QzUvp8Wc5TAJDV3rX6OWW3gLJ1XKX74.jpg?auto=webp&amp;s=254c5de3b40f79115da668fc5ec51bb339bf03d3', 'width': 1200}, 'variants': {}}]}",6,1652552965,1,,True,False,False,CryptoCurrency,t5_2wlj3,4854417,public,new,https://b.thumbs.redditmedia.com/LEXCbpRGOguLcuwkhWrr2hWgIpPYBnHsaFjtCiAfj4A.jpg,A Singaporean LUNA/UST Investor Files Lawsuit Against Terra's Do Kwon,0,[],1.0,https://coinnounce.com/a-singaporean-luna-ust-investor-files-lawsuit-against-terras-do-kwon/,all_ads,6,1652524154.0,,,,,,78.0,140.0,https://coinnounce.com/a-singaporean-luna-ust-investor-files-lawsuit-against-terras-do-kwon/,,,,
67,[],False,BillySheldy,,,[],,,text,t2_a0ydjmuu,False,False,False,[],False,False,1652552760,self.CryptoCurrency,https://www.reddit.com/r/CryptoCurrency/comments/upn8ii/black_rock_and_citadel_are_behind_the_crypto_fall/,{},upn8ii,False,True,False,False,False,True,True,False,#add2e2,ADVICE,"[{'e': 'text', 't': 'ANALYSIS'}]",c1034ee6-9c2a-11e3-a8c4-12313b0e8e20,ANALYSIS,dark,richtext,False,False,True,0,0,False,all_ads,/r/CryptoCurrency/comments/upn8ii/black_rock_and_citadel_are_behind_the_crypto_fall/,False,,,6,1652552770,1,"how to kill a stableCOIN  ... the story behind TerraLuna implosion:

""Blackrock and Citadel borrowed 100K BTC from Gemini (Gemini have just denied apprently on twitter… ). They swapped 25K of that BTC into UST; this was all done quietly in anticipation of the attack.
When the time was right, they called up Do Kwon at Terra Foundation and said they wanted to sell a lot of BTC for UST. As it was a large trade they told him they didn't want to move the market and asked if he would like to buy their large block of BTC at a discount for UST. Do Kwan took the bait. He gave them a huge chunk of UST, thus lowering the UST liquidity significantly. At that point, Blackrock/Citadel dumped all of the BTC and UST causing massive slippage and triggering a cascade of forced selling in both assets. The real problem was Blackrock/Citadel knew that Anchor, which holds a lot of LUNA , was a Ponzi scheme (they offer 20% staking APY for Christsake) and this crash would trigger more withdrawals than Anchor can repay. These forced withdrawals and selling would trigger a massive selloff in Luna, thus further breaking the $1 peg and wrecking the market further.
Blackrock and Citadel can now buy the BTC back cheaply to repay the loan and pocket the difference. Meanwhile, billions of longs and Bitcoin VaR were wiped out.""

At this moment the road to defi is VERY far away .. and it's also a very stupid idea to use bitcoin as an underlying asset for a stable coin...",True,False,False,CryptoCurrency,t5_2wlj3,4854398,public,new,self,Black rock and Citadel are behind the crypto fall,0,[],1.0,https://www.reddit.com/r/CryptoCurrency/comments/upn8ii/black_rock_and_citadel_are_behind_the_crypto_fall/,all_ads,6,1652523960.0,,,,,,,,,,,,
68,[],False,suggestiondude,,,"[{'e': 'text', 't': 'Platinum | QC: CC 42 | r/WSB 76'}]",Platinum | QC: CC 42 | r/WSB 76,dark,richtext,t2_6dh3588k,False,False,False,[],False,False,1652552514,self.CryptoCurrency,https://www.reddit.com/r/CryptoCurrency/comments/upn5hc/i_dont_feel_bad_for_anyone_who_lost_their_life/,{},upn5hc,False,True,False,False,False,True,True,False,#7193ff,DISCUSSION,"[{'e': 'text', 't': 'DISCUSSION'}]",87049662-0882-11e5-82e1-0e9d1a9f7761,DISCUSSION,dark,richtext,False,False,True,0,0,False,all_ads,/r/CryptoCurrency/comments/upn5hc/i_dont_feel_bad_for_anyone_who_lost_their_life/,False,,,6,1652552524,1,"The title says it all. It is sad to see posts about people contemplating suicide or, worse, doing it, and I hope anyone who is thinking of such a thing gets mental help and help for gambling.

Here's why I don't feel bad for them, though. If I go to a casino and turn $1k into $10k and lose it all, no one cares because I was GAMBLING. I was knowingly participating in risky financial behavior, and I have to accept the consequences.

Money is hard to make. People work their ass off for $14 an hour, flipping burgers, and cleaning garbage. If you're lucky, you go to school and get a good paying job where you can buy a property, take care of yourself and your family, and invest some.

These people thought they found an infinite free money hub. Who has ever heard of 20% interest outside of a ponzi scheme? 

It sucks but again, if you put all your money in a risky investment and it goes south, you are to blame. No one forced them. They made a conscious decision and had to accept the consequences. Who here hasn't done the same and felt like shit? 

It sucks but the proposal that Du made that 80% of tokens would go to UST and LUNA holders that held to the end is insane. People who are investing now are keeping this together.",True,False,False,CryptoCurrency,t5_2wlj3,4854370,public,new,self,I don't feel bad for anyone who lost their life savings in LUNA. They were doing very risky gambling.,0,[],1.0,https://www.reddit.com/r/CryptoCurrency/comments/upn5hc/i_dont_feel_bad_for_anyone_who_lost_their_life/,all_ads,6,1652523714.0,,,,,,,,,,,,
69,[],False,DArabbb,,Warning-level2-2,"[{'e': 'text', 't': 'Tin'}]",Tin,dark,richtext,t2_g15wc,False,False,False,[],False,False,1652552126,self.CryptoCurrency,https://www.reddit.com/r/CryptoCurrency/comments/upn0rc/can_someone_please_eli5_the_burning_process_for/,{},upn0rc,False,True,False,False,False,True,True,False,#7193ff,DISCUSSION,"[{'e': 'text', 't': 'DISCUSSION'}]",87049662-0882-11e5-82e1-0e9d1a9f7761,DISCUSSION,dark,richtext,False,False,True,0,0,False,all_ads,/r/CryptoCurrency/comments/upn0rc/can_someone_please_eli5_the_burning_process_for/,False,,,6,1652552136,1,"Please be gentle on my angus. I've never been invested with this eco so I'm trying to get a better understanding of it. 

I'm trying to wrap my head around how the team will salvage the ecosystem. Since the 12th, supply went from 377 million to 6.5 trillion LUNA, there have been talks about a fork and pulling up a snapshot to before the de-peg and Do Gone's response on Agora for resetting network back to 1B tokens. 

Does that mean those who were lucky enough to get in at 0.000001-3c and ended up with thousands and millions of Luna could see their bags emptied overnight? And probably the dumbest question all week, which coins are they burning to get the prices back up? both? Seen on twitter they want to burn the rest of UST but with the sudden pump in Luna, will the newly minted trillions face the fire too?",True,False,False,CryptoCurrency,t5_2wlj3,4854338,public,,self,Can someone please ELI5 the burning process for TerraL?,0,[],1.0,https://www.reddit.com/r/CryptoCurrency/comments/upn0rc/can_someone_please_eli5_the_burning_process_for/,all_ads,6,1652523326.0,,,,,,,,,,,,
