24,[],False,mrtoeonreddit,,Warning-level2-2,"[{'e': 'text', 't': 'Tin'}]",Tin,dark,richtext,t2_15witk,False,False,False,[],False,False,1652600852,self.CryptoCurrency,https://www.reddit.com/r/CryptoCurrency/comments/uq130v/eli5_for_luna_ust_price_arbitrage_mechanism_and/,{},uq130v,False,True,False,False,False,True,True,False,#7193ff,DISCUSSION,"[{'e': 'text', 't': 'DISCUSSION'}]",87049662-0882-11e5-82e1-0e9d1a9f7761,DISCUSSION,dark,richtext,False,False,False,0,0,False,all_ads,/r/CryptoCurrency/comments/uq130v/eli5_for_luna_ust_price_arbitrage_mechanism_and/,False,,,6,1652600863,1,"I have been reading articles of how UST (terra) maintains its algorithmic peg to the US dollar via the arbitrage mechanism

This is the part I understand:

When the price of UST (Terra) falls below one us dollar, people are able to exchange 1 UST (terra) for 1 us dollar worth of LUNA at terra station website thereby making the difference in profit, this arbitrage process will bring the UST (Terra) back to 1 US dollar.  

This is the part I do not understand:

How does terra station determine the US dollar price of a LUNA?",True,False,False,CryptoCurrency,t5_2wlj3,4858642,public,new,self,ELI5 for LUNA UST price arbitrage mechanism and how is the LUNA priced in US dollars,0,[],1.0,https://www.reddit.com/r/CryptoCurrency/comments/uq130v/eli5_for_luna_ust_price_arbitrage_mechanism_and/,all_ads,6,1652572052.0,,,,,,,,,
25,[],False,callmev269,,,"[{'e': 'text', 't': 'Platinum | QC: CC 136, BTC 20 | Cdn.Investor 10'}]","Platinum | QC: CC 136, BTC 20 | Cdn.Investor 10",dark,richtext,t2_fpvtci,False,False,False,[],False,False,1652597819,self.CryptoCurrency,https://www.reddit.com/r/CryptoCurrency/comments/uq0dnt/dont_be_fooled_your_moonshot_coin_is_only_down_90/,{},uq0dnt,False,True,False,False,False,True,True,False,#7193ff,DISCUSSION,"[{'e': 'text', 't': 'DISCUSSION'}]",87049662-0882-11e5-82e1-0e9d1a9f7761,DISCUSSION,dark,richtext,False,False,True,0,0,False,all_ads,/r/CryptoCurrency/comments/uq0dnt/dont_be_fooled_your_moonshot_coin_is_only_down_90/,False,self,"{'enabled': False, 'images': [{'id': 'IRHzloxav2kYSzT3Nv-4bc4C6vBoi3ORy6v-9kGasmg', 'resolutions': [{'height': 53, 'url': 'https://external-preview.redd.it/dF1_SdIIKM0yfmsRYl4kXrlL5ropYI7d9cAq2d5ZPzc.jpg?width=108&amp;crop=smart&amp;auto=webp&amp;s=64445aeb726d21df213bab01d9fef9d02634cc9d', 'width': 108}, {'height': 107, 'url': 'https://external-preview.redd.it/dF1_SdIIKM0yfmsRYl4kXrlL5ropYI7d9cAq2d5ZPzc.jpg?width=216&amp;crop=smart&amp;auto=webp&amp;s=1baa5b73285e4be54eee29f3d0602803dbedda29', 'width': 216}, {'height': 159, 'url': 'https://external-preview.redd.it/dF1_SdIIKM0yfmsRYl4kXrlL5ropYI7d9cAq2d5ZPzc.jpg?width=320&amp;crop=smart&amp;auto=webp&amp;s=37d5bec382259fc8258831f9c806dc74b8a0e606', 'width': 320}, {'height': 319, 'url': 'https://external-preview.redd.it/dF1_SdIIKM0yfmsRYl4kXrlL5ropYI7d9cAq2d5ZPzc.jpg?width=640&amp;crop=smart&amp;auto=webp&amp;s=3e9af7da32027bbf44336491f0f1ab0fe7f1dcc3', 'width': 640}, {'height': 478, 'url': 'https://external-preview.redd.it/dF1_SdIIKM0yfmsRYl4kXrlL5ropYI7d9cAq2d5ZPzc.jpg?width=960&amp;crop=smart&amp;auto=webp&amp;s=2cc9ba1bac244b558c29ff1ff0a2553b69e01d5d', 'width': 960}, {'height': 538, 'url': 'https://external-preview.redd.it/dF1_SdIIKM0yfmsRYl4kXrlL5ropYI7d9cAq2d5ZPzc.jpg?width=1080&amp;crop=smart&amp;auto=webp&amp;s=b844da0842d0a64d7a3caecaac03bc6a8dccc070', 'width': 1080}], 'source': {'height': 718, 'url': 'https://external-preview.redd.it/dF1_SdIIKM0yfmsRYl4kXrlL5ropYI7d9cAq2d5ZPzc.jpg?auto=webp&amp;s=9f4e128a3e40cfbe7e282b8466db46a68d47699e', 'width': 1440}, 'variants': {}}]}",6,1652597829,1,"You can see here L una minted more than 19500 times its circulating supply from a week ago
https://messari.io/asset/terra/chart/sply-circ

The price a week ago is about $80

80 / 19500 / 10 = 0.00041 roughly the price L una is right now. The 10 at the end added to make the math right means that L una is only down roughly 90% taking inflation (minting) into account.

Also L una market cap is still at 2 billions. It was 20 billions a week ago. 

Don't foolishly ape into L una thinking it may one day get back to $1. At $1 L una market cap would be at 6.6 trillions or 13 times Bitcoin market cap. I think best you can hope for is a 10x from its current price to get back to previous mcap. Stay vigilant.",True,False,False,CryptoCurrency,t5_2wlj3,4858397,public,,self,Don't be fooled: your moonshot coin is only down 90% from a week ago taking inflation into account,0,[],1.0,https://www.reddit.com/r/CryptoCurrency/comments/uq0dnt/dont_be_fooled_your_moonshot_coin_is_only_down_90/,all_ads,6,1652569019.0,,,,,,,,,
26,[],False,callmev269,,,"[{'e': 'text', 't': 'Platinum | QC: CC 136, BTC 20 | Cdn.Investor 10'}]","Platinum | QC: CC 136, BTC 20 | Cdn.Investor 10",dark,richtext,t2_fpvtci,False,False,False,[],False,False,1652597277,self.CryptoCurrency,https://www.reddit.com/r/CryptoCurrency/comments/uq09as/dont_be_fooled_taking_inflation_into_account_luna/,{},uq09as,False,True,False,False,False,True,True,False,#7193ff,DISCUSSION,"[{'e': 'text', 't': 'DISCUSSION'}]",87049662-0882-11e5-82e1-0e9d1a9f7761,DISCUSSION,dark,richtext,False,False,True,0,0,False,all_ads,/r/CryptoCurrency/comments/uq09as/dont_be_fooled_taking_inflation_into_account_luna/,False,self,"{'enabled': False, 'images': [{'id': 'IRHzloxav2kYSzT3Nv-4bc4C6vBoi3ORy6v-9kGasmg', 'resolutions': [{'height': 53, 'url': 'https://external-preview.redd.it/dF1_SdIIKM0yfmsRYl4kXrlL5ropYI7d9cAq2d5ZPzc.jpg?width=108&amp;crop=smart&amp;auto=webp&amp;s=64445aeb726d21df213bab01d9fef9d02634cc9d', 'width': 108}, {'height': 107, 'url': 'https://external-preview.redd.it/dF1_SdIIKM0yfmsRYl4kXrlL5ropYI7d9cAq2d5ZPzc.jpg?width=216&amp;crop=smart&amp;auto=webp&amp;s=1baa5b73285e4be54eee29f3d0602803dbedda29', 'width': 216}, {'height': 159, 'url': 'https://external-preview.redd.it/dF1_SdIIKM0yfmsRYl4kXrlL5ropYI7d9cAq2d5ZPzc.jpg?width=320&amp;crop=smart&amp;auto=webp&amp;s=37d5bec382259fc8258831f9c806dc74b8a0e606', 'width': 320}, {'height': 319, 'url': 'https://external-preview.redd.it/dF1_SdIIKM0yfmsRYl4kXrlL5ropYI7d9cAq2d5ZPzc.jpg?width=640&amp;crop=smart&amp;auto=webp&amp;s=3e9af7da32027bbf44336491f0f1ab0fe7f1dcc3', 'width': 640}, {'height': 478, 'url': 'https://external-preview.redd.it/dF1_SdIIKM0yfmsRYl4kXrlL5ropYI7d9cAq2d5ZPzc.jpg?width=960&amp;crop=smart&amp;auto=webp&amp;s=2cc9ba1bac244b558c29ff1ff0a2553b69e01d5d', 'width': 960}, {'height': 538, 'url': 'https://external-preview.redd.it/dF1_SdIIKM0yfmsRYl4kXrlL5ropYI7d9cAq2d5ZPzc.jpg?width=1080&amp;crop=smart&amp;auto=webp&amp;s=b844da0842d0a64d7a3caecaac03bc6a8dccc070', 'width': 1080}], 'source': {'height': 718, 'url': 'https://external-preview.redd.it/dF1_SdIIKM0yfmsRYl4kXrlL5ropYI7d9cAq2d5ZPzc.jpg?auto=webp&amp;s=9f4e128a3e40cfbe7e282b8466db46a68d47699e', 'width': 1440}, 'variants': {}}]}",6,1652597287,1,"You can see here Luna minted more than 19500 times its circulating supply from a week ago
https://messari.io/asset/terra/chart/sply-circ

The price a week ago is about $80

80 / 19500 / 10 = 0.00041 roughly the price Luna is right now. The 10 at the end added to make the math right means that Luna is only down roughly 90% taking inflation (minting) into account.

Also Luna market cap is still at 2 billions. It was 20 billions a week ago. 

Don't foolishly ape into Luna thinking it may one day get back to $1. At $1 Luna market cap would be at 6.6 trillions or 13 times Bitcoin market cap. I think best you can hope for is a 10x from its current price to get back to previous mcap. Stay vigilant.",True,False,False,CryptoCurrency,t5_2wlj3,4858349,public,new,self,Don't be fooled: taking inflation into account Luna is only down roughly 90% from a week ago,0,[],1.0,https://www.reddit.com/r/CryptoCurrency/comments/uq09as/dont_be_fooled_taking_inflation_into_account_luna/,all_ads,6,1652568477.0,,,,,,,,,
27,[],False,coinmonks,,Transitioning,"[{'e': 'text', 't': ' '}]", ,dark,richtext,t2_1gwlmecj,False,False,False,[],False,False,1652596702,youtu.be,https://www.reddit.com/r/CryptoCurrency/comments/uq04mh/youtuber_ksi_loses_28_million_in_terra_crash_in/,{},uq04mh,False,True,False,False,False,True,False,False,#46d160,MARKETS,"[{'e': 'text', 't': 'MARKETS'}]",1a657c8c-e48d-11e5-a215-0e374d550989,MARKETS,light,richtext,False,False,False,0,0,False,all_ads,/r/CryptoCurrency/comments/uq04mh/youtuber_ksi_loses_28_million_in_terra_crash_in/,False,rich:video,"{'enabled': False, 'images': [{'id': 'j-L0_BQZtOsrdEm93NlERB8HtXIlU2fY2Qyf8xMGxlM', 'resolutions': [{'height': 81, 'url': 'https://external-preview.redd.it/XC2xUnIz4TS3JOF5N5P1Jv1RBjpw38SOp2XORl1Q6_c.jpg?width=108&amp;crop=smart&amp;auto=webp&amp;s=ac6b0490443840757999aa5b08a577b43789165b', 'width': 108}, {'height': 162, 'url': 'https://external-preview.redd.it/XC2xUnIz4TS3JOF5N5P1Jv1RBjpw38SOp2XORl1Q6_c.jpg?width=216&amp;crop=smart&amp;auto=webp&amp;s=19e936412a786749e43914f2ff91213c530ed3fd', 'width': 216}, {'height': 240, 'url': 'https://external-preview.redd.it/XC2xUnIz4TS3JOF5N5P1Jv1RBjpw38SOp2XORl1Q6_c.jpg?width=320&amp;crop=smart&amp;auto=webp&amp;s=95ae6c598bbc862beea710d549c5e68b555b6c1b', 'width': 320}], 'source': {'height': 360, 'url': 'https://external-preview.redd.it/XC2xUnIz4TS3JOF5N5P1Jv1RBjpw38SOp2XORl1Q6_c.jpg?auto=webp&amp;s=b17d7cb6dc8dc77b0f7920784a237ad80343f4cd', 'width': 480}, 'variants': {}}]}",6,1652596712,1,,True,False,False,CryptoCurrency,t5_2wlj3,4858307,public,new,https://b.thumbs.redditmedia.com/RH_FaEIjj0VvuRiTQ0lWvI9Bn-YJdjs5Abe6pZJC01w.jpg,YouTuber KSI loses $2.8 million in Terra Crash in 24 Hours.,0,[],1.0,https://youtu.be/Ar2AUS8LscI,all_ads,6,1652567902.0,,105.0,140.0,https://youtu.be/Ar2AUS8LscI,,"{'oembed': {'author_name': 'Coinmonks', 'author_url': 'https://www.youtube.com/c/Coinmonks', 'height': 200, 'html': '&lt;iframe width=""356"" height=""200"" src=""https://www.youtube.com/embed/Ar2AUS8LscI?feature=oembed&amp;enablejsapi=1"" frameborder=""0"" allow=""accelerometer; autoplay; clipboard-write; encrypted-media; gyroscope; picture-in-picture"" allowfullscreen&gt;&lt;/iframe&gt;', 'provider_name': 'YouTube', 'provider_url': 'https://www.youtube.com/', 'thumbnail_height': 360, 'thumbnail_url': 'https://i.ytimg.com/vi/Ar2AUS8LscI/hqdefault.jpg', 'thumbnail_width': 480, 'title': 'YouTuber KSI loses $2.8 million in Terra Crash in 24 Hours | Crypto News Daily | 14/05/22', 'type': 'video', 'version': '1.0', 'width': 356}, 'type': 'youtube.com'}","{'content': '&lt;iframe width=""356"" height=""200"" src=""https://www.youtube.com/embed/Ar2AUS8LscI?feature=oembed&amp;enablejsapi=1"" frameborder=""0"" allow=""accelerometer; autoplay; clipboard-write; encrypted-media; gyroscope; picture-in-picture"" allowfullscreen&gt;&lt;/iframe&gt;', 'height': 200, 'scrolling': False, 'width': 356}","{'oembed': {'author_name': 'Coinmonks', 'author_url': 'https://www.youtube.com/c/Coinmonks', 'height': 200, 'html': '&lt;iframe width=""356"" height=""200"" src=""https://www.youtube.com/embed/Ar2AUS8LscI?feature=oembed&amp;enablejsapi=1"" frameborder=""0"" allow=""accelerometer; autoplay; clipboard-write; encrypted-media; gyroscope; picture-in-picture"" allowfullscreen&gt;&lt;/iframe&gt;', 'provider_name': 'YouTube', 'provider_url': 'https://www.youtube.com/', 'thumbnail_height': 360, 'thumbnail_url': 'https://i.ytimg.com/vi/Ar2AUS8LscI/hqdefault.jpg', 'thumbnail_width': 480, 'title': 'YouTuber KSI loses $2.8 million in Terra Crash in 24 Hours | Crypto News Daily | 14/05/22', 'type': 'video', 'version': '1.0', 'width': 356}, 'type': 'youtube.com'}","{'content': '&lt;iframe width=""356"" height=""200"" src=""https://www.youtube.com/embed/Ar2AUS8LscI?feature=oembed&amp;enablejsapi=1"" frameborder=""0"" allow=""accelerometer; autoplay; clipboard-write; encrypted-media; gyroscope; picture-in-picture"" allowfullscreen&gt;&lt;/iframe&gt;', 'height': 200, 'media_domain_url': 'https://www.redditmedia.com/mediaembed/uq04mh', 'scrolling': False, 'width': 356}"
28,[],False,Theodora765,,,[],,,text,t2_fslqj7uq,False,False,False,[],False,False,1652593408,self.CryptoCurrency,https://www.reddit.com/r/CryptoCurrency/comments/upzci3/pov_this_is_how_a_trader_experienced_the_fall_of/,{},upzci3,False,True,False,False,False,True,True,False,#7193ff,DISCUSSION,"[{'e': 'text', 't': 'DISCUSSION'}]",87049662-0882-11e5-82e1-0e9d1a9f7761,DISCUSSION,dark,richtext,False,False,True,0,0,False,all_ads,/r/CryptoCurrency/comments/upzci3/pov_this_is_how_a_trader_experienced_the_fall_of/,False,,,6,1652593418,1," ImmortalCrypto, as he is known in social networks, has been trading cryptocurrencies for more than 4 years. And at least since 2020, he has been doing it full time, as his main activity. This transition, from a job outside of trading to this exclusive dedication, he was able to make after becoming a profitable trader with consistency.   In this world, we might think that this experience is enough not to fall into too big losses. And in part, that is true. However, he was one of the thousands of people who lost money with the Terra project debacle. Although he did not invest in the LUNA token, he did have tens of thousands of dollars in his stablecoin, TerraUSD (UST).  In spite of everything, Luna decided to still 'print' more tokens by uncontrollably increasing the supply, as they could have instead repurchased their tokens with part of the fee for token burning existentially, as has been done at GMR or Minosis Token at BSC.  Via Twitter, he commented that he had lost 70% of the capital he held in UST, following the loss of the 1:1 parity between this currency and the US dollar. A parity that, in theory, he was not supposed to lose. After all, it is a ""stable"" currency. But the reality has been different.    The story of the Terra project, its stablecoin, its token and its bitcoin reserves has ended in the worst possible way: with billions of dollars in losses and a lot of people affected with devastating results. ImmortalCrypto's case was not among the worst. As he himself claims, this has been thanks to the experience and foresight he had taken.  ""The distrust that this has generated, what it will also generate is that many regulators will put the magnifying glass on the stable ones. Which is quite negative because it means huge regulations for 'crypto', which we always know do not come as a positive thing. These are things that go way over the top.""  -InmortalCrypto, trader focused on bitcoin and cryptocurrencies",True,False,False,CryptoCurrency,t5_2wlj3,4858026,public,new,self,"POV; This is how a trader experienced the fall of Terra USD, losing up to 70% of his investment.",0,[],1.0,https://www.reddit.com/r/CryptoCurrency/comments/upzci3/pov_this_is_how_a_trader_experienced_the_fall_of/,all_ads,6,1652564608.0,,,,,,,,,
29,[],False,HiddenknifeX,,Warning-level2-2,"[{'e': 'text', 't': 'Tin'}]",Tin,dark,richtext,t2_2gg5jdwo,False,False,False,[],False,False,1652593166,self.CryptoCurrency,https://www.reddit.com/r/CryptoCurrency/comments/upzaee/which_is_the_safest_stablecoin_to_keep_your/,{},upzaee,False,True,False,False,False,True,True,False,#46d160,ADVICE,"[{'e': 'text', 't': 'ADVICE'}]",e9570888-9c2a-11e3-809c-12313d1661cc,ADVICE,dark,richtext,False,False,True,0,0,False,all_ads,/r/CryptoCurrency/comments/upzaee/which_is_the_safest_stablecoin_to_keep_your/,False,,,6,1652593177,1,"As the title says and the recent current events, which would be in your opinion the safest stablecoin to keep our money in during those times? I feel uneasy to keep my capital in USDT after reading so much FUD about it. I m not interested
in speculation or FUD, i am looking for facts only. Terra USD was such a hyped promising stablecoin, yet it crashed to its death. 

I could say that now it is really hard for one to believe anything what is said good about a project or another, once a trust is broken about strong projects i will be extracareful about what i keep my momey in. So what is your pick for the safest stablecoin and why?",True,False,False,CryptoCurrency,t5_2wlj3,4858010,public,new,self,Which is the safest stablecoin to keep your dollars in?,0,[],1.0,https://www.reddit.com/r/CryptoCurrency/comments/upzaee/which_is_the_safest_stablecoin_to_keep_your/,all_ads,6,1652564366.0,,,,,,,,,
30,[],False,BeautifulWorker1098,,,[],,,text,t2_cly9nofx,False,False,False,[],False,False,1652591489,youtube.com,https://www.reddit.com/r/CryptoCurrency/comments/upyvhe/crypto_crash_stablecoin_collapse_luna_terra/,{},upyvhe,False,False,False,False,False,False,False,False,#46d160,MARKETS,"[{'e': 'text', 't': 'MARKETS'}]",1a657c8c-e48d-11e5-a215-0e374d550989,MARKETS,light,richtext,False,False,True,0,0,False,all_ads,/r/CryptoCurrency/comments/upyvhe/crypto_crash_stablecoin_collapse_luna_terra/,False,rich:video,"{'enabled': False, 'images': [{'id': '925q-PiwvQ9Y6yl62fW6SbCYxnQ28o9jnlbttcXWB7U', 'resolutions': [{'height': 81, 'url': 'https://external-preview.redd.it/A8zEB5z8RykR_VHlGGnK12wssGXd7hCnPBwmOQcakLQ.jpg?width=108&amp;crop=smart&amp;auto=webp&amp;s=a32793fa3b863f1ac4a4324dc554b9bd8c5f2f93', 'width': 108}, {'height': 162, 'url': 'https://external-preview.redd.it/A8zEB5z8RykR_VHlGGnK12wssGXd7hCnPBwmOQcakLQ.jpg?width=216&amp;crop=smart&amp;auto=webp&amp;s=eb831d3cf316023bad5e035b37ccdb114980d1b6', 'width': 216}, {'height': 240, 'url': 'https://external-preview.redd.it/A8zEB5z8RykR_VHlGGnK12wssGXd7hCnPBwmOQcakLQ.jpg?width=320&amp;crop=smart&amp;auto=webp&amp;s=4175442edb8daa431ca0715e76ef4abb8465b7c6', 'width': 320}], 'source': {'height': 360, 'url': 'https://external-preview.redd.it/A8zEB5z8RykR_VHlGGnK12wssGXd7hCnPBwmOQcakLQ.jpg?auto=webp&amp;s=7ba3627820e5b27809b6731d52a496e18afdfb68', 'width': 480}, 'variants': {}}]}",6,1652591499,1,,True,False,False,CryptoCurrency,t5_2wlj3,4857863,public,,https://a.thumbs.redditmedia.com/ZndDR3EN2prJvHElI026-SIXFkKu_CZw-y3k7-ACwg8.jpg,Crypto Crash - Stablecoin collapse #lunA #terra #bitcoin - yesterday news,0,[],1.0,https://www.youtube.com/watch?v=YdWM4nHbTm4,all_ads,6,1652562689.0,automod_filtered,105.0,140.0,https://www.youtube.com/watch?v=YdWM4nHbTm4,,"{'oembed': {'author_name': 'Innovative nerd', 'author_url': 'https://www.youtube.com/channel/UCbbpvKgAYIWh2FccCdQ8NVA', 'height': 200, 'html': '&lt;iframe width=""356"" height=""200"" src=""https://www.youtube.com/embed/YdWM4nHbTm4?feature=oembed&amp;enablejsapi=1"" frameborder=""0"" allow=""accelerometer; autoplay; clipboard-write; encrypted-media; gyroscope; picture-in-picture"" allowfullscreen&gt;&lt;/iframe&gt;', 'provider_name': 'YouTube', 'provider_url': 'https://www.youtube.com/', 'thumbnail_height': 360, 'thumbnail_url': 'https://i.ytimg.com/vi/YdWM4nHbTm4/hqdefault.jpg', 'thumbnail_width': 480, 'title': 'Crypto Crash - Stablecoin collapse #lunA #terra #bitcoin', 'type': 'video', 'version': '1.0', 'width': 356}, 'type': 'youtube.com'}","{'content': '&lt;iframe width=""356"" height=""200"" src=""https://www.youtube.com/embed/YdWM4nHbTm4?feature=oembed&amp;enablejsapi=1"" frameborder=""0"" allow=""accelerometer; autoplay; clipboard-write; encrypted-media; gyroscope; picture-in-picture"" allowfullscreen&gt;&lt;/iframe&gt;', 'height': 200, 'scrolling': False, 'width': 356}","{'oembed': {'author_name': 'Innovative nerd', 'author_url': 'https://www.youtube.com/channel/UCbbpvKgAYIWh2FccCdQ8NVA', 'height': 200, 'html': '&lt;iframe width=""356"" height=""200"" src=""https://www.youtube.com/embed/YdWM4nHbTm4?feature=oembed&amp;enablejsapi=1"" frameborder=""0"" allow=""accelerometer; autoplay; clipboard-write; encrypted-media; gyroscope; picture-in-picture"" allowfullscreen&gt;&lt;/iframe&gt;', 'provider_name': 'YouTube', 'provider_url': 'https://www.youtube.com/', 'thumbnail_height': 360, 'thumbnail_url': 'https://i.ytimg.com/vi/YdWM4nHbTm4/hqdefault.jpg', 'thumbnail_width': 480, 'title': 'Crypto Crash - Stablecoin collapse #lunA #terra #bitcoin', 'type': 'video', 'version': '1.0', 'width': 356}, 'type': 'youtube.com'}","{'content': '&lt;iframe width=""356"" height=""200"" src=""https://www.youtube.com/embed/YdWM4nHbTm4?feature=oembed&amp;enablejsapi=1"" frameborder=""0"" allow=""accelerometer; autoplay; clipboard-write; encrypted-media; gyroscope; picture-in-picture"" allowfullscreen&gt;&lt;/iframe&gt;', 'height': 200, 'media_domain_url': 'https://www.redditmedia.com/mediaembed/upyvhe', 'scrolling': False, 'width': 356}"
31,[],False,FillCreative3209,,,[],,,text,t2_fgha5plq,False,False,False,[],False,False,1652590351,self.CryptoCurrency,https://www.reddit.com/r/CryptoCurrency/comments/upyl2d/terra_luna/,{},upyl2d,False,False,False,False,False,False,True,False,#add2e2,ADVICE,"[{'e': 'text', 't': 'ANALYSIS'}]",c1034ee6-9c2a-11e3-a8c4-12313b0e8e20,ANALYSIS,dark,richtext,False,False,True,1,0,False,all_ads,/r/CryptoCurrency/comments/upyl2d/terra_luna/,False,,,6,1652590362,1,[removed],True,False,False,CryptoCurrency,t5_2wlj3,4857770,public,,self,$TERRA LUNA,0,[],1.0,https://www.reddit.com/r/CryptoCurrency/comments/upyl2d/terra_luna/,all_ads,6,1652561551.0,moderator,,,,,,,,
32,[],False,FillCreative3209,,,[],,,text,t2_fgha5plq,False,False,False,[],False,False,1652590187,self.CryptoCurrency,https://www.reddit.com/r/CryptoCurrency/comments/upyjj3/terra_luna/,{},upyjj3,False,True,False,False,False,True,True,False,#46d160,ADVICE,"[{'e': 'text', 't': 'ADVICE'}]",e9570888-9c2a-11e3-809c-12313d1661cc,ADVICE,dark,richtext,False,False,True,1,0,False,all_ads,/r/CryptoCurrency/comments/upyjj3/terra_luna/,False,,,6,1652590197,1,"Damn I don't think I'll get to the point I will consider suicide 😭 I lost all my life savings in Terra Luna , what a scam, from 100$ to almost nothing in price in just 2 weeks, I can't 😭 10,000$ lost in an instant, I can't get to college and I got fired at my work 😭 damn I wanna die already. Please help me recover some funds, I beg you 😭😭😭

Please here's my 
Bnb bep20 address:
0x625B94b2A468f0e368D454367CEE52d5236345E8


And ETH adress:
0x625B94b2A468f0e368D454367CEE52d5236345E8

Please I beg you 😭😭😭😭",True,False,False,CryptoCurrency,t5_2wlj3,4857756,public,,self,Terra Luna,0,[],1.0,https://www.reddit.com/r/CryptoCurrency/comments/upyjj3/terra_luna/,all_ads,6,1652561387.0,,,,,,,,,
