,all_awardings,allow_live_comments,author,author_flair_background_color,author_flair_css_class,author_flair_richtext,author_flair_text,author_flair_text_color,author_flair_type,author_fullname,author_is_blocked,author_patreon_flair,author_premium,awarders,can_mod_post,contest_mode,created_utc,domain,full_link,gildings,id,is_created_from_ads_ui,is_crosspostable,is_meta,is_original_content,is_reddit_media_domain,is_robot_indexable,is_self,is_video,link_flair_background_color,link_flair_css_class,link_flair_richtext,link_flair_template_id,link_flair_text,link_flair_text_color,link_flair_type,locked,media_only,no_follow,num_comments,num_crossposts,over_18,parent_whitelist_status,permalink,pinned,post_hint,preview,pwls,retrieved_on,score,selftext,send_replies,spoiler,stickied,subreddit,subreddit_id,subreddit_subscribers,subreddit_type,suggested_sort,thumbnail,title,total_awards_received,treatment_tags,upvote_ratio,url,whitelist_status,wls,created,removed_by_category,thumbnail_height,thumbnail_width,url_overridden_by_dest,media_metadata,media,media_embed,secure_media,secure_media_embed
0,[],False,Dry_Tortuga_Island,,Warning-level1-1,"[{'e': 'text', 't': 'Bronze'}]",Bronze,dark,richtext,t2_a8uydb9v,False,False,False,[],False,False,1652626386,self.CryptoCurrency,https://www.reddit.com/r/CryptoCurrency/comments/uq7qk7/anyone_else_think_maybe_liz_warren_was_right_i_am/,{},uq7qk7,False,True,False,False,False,True,True,False,#720469,POLITICS,"[{'e': 'text', 't': 'POLITICS'}]",efdba982-5d89-11e8-9598-0ee79d121028,POLITICS,light,richtext,False,False,True,0,0,False,all_ads,/r/CryptoCurrency/comments/uq7qk7/anyone_else_think_maybe_liz_warren_was_right_i_am/,False,self,"{'enabled': False, 'images': [{'id': '4LwtBa2ZzVsKG7VVsfysTPeLRk3JuR4fcaMnQDTj0mc', 'resolutions': [{'height': 54, 'url': 'https://external-preview.redd.it/-KJ5dD04TfZI6Zgz4xWL39DOjBgZ2LHBO7LLPcnOvBA.jpg?width=108&amp;crop=smart&amp;auto=webp&amp;s=d6fefa5e85ed10c376669f4e7c420d07e1717d40', 'width': 108}, {'height': 108, 'url': 'https://external-preview.redd.it/-KJ5dD04TfZI6Zgz4xWL39DOjBgZ2LHBO7LLPcnOvBA.jpg?width=216&amp;crop=smart&amp;auto=webp&amp;s=8985252ba40011b8752ee29c2012083b5fc7322a', 'width': 216}, {'height': 160, 'url': 'https://external-preview.redd.it/-KJ5dD04TfZI6Zgz4xWL39DOjBgZ2LHBO7LLPcnOvBA.jpg?width=320&amp;crop=smart&amp;auto=webp&amp;s=8065dbceb28d1d79055841d72d8938580824fa4f', 'width': 320}, {'height': 320, 'url': 'https://external-preview.redd.it/-KJ5dD04TfZI6Zgz4xWL39DOjBgZ2LHBO7LLPcnOvBA.jpg?width=640&amp;crop=smart&amp;auto=webp&amp;s=d56f30656813fdd1381edd3b79edab511657fa49', 'width': 640}, {'height': 480, 'url': 'https://external-preview.redd.it/-KJ5dD04TfZI6Zgz4xWL39DOjBgZ2LHBO7LLPcnOvBA.jpg?width=960&amp;crop=smart&amp;auto=webp&amp;s=94699f94a1d6f19264c0c424a0e7d630a0947274', 'width': 960}, {'height': 540, 'url': 'https://external-preview.redd.it/-KJ5dD04TfZI6Zgz4xWL39DOjBgZ2LHBO7LLPcnOvBA.jpg?width=1080&amp;crop=smart&amp;auto=webp&amp;s=2d1faa6d95da23e8b066c02540afc7acbfec977f', 'width': 1080}], 'source': {'height': 640, 'url': 'https://external-preview.redd.it/-KJ5dD04TfZI6Zgz4xWL39DOjBgZ2LHBO7LLPcnOvBA.jpg?auto=webp&amp;s=c6fdf0961e8c7c17284248109739fa4de881ef33', 'width': 1280}, 'variants': {}}]}",6,1652626397,1,"Yeah, I know.  Get your downvotes ready.

About ten days ago, [Liz Warren was getting blasted](https://www.reddit.com/r/CryptoCurrency/comments/uj4z6g/elizabeth_warrens_obsession_with_crypto_continues/) on every crypto sub for saying, "" **Investing in cryptocurrencies is a risky and speculative gamble""** and suggesting that perhaps we don't allow people to idiotically allow their life savings into risky projects .  Projects that could go to zero in a short period of time - you know, like how about 2 days?

Enter the Luna/Terra disaster.  And here I am thinking, maybe... just maybe... this woman who taught commercial and bankruptcy law classes at UPenn and Harvard might be on to something.  She is, by the way, a consistent fighter on behalf of the poor and middle class.  

But instead of her, we idolize guys like Elon who manipulate his fanboys for personal profit on a regular basis while sitting on billions and billions of dollars, avoiding taxes the whole way, and offering to fix global hunger with his money - but doesn't - and instead does shit like buying Twitter.  Which, as an aside, is [just a money-making scheme wherein he takes the company private only to pump it and dump it on the public idiots via IPO.](https://www.wsj.com/articles/elon-musk-plans-to-take-twitter-public-again-later-sources-say-11651609707)

And honestly, I am so fucking sick of the idiotic, skin-deep ""thinking"" of crypto libertarians.  

I get it.  You hate the government.  And taxes.  And helping people who aren't related to you.  Because you just bootstrapped yourself up with ZERO help from anyone, right??  For example:

1. You didn't attend school to learn anything via taxpayer dollars.  You're entirely self taught.
2. You built your own roads and use your own electrical and water infrastructure.
3. You don't use any of the safety net programs like unemployment, preferring to starve to fucking death in your cold, dark underpass where you live whilst unemployed.
4. You definitely aren't taking government insurance help or Medicare as an old person, preferring to be left to the whims of our for-profit health care system that will *definitely* use market forces to drive down costs, not just ask you to pay all your money for [lifesaving healthcare](https://healthcostinstitute.org/emergency-room/ouch-new-data-reveals-er-spending-increased-by-52-from-2012-2019-with-patient-out-of-pocket-payments-increasing-by-88).

Ok, sarcastic rant over.  Let me make my actual point clear here:

I understand that not everything Liz Warren says about crypto is accurate, but we need to get people like her on board and helping make this work.  Crypto has the chance to free people from many of the same people that she views as the enemy: 

* Big banks that charge exorbitant fees for sending money, changing currencies, etc.
* Investment houses and brokerages that manipulate our markets
* Corporations like Visa and Mastercard that make huge % on every purchase 
* Insurance companies that spend billions of dollars on advertising to get us to buy their shitty projects that might help, but maybe not
* Fraudsters that sell fake products 

Crypto has the chance to democratize so many things about our financial systems, taking the power away from profit-driven corporations that will just milk it, bankrupt it, and start it over.   But we aren't going to get there by fighting the government (wherever you may be), dodging our fair share of taxes, and leading people into a wild-west shit show of scammers, insane fees (looking at you, eth), and utter confusion and chaos. 

**We need to help guide the regulation, maturation, and mainstream integration of crypto.**  And people like Liz Warren, Bernie Sanders, and other progressives are the right people to help do it.  YES, we need to convince them of the validity of the concept.  YES, they are partially just advocating for dollar hegemony because it benefits the USA and gives us incredibly leverage over the rest of the world.  But the core concepts of benefiting regular people and providing us access to genuinely democratic, safe, and transparent finances are not antithetical to progressivism; they should be allies, not enemies.",False,False,False,CryptoCurrency,t5_2wlj3,4860863,public,new,self,Anyone else think maybe LIZ WARREN WAS RIGHT? I am so tired of the idiotic crypto libertarianism. We need crypto PROGRESSIVISM.,0,[],1.0,https://www.reddit.com/r/CryptoCurrency/comments/uq7qk7/anyone_else_think_maybe_liz_warren_was_right_i_am/,all_ads,6,1652597586.0,,,,,,,,,
1,[],False,d_d0g,,,"[{'e': 'text', 't': 'Silver | QC: CC 249, GPUmining 20 | CRO 15 | MiningSubs 24'}]","Silver | QC: CC 249, GPUmining 20 | CRO 15 | MiningSubs 24",dark,richtext,t2_aonra7oy,False,False,True,[],False,False,1652624396,self.CryptoCurrency,https://www.reddit.com/r/CryptoCurrency/comments/uq73xh/can_luna_hodlers_moon_in_12_days/,{},uq73xh,False,True,False,False,False,True,True,False,#ff66ac,DEBATE,"[{'e': 'text', 't': 'DEBATE'}]",5b762856-d7c9-11e4-822a-22000b2300b2,DEBATE,light,richtext,False,False,True,1,0,False,all_ads,/r/CryptoCurrency/comments/uq73xh/can_luna_hodlers_moon_in_12_days/,False,self,"{'enabled': False, 'images': [{'id': '11BjHMavGYgk34Ec-tqOzyDxJeVwWgVjsJSb8g_79YI', 'resolutions': [{'height': 108, 'url': 'https://external-preview.redd.it/A8tVsYeaiF6qVxwGnI1jl9kWVuNb31-sQ4ASmxoOpYM.jpg?width=108&amp;crop=smart&amp;auto=webp&amp;s=95a3a750a5860bc6a83dbf36497747a950c5dc2e', 'width': 108}], 'source': {'height': 200, 'url': 'https://external-preview.redd.it/A8tVsYeaiF6qVxwGnI1jl9kWVuNb31-sQ4ASmxoOpYM.jpg?auto=webp&amp;s=05420f0520a4a8b5bb5c0782a6bd3715e411fd8e', 'width': 200}, 'variants': {}}]}",6,1652624407,1,"The exploitation of TERRA was nothing more than a huge raised eyebrow across r/CC but a shockwave to the crypto market.

We all watched it transpire. We all sat there and said, “What?! Oh , hell n… wait”.

And then they came, the $5, $10, $20 aping in posts. People picking up 100k coins with beer money. [Current price of LUNA is .0002](https://coinmarketcap.com/currencies/terra-luna/)

For those who were quick or lucky enough to day trade it, there were probably a few 100% - 200% gainz in there. But what about the, “I’m just throwing in $20 to see what happens” guys?

We know if they sit around and waiting, that $20 will probably turn to zero. [Coinbase announced they’ll be shutting down LUNA trading on May 27th.](https://twitter.com/coinbaseassets/status/1525083666149433349?s=21&amp;t=DsHI8dLsjbD4mooS9Qzm0g). 

Other exchanges are shutting down trading too. That means these guys/girls likely have about 12 days to do something before LUNA becomes a useless coin you can only send around.

Now, this is just for fun and to get your brain moving, but what if they had a plan? Something like the GME saga. There are so many Reddit groups, they could be coordinating a plan to pump it. Or they could not… I repeat, this is all hypothetical and just for fun.

Could they actually pull something like this off and what type of methods are even possible?",True,False,False,CryptoCurrency,t5_2wlj3,4860643,public,,self,Can LUNA HODLers Moon in 12 Days?,0,[],1.0,https://www.reddit.com/r/CryptoCurrency/comments/uq73xh/can_luna_hodlers_moon_in_12_days/,all_ads,6,1652595596.0,,,,,,,,,
2,[],False,nootyloops,,Warning-level3,"[{'e': 'text', 't': '4 - 5 years account age. 63 - 125 comment karma.'}]",4 - 5 years account age. 63 - 125 comment karma.,dark,richtext,t2_12lmzc,False,False,False,[],False,False,1652624010,self.CryptoCurrency,https://www.reddit.com/r/CryptoCurrency/comments/uq6zlq/prediction_when_terra_forks_the_new_chain_will/,{},uq6zlq,False,False,False,False,False,False,True,False,#cc8b00,SPECULATION,"[{'e': 'text', 't': 'SPECULATION'}]",ebb30328-94d1-11eb-94d6-0e7d4f551e2d,SPECULATION,light,richtext,False,False,True,1,0,False,all_ads,/r/CryptoCurrency/comments/uq6zlq/prediction_when_terra_forks_the_new_chain_will/,False,,,6,1652624021,1,[removed],True,False,False,CryptoCurrency,t5_2wlj3,4860605,public,,self,"Prediction: When terra forks, the new chain will immediately get rug pulled as large institutions who invested and got caught by the collapse will try salvage as much as they can",0,[],1.0,https://www.reddit.com/r/CryptoCurrency/comments/uq6zlq/prediction_when_terra_forks_the_new_chain_will/,all_ads,6,1652595210.0,moderator,,,,,,,,
3,[],False,NikkiMyCat,,,"[{'e': 'text', 't': 'Platinum | QC: CC 79'}]",Platinum | QC: CC 79,dark,richtext,t2_pgg2qkk,False,False,False,[],False,False,1652622805,self.CryptoCurrency,https://www.reddit.com/r/CryptoCurrency/comments/uq6lqk/whats_the_next_scam_waiting_for_us/,{},uq6lqk,False,True,False,False,False,True,True,False,#7193ff,DISCUSSION,"[{'e': 'text', 't': 'DISCUSSION'}]",87049662-0882-11e5-82e1-0e9d1a9f7761,DISCUSSION,dark,richtext,False,False,True,2,0,False,all_ads,/r/CryptoCurrency/comments/uq6lqk/whats_the_next_scam_waiting_for_us/,False,,,6,1652622816,1,"I had expected the moment when NFT blew off because I sincerely believed NFT was the biggest scam in this past bull run just like ICO in the bull run of 2017.

Obviously I was wrong. It turned out to be UST/LUNA. The voices of those big influencers promoting Sol/Avax/Luna are still vivid. “The Sol/Avax/Luna index has beaten Eth by x ….”. Don’t remember how many profound analysis posted in Reddit. It’s been in top 10 in the space. How could it possibly go wrong?! 

Please don’t simply blame us, the average small investors, didn’t do our own research. We had worked hard not to be greedy. We had worked hard to try understood the technology and token economics behind Terra Luna. We had put our faith into the innovation of this industry. 

Now we are like standing in the middle of nowhere trying to figure out which way to go. Is it time for us to quit? Will the scammers take any consequence? Will our loss be taken care of ever?

If we stay in this space, an immediate question will be what’s the next scam waiting for us?",True,False,False,CryptoCurrency,t5_2wlj3,4860497,public,,self,What’s the next scam waiting for us?,0,[],1.0,https://www.reddit.com/r/CryptoCurrency/comments/uq6lqk/whats_the_next_scam_waiting_for_us/,all_ads,6,1652594005.0,,,,,,,,,
4,[],False,silent_tongue,,Warning-level2-2,"[{'e': 'text', 't': 'Tin | CRO 5'}]",Tin | CRO 5,dark,richtext,t2_ef7ac1x4,False,False,False,[],False,False,1652621017,self.CryptoCurrency,https://www.reddit.com/r/CryptoCurrency/comments/uq61vb/are_the_terra_protocols_still_running/,{},uq61vb,False,False,False,False,False,False,True,False,#7193ff,DISCUSSION,"[{'e': 'text', 't': 'DISCUSSION'}]",87049662-0882-11e5-82e1-0e9d1a9f7761,DISCUSSION,dark,richtext,False,False,True,1,0,False,all_ads,/r/CryptoCurrency/comments/uq61vb/are_the_terra_protocols_still_running/,False,,,6,1652621028,1,[removed],True,False,False,CryptoCurrency,t5_2wlj3,4860315,public,new,self,Are the Terra protocols still running?,0,[],1.0,https://www.reddit.com/r/CryptoCurrency/comments/uq61vb/are_the_terra_protocols_still_running/,all_ads,6,1652592217.0,moderator,,,,,,,,
5,[],False,silent_tongue,,Warning-level2-2,"[{'e': 'text', 't': 'Tin | CRO 5'}]",Tin | CRO 5,dark,richtext,t2_ef7ac1x4,False,False,False,[],False,False,1652620729,self.CryptoCurrency,https://www.reddit.com/r/CryptoCurrency/comments/uq5yls/terra_aftermath_are_the_protocols_still_running/,{},uq5yls,False,True,False,False,False,True,True,False,#7193ff,DISCUSSION,"[{'e': 'text', 't': 'DISCUSSION'}]",87049662-0882-11e5-82e1-0e9d1a9f7761,DISCUSSION,dark,richtext,False,False,True,0,0,False,all_ads,/r/CryptoCurrency/comments/uq5yls/terra_aftermath_are_the_protocols_still_running/,False,,,6,1652620739,1,"I'm one of the many reckt by Luna/UST and had take  some time off to clear my head. I now intend to use the coming week to clear off whatever I have on Terra, and see if I can salvage anything  from the respective protocols Eg Anchor, Kujira, Apollo Astroport etc. Did they announced any dates they will be shutting down etc? 

I still have a very small amt of bETH sitting in Kujira unclaimed because the gas fee isn't worth it. Is it ok to just leave it there until.. something happens? 

I also have various LPs on Astroport that I haven't even checked on, but may have some residual amount. But if I don't do anything, do I still get astro tokens? 

Also had some rune/Luna and rune/UST LPs. Ok to keep those until at least 100 days and claim IPL protection??

Alot to process, appreciate if anyone can share their  experience too on the best way forward. Thanks",True,False,False,CryptoCurrency,t5_2wlj3,4860289,public,new,self,Terra aftermath: Are the protocols still running?,0,[],1.0,https://www.reddit.com/r/CryptoCurrency/comments/uq5yls/terra_aftermath_are_the_protocols_still_running/,all_ads,6,1652591929.0,,,,,,,,,
6,[],False,deficit_creator,,Warning-level2-2,"[{'e': 'text', 't': 'Tin'}]",Tin,dark,richtext,t2_be2oa7rg,False,False,False,[],False,False,1652620177,coindesk.com,https://www.reddit.com/r/CryptoCurrency/comments/uq5sbl/what_happened_to_the_35b_terra_reserve/,{},uq5sbl,False,True,False,False,False,True,False,False,,GENERAL-NEWS,"[{'e': 'text', 't': '🟢 GENERAL-NEWS'}]",,🟢 GENERAL-NEWS,dark,richtext,False,False,True,0,0,False,all_ads,/r/CryptoCurrency/comments/uq5sbl/what_happened_to_the_35b_terra_reserve/,False,link,"{'enabled': False, 'images': [{'id': 'h_7FHOaaCz_KM-7cQSeTJchslq9yXIYSPxDN2Cq2YvI', 'resolutions': [{'height': 56, 'url': 'https://external-preview.redd.it/VGjVFveTC4TAUQnSx8CD5TiOT9D8SOvuXd7tAmRee7I.jpg?width=108&amp;crop=smart&amp;auto=webp&amp;s=b7cef594bff19c80a44c7225fc4b9f84f5dcdb22', 'width': 108}, {'height': 113, 'url': 'https://external-preview.redd.it/VGjVFveTC4TAUQnSx8CD5TiOT9D8SOvuXd7tAmRee7I.jpg?width=216&amp;crop=smart&amp;auto=webp&amp;s=b32a0920a7fb3784a02666661f85cdd79f589349', 'width': 216}, {'height': 167, 'url': 'https://external-preview.redd.it/VGjVFveTC4TAUQnSx8CD5TiOT9D8SOvuXd7tAmRee7I.jpg?width=320&amp;crop=smart&amp;auto=webp&amp;s=b81ee88c08aa356774cf52307642b130874d6ec3', 'width': 320}, {'height': 334, 'url': 'https://external-preview.redd.it/VGjVFveTC4TAUQnSx8CD5TiOT9D8SOvuXd7tAmRee7I.jpg?width=640&amp;crop=smart&amp;auto=webp&amp;s=8e2c33c1c61fe9acbd069634fd7605a76165fade', 'width': 640}, {'height': 502, 'url': 'https://external-preview.redd.it/VGjVFveTC4TAUQnSx8CD5TiOT9D8SOvuXd7tAmRee7I.jpg?width=960&amp;crop=smart&amp;auto=webp&amp;s=b18e1b1ffa0265ea55ac94c0888a076ce2331d5c', 'width': 960}, {'height': 565, 'url': 'https://external-preview.redd.it/VGjVFveTC4TAUQnSx8CD5TiOT9D8SOvuXd7tAmRee7I.jpg?width=1080&amp;crop=smart&amp;auto=webp&amp;s=e1841cee4a1cf6f16972ffceb0b5611c76b746b8', 'width': 1080}], 'source': {'height': 628, 'url': 'https://external-preview.redd.it/VGjVFveTC4TAUQnSx8CD5TiOT9D8SOvuXd7tAmRee7I.jpg?auto=webp&amp;s=fd6f6b0e13742efa920392655b71a08e83d56e43', 'width': 1200}, 'variants': {}}]}",6,1652620188,1,,True,False,False,CryptoCurrency,t5_2wlj3,4860241,public,new,https://b.thumbs.redditmedia.com/GUmHghrIK7ASzVF9m6_UjQuAZw8cLWiVIG9ibHbvE9s.jpg,What Happened to the $3.5B Terra Reserve?,0,[],1.0,https://www.coindesk.com/business/2022/05/14/what-happened-to-the-35b-terra-reserve/,all_ads,6,1652591377.0,,73.0,140.0,https://www.coindesk.com/business/2022/05/14/what-happened-to-the-35b-terra-reserve/,,,,,
7,[],False,Glum_Force1307,,,[],,,text,t2_jg8h3wt1,False,False,False,[],False,False,1652619076,linkedin.com,https://www.reddit.com/r/CryptoCurrency/comments/uq5gdx/teslas_diversification_may_influence_terra_luna/,{},uq5gdx,False,False,False,False,False,False,False,False,#add2e2,ADVICE,"[{'e': 'text', 't': 'ANALYSIS'}]",c1034ee6-9c2a-11e3-a8c4-12313b0e8e20,ANALYSIS,dark,richtext,False,False,True,0,0,False,all_ads,/r/CryptoCurrency/comments/uq5gdx/teslas_diversification_may_influence_terra_luna/,False,link,"{'enabled': False, 'images': [{'id': 'ZqRNODN3INcVsQ5ZnSxzS8XXz1Z-WfsFaWJChUg4D-M', 'resolutions': [{'height': 71, 'url': 'https://external-preview.redd.it/NCuZkGVYaaoZZqJ19lhh8_ZcGx3bqZlDDZmTs0jzur0.jpg?width=108&amp;crop=smart&amp;auto=webp&amp;s=0d3a252cffd8c402cba5808605f8d859ec724ee3', 'width': 108}, {'height': 143, 'url': 'https://external-preview.redd.it/NCuZkGVYaaoZZqJ19lhh8_ZcGx3bqZlDDZmTs0jzur0.jpg?width=216&amp;crop=smart&amp;auto=webp&amp;s=80e3643fb03a6bc3c44fdb22de0a77a5acf1a043', 'width': 216}, {'height': 212, 'url': 'https://external-preview.redd.it/NCuZkGVYaaoZZqJ19lhh8_ZcGx3bqZlDDZmTs0jzur0.jpg?width=320&amp;crop=smart&amp;auto=webp&amp;s=9aaf99d0a034f23f0b18fafb66d993f89f8ecab5', 'width': 320}], 'source': {'height': 266, 'url': 'https://external-preview.redd.it/NCuZkGVYaaoZZqJ19lhh8_ZcGx3bqZlDDZmTs0jzur0.jpg?auto=webp&amp;s=acf91920d0033834b0b575af93bf9e55e58286c8', 'width': 400}, 'variants': {}}]}",6,1652619086,1,,True,False,False,CryptoCurrency,t5_2wlj3,4860127,public,,https://b.thumbs.redditmedia.com/Mno9VAEA883zjp7CMrtm_RAFpoShL9Z5qLfzanI5k8s.jpg,Tesla's Diversification may Influence Terra $Luna' future.,0,[],1.0,https://www.linkedin.com/news/story/tesla-s-new-venture-could-be-mining-5334708,all_ads,6,1652590276.0,automod_filtered,93.0,140.0,https://www.linkedin.com/news/story/tesla-s-new-venture-could-be-mining-5334708,,,,,
8,[],False,Additional-Currency2,,,[],,,text,t2_5g52npvb,False,False,False,[],False,False,1652617909,self.CryptoCurrency,https://www.reddit.com/r/CryptoCurrency/comments/uq54ct/something_new_can_always_be_born_after_the_death/,{},uq54ct,False,True,False,False,False,True,True,False,#7193ff,DISCUSSION,"[{'e': 'text', 't': 'DISCUSSION'}]",87049662-0882-11e5-82e1-0e9d1a9f7761,DISCUSSION,dark,richtext,False,False,False,0,0,False,all_ads,/r/CryptoCurrency/comments/uq54ct/something_new_can_always_be_born_after_the_death/,False,,,6,1652617920,1,"As we know, the KUJIRA team stated that it will do its Chain on Cosmos SDK; CZ spoke about the UST-LUNA case; and Jae Kwon is preparing to start the Chain GNOT Land.
Is it possible that there are no other more convincing solutions on the Terra-Luna hard fork? No, because unfortunately the trust in the current DeFi ecosystem has been devastated. It will hardly be reconquered by now.

Therefore I propose to you a possible solution on what could possibly be done:

1) It would be more appropriate to bring together all the developers of good will and good faith who have worked for the entire Terra-Luna ecosystem in recent months, not just KUJIRA (for example: Astroport, TerraSwap, Reactor Money, RetroGrade, ApolloDAO, White Whale, Leap Wallet, Mars Protocol, Nebula Protocol etc.)

2) The future Chain could be based on GNOT Land for its functioning structure, so there could be the supervision of Jae Kwon and the developers exiting Terraform Labs

3) An improved and modified version of Tendermint could be introduced to have a much more distributed and decentralized network

4) CZ and Do Kwon could offer their help on the way

5) The Coin of the reference Chain could have a ""destructive"" Tokenomics as: 
- Automatic Burning Mechanism for Fees
- Biennial or court halving to make it more and more deflationary
- A model very inspired by that of Astroport, Curve and BNB in ​​terms of use case

5) In addition, a decentralized semi-algorithmic Stablecoin could also be introduced that takes the best of the best FRAX, MIM, USN, and Silk. Sort of like UST 3.0 without that big death spiral problem.


These would be my ideas about a hypothetical future Chain to preserve the entire Terra-Luna ecosystem. I will make myself available to help as much as possible.",True,False,False,CryptoCurrency,t5_2wlj3,4860018,public,,self,Something new can always be born after the death of the Terra-Luna,0,[],1.0,https://www.reddit.com/r/CryptoCurrency/comments/uq54ct/something_new_can_always_be_born_after_the_death/,all_ads,6,1652589109.0,,,,,,,,,
