220,[],False,ismirschlecht,,"[{'e': 'text', 't': 'Platinum | QC: BTC 523'}]",Platinum | QC: BTC 523,richtext,t2_cmz0cj8u,False,False,False,[],False,False,1652477244,self.CryptoCurrency,https://www.reddit.com/r/CryptoCurrency/comments/up1vfx/theyve_been_warned_but_they_didnt_listen/,{},up1vfx,False,True,False,False,False,True,True,False,#46d160,ADVICE,"[{'e': 'text', 't': 'ADVICE'}]",e9570888-9c2a-11e3-809c-12313d1661cc,ADVICE,dark,richtext,False,False,False,0,0,False,all_ads,/r/CryptoCurrency/comments/up1vfx/theyve_been_warned_but_they_didnt_listen/,False,6,,1652477255,1,"Here's a post of someone explaining how UST could be depegged for good: [risks\_how\_real\_are\_they](https://www.reddit.com/r/terraluna/comments/s2bnbw/terra_luna_ust_ecosystem_risks_how_real_are_they/)

One of the top comments was 

&gt; Rumor going around that Do just bought more than $1 billion in Btc to  help maintain peg in times of crisis. Appreciate your analysis but he’s  playing 5D chess while we all play checkers 

Or how about this? Bet you've seen responses like this a lot in certain subs:

&gt; So question is what's your buy price you put in already for LUNA? lol.   Since you state you've been looking, I'm going to assume you have 0  LUNA. 

I'm spending a lot of time in old reddit posts, reading how people reacted to events like ""FUD"", bullruns or crashes - and you should do that, too. It's easier to learn from other investor's failures than learning it by losing money yourself.

Another good advice is the ""advanced search"" on Twitter. Just check the guy you want to follow by searching something and then chosing ""Advanced search"" from the menu. You can insert a twitter account and also dates (like the weeks before the 2021 crash).",True,False,False,CryptoCurrency,t5_2wlj3,4847676,public,self,They've been warned - but they didn't listen.,0,[],1.0,https://www.reddit.com/r/CryptoCurrency/comments/up1vfx/theyve_been_warned_but_they_didnt_listen/,all_ads,6,1652448444.0,,,new,,,,,dark,,,,,,,,
221,[],False,MysteriousFan1897,Training,"[{'e': 'text', 't': 'Redditor for 3 months.'}]",Redditor for 3 months.,richtext,t2_4lyfw946,False,False,False,[],False,False,1652477218,self.CryptoCurrency,https://www.reddit.com/r/CryptoCurrency/comments/up1v46/lets_bring_back_terra_luna_token_whos_down/,{},up1v46,False,False,False,False,False,False,True,False,#46d160,MARKETS,"[{'e': 'text', 't': 'MARKETS'}]",1a657c8c-e48d-11e5-a215-0e374d550989,MARKETS,light,richtext,False,False,True,1,0,False,all_ads,/r/CryptoCurrency/comments/up1v46/lets_bring_back_terra_luna_token_whos_down/,False,6,moderator,1652477229,1,[removed],True,False,False,CryptoCurrency,t5_2wlj3,4847673,public,self,LETS BRING BACK TERRA LUNA TOKEN !! WHO'S DOWN??,0,[],1.0,https://www.reddit.com/r/CryptoCurrency/comments/up1v46/lets_bring_back_terra_luna_token_whos_down/,all_ads,6,1652448418.0,,,,,,,,dark,,,,,,,,
222,[],False,slavaMZ,Warning-level2-2,"[{'e': 'text', 't': 'Tin'}]",Tin,richtext,t2_40zo79ei,False,False,False,[],False,False,1652477022,youtu.be,https://www.reddit.com/r/CryptoCurrency/comments/up1stf/terra_luna_is_dead_and_do_kwon_is_screwed_is_this/,{},up1stf,False,True,False,False,False,True,False,False,#7193ff,DISCUSSION,"[{'e': 'text', 't': 'DISCUSSION'}]",87049662-0882-11e5-82e1-0e9d1a9f7761,DISCUSSION,dark,richtext,False,False,True,0,0,False,all_ads,/r/CryptoCurrency/comments/up1stf/terra_luna_is_dead_and_do_kwon_is_screwed_is_this/,False,6,,1652477033,1,,True,False,False,CryptoCurrency,t5_2wlj3,4847655,public,https://b.thumbs.redditmedia.com/wC19eUuQSOQlBPGZ-onZqnMfRdBHhr3RAhspq2_7qkY.jpg,Terra Luna is Dead and Do Kwon is Screwed... Is This The End of DeFi?,0,[],1.0,https://youtu.be/uYzj2JbYAB0,all_ads,6,1652448222.0,rich:video,"{'enabled': False, 'images': [{'id': 'bwPTek_5jpPe6oKSrnXs8BXinDpjEXGEejo9melcrlg', 'resolutions': [{'height': 81, 'url': 'https://external-preview.redd.it/qpC6AAJUR24Lq7t5suS_o33j0B0qOmHy-GQmExb2luQ.jpg?width=108&amp;crop=smart&amp;auto=webp&amp;s=099b2ecb7b072cee83b8c9f50ee578f203098cb3', 'width': 108}, {'height': 162, 'url': 'https://external-preview.redd.it/qpC6AAJUR24Lq7t5suS_o33j0B0qOmHy-GQmExb2luQ.jpg?width=216&amp;crop=smart&amp;auto=webp&amp;s=6ddabfc30d3dd0c567b75f972e2d323bdb6189a5', 'width': 216}, {'height': 240, 'url': 'https://external-preview.redd.it/qpC6AAJUR24Lq7t5suS_o33j0B0qOmHy-GQmExb2luQ.jpg?width=320&amp;crop=smart&amp;auto=webp&amp;s=f61c7b69ca7d0f3eb0d45c951fc7d25a0866df94', 'width': 320}], 'source': {'height': 360, 'url': 'https://external-preview.redd.it/qpC6AAJUR24Lq7t5suS_o33j0B0qOmHy-GQmExb2luQ.jpg?auto=webp&amp;s=20dd9ac685750c76cab54cd22e5468c0219bebef', 'width': 480}, 'variants': {}}]}",new,105.0,140.0,https://youtu.be/uYzj2JbYAB0,,dark,,,,"{'oembed': {'author_name': 'PromoAmbitions', 'author_url': 'https://www.youtube.com/c/PromoAmbitions', 'height': 200, 'html': '&lt;iframe width=""356"" height=""200"" src=""https://www.youtube.com/embed/uYzj2JbYAB0?feature=oembed&amp;enablejsapi=1"" frameborder=""0"" allow=""accelerometer; autoplay; clipboard-write; encrypted-media; gyroscope; picture-in-picture"" allowfullscreen&gt;&lt;/iframe&gt;', 'provider_name': 'YouTube', 'provider_url': 'https://www.youtube.com/', 'thumbnail_height': 360, 'thumbnail_url': 'https://i.ytimg.com/vi/uYzj2JbYAB0/hqdefault.jpg', 'thumbnail_width': 480, 'title': 'Terra Luna is Dead and Do Kwon is Screwed... Is This The End of DeFi?', 'type': 'video', 'version': '1.0', 'width': 356}, 'type': 'youtube.com'}","{'content': '&lt;iframe width=""356"" height=""200"" src=""https://www.youtube.com/embed/uYzj2JbYAB0?feature=oembed&amp;enablejsapi=1"" frameborder=""0"" allow=""accelerometer; autoplay; clipboard-write; encrypted-media; gyroscope; picture-in-picture"" allowfullscreen&gt;&lt;/iframe&gt;', 'height': 200, 'scrolling': False, 'width': 356}","{'oembed': {'author_name': 'PromoAmbitions', 'author_url': 'https://www.youtube.com/c/PromoAmbitions', 'height': 200, 'html': '&lt;iframe width=""356"" height=""200"" src=""https://www.youtube.com/embed/uYzj2JbYAB0?feature=oembed&amp;enablejsapi=1"" frameborder=""0"" allow=""accelerometer; autoplay; clipboard-write; encrypted-media; gyroscope; picture-in-picture"" allowfullscreen&gt;&lt;/iframe&gt;', 'provider_name': 'YouTube', 'provider_url': 'https://www.youtube.com/', 'thumbnail_height': 360, 'thumbnail_url': 'https://i.ytimg.com/vi/uYzj2JbYAB0/hqdefault.jpg', 'thumbnail_width': 480, 'title': 'Terra Luna is Dead and Do Kwon is Screwed... Is This The End of DeFi?', 'type': 'video', 'version': '1.0', 'width': 356}, 'type': 'youtube.com'}","{'content': '&lt;iframe width=""356"" height=""200"" src=""https://www.youtube.com/embed/uYzj2JbYAB0?feature=oembed&amp;enablejsapi=1"" frameborder=""0"" allow=""accelerometer; autoplay; clipboard-write; encrypted-media; gyroscope; picture-in-picture"" allowfullscreen&gt;&lt;/iframe&gt;', 'height': 200, 'media_domain_url': 'https://www.redditmedia.com/mediaembed/up1stf', 'scrolling': False, 'width': 356}",
223,[],False,sftech86,,[],,text,t2_dcx7jjo9,False,False,False,[],False,False,1652476654,self.CryptoCurrency,https://www.reddit.com/r/CryptoCurrency/comments/up1obh/serious_question_can_ust_repeg/,{},up1obh,False,True,False,False,False,True,True,False,#7193ff,DISCUSSION,"[{'e': 'text', 't': 'DISCUSSION'}]",87049662-0882-11e5-82e1-0e9d1a9f7761,DISCUSSION,dark,richtext,False,False,True,1,0,False,all_ads,/r/CryptoCurrency/comments/up1obh/serious_question_can_ust_repeg/,False,6,,1652476665,1,"It's a dark week for Luna and UST holders. I'm sorry to all who are impacted by this, but I'm still latching on to some hope. I lost a significant amount of money and my life is upside down.

I'm following the proposals closely, but is there any chance UST can repeg or get partially there? What would the mechanics of this look like? My understanding is that in order to repeg, more Luna would have to be minted or UST burned.

There was the following [proposal](https://agora.terra.money/t/proposal-help-ust-pegging-increase-estimated-minting-capacity-to-1200m/6287) but that was 2 days ago on May 11. Now there are many proposals and I'm wondering how can I find out what the most realistic or considered proposals are?",True,False,False,CryptoCurrency,t5_2wlj3,4847596,public,self,Serious question: Can UST repeg?,0,[],1.0,https://www.reddit.com/r/CryptoCurrency/comments/up1obh/serious_question_can_ust_repeg/,all_ads,6,1652447854.0,self,"{'enabled': False, 'images': [{'id': 'jQeenTPWQN5-mcp4HMHN-nnX4pSJWKmI4-HiWHpUpyk', 'resolutions': [{'height': 32, 'url': 'https://external-preview.redd.it/4n0H2Av6lpdnCl3K8nRMyuOAoU6-2rDDEy6VzT27mrs.jpg?width=108&amp;crop=smart&amp;auto=webp&amp;s=3e0ace626815f8c5b88287961a706f9f31017994', 'width': 108}, {'height': 64, 'url': 'https://external-preview.redd.it/4n0H2Av6lpdnCl3K8nRMyuOAoU6-2rDDEy6VzT27mrs.jpg?width=216&amp;crop=smart&amp;auto=webp&amp;s=95cd1eee2667b84a2fc957b6275d445602deb83d', 'width': 216}, {'height': 95, 'url': 'https://external-preview.redd.it/4n0H2Av6lpdnCl3K8nRMyuOAoU6-2rDDEy6VzT27mrs.jpg?width=320&amp;crop=smart&amp;auto=webp&amp;s=2fab4022c311ad9d17f2195a8135c0ab22944557', 'width': 320}, {'height': 190, 'url': 'https://external-preview.redd.it/4n0H2Av6lpdnCl3K8nRMyuOAoU6-2rDDEy6VzT27mrs.jpg?width=640&amp;crop=smart&amp;auto=webp&amp;s=8d99ed285376acb877dd47f9f9c53a92203bbb33', 'width': 640}, {'height': 285, 'url': 'https://external-preview.redd.it/4n0H2Av6lpdnCl3K8nRMyuOAoU6-2rDDEy6VzT27mrs.jpg?width=960&amp;crop=smart&amp;auto=webp&amp;s=af30d9fbe757593910bab5d5d7e1a76046a32936', 'width': 960}], 'source': {'height': 304, 'url': 'https://external-preview.redd.it/4n0H2Av6lpdnCl3K8nRMyuOAoU6-2rDDEy6VzT27mrs.jpg?auto=webp&amp;s=2abf1ed5aa5b6e7140a2f73f0bfe887c9f387caf', 'width': 1024}, 'variants': {}}]}",,,,,,,,,,,,,,
224,[],False,XLg7bhS3wbs47yt,Warning-level2-2,"[{'e': 'text', 't': 'Tin'}]",Tin,richtext,t2_4s65qqn9,False,False,False,[],False,False,1652476245,i.redd.it,https://www.reddit.com/r/CryptoCurrency/comments/up1jgd/i_think_they_managed_to_solve_the_problem_luna/,{},up1jgd,False,True,False,False,True,True,False,False,#c403f5,COMEDY,"[{'e': 'text', 't': 'COMEDY'}]",5c104cfc-d7c8-11e4-9d14-22000b6902b0,COMEDY,dark,richtext,False,False,True,1,0,False,all_ads,/r/CryptoCurrency/comments/up1jgd/i_think_they_managed_to_solve_the_problem_luna/,False,6,,1652476255,1,,True,False,False,CryptoCurrency,t5_2wlj3,4847549,public,https://b.thumbs.redditmedia.com/43x-tNJMron9qOd0ys47vi4aETtvsom1sTQ3IwNRWSM.jpg,"I think they managed to solve the problem, LUNA looks quite stable to me!",0,[],1.0,https://i.redd.it/jio8dof36bz81.png,all_ads,6,1652447445.0,image,"{'enabled': True, 'images': [{'id': 'ES-NvyU9_G0RdYA0-JmFPTPr3qCy7Wcxp3iuPX4EpdU', 'resolutions': [{'height': 71, 'url': 'https://preview.redd.it/jio8dof36bz81.png?width=108&amp;crop=smart&amp;auto=webp&amp;s=19e9a4f73a3d634323b4bf7d1aa14a558679f486', 'width': 108}, {'height': 142, 'url': 'https://preview.redd.it/jio8dof36bz81.png?width=216&amp;crop=smart&amp;auto=webp&amp;s=7940b79a5f9f01b701b9d2c0ea6aea4029dc5523', 'width': 216}, {'height': 211, 'url': 'https://preview.redd.it/jio8dof36bz81.png?width=320&amp;crop=smart&amp;auto=webp&amp;s=aa96dd507d547190823cc5e2f3cb9e87377cfad3', 'width': 320}, {'height': 422, 'url': 'https://preview.redd.it/jio8dof36bz81.png?width=640&amp;crop=smart&amp;auto=webp&amp;s=27652506a0586b714ca78030aff9af14955ca421', 'width': 640}], 'source': {'height': 562, 'url': 'https://preview.redd.it/jio8dof36bz81.png?auto=webp&amp;s=729922118b1087d1cf6e92a2426a6493f689b0e5', 'width': 852}, 'variants': {}}]}",,92.0,140.0,https://i.redd.it/jio8dof36bz81.png,,dark,,,,,,,,
225,[],False,itsthelibyans,,[],,text,t2_46neh,False,False,False,[],False,False,1652476121,self.CryptoCurrency,https://www.reddit.com/r/CryptoCurrency/comments/up1hy4/meme_stockcrypto_connection/,{},up1hy4,False,True,False,False,False,True,True,False,#7193ff,DISCUSSION,"[{'e': 'text', 't': 'DISCUSSION'}]",87049662-0882-11e5-82e1-0e9d1a9f7761,DISCUSSION,dark,richtext,False,False,False,0,0,False,all_ads,/r/CryptoCurrency/comments/up1hy4/meme_stockcrypto_connection/,False,6,,1652476132,1,"I haven’t seen much discussion on the possibility that Citadel is the main reason for the crypto bloodbath.  Saw posts that claim they sold over 100k Bitcoin, and other coins…and that they were behind the UST and Luna wipeout.  

Do you guys think there isn’t even the slightest possibility that they are just trying to remain solvent by selling crypto to cover the aggressive naked short selling of meme stocks??   

Do you guys believe the crypto market is just a constant pump and dump by hedge funds to make money?  Everyone just didn’t wake up this week and say “I need to get out of crypto…” on basically no negative news.  The buying and selling from whales is what really moves the price after all.

Hope y’all have a great weekend.  We will be over the moon again soon…",True,False,False,CryptoCurrency,t5_2wlj3,4847530,public,self,Meme stock/crypto connection,0,[],1.0,https://www.reddit.com/r/CryptoCurrency/comments/up1hy4/meme_stockcrypto_connection/,all_ads,6,1652447321.0,,,,,,,,,,,,,,,,
226,[],False,silverfire626,,"[{'e': 'text', 't': 'Platinum | QC: CC 163'}]",Platinum | QC: CC 163,richtext,t2_4gly7aps,False,False,False,[],False,False,1652475836,self.CryptoCurrency,https://www.reddit.com/r/CryptoCurrency/comments/up1ect/what_do_you_hope_comes_out_of_this_bear_market/,{},up1ect,False,True,False,False,False,True,True,False,#7193ff,DISCUSSION,"[{'e': 'text', 't': 'DISCUSSION'}]",87049662-0882-11e5-82e1-0e9d1a9f7761,DISCUSSION,dark,richtext,False,False,True,0,0,False,all_ads,/r/CryptoCurrency/comments/up1ect/what_do_you_hope_comes_out_of_this_bear_market/,False,6,,1652475846,1,"For as much as we give grayscale crap, I do like their market analysis. See snip below:

The fallout of UST and LUNA coupled with efforts by the Federal Reserve to slow the economy and tackle inflation may have shaken the confidence of many retail investors and created sizable losses for institutional investors backing the Terra ecosystem. As a result, we believe we’re likely to see a consolidation phase into the larger crypto assets like Bitcoin and Ethereum. The losses experienced by institutional investors may result in decreased venture funding for new and existing protocol teams, as well as a consolidation of capital around teams building core infrastructure for the ecosystem. Historically, these times have been when the most important crypto protocols were developed, such as Ethereum after the Mt. Gox hack of 2014, or MakerDAO and Uniswap after the crypto market crash in 2017. Despite an overall bearish sentiment from the market, crypto fundamentals look strong and are continuing to push new highs like the Bitcoin hash rate – a crucial metric in understanding the security of the network.

So instead of focusing on doom and gloom, I’m just making a wish list of things I’d like to see:

1) proof of humanity 
2) medical NFTs (x rays, etc)
3) defi insurance 
4) a stable stable coin (maybe too soon)",True,False,False,CryptoCurrency,t5_2wlj3,4847492,public,self,"What do you hope comes out of this bear market? For me, the biggest one is proof of humanity",0,[],1.0,https://www.reddit.com/r/CryptoCurrency/comments/up1ect/what_do_you_hope_comes_out_of_this_bear_market/,all_ads,6,1652447036.0,,,,,,,,dark,,,,,,,,
227,[],False,LadyMercedes,Warning-level1-1,"[{'e': 'text', 't': 'Bronze'}]",Bronze,richtext,t2_4e1jg50e,False,False,False,[],False,False,1652475627,youtu.be,https://www.reddit.com/r/CryptoCurrency/comments/up1blo/arthur_breitman_predicted_the_luna_collapse_2/,{},up1blo,False,True,False,False,False,True,False,False,#add2e2,ADVICE,"[{'e': 'text', 't': 'ANALYSIS'}]",c1034ee6-9c2a-11e3-a8c4-12313b0e8e20,ANALYSIS,dark,richtext,False,False,True,0,0,False,all_ads,/r/CryptoCurrency/comments/up1blo/arthur_breitman_predicted_the_luna_collapse_2/,False,6,,1652475637,1,,False,False,False,CryptoCurrency,t5_2wlj3,4847475,public,https://b.thumbs.redditmedia.com/jg_QZPQvoEYUIvdYc7keF8dh6Sclq2ZbRTKxeC2MXUY.jpg,Arthur Breitman predicted the LUNA collapse 2 weeks ago (less than 3000 views!). From 01:05:10,0,[],1.0,https://youtu.be/8zpH_1aaZNE,all_ads,6,1652446827.0,rich:video,"{'enabled': False, 'images': [{'id': 'k5wVqpX6lHHKzxlC4nB4iNl8HHRqThzbV_YOA_Le9-s', 'resolutions': [{'height': 81, 'url': 'https://external-preview.redd.it/6_tCCHT-jQmW2Xf6ESvycm0omotPGqG9YKw5XmIN6Ts.jpg?width=108&amp;crop=smart&amp;auto=webp&amp;s=ea1292f50c4a309a334d332f3cb4524a614486e0', 'width': 108}, {'height': 162, 'url': 'https://external-preview.redd.it/6_tCCHT-jQmW2Xf6ESvycm0omotPGqG9YKw5XmIN6Ts.jpg?width=216&amp;crop=smart&amp;auto=webp&amp;s=e319bfffca3ff6e0f47835786f7c22390cdce171', 'width': 216}, {'height': 240, 'url': 'https://external-preview.redd.it/6_tCCHT-jQmW2Xf6ESvycm0omotPGqG9YKw5XmIN6Ts.jpg?width=320&amp;crop=smart&amp;auto=webp&amp;s=c55083d85e6270a9973493e78f5c8822ecd5da51', 'width': 320}], 'source': {'height': 360, 'url': 'https://external-preview.redd.it/6_tCCHT-jQmW2Xf6ESvycm0omotPGqG9YKw5XmIN6Ts.jpg?auto=webp&amp;s=48e7f245fbe83ac5714da898c8dfcc37097c47f8', 'width': 480}, 'variants': {}}]}",new,105.0,140.0,https://youtu.be/8zpH_1aaZNE,,dark,,,,"{'oembed': {'author_name': 'Arthur Breitman', 'author_url': 'https://www.youtube.com/c/ArthurBreitman', 'height': 200, 'html': '&lt;iframe width=""356"" height=""200"" src=""https://www.youtube.com/embed/8zpH_1aaZNE?feature=oembed&amp;enablejsapi=1"" frameborder=""0"" allow=""accelerometer; autoplay; clipboard-write; encrypted-media; gyroscope; picture-in-picture"" allowfullscreen&gt;&lt;/iframe&gt;', 'provider_name': 'YouTube', 'provider_url': 'https://www.youtube.com/', 'thumbnail_height': 360, 'thumbnail_url': 'https://i.ytimg.com/vi/8zpH_1aaZNE/hqdefault.jpg', 'thumbnail_width': 480, 'title': 'Arthur Breitman Tezos AMA 2022-04-24', 'type': 'video', 'version': '1.0', 'width': 356}, 'type': 'youtube.com'}","{'content': '&lt;iframe width=""356"" height=""200"" src=""https://www.youtube.com/embed/8zpH_1aaZNE?feature=oembed&amp;enablejsapi=1"" frameborder=""0"" allow=""accelerometer; autoplay; clipboard-write; encrypted-media; gyroscope; picture-in-picture"" allowfullscreen&gt;&lt;/iframe&gt;', 'height': 200, 'scrolling': False, 'width': 356}","{'oembed': {'author_name': 'Arthur Breitman', 'author_url': 'https://www.youtube.com/c/ArthurBreitman', 'height': 200, 'html': '&lt;iframe width=""356"" height=""200"" src=""https://www.youtube.com/embed/8zpH_1aaZNE?feature=oembed&amp;enablejsapi=1"" frameborder=""0"" allow=""accelerometer; autoplay; clipboard-write; encrypted-media; gyroscope; picture-in-picture"" allowfullscreen&gt;&lt;/iframe&gt;', 'provider_name': 'YouTube', 'provider_url': 'https://www.youtube.com/', 'thumbnail_height': 360, 'thumbnail_url': 'https://i.ytimg.com/vi/8zpH_1aaZNE/hqdefault.jpg', 'thumbnail_width': 480, 'title': 'Arthur Breitman Tezos AMA 2022-04-24', 'type': 'video', 'version': '1.0', 'width': 356}, 'type': 'youtube.com'}","{'content': '&lt;iframe width=""356"" height=""200"" src=""https://www.youtube.com/embed/8zpH_1aaZNE?feature=oembed&amp;enablejsapi=1"" frameborder=""0"" allow=""accelerometer; autoplay; clipboard-write; encrypted-media; gyroscope; picture-in-picture"" allowfullscreen&gt;&lt;/iframe&gt;', 'height': 200, 'media_domain_url': 'https://www.redditmedia.com/mediaembed/up1blo', 'scrolling': False, 'width': 356}",
228,[],False,poopsixty,Warning-level2-2,"[{'e': 'text', 't': 'Tin'}]",Tin,richtext,t2_81cmw,False,False,False,[],False,False,1652475540,self.CryptoCurrency,https://www.reddit.com/r/CryptoCurrency/comments/up1aat/major_crypto_youtubers_are_still_shilling_luna/,{},up1aat,False,True,False,False,False,True,True,False,#7193ff,DISCUSSION,"[{'e': 'text', 't': 'DISCUSSION'}]",87049662-0882-11e5-82e1-0e9d1a9f7761,DISCUSSION,dark,richtext,False,False,True,0,0,False,all_ads,/r/CryptoCurrency/comments/up1aat/major_crypto_youtubers_are_still_shilling_luna/,False,6,,1652475551,1,"Are these people (and specifically Carl Runefelt/The Moon Carl) just straight-up sociopaths? This clown has half a million followers on YouTube. He claims to have lost nearly $2 million in Luna and is still shilling it as ""NOT DEAD!!!"" as of a few hours ago.

What would even compel someone to act like this? Do they just get off on manipulating people who are already broken beyond belief at this point? 

He somehow made the Forbes 30 Under 30 list and has an interview about Bitcoin on CNBC. It's dangerous for someone with this much power and influence to be running their mouth like this with no regard to the consequences it has on real people.



I don't actually believe he's telling the truth about anything he claims. Apparently he's been caught got caught using a demo account to ""prove"" past trades.

Had anyone of note called this guy out yet?",True,False,False,CryptoCurrency,t5_2wlj3,4847468,public,self,Major Crypto YouTubers are still shilling LUNA,0,[],1.0,https://www.reddit.com/r/CryptoCurrency/comments/up1aat/major_crypto_youtubers_are_still_shilling_luna/,all_ads,6,1652446740.0,,,,,,,,dark,,,,,,,,
229,[],False,Jaha_jaha1,Warning-level2-2,"[{'e': 'text', 't': 'Tin'}]",Tin,richtext,t2_azk08k6l,False,False,False,[],False,False,1652475388,self.CryptoCurrency,https://www.reddit.com/r/CryptoCurrency/comments/up18eb/historical_anecdote_of_crypto_bear_markets/,{},up18eb,False,True,False,False,False,True,True,False,#cc8b00,ANECDOTAL,"[{'e': 'text', 't': 'ANECDOTAL'}]",613cabf0-1d90-11e4-953d-12313b0eb482,ANECDOTAL,light,richtext,False,False,True,0,0,False,all_ads,/r/CryptoCurrency/comments/up18eb/historical_anecdote_of_crypto_bear_markets/,False,6,,1652475399,1,"The bad news? Realistically speaking, your alt coins will fail. I don’t mean fail as in LUNA fail, more like BitcoinCash fail. Slow, steady ups and bigger downs. As each tiny bull run happens the wave goes up, then crashes even lower. Low until it’s basically worth 90% of what you put in. I’m not just saying that. Look at the CMC charts for historical anecdotes. This is likely going to happen. Look at Litecoin, ZCash, Dash, Decred, or Neo. All were top 10 coins at some point. They only ever kind of recovered during 2020 thanks to stimulus checks. This is the reality we all need to accept. 

The good news? During this sideways market some of you will get the opportunity to grab BTC at a reasonable price. This is about historical information. BTC has been the only coin to have consistently, year over year, dominated the market. All other alts have done well but are a lot riskier. 

I’m not saying to dump everything or to buy BTC. Quite honestly, I own less than $10 worth of it. I don’t care what you do with your money. I’m looking at it from the eyes of someone who put it all into alts hoping to get a Lambo and seeing my position shrink, over and over again. If I were in that position, I would not bother DCA any alts. 

Exceptions: I strongly believe ETH and BNB will be here next year. Their ecosystem is broad and is used by many people. This bull run created something we’ve never seen before: utility. Whether you consider NFTs valid or not, they are being used for more than just collectible aspects. They are being used as a marketing tool for businesses to give their customers exclusivity. This is big for marketing. We also so the rise of crypto payment platforms. Solana introduced an open sourced product (Solana Pay) that anyone can fork from GitHub and turn their online of physical business into a crypto (USDC or SOL) accepting store. 
All in all, look at your atls. What did they do during this bull run? Did they innovate? Did they create tools for developers? Or did they just say “BUY AND HODL 🚀🚀📈”? Or did they just copy a protocol? Think long and hard before you consider DCA.",True,False,False,CryptoCurrency,t5_2wlj3,4847451,public,self,Historical Anecdote of Crypto Bear Markets,0,[],1.0,https://www.reddit.com/r/CryptoCurrency/comments/up18eb/historical_anecdote_of_crypto_bear_markets/,all_ads,6,1652446588.0,,,new,,,,,dark,,,,,,,,
