15,[],False,Agreverga,,Warning-level2-2,"[{'e': 'text', 't': 'Tin'}]",Tin,dark,richtext,t2_vrl9ikl,False,False,False,[],False,False,1652611672,cryptoslate.com,https://www.reddit.com/r/CryptoCurrency/comments/uq3iof/luna_ceo_do_kwon_proposes_forking_luna_ust_to/,{},uq3iof,False,True,False,False,False,True,False,False,,GENERAL-NEWS,"[{'e': 'text', 't': '🟢 GENERAL-NEWS'}]",,🟢 GENERAL-NEWS,dark,richtext,False,False,False,0,0,False,all_ads,/r/CryptoCurrency/comments/uq3iof/luna_ceo_do_kwon_proposes_forking_luna_ust_to/,False,link,"{'enabled': False, 'images': [{'id': '4H-Qr9bl1n20CP9x1P7PSYETb1y1QSlk6UnFOeCZ6ZI', 'resolutions': [{'height': 56, 'url': 'https://external-preview.redd.it/ZvhgRgJmR6K9Jh8WM54JhehbtwIaBPaqfwjMmXQFfdE.jpg?width=108&amp;crop=smart&amp;auto=webp&amp;s=2afab1c1fd8f69ee37b0b0ebf0b8a43f586bea52', 'width': 108}, {'height': 113, 'url': 'https://external-preview.redd.it/ZvhgRgJmR6K9Jh8WM54JhehbtwIaBPaqfwjMmXQFfdE.jpg?width=216&amp;crop=smart&amp;auto=webp&amp;s=2763f101d5dd460cdec78ffc870308faa84f64fc', 'width': 216}, {'height': 168, 'url': 'https://external-preview.redd.it/ZvhgRgJmR6K9Jh8WM54JhehbtwIaBPaqfwjMmXQFfdE.jpg?width=320&amp;crop=smart&amp;auto=webp&amp;s=a0786e6cd3e0efd26d9640336569f989a76e5f06', 'width': 320}, {'height': 336, 'url': 'https://external-preview.redd.it/ZvhgRgJmR6K9Jh8WM54JhehbtwIaBPaqfwjMmXQFfdE.jpg?width=640&amp;crop=smart&amp;auto=webp&amp;s=0b734905a3bb26334fdb9054a3e4c186007b0a5e', 'width': 640}, {'height': 504, 'url': 'https://external-preview.redd.it/ZvhgRgJmR6K9Jh8WM54JhehbtwIaBPaqfwjMmXQFfdE.jpg?width=960&amp;crop=smart&amp;auto=webp&amp;s=075dd3975e8b1603295fbe6466972086d840ef06', 'width': 960}, {'height': 567, 'url': 'https://external-preview.redd.it/ZvhgRgJmR6K9Jh8WM54JhehbtwIaBPaqfwjMmXQFfdE.jpg?width=1080&amp;crop=smart&amp;auto=webp&amp;s=b8b79a5c61dc1ab0ead941ce7a7dd0180cecadcc', 'width': 1080}], 'source': {'height': 630, 'url': 'https://external-preview.redd.it/ZvhgRgJmR6K9Jh8WM54JhehbtwIaBPaqfwjMmXQFfdE.jpg?auto=webp&amp;s=c7de71583c613e11486665f8cbf3c10a6abeeafa', 'width': 1200}, 'variants': {}}]}",6,1652611683,1,,False,False,False,CryptoCurrency,t5_2wlj3,4859493,public,new,https://a.thumbs.redditmedia.com/yf_Sf46CdZlZQTfZH2RQneExJuBJHWQ3UVmgxxw3D80.jpg,"Luna CEO Do Kwon proposes forking LUNA, UST to reimburse hodlers | CryptoSlate",0,[],1.0,https://cryptoslate.com/luna-ceo-do-kwon-proposes-forking-luna-ust-to-reimburse-hodlers/,all_ads,6,1652582872.0,,,,,,73.0,140.0,https://cryptoslate.com/luna-ceo-do-kwon-proposes-forking-luna-ust-to-reimburse-hodlers/,,,,
16,[],False,AdventurousAdagio830,,,[],,,text,t2_e1qnw0tj,False,False,False,[],False,False,1652611417,self.CryptoCurrency,https://www.reddit.com/r/CryptoCurrency/comments/uq3gm2/i_cant_fully_blame_luna_or_ust_for_but_im_going/,{},uq3gm2,False,False,False,False,False,False,True,False,#46d160,MARKETS,"[{'e': 'text', 't': 'MARKETS'}]",1a657c8c-e48d-11e5-a215-0e374d550989,MARKETS,light,richtext,False,False,True,1,0,False,all_ads,/r/CryptoCurrency/comments/uq3gm2/i_cant_fully_blame_luna_or_ust_for_but_im_going/,False,,,6,1652611428,1,[removed],True,False,False,CryptoCurrency,t5_2wlj3,4859477,public,,self,"I can’t fully blame LUNA or UST for but I’m going through some of the darkest, most severe mental pain of my life.",0,[],1.0,https://www.reddit.com/r/CryptoCurrency/comments/uq3gm2/i_cant_fully_blame_luna_or_ust_for_but_im_going/,all_ads,6,1652582617.0,,,moderator,,,,,,,,,
17,[],False,CptBeetle,,Warning-level2-2,"[{'e': 'text', 't': 'Tin | r/WSB 32'}]",Tin | r/WSB 32,dark,richtext,t2_nz6ie,False,False,False,[],False,False,1652609760,i.redd.it,https://www.reddit.com/r/CryptoCurrency/comments/uq32vl/ustluna_side_by_side_revival_lfg/,{},uq32vl,False,True,False,False,True,True,False,False,#c403f5,COMEDY,"[{'e': 'text', 't': 'COMEDY'}]",5c104cfc-d7c8-11e4-9d14-22000b6902b0,COMEDY,dark,richtext,False,False,True,1,0,False,all_ads,/r/CryptoCurrency/comments/uq32vl/ustluna_side_by_side_revival_lfg/,False,image,"{'enabled': True, 'images': [{'id': '-HdZAxs1GMtv5kjDtdWSM6y1EAsbYxD_HnBsz7SLckU', 'resolutions': [{'height': 80, 'url': 'https://preview.redd.it/5val58qr7mz81.jpg?width=108&amp;crop=smart&amp;auto=webp&amp;s=b0b44ea3a8f199f0e30bd2458b9e675a7c500ef9', 'width': 108}, {'height': 160, 'url': 'https://preview.redd.it/5val58qr7mz81.jpg?width=216&amp;crop=smart&amp;auto=webp&amp;s=bed6b9fca6ee6783d547b79faf09e6d483b2b1f9', 'width': 216}, {'height': 237, 'url': 'https://preview.redd.it/5val58qr7mz81.jpg?width=320&amp;crop=smart&amp;auto=webp&amp;s=7bc3cbbea6d213577c39a4cd2856fad6a96e23c8', 'width': 320}, {'height': 475, 'url': 'https://preview.redd.it/5val58qr7mz81.jpg?width=640&amp;crop=smart&amp;auto=webp&amp;s=106eab0b9af98fbe31a13c1793acfa08658808d5', 'width': 640}, {'height': 713, 'url': 'https://preview.redd.it/5val58qr7mz81.jpg?width=960&amp;crop=smart&amp;auto=webp&amp;s=e3ef19b4ed1cb45d8a87b1df506226f6a4717bf7', 'width': 960}], 'source': {'height': 761, 'url': 'https://preview.redd.it/5val58qr7mz81.jpg?auto=webp&amp;s=d2ccc0e755cea6cb93d849d8b2425ef270839643', 'width': 1024}, 'variants': {}}]}",6,1652609770,1,,True,False,False,CryptoCurrency,t5_2wlj3,4859361,public,new,https://b.thumbs.redditmedia.com/VdQCmAZzohc3AsjZA13WCREC3wMcAEtPLK7asdNkE_U.jpg,UST/LUNA side by side revival LFG!!,0,[],1.0,https://i.redd.it/5val58qr7mz81.jpg,all_ads,6,1652580960.0,,,,,,104.0,140.0,https://i.redd.it/5val58qr7mz81.jpg,,,,
18,[],False,CptBeetle,,Warning-level2-2,"[{'e': 'text', 't': 'Tin | r/WSB 32'}]",Tin | r/WSB 32,dark,richtext,t2_nz6ie,False,False,False,[],False,False,1652609707,i.redd.it,https://www.reddit.com/r/CryptoCurrency/comments/uq32fa/ustluna_side_by_side_revival_lfg/,{},uq32fa,False,True,False,False,True,True,False,False,#c403f5,COMEDY,"[{'e': 'text', 't': 'COMEDY'}]",5c104cfc-d7c8-11e4-9d14-22000b6902b0,COMEDY,dark,richtext,False,False,True,1,0,False,all_ads,/r/CryptoCurrency/comments/uq32fa/ustluna_side_by_side_revival_lfg/,False,image,"{'enabled': True, 'images': [{'id': 'kqbyXUqF08uM4eDSJgfzBz1HXs7knxxCRHcuitRmszo', 'resolutions': [{'height': 80, 'url': 'https://preview.redd.it/nkbygc1m7mz81.jpg?width=108&amp;crop=smart&amp;auto=webp&amp;s=a317df5c88434a83540d1ebd4484a009d456ad86', 'width': 108}, {'height': 160, 'url': 'https://preview.redd.it/nkbygc1m7mz81.jpg?width=216&amp;crop=smart&amp;auto=webp&amp;s=fb642e1fc2c42fdb3ad965400ea1aacf4f6d899f', 'width': 216}, {'height': 237, 'url': 'https://preview.redd.it/nkbygc1m7mz81.jpg?width=320&amp;crop=smart&amp;auto=webp&amp;s=0396662735b7938cdcd8dfa7de47ef086de17b4d', 'width': 320}, {'height': 475, 'url': 'https://preview.redd.it/nkbygc1m7mz81.jpg?width=640&amp;crop=smart&amp;auto=webp&amp;s=37d22e34f4b6e1c0dd4792d8eea4899aa49ed4d3', 'width': 640}, {'height': 713, 'url': 'https://preview.redd.it/nkbygc1m7mz81.jpg?width=960&amp;crop=smart&amp;auto=webp&amp;s=0edbb7b455f2fa841f7b2765125627828a6aeb59', 'width': 960}], 'source': {'height': 761, 'url': 'https://preview.redd.it/nkbygc1m7mz81.jpg?auto=webp&amp;s=6fa90639c671a6c2bf188079d90d0eeb917ef163', 'width': 1024}, 'variants': {}}]}",6,1652609717,1,,True,False,False,CryptoCurrency,t5_2wlj3,4859358,public,new,https://b.thumbs.redditmedia.com/QVs-YMv7aa5LRFsn9qg6XKlQlWernh0Bn5JizvBhgOg.jpg,UST/LUNA side by side revival LFG!!,0,[],1.0,https://i.redd.it/nkbygc1m7mz81.jpg,all_ads,6,1652580907.0,,,,,,104.0,140.0,https://i.redd.it/nkbygc1m7mz81.jpg,,,,
19,[],False,CptBeetle,,Warning-level2-2,"[{'e': 'text', 't': 'Tin | r/WSB 32'}]",Tin | r/WSB 32,dark,richtext,t2_nz6ie,False,False,False,[],False,False,1652609593,i.redd.it,https://www.reddit.com/r/CryptoCurrency/comments/uq31dm/ustluna_side_by_side_revival_lfg/,{},uq31dm,False,True,False,False,True,True,False,False,#c403f5,COMEDY,"[{'e': 'text', 't': 'COMEDY'}]",5c104cfc-d7c8-11e4-9d14-22000b6902b0,COMEDY,dark,richtext,False,False,True,1,0,False,all_ads,/r/CryptoCurrency/comments/uq31dm/ustluna_side_by_side_revival_lfg/,False,image,"{'enabled': True, 'images': [{'id': '4FoldTg58-GaD5qxB9BdI7G87ya69_zewMSFiNyUaI0', 'resolutions': [{'height': 80, 'url': 'https://preview.redd.it/2wqqvat97mz81.jpg?width=108&amp;crop=smart&amp;auto=webp&amp;s=01cb0d32606d57334cad4764a1cbb50d74b7d1f3', 'width': 108}, {'height': 160, 'url': 'https://preview.redd.it/2wqqvat97mz81.jpg?width=216&amp;crop=smart&amp;auto=webp&amp;s=29fd4a89c151d6ba4a06abc7d48c74d95a7c2eb7', 'width': 216}, {'height': 237, 'url': 'https://preview.redd.it/2wqqvat97mz81.jpg?width=320&amp;crop=smart&amp;auto=webp&amp;s=aa0c3be75a08d822d4e0b0a35f74ac4d1b1834d2', 'width': 320}, {'height': 475, 'url': 'https://preview.redd.it/2wqqvat97mz81.jpg?width=640&amp;crop=smart&amp;auto=webp&amp;s=c4766765b57f3f9f83c2931448ddff1b7fa12f8b', 'width': 640}, {'height': 713, 'url': 'https://preview.redd.it/2wqqvat97mz81.jpg?width=960&amp;crop=smart&amp;auto=webp&amp;s=cf5370a910a8329f49c7ddfd026182da72c218e3', 'width': 960}], 'source': {'height': 761, 'url': 'https://preview.redd.it/2wqqvat97mz81.jpg?auto=webp&amp;s=985f8cd9f89cb0a3ae4aa78bfd2147b44e6f90a6', 'width': 1024}, 'variants': {}}]}",6,1652609604,1,,True,False,False,CryptoCurrency,t5_2wlj3,4859350,public,,https://b.thumbs.redditmedia.com/9jbiEfLVYGz73Z9kCanaLzEVwvhLonbZkc9SnaovlrQ.jpg,UST/LUNA side by side revival LFG!!,0,[],1.0,https://i.redd.it/2wqqvat97mz81.jpg,all_ads,6,1652580793.0,,,,,,104.0,140.0,https://i.redd.it/2wqqvat97mz81.jpg,,,,
20,[],False,xlg_com,,Warning-level2-2,"[{'e': 'text', 't': 'Tin'}]",Tin,dark,richtext,t2_qp95ubw,False,False,False,[],False,False,1652609141,self.CryptoCurrency,https://www.reddit.com/r/CryptoCurrency/comments/uq2xqs/what_should_i_do_with_my_cro/,{},uq2xqs,False,True,False,False,False,True,True,False,#46d160,ADVICE,"[{'e': 'text', 't': 'ADVICE'}]",e9570888-9c2a-11e3-809c-12313d1661cc,ADVICE,dark,richtext,False,False,True,0,0,False,all_ads,/r/CryptoCurrency/comments/uq2xqs/what_should_i_do_with_my_cro/,False,,,6,1652609151,1,"Long story short, last month I made a silly mistake when selling my stable coin. Instead of selling them to Fiat, I didn't pay much attention and the design of CDC was sneaky so I ended up sold them to CRO. I was hoping for CRO to go up a bit so I can get them back to Fiat even money but I was so wrong now I'm down 60%. Given I am already lost a ton from UST this week, I really don't know what to do with my CRO.

Should I take the loss, or you think CRO has potential to go up. Sorry guys, I know I should do my own research, but losing almost half year salary on UST made me already live like a walking corpse for days......",True,False,False,CryptoCurrency,t5_2wlj3,4859303,public,new,self,What should I do with my CRO,0,[],1.0,https://www.reddit.com/r/CryptoCurrency/comments/uq2xqs/what_should_i_do_with_my_cro/,all_ads,6,1652580341.0,,,,,,,,,,,,
21,[],False,kgtrip,,Warning-level1-1,"[{'e': 'text', 't': 'Bronze'}]",Bronze,dark,richtext,t2_9ozxf9,False,False,False,[],False,False,1652608753,self.CryptoCurrency,https://www.reddit.com/r/CryptoCurrency/comments/uq2u7s/does_the_scenario_happened_with_ust_can_happen_in/,{},uq2u7s,False,False,False,False,False,False,True,False,#7193ff,DISCUSSION,"[{'e': 'text', 't': 'DISCUSSION'}]",87049662-0882-11e5-82e1-0e9d1a9f7761,DISCUSSION,dark,richtext,False,False,True,1,0,False,all_ads,/r/CryptoCurrency/comments/uq2u7s/does_the_scenario_happened_with_ust_can_happen_in/,False,,,6,1652608763,1,[removed],True,False,False,CryptoCurrency,t5_2wlj3,4859272,public,,self,Does the scenario happened with UST can happen in other stables such as DAI?,0,[],1.0,https://www.reddit.com/r/CryptoCurrency/comments/uq2u7s/does_the_scenario_happened_with_ust_can_happen_in/,all_ads,6,1652579953.0,,,moderator,,,,,,,,,
22,[],False,RefugeeDutch_Syrian,, Investor,"[{'e': 'text', 't': ' BTC is boss and boss is BTC'}]", BTC is boss and boss is BTC,dark,richtext,t2_16sf0t,False,False,False,[],False,False,1652606994,self.CryptoCurrency,https://www.reddit.com/r/CryptoCurrency/comments/uq2gk2/how_do_we_know_that_what_happened_to_terrausd/,{},uq2gk2,False,True,False,False,False,True,True,False,#7193ff,DISCUSSION,"[{'e': 'text', 't': 'DISCUSSION'}]",87049662-0882-11e5-82e1-0e9d1a9f7761,DISCUSSION,dark,richtext,False,False,True,0,0,False,all_ads,/r/CryptoCurrency/comments/uq2gk2/how_do_we_know_that_what_happened_to_terrausd/,False,,,6,1652607004,1,"Basically my title. I have been in the space for a while but I have not once came across a post or a PSA warning against obtaining TerraUSD (UST), but I have seen quite the number of them warning about Tether USD (USDT). We saw how ugly things got with Terra and that let me to wonder, what (if at all) is preventing the same to happen to other ""stable"" coins?

&amp;#x200B;

I'm starting to think that some regulations in the space won't harm us, as it is absolutely ridiculous how many people lost their live savings due to the situation with Terra. What do you guys think?",True,False,False,CryptoCurrency,t5_2wlj3,4859138,public,new,self,How do we know that what happened to TerraUSD won't happen to Tether USD and USDC?,0,[],1.0,https://www.reddit.com/r/CryptoCurrency/comments/uq2gk2/how_do_we_know_that_what_happened_to_terrausd/,all_ads,6,1652578194.0,,,,,,,,,,,,
23,[],False,Siri_9_200,,Warning-level2-2,"[{'e': 'text', 't': 'Tin | 4 months old'}]",Tin | 4 months old,dark,richtext,t2_eih5kpar,False,False,False,[],False,False,1652605545,self.CryptoCurrency,https://www.reddit.com/r/CryptoCurrency/comments/uq251o/if_you_want_to_show_crypto_is_better_for_the/,{},uq251o,False,True,False,False,False,True,True,False,#ff66ac,DEBATE,"[{'e': 'text', 't': 'DEBATE'}]",5b762856-d7c9-11e4-822a-22000b2300b2,DEBATE,light,richtext,False,False,True,0,0,False,all_ads,/r/CryptoCurrency/comments/uq251o/if_you_want_to_show_crypto_is_better_for_the/,False,,,6,1652605555,1,"In 2008 none of the Wall Street guys went to prison. Crypto enthusias likes to keep reminding us about that, but when it's a crypto guy who lost more than 40 billion in 2  days. We start asking to give him a break or sympathy??
People who keep saying crypto is the future and it will change everything.
How about some accountability? 
Do Kwon did exactly what wall streets people do, and Bitcoin was created to oppose that.
Some defend him saying that people bought into it and deserve what happened to them, yeah that's wall street too.
He bought BTC and then gave UST OTC to some rich entity to destroy the project.
There were so many people describing why it is a bad idea to do that and he kept laughing at them and trolling.

This man deserves no sympathy and should be held accountable",True,False,False,CryptoCurrency,t5_2wlj3,4859042,public,,self,"If you want to show crypto is better for the financial system, you have to hold Do Kwon and Terra accountable.",0,[],1.0,https://www.reddit.com/r/CryptoCurrency/comments/uq251o/if_you_want_to_show_crypto_is_better_for_the/,all_ads,6,1652576745.0,,,,,,,,,,,,
24,[],False,FunnyAggressive5781,,Warning-level2-2,"[{'e': 'text', 't': 'Tin | 4 months old'}]",Tin | 4 months old,dark,richtext,t2_ica0huv8,False,False,False,[],False,False,1652603722,self.CryptoCurrency,https://www.reddit.com/r/CryptoCurrency/comments/uq1qi9/the_recent_crash_just_showed_that_whenever/,{},uq1qi9,False,True,False,False,False,True,True,False,#add2e2,ADVICE,"[{'e': 'text', 't': 'ANALYSIS'}]",c1034ee6-9c2a-11e3-a8c4-12313b0e8e20,ANALYSIS,dark,richtext,False,False,False,0,0,False,all_ads,/r/CryptoCurrency/comments/uq1qi9/the_recent_crash_just_showed_that_whenever/,False,,,6,1652603733,1,"Yes I’m talking about Luna and UST which have crazy 20% returns in anchor protocol.
Anchor was sort of giving the first signal when it’s yield reserve starting going against what should’ve happened and at one point the returns were about to be halved until Terra labs just flushed 300M into them.

I’m not saying that every project is the same but every time when something looks too good to be true, it has always failed in Crypto.
Time after time it proves that the only best investment you can make blindly is in bitcoin and always the wise only invest what they can afford to lose, especially follow this in here,
Thanks for listening to my ted talk!",True,False,False,CryptoCurrency,t5_2wlj3,4858895,public,new,self,"The recent crash just showed that whenever something is “to good to be true” , it’s always to good to be true in Crypto",0,[],1.0,https://www.reddit.com/r/CryptoCurrency/comments/uq1qi9/the_recent_crash_just_showed_that_whenever/,all_ads,6,1652574922.0,,,,,,,,,,,,
25,[],False,DenwoGames,,,[],,,text,t2_13tugc,False,False,False,[],False,False,1652602457,youtube.com,https://www.reddit.com/r/CryptoCurrency/comments/uq1gc5/luna_ust_explained_supply_increased_whats_next_us/,{},uq1gc5,False,False,False,False,False,False,False,False,#add2e2,ADVICE,"[{'e': 'text', 't': 'ANALYSIS'}]",c1034ee6-9c2a-11e3-a8c4-12313b0e8e20,ANALYSIS,dark,richtext,False,False,True,2,0,False,all_ads,/r/CryptoCurrency/comments/uq1gc5/luna_ust_explained_supply_increased_whats_next_us/,False,link,"{'enabled': False, 'images': [{'id': '2NIW6awDKYUcpaoS_FRiGrjSynSblYyLXtsw7wzykPg', 'resolutions': [{'height': 81, 'url': 'https://external-preview.redd.it/mtP93TY2G1YNCvnS9Cbt2CpsAMWQkbPhLC61vtblDKU.jpg?width=108&amp;crop=smart&amp;auto=webp&amp;s=ded241e45bb8420ab3b5ea9868e08a47c243b70e', 'width': 108}, {'height': 162, 'url': 'https://external-preview.redd.it/mtP93TY2G1YNCvnS9Cbt2CpsAMWQkbPhLC61vtblDKU.jpg?width=216&amp;crop=smart&amp;auto=webp&amp;s=bcaeeb19383a68ac0ea868f0bcbefd279749bcdd', 'width': 216}, {'height': 240, 'url': 'https://external-preview.redd.it/mtP93TY2G1YNCvnS9Cbt2CpsAMWQkbPhLC61vtblDKU.jpg?width=320&amp;crop=smart&amp;auto=webp&amp;s=c71dda3f5a2d52cbe1cfa83229ee48b89bb595b1', 'width': 320}], 'source': {'height': 360, 'url': 'https://external-preview.redd.it/mtP93TY2G1YNCvnS9Cbt2CpsAMWQkbPhLC61vtblDKU.jpg?auto=webp&amp;s=87c90b3b4c453b9f10a436eba1f397fee29f241e', 'width': 480}, 'variants': {}}]}",6,1652602467,1,,False,False,False,CryptoCurrency,t5_2wlj3,4858785,public,new,https://a.thumbs.redditmedia.com/LHDBYV_lAF1FqUFQ3AfHySHa2ZPNwI5IBu1yQKdf9B8.jpg,LUNA UST Explained : Supply Increased! What's Next? U.S. Dollar In Trouble,0,[],1.0,https://youtube.com/shorts/WFPRI5Ly4OM?feature=share,all_ads,6,1652573657.0,,,moderator,,,105.0,140.0,https://youtube.com/shorts/WFPRI5Ly4OM?feature=share,,,,
26,[],False,mrtoeonreddit,,Warning-level2-2,"[{'e': 'text', 't': 'Tin'}]",Tin,dark,richtext,t2_15witk,False,False,False,[],False,False,1652600852,self.CryptoCurrency,https://www.reddit.com/r/CryptoCurrency/comments/uq130v/eli5_for_luna_ust_price_arbitrage_mechanism_and/,{},uq130v,False,True,False,False,False,True,True,False,#7193ff,DISCUSSION,"[{'e': 'text', 't': 'DISCUSSION'}]",87049662-0882-11e5-82e1-0e9d1a9f7761,DISCUSSION,dark,richtext,False,False,False,0,0,False,all_ads,/r/CryptoCurrency/comments/uq130v/eli5_for_luna_ust_price_arbitrage_mechanism_and/,False,,,6,1652600863,1,"I have been reading articles of how UST (terra) maintains its algorithmic peg to the US dollar via the arbitrage mechanism

This is the part I understand:

When the price of UST (Terra) falls below one us dollar, people are able to exchange 1 UST (terra) for 1 us dollar worth of LUNA at terra station website thereby making the difference in profit, this arbitrage process will bring the UST (Terra) back to 1 US dollar.  

This is the part I do not understand:

How does terra station determine the US dollar price of a LUNA?",True,False,False,CryptoCurrency,t5_2wlj3,4858642,public,new,self,ELI5 for LUNA UST price arbitrage mechanism and how is the LUNA priced in US dollars,0,[],1.0,https://www.reddit.com/r/CryptoCurrency/comments/uq130v/eli5_for_luna_ust_price_arbitrage_mechanism_and/,all_ads,6,1652572052.0,,,,,,,,,,,,
27,[],False,Theodora765,,,[],,,text,t2_fslqj7uq,False,False,False,[],False,False,1652593408,self.CryptoCurrency,https://www.reddit.com/r/CryptoCurrency/comments/upzci3/pov_this_is_how_a_trader_experienced_the_fall_of/,{},upzci3,False,True,False,False,False,True,True,False,#7193ff,DISCUSSION,"[{'e': 'text', 't': 'DISCUSSION'}]",87049662-0882-11e5-82e1-0e9d1a9f7761,DISCUSSION,dark,richtext,False,False,True,0,0,False,all_ads,/r/CryptoCurrency/comments/upzci3/pov_this_is_how_a_trader_experienced_the_fall_of/,False,,,6,1652593418,1," ImmortalCrypto, as he is known in social networks, has been trading cryptocurrencies for more than 4 years. And at least since 2020, he has been doing it full time, as his main activity. This transition, from a job outside of trading to this exclusive dedication, he was able to make after becoming a profitable trader with consistency.   In this world, we might think that this experience is enough not to fall into too big losses. And in part, that is true. However, he was one of the thousands of people who lost money with the Terra project debacle. Although he did not invest in the LUNA token, he did have tens of thousands of dollars in his stablecoin, TerraUSD (UST).  In spite of everything, Luna decided to still 'print' more tokens by uncontrollably increasing the supply, as they could have instead repurchased their tokens with part of the fee for token burning existentially, as has been done at GMR or Minosis Token at BSC.  Via Twitter, he commented that he had lost 70% of the capital he held in UST, following the loss of the 1:1 parity between this currency and the US dollar. A parity that, in theory, he was not supposed to lose. After all, it is a ""stable"" currency. But the reality has been different.    The story of the Terra project, its stablecoin, its token and its bitcoin reserves has ended in the worst possible way: with billions of dollars in losses and a lot of people affected with devastating results. ImmortalCrypto's case was not among the worst. As he himself claims, this has been thanks to the experience and foresight he had taken.  ""The distrust that this has generated, what it will also generate is that many regulators will put the magnifying glass on the stable ones. Which is quite negative because it means huge regulations for 'crypto', which we always know do not come as a positive thing. These are things that go way over the top.""  -InmortalCrypto, trader focused on bitcoin and cryptocurrencies",True,False,False,CryptoCurrency,t5_2wlj3,4858026,public,new,self,"POV; This is how a trader experienced the fall of Terra USD, losing up to 70% of his investment.",0,[],1.0,https://www.reddit.com/r/CryptoCurrency/comments/upzci3/pov_this_is_how_a_trader_experienced_the_fall_of/,all_ads,6,1652564608.0,,,,,,,,,,,,
