33,[],False,getrich_or_diemining,,noflair,[],,dark,text,t2_23csy0qb,False,False,False,[],False,False,1652589836,self.CryptoCurrency,https://www.reddit.com/r/CryptoCurrency/comments/upygce/do_kwon_disolved_terraform_labs_on_april_30th/,{},upygce,False,True,False,False,False,True,True,False,#7193ff,DISCUSSION,"[{'e': 'text', 't': 'DISCUSSION'}]",87049662-0882-11e5-82e1-0e9d1a9f7761,DISCUSSION,dark,richtext,False,False,True,0,0,False,all_ads,/r/CryptoCurrency/comments/upygce/do_kwon_disolved_terraform_labs_on_april_30th/,False,,,6,1652589847,1," KWON-DO-HYUNG is listed in this Korean document as disolving his company Terraform Labs on April 30th, registered May 4th. The act of dissolving just days before the collapse of UST suggests the intent to eliminate responsibility of the aftermath, which serves as evidence that he knew something was going to happen. On top of it all, Do Kwon's Terra foundation sent 52,189 Bitcoin to Gemini and 28,205 Bitcoin to Binance, which were intended to serve as reserves to prop up TerraUSD (UST). So what happened here? This looks like one big premeditated crime to steal 2 billion USD worth of Bitcoin by means of using Terra Luna and UST as the front.

Below is the documentation showing Terraform labs being dissolved just days before the collapse

https://preview.redd.it/o97fvmmbikz81.png?width=1125&amp;format=png&amp;auto=webp&amp;s=519a776f8aad740b938fc9d28d76ccb5b9d07f8a

https://preview.redd.it/0sfms3fdikz81.png?width=1125&amp;format=png&amp;auto=webp&amp;s=659a817616446fdab5757ff02d9f9bacce1e55e4",True,False,False,CryptoCurrency,t5_2wlj3,4857725,public,new,https://b.thumbs.redditmedia.com/37Sp3FTaHzpPDB-34ALb8gsJxpGfhWPTlJ0ixVwYBHU.jpg,Do Kwon Disolved Terraform Labs on April 30th!,0,[],1.0,https://www.reddit.com/r/CryptoCurrency/comments/upygce/do_kwon_disolved_terraform_labs_on_april_30th/,all_ads,6,1652561036.0,,140.0,140.0,,"{'0sfms3fdikz81': {'e': 'Image', 'id': '0sfms3fdikz81', 'm': 'image/png', 'p': [{'u': 'https://preview.redd.it/0sfms3fdikz81.png?width=108&amp;crop=smart&amp;auto=webp&amp;s=ab8faac312f3143b03a8caa3f62933c7052c89af', 'x': 108, 'y': 124}, {'u': 'https://preview.redd.it/0sfms3fdikz81.png?width=216&amp;crop=smart&amp;auto=webp&amp;s=79f2ce1be2fad84e4f7a4818979c96657964faa9', 'x': 216, 'y': 248}, {'u': 'https://preview.redd.it/0sfms3fdikz81.png?width=320&amp;crop=smart&amp;auto=webp&amp;s=e314ed5cebed42cfc2a94fc55cf9ec3298be44bf', 'x': 320, 'y': 367}, {'u': 'https://preview.redd.it/0sfms3fdikz81.png?width=640&amp;crop=smart&amp;auto=webp&amp;s=2ca8f7dba443bf29ed27b070f2883bd2208bb837', 'x': 640, 'y': 735}, {'u': 'https://preview.redd.it/0sfms3fdikz81.png?width=960&amp;crop=smart&amp;auto=webp&amp;s=877147a10dfd9a6de22e8abad236a5f1c564abe6', 'x': 960, 'y': 1102}, {'u': 'https://preview.redd.it/0sfms3fdikz81.png?width=1080&amp;crop=smart&amp;auto=webp&amp;s=a44bfad6b1cb5df80a3c00862877397fd2765f72', 'x': 1080, 'y': 1240}], 's': {'u': 'https://preview.redd.it/0sfms3fdikz81.png?width=1125&amp;format=png&amp;auto=webp&amp;s=659a817616446fdab5757ff02d9f9bacce1e55e4', 'x': 1125, 'y': 1292}, 'status': 'valid'}, 'o97fvmmbikz81': {'e': 'Image', 'id': 'o97fvmmbikz81', 'm': 'image/png', 'p': [{'u': 'https://preview.redd.it/o97fvmmbikz81.png?width=108&amp;crop=smart&amp;auto=webp&amp;s=371e9dede46370eef6d9e4993c613d091ed74602', 'x': 108, 'y': 123}, {'u': 'https://preview.redd.it/o97fvmmbikz81.png?width=216&amp;crop=smart&amp;auto=webp&amp;s=57bbf25ab857555dbbf9408922691112de5511cf', 'x': 216, 'y': 246}, {'u': 'https://preview.redd.it/o97fvmmbikz81.png?width=320&amp;crop=smart&amp;auto=webp&amp;s=626cbd281ab6b26e90e1403e93f29e7c4ca41c70', 'x': 320, 'y': 365}, {'u': 'https://preview.redd.it/o97fvmmbikz81.png?width=640&amp;crop=smart&amp;auto=webp&amp;s=f294380fedbc235dbd7005e0a48e26bab5dc089f', 'x': 640, 'y': 731}, {'u': 'https://preview.redd.it/o97fvmmbikz81.png?width=960&amp;crop=smart&amp;auto=webp&amp;s=bbd146dec8749c435e51da5525258a6525ea75c4', 'x': 960, 'y': 1097}, {'u': 'https://preview.redd.it/o97fvmmbikz81.png?width=1080&amp;crop=smart&amp;auto=webp&amp;s=a8f6e5e0623d6fa7b7292651f6481d5df7092ef0', 'x': 1080, 'y': 1234}], 's': {'u': 'https://preview.redd.it/o97fvmmbikz81.png?width=1125&amp;format=png&amp;auto=webp&amp;s=519a776f8aad740b938fc9d28d76ccb5b9d07f8a', 'x': 1125, 'y': 1286}, 'status': 'valid'}}",,,,
34,[],False,nutandshell,,,[],,,text,t2_26doipqe,False,False,False,[],False,False,1652589565,self.CryptoCurrency,https://www.reddit.com/r/CryptoCurrency/comments/upydtc/terra_lunas_subreddit_seems_to_have_disabled/,{},upydtc,False,False,False,False,False,False,True,False,#7193ff,DISCUSSION,"[{'e': 'text', 't': 'DISCUSSION'}]",87049662-0882-11e5-82e1-0e9d1a9f7761,DISCUSSION,dark,richtext,False,False,True,1,0,False,all_ads,/r/CryptoCurrency/comments/upydtc/terra_lunas_subreddit_seems_to_have_disabled/,False,self,"{'enabled': False, 'images': [{'id': 'Pj6x3wJSqwAPVfMfixD7LMx8ArYiwAlrD9ADfH6W1yk', 'resolutions': [{'height': 56, 'url': 'https://external-preview.redd.it/I64Teve1HeadUCvzCMqLh4R_rbeV4Rfc3-WRVVhznkA.jpg?width=108&amp;crop=smart&amp;auto=webp&amp;s=5dfd3bac866fc57ceeac47fb3522f8af1f842364', 'width': 108}, {'height': 113, 'url': 'https://external-preview.redd.it/I64Teve1HeadUCvzCMqLh4R_rbeV4Rfc3-WRVVhznkA.jpg?width=216&amp;crop=smart&amp;auto=webp&amp;s=38460e8804302a447f1855d0a586d756636bc763', 'width': 216}, {'height': 167, 'url': 'https://external-preview.redd.it/I64Teve1HeadUCvzCMqLh4R_rbeV4Rfc3-WRVVhznkA.jpg?width=320&amp;crop=smart&amp;auto=webp&amp;s=24f0f2838f99f75f116b99c9aee7b4ade86add9a', 'width': 320}, {'height': 334, 'url': 'https://external-preview.redd.it/I64Teve1HeadUCvzCMqLh4R_rbeV4Rfc3-WRVVhznkA.jpg?width=640&amp;crop=smart&amp;auto=webp&amp;s=96c7fbe70c33169f857c16c8667d905706184a4f', 'width': 640}, {'height': 502, 'url': 'https://external-preview.redd.it/I64Teve1HeadUCvzCMqLh4R_rbeV4Rfc3-WRVVhznkA.jpg?width=960&amp;crop=smart&amp;auto=webp&amp;s=3edd3348b6fa4aca6b47b957d61a14be2ff8332b', 'width': 960}, {'height': 565, 'url': 'https://external-preview.redd.it/I64Teve1HeadUCvzCMqLh4R_rbeV4Rfc3-WRVVhznkA.jpg?width=1080&amp;crop=smart&amp;auto=webp&amp;s=b0d01e30653a322ccc7d881116b3bdc803b6b2c0', 'width': 1080}], 'source': {'height': 628, 'url': 'https://external-preview.redd.it/I64Teve1HeadUCvzCMqLh4R_rbeV4Rfc3-WRVVhznkA.jpg?auto=webp&amp;s=634357e7ecc6ea4f6ea24dd8a99aba508d1fbe75', 'width': 1200}, 'variants': {}}]}",6,1652589575,1,[removed],True,False,False,CryptoCurrency,t5_2wlj3,4857709,public,,self,Terra LUNA’s subreddit seems to have disabled posts… Did anyone know that Do Kwon was apparently behind an earlier failed algorithmic stablecoin project founded by an anonymous “Rick” and “Morty” in 2020?,0,[],1.0,https://www.reddit.com/r/CryptoCurrency/comments/upydtc/terra_lunas_subreddit_seems_to_have_disabled/,all_ads,6,1652560765.0,moderator,,,,,,,,
35,[],False,0xArzeefy,,,[],,,text,t2_lxnupxtj,False,False,False,[],False,False,1652589516,coindesk.com,https://www.reddit.com/r/CryptoCurrency/comments/upyddc/what_happened_to_the_35b_terra_reserve/,{},upyddc,False,True,False,False,False,True,False,False,,GENERAL-NEWS,"[{'e': 'text', 't': '🟢 GENERAL-NEWS'}]",,🟢 GENERAL-NEWS,dark,richtext,False,False,True,0,0,False,all_ads,/r/CryptoCurrency/comments/upyddc/what_happened_to_the_35b_terra_reserve/,False,link,"{'enabled': False, 'images': [{'id': 'h_7FHOaaCz_KM-7cQSeTJchslq9yXIYSPxDN2Cq2YvI', 'resolutions': [{'height': 56, 'url': 'https://external-preview.redd.it/VGjVFveTC4TAUQnSx8CD5TiOT9D8SOvuXd7tAmRee7I.jpg?width=108&amp;crop=smart&amp;auto=webp&amp;s=b7cef594bff19c80a44c7225fc4b9f84f5dcdb22', 'width': 108}, {'height': 113, 'url': 'https://external-preview.redd.it/VGjVFveTC4TAUQnSx8CD5TiOT9D8SOvuXd7tAmRee7I.jpg?width=216&amp;crop=smart&amp;auto=webp&amp;s=b32a0920a7fb3784a02666661f85cdd79f589349', 'width': 216}, {'height': 167, 'url': 'https://external-preview.redd.it/VGjVFveTC4TAUQnSx8CD5TiOT9D8SOvuXd7tAmRee7I.jpg?width=320&amp;crop=smart&amp;auto=webp&amp;s=b81ee88c08aa356774cf52307642b130874d6ec3', 'width': 320}, {'height': 334, 'url': 'https://external-preview.redd.it/VGjVFveTC4TAUQnSx8CD5TiOT9D8SOvuXd7tAmRee7I.jpg?width=640&amp;crop=smart&amp;auto=webp&amp;s=8e2c33c1c61fe9acbd069634fd7605a76165fade', 'width': 640}, {'height': 502, 'url': 'https://external-preview.redd.it/VGjVFveTC4TAUQnSx8CD5TiOT9D8SOvuXd7tAmRee7I.jpg?width=960&amp;crop=smart&amp;auto=webp&amp;s=b18e1b1ffa0265ea55ac94c0888a076ce2331d5c', 'width': 960}, {'height': 565, 'url': 'https://external-preview.redd.it/VGjVFveTC4TAUQnSx8CD5TiOT9D8SOvuXd7tAmRee7I.jpg?width=1080&amp;crop=smart&amp;auto=webp&amp;s=e1841cee4a1cf6f16972ffceb0b5611c76b746b8', 'width': 1080}], 'source': {'height': 628, 'url': 'https://external-preview.redd.it/VGjVFveTC4TAUQnSx8CD5TiOT9D8SOvuXd7tAmRee7I.jpg?auto=webp&amp;s=fd6f6b0e13742efa920392655b71a08e83d56e43', 'width': 1200}, 'variants': {}}]}",6,1652589527,1,,False,False,False,CryptoCurrency,t5_2wlj3,4857704,public,new,https://b.thumbs.redditmedia.com/GUmHghrIK7ASzVF9m6_UjQuAZw8cLWiVIG9ibHbvE9s.jpg,What Happened to the $3.5B Terra Reserve?,0,[],1.0,https://www.coindesk.com/business/2022/05/14/what-happened-to-the-35b-terra-reserve/,all_ads,6,1652560716.0,,73.0,140.0,https://www.coindesk.com/business/2022/05/14/what-happened-to-the-35b-terra-reserve/,,,,,
36,[],False,VisionGuard,,Warning-level1-1,"[{'e': 'text', 't': 'Bronze | QC: BTC 17'}]",Bronze | QC: BTC 17,dark,richtext,t2_4ggp7yre,False,False,True,[],False,False,1652579468,self.CryptoCurrency,https://www.reddit.com/r/CryptoCurrency/comments/upvkr4/what_could_do_kwon_have_done_differently/,{},upvkr4,False,True,False,False,False,True,True,False,#7193ff,DISCUSSION,"[{'e': 'text', 't': 'DISCUSSION'}]",87049662-0882-11e5-82e1-0e9d1a9f7761,DISCUSSION,dark,richtext,False,False,False,0,0,False,all_ads,/r/CryptoCurrency/comments/upvkr4/what_could_do_kwon_have_done_differently/,False,,,6,1652579479,1,"I made this point on a different comment, and I'm leaning towards it's just that algo stable coins are always a bust, but in light of us dancing on his grave (and I've been doing that a ton) for balance: could Do have done something different before he made it to critical mass of UST ""everywhere"" with ""enough bitcoin"" to reach escape velocity?

To wit, just having some kind of established policy of stopping the chain with an *a priori consensus* determined circuit breaker on, say, 10 percent UST drops would have been HUGE.

Not to mention the Terra foundation/whomever made the decision basically causing most of these issues by permitting absolutely gargantuan amounts of UST to be traded off the central mechanism - so now people could tank the price without going through the UST-LUNA wallet/station mechanism, which basically charged a 10% escalating fee (which would accrue to LUNA holders) when withdrawals of more than 100 million UST over a day were happening. That would slowly shut down at least the LUNA printing machine quickly AND incentivize LUNA holding at that time (since you're now getting an escalating fee from the bank runners).

Obviously the coup de grace was Do Kwon's ultimate purchase of billions of dollars worth of Bitcoin *with UST* (so his conjured coin) permitted those who *he gave that UST to* to now have billions of dollars worth of UST in their possession. Which they then dumped in droves at the precisely right time.

Perhaps the smartest thing for him to have done (in hindsight, though if you make a fucking algo stable coin, this should be obvious) is to *raise outside VC cash* and then use that fiat to buy your BTC as a backstop of last resort, if he felt that was necessary. He could use his UST as collateral if he really needed to work that in which would only slowly pay out in a privately determined way under very grave circumstances.",True,False,False,CryptoCurrency,t5_2wlj3,4856853,public,new,self,What could Do Kwon have done differently?,0,[],1.0,https://www.reddit.com/r/CryptoCurrency/comments/upvkr4/what_could_do_kwon_have_done_differently/,all_ads,6,1652550668.0,,,,,,,,,
37,[],False,stanley_okita_89,,,"[{'e': 'text', 't': 'Silver | QC: CC 29 | ADA 65'}]",Silver | QC: CC 29 | ADA 65,dark,richtext,t2_9qtw07cm,False,False,False,[],False,False,1652579105,self.CryptoCurrency,https://www.reddit.com/r/CryptoCurrency/comments/upvgzk/is_the_terra_blockchain_explorer_down_for_you/,{},upvgzk,False,True,False,False,False,True,True,False,#6b6031,TOOLS,"[{'e': 'text', 't': 'TOOLS'}]",3b73041e-2f21-11ec-b475-1aea7f17b156,TOOLS,light,richtext,False,False,True,0,0,False,all_ads,/r/CryptoCurrency/comments/upvgzk/is_the_terra_blockchain_explorer_down_for_you/,False,,,6,1652579116,1,"I am trying to look at a particular transaction I made on the Terra blockchain a few days ago. In the Terra Station, I click the transaction. It just leads to the main Terra finder page. Even if I click another transaction, it just leads to the same page: [https://finder.terra.money/](https://finder.terra.money/). It doesn't take me to the particular transaction, and I can't see the full transaction ID on Terra Station either. Just the link is available to click but the full transaction ID is shortened.

Is that happening for you as well if you click some random transaction in Terra Station? That didn't happen yesterday, so I'm if it's just me or if it's affecting you too. If they're changing something, I wonder why they're doing that when there's more important things for them right now than trying to improve the blockchain explorer lol",True,False,False,CryptoCurrency,t5_2wlj3,4856828,public,new,self,Is the Terra blockchain explorer down for you?,0,[],1.0,https://www.reddit.com/r/CryptoCurrency/comments/upvgzk/is_the_terra_blockchain_explorer_down_for_you/,all_ads,6,1652550305.0,,,,,,,,,
38,[],False,wazzzzah,,,[],,,text,t2_8p3r4,False,False,False,[],False,False,1652578983,self.CryptoCurrency,https://www.reddit.com/r/CryptoCurrency/comments/upvfqj/whats_the_next_top_50_coin_that_is_likely_to/,{},upvfqj,False,False,False,False,False,False,True,False,#7193ff,DISCUSSION,"[{'e': 'text', 't': 'DISCUSSION'}]",87049662-0882-11e5-82e1-0e9d1a9f7761,DISCUSSION,dark,richtext,False,False,True,1,0,False,all_ads,/r/CryptoCurrency/comments/upvfqj/whats_the_next_top_50_coin_that_is_likely_to/,False,,,6,1652578994,1,[removed],True,False,False,CryptoCurrency,t5_2wlj3,4856819,public,,self,"What's the next Top 50 coin that is likely to collapse within the next few months? I see some comments from people saying that they totally knew that Terra was going to fall that way this year, so, what's another?",0,[],1.0,https://www.reddit.com/r/CryptoCurrency/comments/upvfqj/whats_the_next_top_50_coin_that_is_likely_to/,all_ads,6,1652550183.0,moderator,,,,,,,,
39,[],False,WorkerBee-3,, Gentleman,"[{'e': 'text', 't': ' Cosmonaut '}]", Cosmonaut ,dark,richtext,t2_a48lq27q,False,False,False,[],False,False,1652576515,self.CryptoCurrency,https://www.reddit.com/r/CryptoCurrency/comments/upuq5s/please_watch_out_for_scammers_everyone_terra/,{},upuq5s,False,False,False,False,False,False,True,False,#46d160,ADVICE,"[{'e': 'text', 't': 'ADVICE'}]",e9570888-9c2a-11e3-809c-12313d1661cc,ADVICE,dark,richtext,False,False,True,1,0,False,all_ads,/r/CryptoCurrency/comments/upuq5s/please_watch_out_for_scammers_everyone_terra/,False,,,6,1652576526,1,[removed],True,False,False,CryptoCurrency,t5_2wlj3,4856615,public,,self,Please watch out for scammers everyone. Terra going down has created some chaos in the space and a lot of desperate people are gonna be asking for help. Please be on your toes that any DMs are gonna be dangerous. Scammers will pounce on the opportunity to hurt those in distress more. Give a heads up,0,[],1.0,https://www.reddit.com/r/CryptoCurrency/comments/upuq5s/please_watch_out_for_scammers_everyone_terra/,all_ads,6,1652547715.0,moderator,,,,,,,,
40,[],False,GODB0RN,,Warning-level2-2,"[{'e': 'text', 't': 'Tin'}]",Tin,dark,richtext,t2_669vn9xx,False,False,True,[],False,False,1652573069,self.CryptoCurrency,https://www.reddit.com/r/CryptoCurrency/comments/uptprp/terra_luna_is_wonderful/,{},uptprp,False,True,False,False,False,True,True,False,#7193ff,DISCUSSION,"[{'e': 'text', 't': 'DISCUSSION'}]",87049662-0882-11e5-82e1-0e9d1a9f7761,DISCUSSION,dark,richtext,False,False,False,0,0,False,all_ads,/r/CryptoCurrency/comments/uptprp/terra_luna_is_wonderful/,False,,,6,1652573079,1,"     Just found this project a few days ago. At first I was doubtful but after some research I can’t believe it’s so undervalued. I see a bright future. I bought a small bag and it’s already went up substantially! I was able to sell 25% of my investment to get nearly double back. Now that I’m profitable I can just sit back and wait to see how it goes. 

     Apparently others are seeing he bright future in it as it’s on the rise. What do y’all think of it? Any advice on this particular project?

Are there any other uses for this I’m not aware of? Nft possibilities?",True,False,False,CryptoCurrency,t5_2wlj3,4856315,public,new,self,Terra Luna is wonderful!,0,[],1.0,https://www.reddit.com/r/CryptoCurrency/comments/uptprp/terra_luna_is_wonderful/,all_ads,6,1652544269.0,,,,,,,,,
41,[],False,GODB0RN,,Warning-level2-2,"[{'e': 'text', 't': 'Tin'}]",Tin,dark,richtext,t2_669vn9xx,False,False,True,[],False,False,1652572777,self.CryptoCurrency,https://www.reddit.com/r/CryptoCurrency/comments/uptmhr/terra_luna_is_amazing/,{},uptmhr,False,False,False,False,False,False,True,False,#7193ff,DISCUSSION,"[{'e': 'text', 't': 'DISCUSSION'}]",87049662-0882-11e5-82e1-0e9d1a9f7761,DISCUSSION,dark,richtext,False,False,True,1,0,False,all_ads,/r/CryptoCurrency/comments/uptmhr/terra_luna_is_amazing/,False,,,6,1652572787,1,[removed],True,False,False,CryptoCurrency,t5_2wlj3,4856297,public,,self,Terra Luna is amazing!,0,[],1.0,https://www.reddit.com/r/CryptoCurrency/comments/uptmhr/terra_luna_is_amazing/,all_ads,6,1652543977.0,moderator,,,,,,,,
42,[],False,GODB0RN,,Warning-level2-2,"[{'e': 'text', 't': 'Tin'}]",Tin,dark,richtext,t2_669vn9xx,False,False,True,[],False,False,1652572431,self.CryptoCurrency,https://www.reddit.com/r/CryptoCurrency/comments/uptipp/terra_luna/,{},uptipp,False,False,False,False,False,False,True,False,#7193ff,DISCUSSION,"[{'e': 'text', 't': 'DISCUSSION'}]",87049662-0882-11e5-82e1-0e9d1a9f7761,DISCUSSION,dark,richtext,False,False,True,1,0,False,all_ads,/r/CryptoCurrency/comments/uptipp/terra_luna/,False,,,6,1652572442,1,[removed],True,False,False,CryptoCurrency,t5_2wlj3,4856268,public,,self,Terra Luna!,0,[],1.0,https://www.reddit.com/r/CryptoCurrency/comments/uptipp/terra_luna/,all_ads,6,1652543631.0,moderator,,,,,,,,
43,[],False,GODB0RN,,Warning-level2-2,"[{'e': 'text', 't': 'Tin'}]",Tin,dark,richtext,t2_669vn9xx,False,False,True,[],False,False,1652571992,self.CryptoCurrency,https://www.reddit.com/r/CryptoCurrency/comments/uptdyi/terra_luna/,{},uptdyi,False,False,False,False,False,False,True,False,#7193ff,DISCUSSION,"[{'e': 'text', 't': 'DISCUSSION'}]",87049662-0882-11e5-82e1-0e9d1a9f7761,DISCUSSION,dark,richtext,False,False,True,1,0,False,all_ads,/r/CryptoCurrency/comments/uptdyi/terra_luna/,False,,,6,1652572003,1,[removed],True,False,False,CryptoCurrency,t5_2wlj3,4856221,public,,self,Terra Luna,0,[],1.0,https://www.reddit.com/r/CryptoCurrency/comments/uptdyi/terra_luna/,all_ads,6,1652543192.0,moderator,,,,,,,,
44,[],False,ComprehensivePop1964,,,[],,,text,t2_h0lln32i,False,False,False,[],False,False,1652569780,i.redd.it,https://www.reddit.com/r/CryptoCurrency/comments/upspjl/terra_luna/,{},upspjl,False,True,False,False,True,True,False,False,#c403f5,COMEDY,"[{'e': 'text', 't': 'COMEDY'}]",5c104cfc-d7c8-11e4-9d14-22000b6902b0,COMEDY,dark,richtext,False,False,True,1,0,True,all_ads,/r/CryptoCurrency/comments/upspjl/terra_luna/,False,image,"{'enabled': True, 'images': [{'id': 'iPeat-2VnQUlqYyPFcdCOISUcB69Z6AZkqeNQ05_8W4', 'resolutions': [{'height': 174, 'url': 'https://preview.redd.it/wgzjjlsvwiz81.jpg?width=108&amp;crop=smart&amp;auto=webp&amp;s=23a86f4049fca38158e2f6d8605a90e5b6d7c700', 'width': 108}, {'height': 348, 'url': 'https://preview.redd.it/wgzjjlsvwiz81.jpg?width=216&amp;crop=smart&amp;auto=webp&amp;s=bc5d0a34e1097b54b6ff497a0a82dee87c8ad5ed', 'width': 216}, {'height': 516, 'url': 'https://preview.redd.it/wgzjjlsvwiz81.jpg?width=320&amp;crop=smart&amp;auto=webp&amp;s=f56cc7045950b0ba7000a4802af28ad16eb6dd76', 'width': 320}], 'source': {'height': 807, 'url': 'https://preview.redd.it/wgzjjlsvwiz81.jpg?auto=webp&amp;s=dbc542d5601cf7fcc66d541e776befed85cadb76', 'width': 500}, 'variants': {'nsfw': {'resolutions': [{'height': 174, 'url': 'https://preview.redd.it/wgzjjlsvwiz81.jpg?width=108&amp;crop=smart&amp;blur=10&amp;format=pjpg&amp;auto=webp&amp;s=ac4d31b1f177939c799460f7fccc1c9a9ef5632c', 'width': 108}, {'height': 348, 'url': 'https://preview.redd.it/wgzjjlsvwiz81.jpg?width=216&amp;crop=smart&amp;blur=21&amp;format=pjpg&amp;auto=webp&amp;s=78194410cb312dbcd287a0499650c9ce09bae99f', 'width': 216}, {'height': 516, 'url': 'https://preview.redd.it/wgzjjlsvwiz81.jpg?width=320&amp;crop=smart&amp;blur=32&amp;format=pjpg&amp;auto=webp&amp;s=fcda3eeee3b21557be612336336ae7e1c145acf2', 'width': 320}], 'source': {'height': 807, 'url': 'https://preview.redd.it/wgzjjlsvwiz81.jpg?blur=40&amp;format=pjpg&amp;auto=webp&amp;s=f9005fa8b6520c9ef64bd3c83952f45dbbf6ca24', 'width': 500}}, 'obfuscated': {'resolutions': [{'height': 174, 'url': 'https://preview.redd.it/wgzjjlsvwiz81.jpg?width=108&amp;crop=smart&amp;blur=10&amp;format=pjpg&amp;auto=webp&amp;s=ac4d31b1f177939c799460f7fccc1c9a9ef5632c', 'width': 108}, {'height': 348, 'url': 'https://preview.redd.it/wgzjjlsvwiz81.jpg?width=216&amp;crop=smart&amp;blur=21&amp;format=pjpg&amp;auto=webp&amp;s=78194410cb312dbcd287a0499650c9ce09bae99f', 'width': 216}, {'height': 516, 'url': 'https://preview.redd.it/wgzjjlsvwiz81.jpg?width=320&amp;crop=smart&amp;blur=32&amp;format=pjpg&amp;auto=webp&amp;s=fcda3eeee3b21557be612336336ae7e1c145acf2', 'width': 320}], 'source': {'height': 807, 'url': 'https://preview.redd.it/wgzjjlsvwiz81.jpg?blur=40&amp;format=pjpg&amp;auto=webp&amp;s=f9005fa8b6520c9ef64bd3c83952f45dbbf6ca24', 'width': 500}}}}]}",6,1652569791,1,,False,False,False,CryptoCurrency,t5_2wlj3,4856012,public,,nsfw,Terra Luna,0,[],1.0,https://i.redd.it/wgzjjlsvwiz81.jpg,promo_adult_nsfw,3,1652540980.0,,140.0,140.0,https://i.redd.it/wgzjjlsvwiz81.jpg,,,,,
45,[],False,Horizon0D,,Warning-level1-1,"[{'e': 'text', 't': 'Bronze | QC: CC 18'}]",Bronze | QC: CC 18,dark,richtext,t2_1kb7roa,False,False,False,[],False,False,1652567121,bitcoinist.com,https://www.reddit.com/r/CryptoCurrency/comments/uprwlz/cryptofriendly_sec_commissioner_hints_at/,{},uprwlz,False,True,False,False,False,True,False,False,,GENERAL-NEWS,"[{'e': 'text', 't': '🟢 GENERAL-NEWS'}]",,🟢 GENERAL-NEWS,dark,richtext,False,False,True,0,0,False,all_ads,/r/CryptoCurrency/comments/uprwlz/cryptofriendly_sec_commissioner_hints_at/,False,link,"{'enabled': False, 'images': [{'id': 'nG9N88AKJ4bLetJCHlR4ZJhko9jgqXMMN8JEfK0luMA', 'resolutions': [{'height': 71, 'url': 'https://external-preview.redd.it/Xt5XwrANn_pOlhMFeZDm5mnN2g-hxeBb7bvzQIww7MI.jpg?width=108&amp;crop=smart&amp;auto=webp&amp;s=cd1552dd31ee58e81eb59e543986fd5d660b3997', 'width': 108}, {'height': 143, 'url': 'https://external-preview.redd.it/Xt5XwrANn_pOlhMFeZDm5mnN2g-hxeBb7bvzQIww7MI.jpg?width=216&amp;crop=smart&amp;auto=webp&amp;s=df3fe3fd2997bf9c54a25582de872648023d4301', 'width': 216}, {'height': 213, 'url': 'https://external-preview.redd.it/Xt5XwrANn_pOlhMFeZDm5mnN2g-hxeBb7bvzQIww7MI.jpg?width=320&amp;crop=smart&amp;auto=webp&amp;s=6a456855c14136bbc3705a07777a0a1bfaf1dfc7', 'width': 320}, {'height': 426, 'url': 'https://external-preview.redd.it/Xt5XwrANn_pOlhMFeZDm5mnN2g-hxeBb7bvzQIww7MI.jpg?width=640&amp;crop=smart&amp;auto=webp&amp;s=5a54d34fc7eaac727938e2f3ffedfda73be63622', 'width': 640}], 'source': {'height': 632, 'url': 'https://external-preview.redd.it/Xt5XwrANn_pOlhMFeZDm5mnN2g-hxeBb7bvzQIww7MI.jpg?auto=webp&amp;s=0f05e2b64073266b01888ff304e3a61481b4f3f4', 'width': 949}, 'variants': {}}]}",6,1652567131,1,,True,False,False,CryptoCurrency,t5_2wlj3,4855790,public,,https://a.thumbs.redditmedia.com/3MQvAvxfJ2w1kEWjS7-YI7834zIbpIZDZySjBgdJ3E4.jpg,Crypto-friendly SEC Commissioner Hints At Stablecoin Regulation After Terra Collapse,0,[],1.0,https://bitcoinist.com/sec-commissioner-hints-at-stablecoin-regulation/,all_ads,6,1652538321.0,,93.0,140.0,https://bitcoinist.com/sec-commissioner-hints-at-stablecoin-regulation/,,,,,
46,[],False,PPIIKKAACCHHUU,,,[],,,text,t2_l2kzs9q,False,False,False,[],False,False,1652565425,self.CryptoCurrency,https://www.reddit.com/r/CryptoCurrency/comments/uprd30/why_is_terra_up_500/,{},uprd30,False,False,False,False,False,False,True,False,#7193ff,DISCUSSION,"[{'e': 'text', 't': 'DISCUSSION'}]",87049662-0882-11e5-82e1-0e9d1a9f7761,DISCUSSION,dark,richtext,False,False,True,1,0,False,all_ads,/r/CryptoCurrency/comments/uprd30/why_is_terra_up_500/,False,,,6,1652565435,1,[removed],True,False,False,CryptoCurrency,t5_2wlj3,4855627,public,,self,Why is terra up 500%?,0,[],1.0,https://www.reddit.com/r/CryptoCurrency/comments/uprd30/why_is_terra_up_500/,all_ads,6,1652536625.0,moderator,,,,,,,,
