,all_awardings,allow_live_comments,author,author_flair_css_class,author_flair_richtext,author_flair_text,author_flair_type,author_fullname,author_is_blocked,author_patreon_flair,author_premium,awarders,can_mod_post,contest_mode,created_utc,domain,full_link,gildings,id,is_created_from_ads_ui,is_crosspostable,is_meta,is_original_content,is_reddit_media_domain,is_robot_indexable,is_self,is_video,link_flair_background_color,link_flair_css_class,link_flair_richtext,link_flair_template_id,link_flair_text,link_flair_text_color,link_flair_type,locked,media_only,no_follow,num_comments,num_crossposts,over_18,parent_whitelist_status,permalink,pinned,pwls,removed_by_category,retrieved_on,score,selftext,send_replies,spoiler,stickied,subreddit,subreddit_id,subreddit_subscribers,subreddit_type,thumbnail,title,total_awards_received,treatment_tags,upvote_ratio,url,whitelist_status,wls,created,post_hint,preview,suggested_sort,thumbnail_height,thumbnail_width,url_overridden_by_dest,author_flair_background_color,author_flair_text_color,author_flair_template_id,crosspost_parent,crosspost_parent_list,media,media_embed,secure_media,secure_media_embed,author_cakeday
0,[],False,joerock1,,[],,text,t2_ye6r2,False,False,False,[],False,False,1652543776,self.CryptoCurrency,https://www.reddit.com/r/CryptoCurrency/comments/upk5m5/luna/,{},upk5m5,False,False,False,False,False,False,True,False,#7193ff,DISCUSSION,"[{'e': 'text', 't': 'DISCUSSION'}]",87049662-0882-11e5-82e1-0e9d1a9f7761,DISCUSSION,dark,richtext,False,False,True,1,0,False,all_ads,/r/CryptoCurrency/comments/upk5m5/luna/,False,6,moderator,1652543787,1,[removed],True,False,False,CryptoCurrency,t5_2wlj3,4853458,public,self,Luna,0,[],1.0,https://www.reddit.com/r/CryptoCurrency/comments/upk5m5/luna/,all_ads,6,1652514976.0,,,,,,,,,,,,,,,,
1,[],False,Cryptoshroud,,[],,text,t2_lxn488hk,False,False,False,[],False,False,1652543615,self.CryptoCurrency,https://www.reddit.com/r/CryptoCurrency/comments/upk3oc/why_luna_is_down_and_how_did_it_happen/,{},upk3oc,False,False,False,False,False,False,True,False,#add2e2,ADVICE,"[{'e': 'text', 't': 'ANALYSIS'}]",c1034ee6-9c2a-11e3-a8c4-12313b0e8e20,ANALYSIS,dark,richtext,False,False,True,1,0,False,all_ads,/r/CryptoCurrency/comments/upk3oc/why_luna_is_down_and_how_did_it_happen/,False,6,moderator,1652543626,1,[removed],True,False,False,CryptoCurrency,t5_2wlj3,4853437,public,self,Why LUNA is down and how did it happen?🧐,0,[],1.0,https://www.reddit.com/r/CryptoCurrency/comments/upk3oc/why_luna_is_down_and_how_did_it_happen/,all_ads,6,1652514815.0,self,"{'enabled': False, 'images': [{'id': 'Trky9Fx3VBjnsMzkmVtvj-F7ZXUoiKyVE2VmBwukD7Q', 'resolutions': [{'height': 71, 'url': 'https://external-preview.redd.it/MujAmrzURTDRUBchtyOmgLrqGeEorDUnHhqzQWC5ahI.jpg?width=108&amp;crop=smart&amp;auto=webp&amp;s=4f08945d7023fcfbdd8a8b6008e35260f11edd7b', 'width': 108}, {'height': 142, 'url': 'https://external-preview.redd.it/MujAmrzURTDRUBchtyOmgLrqGeEorDUnHhqzQWC5ahI.jpg?width=216&amp;crop=smart&amp;auto=webp&amp;s=d2f71cd5554561dbda113cd06d769f04e05d722c', 'width': 216}, {'height': 211, 'url': 'https://external-preview.redd.it/MujAmrzURTDRUBchtyOmgLrqGeEorDUnHhqzQWC5ahI.jpg?width=320&amp;crop=smart&amp;auto=webp&amp;s=d2daf3c9be101a4440c5a65be4ad2a06571a5faa', 'width': 320}, {'height': 423, 'url': 'https://external-preview.redd.it/MujAmrzURTDRUBchtyOmgLrqGeEorDUnHhqzQWC5ahI.jpg?width=640&amp;crop=smart&amp;auto=webp&amp;s=cba14f1dab8f510806f6ccbd7fc5815cc4de4269', 'width': 640}, {'height': 635, 'url': 'https://external-preview.redd.it/MujAmrzURTDRUBchtyOmgLrqGeEorDUnHhqzQWC5ahI.jpg?width=960&amp;crop=smart&amp;auto=webp&amp;s=1c4eb02d3f27ece939eeab066b460dda94ea9324', 'width': 960}], 'source': {'height': 647, 'url': 'https://external-preview.redd.it/MujAmrzURTDRUBchtyOmgLrqGeEorDUnHhqzQWC5ahI.jpg?auto=webp&amp;s=0f4d0040de5e88252ee739f591e81cd5b1a87e31', 'width': 978}, 'variants': {}}]}",,,,,,,,,,,,,,
2,[],False,Kassabad,,[],,text,t2_7wloaxs3,False,False,False,[],False,False,1652543403,self.CryptoCurrency,https://www.reddit.com/r/CryptoCurrency/comments/upk151/how_to_get_luna_in_canada/,{},upk151,False,False,False,False,False,False,True,False,#7193ff,DISCUSSION,"[{'e': 'text', 't': 'DISCUSSION'}]",87049662-0882-11e5-82e1-0e9d1a9f7761,DISCUSSION,dark,richtext,False,False,True,1,0,False,all_ads,/r/CryptoCurrency/comments/upk151/how_to_get_luna_in_canada/,False,6,moderator,1652543414,1,[removed],True,False,False,CryptoCurrency,t5_2wlj3,4853413,public,self,HOW TO GET LUNA IN CANADA????,0,[],1.0,https://www.reddit.com/r/CryptoCurrency/comments/upk151/how_to_get_luna_in_canada/,all_ads,6,1652514603.0,,,,,,,,,,,,,,,,
3,[],False,destroyerpal,,[],,text,t2_lrr8uwqd,False,False,False,[],False,False,1652543357,i.redd.it,https://www.reddit.com/r/CryptoCurrency/comments/upk0m2/is_luna_going_to_launch_a_new_coin_if_ye_what/,{},upk0m2,False,True,False,False,True,True,False,False,#7193ff,DISCUSSION,"[{'e': 'text', 't': 'DISCUSSION'}]",87049662-0882-11e5-82e1-0e9d1a9f7761,DISCUSSION,dark,richtext,False,False,True,1,0,False,all_ads,/r/CryptoCurrency/comments/upk0m2/is_luna_going_to_launch_a_new_coin_if_ye_what/,False,6,,1652543368,1,,True,False,False,CryptoCurrency,t5_2wlj3,4853409,public,https://b.thumbs.redditmedia.com/7u3D0aFSzaRhMGjIjvBZA6CiFSjMf5HjastPvAEzdtg.jpg,Is luna going to launch a new coin? if ye what will happen to current Luna holders?,0,[],1.0,https://i.redd.it/nhvg4335qgz81.png,all_ads,6,1652514557.0,image,"{'enabled': True, 'images': [{'id': 'CYEFJSZA3XtAKIM4jAkyinaf8A_SghWpCt_MFtZiCBU', 'resolutions': [{'height': 56, 'url': 'https://preview.redd.it/nhvg4335qgz81.png?width=108&amp;crop=smart&amp;auto=webp&amp;s=bb4c4d526fdbc645a973dee49b9cd4d29c19e9b7', 'width': 108}, {'height': 112, 'url': 'https://preview.redd.it/nhvg4335qgz81.png?width=216&amp;crop=smart&amp;auto=webp&amp;s=f82678b9a9c29e5508811ca1a7bdc4c69b7318a7', 'width': 216}, {'height': 166, 'url': 'https://preview.redd.it/nhvg4335qgz81.png?width=320&amp;crop=smart&amp;auto=webp&amp;s=d13f9a115673865ade956739066d57b23445b502', 'width': 320}, {'height': 332, 'url': 'https://preview.redd.it/nhvg4335qgz81.png?width=640&amp;crop=smart&amp;auto=webp&amp;s=79d6c9e4ea246bed189fe8ed751889fc6df7934e', 'width': 640}], 'source': {'height': 383, 'url': 'https://preview.redd.it/nhvg4335qgz81.png?auto=webp&amp;s=0007b17d33615588cbbc59413fb0699ec7fddc27', 'width': 737}, 'variants': {}}]}",new,72.0,140.0,https://i.redd.it/nhvg4335qgz81.png,,,,,,,,,,
4,[],False,doglordtray,Warning-level2-2,"[{'e': 'text', 't': 'Tin'}]",Tin,richtext,t2_40uizhkk,False,False,False,[],False,False,1652542275,self.CryptoCurrency,https://www.reddit.com/r/CryptoCurrency/comments/upjn8a/terra_luna_advice_or_explanation/,{},upjn8a,False,True,False,False,False,True,True,False,#46d160,ADVICE,"[{'e': 'text', 't': 'ADVICE'}]",e9570888-9c2a-11e3-809c-12313d1661cc,ADVICE,dark,richtext,False,False,False,0,0,False,all_ads,/r/CryptoCurrency/comments/upjn8a/terra_luna_advice_or_explanation/,False,6,,1652542285,1,"With Terra Luna proposal to potentially restart the blockchain prior to the ""attack"" what will this do thethe coins in current circulation? For instance I converted some other worthless coin to wluna on coinbase cause why not? It had since 4x as of this morning - wondering if I should pull it out with their proposed idea of converting the blockchain back to pre attack- can any one explain what this means or the potential outcome of the ceo plan to current coins? 

Now with coinbase delisting wluna and ust I’m wondering what’s gonna happen next",True,False,False,CryptoCurrency,t5_2wlj3,4853276,public,self,Terra Luna Advice or explanation,0,[],1.0,https://www.reddit.com/r/CryptoCurrency/comments/upjn8a/terra_luna_advice_or_explanation/,all_ads,6,1652513475.0,,,new,,,,,dark,,,,,,,,
5,[],False,Odlavso,,"[{'e': 'text', 't': ' kidney for sale, slightly used. DM for details '}]"," kidney for sale, slightly used. DM for details ",richtext,t2_4r7d40d,False,False,True,[],False,False,1652542144,self.CryptoCurrency,https://www.reddit.com/r/CryptoCurrency/comments/upjlla/the_five_stages_of_grief_what_i_have_observed_on/,{},upjlla,False,True,False,False,False,True,True,False,#cc8b00,ANECDOTAL,"[{'e': 'text', 't': 'ANECDOTAL'}]",613cabf0-1d90-11e4-953d-12313b0eb482,ANECDOTAL,light,richtext,False,False,True,1,0,False,all_ads,/r/CryptoCurrency/comments/upjlla/the_five_stages_of_grief_what_i_have_observed_on/,False,6,,1652542155,1,"Crypto winter is here, and browsing through this sub this last week has been entertaining, informative and depressing at times to say the least. 

 The **five stages of grief** model (or the **Kübler-Ross model**) states that those experiencing [grief](https://en.wikipedia.org/wiki/Grief) go through a series of five emotions: [denial](https://en.wikipedia.org/wiki/Denial), [anger](https://en.wikipedia.org/wiki/Anger), [bargaining](https://en.wikipedia.org/wiki/Bargaining), [depression](https://en.wikipedia.org/wiki/Depression_(mood)) and [acceptance](https://en.wikipedia.org/wiki/Acceptance). 

# Denial

&gt;This was most visible on the first day of the crash, many still believed that UST would repeg and LUNA would regain its value. It got worst as LUNA value dropped and this is when you had various crypto/youtubers telling their followers to buy low because LUNA was coming back.  
&gt;  
&gt;The Phrase ""Last time to buy LUNA under $10"" was thrown around, it then turned into ""Last time to buy LUNA under $5"" then ""Last time to buy LUNA under $1""

# Anger

&gt;I think some are still at this stage, they started posting on r/cc about how Crypto is a scam, how they are done with crypto and can't believe they fell for this Ponzi scheme. It looks like a lot of the same people that posted angry post on here also went over to r/buttcoin to vent their anger there and find some support.

# Bargaining

&gt;Some are still at this stage, I believe the majority of the people following Do Kwon and believing he can somehow pull off LUNA 2.0 are at this stage. Others are making small to large gains gambling on the pumps of a dead coin, using the gains as a coping mechanism to feel a bit better about the loses they took.

# Depression

&gt;If you are in this stage and feel truly Depressed, seek someone to talk to.  
&gt;  
&gt;Here we saw the suicide hotline posted on various subs and to be honest it was quite depressing reading some of the post, people took real loses.

# Acceptance

&gt;I believe the majority of people who have been in crypto for a while, those that have gone through previous crashes and have held went straight into this stage. Some holding bitcoin and eth for years simply accepted that this was coming and that they would hold through it coming out wealthier on the other side. This should be the stage that everybody should get to eventually but sadly it looks like some will remain in the anger stage leaving crypto completely.

Well thank you for attending my TED talk and cheer up things should start looking better at some point next year hopefully.",True,False,False,CryptoCurrency,t5_2wlj3,4853258,public,self,The Five Stages of Grief - What I have observed on this sub since we got in to the bear market,0,[],1.0,https://www.reddit.com/r/CryptoCurrency/comments/upjlla/the_five_stages_of_grief_what_i_have_observed_on/,all_ads,6,1652513344.0,self,"{'enabled': False, 'images': [{'id': 'JmTmgc-twTxG0eLM-zn1KFoHnhlt9s07GdNwRefEXfU', 'resolutions': [{'height': 143, 'url': 'https://external-preview.redd.it/NFaar0-VGljWnhPKmjdaQ1AWhxZiet7J9tMzQURXiz8.jpg?width=108&amp;crop=smart&amp;auto=webp&amp;s=5713ee0ace41eae2aad894f62147210eeb03226e', 'width': 108}, {'height': 287, 'url': 'https://external-preview.redd.it/NFaar0-VGljWnhPKmjdaQ1AWhxZiet7J9tMzQURXiz8.jpg?width=216&amp;crop=smart&amp;auto=webp&amp;s=9740f2a147de2b9ddb5a7ddabb99daa3ee5d8ce1', 'width': 216}], 'source': {'height': 293, 'url': 'https://external-preview.redd.it/NFaar0-VGljWnhPKmjdaQ1AWhxZiet7J9tMzQURXiz8.jpg?auto=webp&amp;s=5c02cb55ebf58d11a450fa709e166f6640b21fe2', 'width': 220}, 'variants': {}}]}",new,,,,,dark,,,,,,,,
6,[],False,kissthesky303,,"[{'e': 'text', 't': 'Silver | QC: CC 28 | r/SSB 117'}]",Silver | QC: CC 28 | r/SSB 117,richtext,t2_9jxr9xai,False,False,False,[],False,False,1652541957,self.CryptoCurrency,https://www.reddit.com/r/CryptoCurrency/comments/upjjfk/do_kwon_is_turning_the_situation_from_a_failed/,{},upjjfk,False,True,False,False,False,True,True,False,#7193ff,DISCUSSION,"[{'e': 'text', 't': 'DISCUSSION'}]",87049662-0882-11e5-82e1-0e9d1a9f7761,DISCUSSION,dark,richtext,False,False,True,0,0,False,all_ads,/r/CryptoCurrency/comments/upjjfk/do_kwon_is_turning_the_situation_from_a_failed/,False,6,,1652541968,1,"While a police report have been made against Do Kwon, on behalf of UST and Luna investors in Singapore, CZ is publicy asking on twitter where the BTCs are, that were supposed to buyback Luna.

But in the meantime Do Kwon making proposals to fork a worthless coin on a wortless chain? He is supposed to pay whats left back to the investors, but all he does is working on a second version, that is not containing any concept on making anyone whole again. This is starting to smell pretty fishy. Is this rapidly turning from a failing algostable into a fraud?",True,False,False,CryptoCurrency,t5_2wlj3,4853243,public,self,Do Kwon is turning the situation from a failed project into a crime,0,[],1.0,https://www.reddit.com/r/CryptoCurrency/comments/upjjfk/do_kwon_is_turning_the_situation_from_a_failed/,all_ads,6,1652513157.0,,,new,,,,,dark,,,,,,,,
7,[],False,ObamaWhisperer,Warning-level2-2,"[{'e': 'text', 't': 'Tin'}]",Tin,richtext,t2_1jgk8c8m,False,False,False,[],False,False,1652541835,self.CryptoCurrency,https://www.reddit.com/r/CryptoCurrency/comments/upji1z/luna_and_kucoin/,{},upji1z,False,True,False,False,False,True,True,False,#7193ff,DISCUSSION,"[{'e': 'text', 't': 'DISCUSSION'}]",87049662-0882-11e5-82e1-0e9d1a9f7761,DISCUSSION,dark,richtext,False,False,True,0,0,False,all_ads,/r/CryptoCurrency/comments/upji1z/luna_and_kucoin/,False,6,,1652541846,1,"I just made 20x. I am absolutely Euphoric and just have to tell someone. I love you all. I’ve been having a streak of good luck lately, after longing Luna 50x leverage from $1 to $5. 

“Do not get it twisted, do not gamble. Do not start gambling. Gambling is entertainment and entertainment only. You won't break even, you won't win. You won't do any of that, you understand? You will only go into debt and ruin your fucking life.”

I’m just lucky. And it’s too early to tell anyone close to me. But what the fuck is going on I thought this shit was going to 0?",True,False,False,CryptoCurrency,t5_2wlj3,4853226,public,self,Luna and Kucoin,0,[],1.0,https://www.reddit.com/r/CryptoCurrency/comments/upji1z/luna_and_kucoin/,all_ads,6,1652513035.0,,,new,,,,,dark,,,,,,,,
8,[],False,doglordtray,Warning-level2-2,"[{'e': 'text', 't': 'Tin'}]",Tin,richtext,t2_40uizhkk,False,False,False,[],False,False,1652541739,self.CryptoCurrency,https://www.reddit.com/r/CryptoCurrency/comments/upjgxc/terra_luna_proposal_from_yesterday/,{},upjgxc,False,False,False,False,False,False,True,False,#46d160,ADVICE,"[{'e': 'text', 't': 'ADVICE'}]",e9570888-9c2a-11e3-809c-12313d1661cc,ADVICE,dark,richtext,False,False,True,1,0,False,all_ads,/r/CryptoCurrency/comments/upjgxc/terra_luna_proposal_from_yesterday/,False,6,moderator,1652541750,1,[removed],True,False,False,CryptoCurrency,t5_2wlj3,4853213,public,self,Terra Luna - proposal from yesterday,0,[],1.0,https://www.reddit.com/r/CryptoCurrency/comments/upjgxc/terra_luna_proposal_from_yesterday/,all_ads,6,1652512939.0,,,new,,,,,dark,,,,,,,,
9,[],False,san_tushar,,[],,text,t2_dv300w7v,False,False,False,[],False,False,1652541717,i.redd.it,https://www.reddit.com/r/Bitcoin/comments/upjgo0/can_luna_become_next_gamestop_shib_their_market/,{},upjgo0,False,False,False,False,True,False,False,False,,,[],,,dark,text,False,False,True,0,0,True,all_ads,/r/Bitcoin/comments/upjgo0/can_luna_become_next_gamestop_shib_their_market/,False,6,moderator,1652541735,1,,True,False,False,Bitcoin,t5_2s3qj,4189151,public,nsfw,Can Luna become next GameStop/ Shib? Their market share has crossed $2B overnight and as of now it is ranking over MANA.,0,[],1.0,https://i.redd.it/trlpc60glgz81.jpg,promo_adult_nsfw,3,1652512917.0,image,"{'enabled': True, 'images': [{'id': 'eZUdwDZBbTEum9eCg52qrh1mzwSzw1m9bvUlLrwGn0Q', 'resolutions': [{'height': 100, 'url': 'https://preview.redd.it/trlpc60glgz81.jpg?width=108&amp;crop=smart&amp;auto=webp&amp;s=1cc81feb0179b3811d72d4817d35b624273a97f6', 'width': 108}, {'height': 200, 'url': 'https://preview.redd.it/trlpc60glgz81.jpg?width=216&amp;crop=smart&amp;auto=webp&amp;s=555bb078deee472044612c2bc4d1e170a60260a0', 'width': 216}, {'height': 296, 'url': 'https://preview.redd.it/trlpc60glgz81.jpg?width=320&amp;crop=smart&amp;auto=webp&amp;s=bff6b55bcd5c1409e7058b576c73dfecf3f48e55', 'width': 320}, {'height': 593, 'url': 'https://preview.redd.it/trlpc60glgz81.jpg?width=640&amp;crop=smart&amp;auto=webp&amp;s=121be054cdae5771d7c7120d19a6cc5efb4b99de', 'width': 640}, {'height': 890, 'url': 'https://preview.redd.it/trlpc60glgz81.jpg?width=960&amp;crop=smart&amp;auto=webp&amp;s=6b7ff3165986e5f82d0dba96686bb2c9b92b05e4', 'width': 960}, {'height': 1001, 'url': 'https://preview.redd.it/trlpc60glgz81.jpg?width=1080&amp;crop=smart&amp;auto=webp&amp;s=898353fc19560a3fc698804661a7b56a4bdd68ad', 'width': 1080}], 'source': {'height': 1191, 'url': 'https://preview.redd.it/trlpc60glgz81.jpg?auto=webp&amp;s=c8a409030cf014726fc80f8c9110ecd20b84c756', 'width': 1284}, 'variants': {'nsfw': {'resolutions': [{'height': 100, 'url': 'https://preview.redd.it/trlpc60glgz81.jpg?width=108&amp;crop=smart&amp;blur=10&amp;format=pjpg&amp;auto=webp&amp;s=c5b284d57439a3cb1b7c78bd40ed09c796115f0a', 'width': 108}, {'height': 200, 'url': 'https://preview.redd.it/trlpc60glgz81.jpg?width=216&amp;crop=smart&amp;blur=21&amp;format=pjpg&amp;auto=webp&amp;s=e0a4925c740fa98f84bcc6b22f1148ab5352f0a3', 'width': 216}, {'height': 296, 'url': 'https://preview.redd.it/trlpc60glgz81.jpg?width=320&amp;crop=smart&amp;blur=32&amp;format=pjpg&amp;auto=webp&amp;s=5ea7064abc750e420a2233da540c46fd27e107f2', 'width': 320}, {'height': 593, 'url': 'https://preview.redd.it/trlpc60glgz81.jpg?width=640&amp;crop=smart&amp;blur=40&amp;format=pjpg&amp;auto=webp&amp;s=cf907e7505d7612db177d0fe36d2c0cb8eeb9f34', 'width': 640}, {'height': 890, 'url': 'https://preview.redd.it/trlpc60glgz81.jpg?width=960&amp;crop=smart&amp;blur=40&amp;format=pjpg&amp;auto=webp&amp;s=32e9b2a1d3606edf3bd11532d45d1973512792ef', 'width': 960}, {'height': 1001, 'url': 'https://preview.redd.it/trlpc60glgz81.jpg?width=1080&amp;crop=smart&amp;blur=40&amp;format=pjpg&amp;auto=webp&amp;s=15c10f489a1e871c4e4cd0a716d9d16cd560484f', 'width': 1080}], 'source': {'height': 1191, 'url': 'https://preview.redd.it/trlpc60glgz81.jpg?blur=40&amp;format=pjpg&amp;auto=webp&amp;s=239d9cdb26de6d01cbe319da8340f9f030d62328', 'width': 1284}}, 'obfuscated': {'resolutions': [{'height': 100, 'url': 'https://preview.redd.it/trlpc60glgz81.jpg?width=108&amp;crop=smart&amp;blur=10&amp;format=pjpg&amp;auto=webp&amp;s=c5b284d57439a3cb1b7c78bd40ed09c796115f0a', 'width': 108}, {'height': 200, 'url': 'https://preview.redd.it/trlpc60glgz81.jpg?width=216&amp;crop=smart&amp;blur=21&amp;format=pjpg&amp;auto=webp&amp;s=e0a4925c740fa98f84bcc6b22f1148ab5352f0a3', 'width': 216}, {'height': 296, 'url': 'https://preview.redd.it/trlpc60glgz81.jpg?width=320&amp;crop=smart&amp;blur=32&amp;format=pjpg&amp;auto=webp&amp;s=5ea7064abc750e420a2233da540c46fd27e107f2', 'width': 320}, {'height': 593, 'url': 'https://preview.redd.it/trlpc60glgz81.jpg?width=640&amp;crop=smart&amp;blur=40&amp;format=pjpg&amp;auto=webp&amp;s=cf907e7505d7612db177d0fe36d2c0cb8eeb9f34', 'width': 640}, {'height': 890, 'url': 'https://preview.redd.it/trlpc60glgz81.jpg?width=960&amp;crop=smart&amp;blur=40&amp;format=pjpg&amp;auto=webp&amp;s=32e9b2a1d3606edf3bd11532d45d1973512792ef', 'width': 960}, {'height': 1001, 'url': 'https://preview.redd.it/trlpc60glgz81.jpg?width=1080&amp;crop=smart&amp;blur=40&amp;format=pjpg&amp;auto=webp&amp;s=15c10f489a1e871c4e4cd0a716d9d16cd560484f', 'width': 1080}], 'source': {'height': 1191, 'url': 'https://preview.redd.it/trlpc60glgz81.jpg?blur=40&amp;format=pjpg&amp;auto=webp&amp;s=239d9cdb26de6d01cbe319da8340f9f030d62328', 'width': 1284}}}}]}",,129.0,140.0,https://i.redd.it/trlpc60glgz81.jpg,,,,,,,,,,
10,[],False,SkepticalCryptoDude,Warning-level1-1,"[{'e': 'text', 't': 'Bronze | QC: CC 21'}]",Bronze | QC: CC 21,richtext,t2_dzi830nv,False,False,False,[],False,False,1652541229,self.CryptoCurrency,https://www.reddit.com/r/CryptoCurrency/comments/upjaw9/after_the_luna_debacle_lets_talk_about_projects/,{},upjaw9,False,True,False,False,False,True,True,False,#7193ff,DISCUSSION,"[{'e': 'text', 't': 'DISCUSSION'}]",87049662-0882-11e5-82e1-0e9d1a9f7761,DISCUSSION,dark,richtext,False,False,True,0,0,False,all_ads,/r/CryptoCurrency/comments/upjaw9/after_the_luna_debacle_lets_talk_about_projects/,False,6,,1652541240,1,"The Luna situation is one of the saddest in crypto history. I truly feel for anyone who was affected by this. I think it’s time to talk about projects that are trustworthy. 

I have projects that I deem to be trustworthy but instead of me “shilling” my bags, I’ll let you my friends in the comment section have at it.

Please list the project, why you think it’s trustworthy and why you think it has a bright future. 

Also, I’m now wondering if regulation could possibly be a good thing for crypto? We can’t have things like this happening in our space. It gives the government more ammo to attack crypto and leaves investors vulnerable which will deter mass adoption. 

Anyways, I’m interested to hear what projects you have researched that you deem trustworthy. Try to cite % of coins on launch that went to retail or founders, tokenemonics, who the team is and why it’s future is bright.",True,False,False,CryptoCurrency,t5_2wlj3,4853157,public,self,"After the Luna debacle, let’s talk about projects you think are trustworthy",0,[],1.0,https://www.reddit.com/r/CryptoCurrency/comments/upjaw9/after_the_luna_debacle_lets_talk_about_projects/,all_ads,6,1652512429.0,,,,,,,,dark,,,,,,,,
11,[],False,zerosdontcount,noflair,"[{'e': 'text', 't': 'Crypto Nerd | QC: CC 27'}]",Crypto Nerd | QC: CC 27,richtext,t2_6gs6x,False,False,False,[],False,False,1652541193,self.CryptoCurrency,https://www.reddit.com/r/CryptoCurrency/comments/upjag2/luna_just_did_60k_in_36_hours_is_this_the/,{},upjag2,False,True,False,False,False,True,True,False,#646d73,MOONS,"[{'e': 'text', 't': 'MOONS 🌕'}]",1e195abc-f3e5-11e5-8899-0e1af474c431,MOONS 🌕,light,richtext,False,False,False,0,0,False,all_ads,/r/CryptoCurrency/comments/upjag2/luna_just_did_60k_in_36_hours_is_this_the/,False,6,,1652541204,1,"60k% in 36 hours: [https://imgur.com/a/DVs1NTD](https://imgur.com/a/DVs1NTD)  


Alright so LUNA royally murdered me. I swapped some USDT to LUNA (5 figures worth) and the next day it collapsed. But boys, I'm letting that get me down. Now is our time to revive this shitcoin and make our collective moms proud. I was lucky enough to put in some at the bottom and make much of my losses back. There is more volume on LUNA right now than ETH, be careful out there, but I think w can have a lot of fun with this. When have you ever seen 60k% return with good volume? I""ve been trading crypto since 2017 and have never seen something quite like this.",True,False,False,CryptoCurrency,t5_2wlj3,4853154,public,self,LUNA just did 60k % in 36 hours -- Is this the Shitcoin of our Dreams?,0,[],1.0,https://www.reddit.com/r/CryptoCurrency/comments/upjag2/luna_just_did_60k_in_36_hours_is_this_the/,all_ads,6,1652512393.0,self,"{'enabled': False, 'images': [{'id': 'AHf2-v3E6DoE0fZ1rbt4ykLEYPBLaVmo17hlJfLS6yQ', 'resolutions': [{'height': 61, 'url': 'https://external-preview.redd.it/7hFOy9FVQhZyiOQD8zFe85qutAxPKjBz4aD1Jt6fpZk.jpg?width=108&amp;crop=smart&amp;auto=webp&amp;s=c2dd642992cd3132d31586484105cac6a98cb043', 'width': 108}, {'height': 123, 'url': 'https://external-preview.redd.it/7hFOy9FVQhZyiOQD8zFe85qutAxPKjBz4aD1Jt6fpZk.jpg?width=216&amp;crop=smart&amp;auto=webp&amp;s=116def8863baef0da6993e9f94cc16ee7916ae9d', 'width': 216}, {'height': 182, 'url': 'https://external-preview.redd.it/7hFOy9FVQhZyiOQD8zFe85qutAxPKjBz4aD1Jt6fpZk.jpg?width=320&amp;crop=smart&amp;auto=webp&amp;s=b129c6cde8a9869e8004e3ba95923ff1dad510bc', 'width': 320}, {'height': 365, 'url': 'https://external-preview.redd.it/7hFOy9FVQhZyiOQD8zFe85qutAxPKjBz4aD1Jt6fpZk.jpg?width=640&amp;crop=smart&amp;auto=webp&amp;s=5c0d1809c5eaed6e9b1b2276b2bcc41103cebf81', 'width': 640}, {'height': 548, 'url': 'https://external-preview.redd.it/7hFOy9FVQhZyiOQD8zFe85qutAxPKjBz4aD1Jt6fpZk.jpg?width=960&amp;crop=smart&amp;auto=webp&amp;s=e9898a99c20ef3b008f8747e2c92ac232b9a3ca7', 'width': 960}, {'height': 616, 'url': 'https://external-preview.redd.it/7hFOy9FVQhZyiOQD8zFe85qutAxPKjBz4aD1Jt6fpZk.jpg?width=1080&amp;crop=smart&amp;auto=webp&amp;s=8c6e7e087d4d75e11d6e72b0b39004a45cc738ce', 'width': 1080}], 'source': {'height': 870, 'url': 'https://external-preview.redd.it/7hFOy9FVQhZyiOQD8zFe85qutAxPKjBz4aD1Jt6fpZk.jpg?auto=webp&amp;s=14be80562086da3dc8163092a71145f583f1df54', 'width': 1524}, 'variants': {}}]}",new,,,,,dark,,,,,,,,
