107,[],False,kwonartist92,,[],,text,t2_ltwelg47,False,False,False,[],False,False,1652570894,self.CryptoCurrency,https://www.reddit.com/r/CryptoCurrency/comments/upt1s4/just_wondering_are_people_still_able_to_buy_and/,{},upt1s4,False,False,False,False,False,False,True,False,#7193ff,DISCUSSION,"[{'e': 'text', 't': 'DISCUSSION'}]",87049662-0882-11e5-82e1-0e9d1a9f7761,DISCUSSION,dark,richtext,False,False,True,1,0,False,all_ads,/r/CryptoCurrency/comments/upt1s4/just_wondering_are_people_still_able_to_buy_and/,False,6,1652570904,1,[removed],True,False,False,CryptoCurrency,t5_2wlj3,4856129,public,,self,"Just wondering, are people still able to buy and sell Luna?",0,[],1.0,https://www.reddit.com/r/CryptoCurrency/comments/upt1s4/just_wondering_are_people_still_able_to_buy_and/,,all_ads,6,1652542094.0,moderator,,,,,,,,,,,,,,,
108,[],False,most_triumphant_yeah,Warning-level2-2,"[{'e': 'text', 't': 'Tin'}]",Tin,richtext,t2_10b1zq,False,False,False,[],False,False,1652570577,self.CryptoCurrency,https://www.reddit.com/r/CryptoCurrency/comments/upsydi/wrapped_luna_wilin_today/,{},upsydi,False,True,False,False,False,True,True,False,#7193ff,DISCUSSION,"[{'e': 'text', 't': 'DISCUSSION'}]",87049662-0882-11e5-82e1-0e9d1a9f7761,DISCUSSION,dark,richtext,False,False,True,0,0,False,all_ads,/r/CryptoCurrency/comments/upsydi/wrapped_luna_wilin_today/,False,6,1652570588,1,"Searched and didn’t see anything posted today about what’s happening with Wrapped Luna. It’s increased over 300% just today, and the market cap still looks relatively low. Hoping to establish a discussion about the complexity and nature of how to look at it moving forward.

Coinbase currently gives a warning message that “Trading for UST and WLUNA will be suspended on May 27th. Your ability to store, send, and receive UST and WLUNA will not be impacted”. 

Is that impacting overall consensus about what’s happening with it? Is there a chance it bounces back after that 5/27 suspension? Or is this an example of throwing money into a fire? 

Is the wrapped version fundamentally different or is it destined to have the same problems as the past?",True,False,False,CryptoCurrency,t5_2wlj3,4856095,public,new,self,Wrapped Luna Wilin’ Today,0,[],1.0,https://www.reddit.com/r/CryptoCurrency/comments/upsydi/wrapped_luna_wilin_today/,,all_ads,6,1652541777.0,,,dark,,,,,,,,,,,,,
109,[],False,most_triumphant_yeah,Warning-level2-2,"[{'e': 'text', 't': 'Tin'}]",Tin,richtext,t2_10b1zq,False,False,False,[],False,False,1652570243,self.CryptoCurrency,https://www.reddit.com/r/CryptoCurrency/comments/upsuq9/wrapped_luna_wilin_today/,{},upsuq9,False,False,False,False,False,False,True,False,#7193ff,DISCUSSION,"[{'e': 'text', 't': 'DISCUSSION'}]",87049662-0882-11e5-82e1-0e9d1a9f7761,DISCUSSION,dark,richtext,False,False,True,1,0,False,all_ads,/r/CryptoCurrency/comments/upsuq9/wrapped_luna_wilin_today/,False,6,1652570253,1,[removed],True,False,False,CryptoCurrency,t5_2wlj3,4856058,public,,self,Wrapped Luna Wilin’ Today,0,[],1.0,https://www.reddit.com/r/CryptoCurrency/comments/upsuq9/wrapped_luna_wilin_today/,,all_ads,6,1652541443.0,moderator,,dark,,,,,,,,,,,,,
110,[],False,ComprehensivePop1964,,[],,text,t2_h0lln32i,False,False,False,[],False,False,1652569780,i.redd.it,https://www.reddit.com/r/CryptoCurrency/comments/upspjl/terra_luna/,{},upspjl,False,True,False,False,True,True,False,False,#c403f5,COMEDY,"[{'e': 'text', 't': 'COMEDY'}]",5c104cfc-d7c8-11e4-9d14-22000b6902b0,COMEDY,dark,richtext,False,False,True,1,0,True,all_ads,/r/CryptoCurrency/comments/upspjl/terra_luna/,False,6,1652569791,1,,False,False,False,CryptoCurrency,t5_2wlj3,4856012,public,,nsfw,Terra Luna,0,[],1.0,https://i.redd.it/wgzjjlsvwiz81.jpg,https://i.redd.it/wgzjjlsvwiz81.jpg,promo_adult_nsfw,3,1652540980.0,,,,image,"{'enabled': True, 'images': [{'id': 'iPeat-2VnQUlqYyPFcdCOISUcB69Z6AZkqeNQ05_8W4', 'resolutions': [{'height': 174, 'url': 'https://preview.redd.it/wgzjjlsvwiz81.jpg?width=108&amp;crop=smart&amp;auto=webp&amp;s=23a86f4049fca38158e2f6d8605a90e5b6d7c700', 'width': 108}, {'height': 348, 'url': 'https://preview.redd.it/wgzjjlsvwiz81.jpg?width=216&amp;crop=smart&amp;auto=webp&amp;s=bc5d0a34e1097b54b6ff497a0a82dee87c8ad5ed', 'width': 216}, {'height': 516, 'url': 'https://preview.redd.it/wgzjjlsvwiz81.jpg?width=320&amp;crop=smart&amp;auto=webp&amp;s=f56cc7045950b0ba7000a4802af28ad16eb6dd76', 'width': 320}], 'source': {'height': 807, 'url': 'https://preview.redd.it/wgzjjlsvwiz81.jpg?auto=webp&amp;s=dbc542d5601cf7fcc66d541e776befed85cadb76', 'width': 500}, 'variants': {'nsfw': {'resolutions': [{'height': 174, 'url': 'https://preview.redd.it/wgzjjlsvwiz81.jpg?width=108&amp;crop=smart&amp;blur=10&amp;format=pjpg&amp;auto=webp&amp;s=ac4d31b1f177939c799460f7fccc1c9a9ef5632c', 'width': 108}, {'height': 348, 'url': 'https://preview.redd.it/wgzjjlsvwiz81.jpg?width=216&amp;crop=smart&amp;blur=21&amp;format=pjpg&amp;auto=webp&amp;s=78194410cb312dbcd287a0499650c9ce09bae99f', 'width': 216}, {'height': 516, 'url': 'https://preview.redd.it/wgzjjlsvwiz81.jpg?width=320&amp;crop=smart&amp;blur=32&amp;format=pjpg&amp;auto=webp&amp;s=fcda3eeee3b21557be612336336ae7e1c145acf2', 'width': 320}], 'source': {'height': 807, 'url': 'https://preview.redd.it/wgzjjlsvwiz81.jpg?blur=40&amp;format=pjpg&amp;auto=webp&amp;s=f9005fa8b6520c9ef64bd3c83952f45dbbf6ca24', 'width': 500}}, 'obfuscated': {'resolutions': [{'height': 174, 'url': 'https://preview.redd.it/wgzjjlsvwiz81.jpg?width=108&amp;crop=smart&amp;blur=10&amp;format=pjpg&amp;auto=webp&amp;s=ac4d31b1f177939c799460f7fccc1c9a9ef5632c', 'width': 108}, {'height': 348, 'url': 'https://preview.redd.it/wgzjjlsvwiz81.jpg?width=216&amp;crop=smart&amp;blur=21&amp;format=pjpg&amp;auto=webp&amp;s=78194410cb312dbcd287a0499650c9ce09bae99f', 'width': 216}, {'height': 516, 'url': 'https://preview.redd.it/wgzjjlsvwiz81.jpg?width=320&amp;crop=smart&amp;blur=32&amp;format=pjpg&amp;auto=webp&amp;s=fcda3eeee3b21557be612336336ae7e1c145acf2', 'width': 320}], 'source': {'height': 807, 'url': 'https://preview.redd.it/wgzjjlsvwiz81.jpg?blur=40&amp;format=pjpg&amp;auto=webp&amp;s=f9005fa8b6520c9ef64bd3c83952f45dbbf6ca24', 'width': 500}}}}]}",140.0,140.0,,,,,,,,,
111,[],False,bigballsmcginty,,[],,text,t2_50yqedh4,False,False,False,[],False,False,1652567878,i.redd.it,https://www.reddit.com/r/CryptoCurrency/comments/ups4u4/luna_casually_deleting_0s_on_the_way_back_to_1/,{},ups4u4,False,True,False,False,True,True,False,False,#646d73,MOONS,"[{'e': 'text', 't': 'MOONS 🌕'}]",1e195abc-f3e5-11e5-8899-0e1af474c431,MOONS 🌕,light,richtext,False,False,True,1,0,False,all_ads,/r/CryptoCurrency/comments/ups4u4/luna_casually_deleting_0s_on_the_way_back_to_1/,False,6,1652567889,1,,True,False,False,CryptoCurrency,t5_2wlj3,4855856,public,new,https://b.thumbs.redditmedia.com/hQaMGJfe1rrchtkQwnn89MDyoknlbddqHcHv2JpcIwc.jpg,LUNA Casually deleting 0s on the way back to $1,0,[],1.0,https://i.redd.it/upsn41j8riz81.jpg,https://i.redd.it/upsn41j8riz81.jpg,all_ads,6,1652539078.0,,,,image,"{'enabled': True, 'images': [{'id': 'QEi3O6tgudihjHsn-EWuBLD0t7GrcfqlbceYILa6ae8', 'resolutions': [{'height': 61, 'url': 'https://preview.redd.it/upsn41j8riz81.jpg?width=108&amp;crop=smart&amp;auto=webp&amp;s=ae8e7c2a95916ac739e600b53392da6d0ab8ef93', 'width': 108}, {'height': 122, 'url': 'https://preview.redd.it/upsn41j8riz81.jpg?width=216&amp;crop=smart&amp;auto=webp&amp;s=fa443bafa92cbf7bccad2f6382880e4439230205', 'width': 216}, {'height': 180, 'url': 'https://preview.redd.it/upsn41j8riz81.jpg?width=320&amp;crop=smart&amp;auto=webp&amp;s=37fb3751635ae91ba502df605873fdd554eeab05', 'width': 320}, {'height': 361, 'url': 'https://preview.redd.it/upsn41j8riz81.jpg?width=640&amp;crop=smart&amp;auto=webp&amp;s=c76c2f037282724beeb274086ae19d0ee2ff3b09', 'width': 640}], 'source': {'height': 509, 'url': 'https://preview.redd.it/upsn41j8riz81.jpg?auto=webp&amp;s=520eac83e70a1e06e81ec0b8876de69272d36d42', 'width': 900}, 'variants': {}}]}",79.0,140.0,,,,,,,,,
112,[],False,Maple2w5e4t,,[],,text,t2_a2gb41zm,False,False,False,[],False,False,1652567493,self.CryptoCurrency,https://www.reddit.com/r/CryptoCurrency/comments/ups0nj/bought_15mil_of_luna_this_morning/,{},ups0nj,False,False,False,False,False,False,True,False,#7193ff,DISCUSSION,"[{'e': 'text', 't': 'DISCUSSION'}]",87049662-0882-11e5-82e1-0e9d1a9f7761,DISCUSSION,dark,richtext,False,False,True,1,0,False,all_ads,/r/CryptoCurrency/comments/ups0nj/bought_15mil_of_luna_this_morning/,False,6,1652567503,1,[removed],True,False,False,CryptoCurrency,t5_2wlj3,4855815,public,,self,Bought 1.5mil of Luna this morning,0,[],1.0,https://www.reddit.com/r/CryptoCurrency/comments/ups0nj/bought_15mil_of_luna_this_morning/,,all_ads,6,1652538693.0,moderator,,,,,,,,,,,,,,,
113,[],False,Maple2w5e4t,,[],,text,t2_a2gb41zm,False,False,False,[],False,False,1652567156,self.CryptoCurrency,https://www.reddit.com/r/CryptoCurrency/comments/uprwz1/i_bought_300k_of_luna_this_morning/,{},uprwz1,False,False,False,False,False,False,True,False,#7193ff,DISCUSSION,"[{'e': 'text', 't': 'DISCUSSION'}]",87049662-0882-11e5-82e1-0e9d1a9f7761,DISCUSSION,dark,richtext,False,False,True,1,0,False,all_ads,/r/CryptoCurrency/comments/uprwz1/i_bought_300k_of_luna_this_morning/,False,6,1652567166,1,[removed],True,False,False,CryptoCurrency,t5_2wlj3,4855791,public,,self,I bought 300k of Luna this morning,0,[],1.0,https://www.reddit.com/r/CryptoCurrency/comments/uprwz1/i_bought_300k_of_luna_this_morning/,,all_ads,6,1652538356.0,moderator,,,,,,,,,,,,,,,
114,[],False,qutiepie123,Warning-level2-2,"[{'e': 'text', 't': 'Tin'}]",Tin,richtext,t2_2v8a4sea,False,False,False,[],False,False,1652566673,self.CryptoCurrency,https://www.reddit.com/r/CryptoCurrency/comments/uprrja/whats_the_chance_of_luna_ever_hitting_1_again/,{},uprrja,False,False,False,False,False,False,True,False,#7193ff,DISCUSSION,"[{'e': 'text', 't': 'DISCUSSION'}]",87049662-0882-11e5-82e1-0e9d1a9f7761,DISCUSSION,dark,richtext,False,False,True,1,0,False,all_ads,/r/CryptoCurrency/comments/uprrja/whats_the_chance_of_luna_ever_hitting_1_again/,False,6,1652566683,1,[removed],True,False,False,CryptoCurrency,t5_2wlj3,4855745,public,,self,What’s the chance of Luna ever hitting $1 again?,0,[],1.0,https://www.reddit.com/r/CryptoCurrency/comments/uprrja/whats_the_chance_of_luna_ever_hitting_1_again/,,all_ads,6,1652537873.0,moderator,,dark,,,,,,,,,,,,,
115,[],False,rightmeow2009,Warning-level3,"[{'e': 'text', 't': '1 - 2 years account age. -15 - 35 comment karma.'}]",1 - 2 years account age. -15 - 35 comment karma.,richtext,t2_bc6cbuvj,False,False,False,[],False,False,1652565798,self.CryptoCurrency,https://www.reddit.com/r/CryptoCurrency/comments/uprhgm/as_a_us_investor_where_do_you_buy_bitcoin_puts/,{},uprhgm,False,True,False,False,False,True,True,False,#007373,EXCHANGES,"[{'e': 'text', 't': 'EXCHANGES'}]",38a8ac5a-9d5c-11e5-a136-0e9f3a832fc3,EXCHANGES,light,richtext,False,False,False,0,0,False,all_ads,/r/CryptoCurrency/comments/uprhgm/as_a_us_investor_where_do_you_buy_bitcoin_puts/,False,6,1652565808,1,"In Arthur Hayes's essay, ""The Q-Trap"" (published on April 10th: [https://cryptohayes.medium.com/the-q-trap-f1a38312f00f](https://cryptohayes.medium.com/the-q-trap-f1a38312f00f)), he talks about buying crash June 2022 puts on Bitcoin as he believes it will have tested $30,000.  In his most recent essay, Luna Brothers: [https://cryptohayes.medium.com/luna-brothers-inc-712ec5abe199](https://cryptohayes.medium.com/luna-brothers-inc-712ec5abe199), he talks about selling these puts, so it a moot point now, but I just have to know for next time...

**My question is: as a US investor, where do you buy Bitcoin puts?**

Issues with existing solutions:

* Derebit basically owns the centralized options market (The Block: [https://www.theblockcrypto.com/data/crypto-markets/options](https://www.theblockcrypto.com/data/crypto-markets/options), Skew: [https://analytics.skew.com/dashboard/bitcoin-options](https://analytics.skew.com/dashboard/bitcoin-options)). Unfortunately, they require you to KYC and prove that you are not a citizen or located in the US (Restricted Countries: [https://legacy.deribit.com/pages/information/Restricted\_Countries](https://legacy.deribit.com/pages/information/Restricted_Countries)), so a simple VPN won't get you access.
* I've used LedgerX (now known as ""FTX US Derivatives""), but I was unable to buy puts in size for a fair price due to the low liquidity. I think when I was buying my puts, the June 2022 ask for BTC was around $5, and the bid was $2.5. The same contracts on Derebit had a bid of around $3.6 and an ask of $3.8...a much more accurate reflection of market price.
* There are also a bunch of decentralized options exchanges ([https://jumpcrypto.com/state-of-crypto-derivatives-market/](https://jumpcrypto.com/state-of-crypto-derivatives-market/)), but they either don't have long dated puts or still require KYC+ban US residents/citizens.

A few solutions that cross my mind that I'm wondering if people do:

1. They happen to have dual citizenship and can just use Derebit
2. They use the CME options, since they seem to have 3.6x BTC open interest vs. LedgerX (according to skew today)
3. They use one of the decentralized options exchanges listed in the Jump post linked above and just roll their puts into the next contract as each one expires

**So, to restate the core question: as a US investor, where do you buy Bitcoin puts?**",True,False,False,CryptoCurrency,t5_2wlj3,4855660,public,,self,"As a US investor, where do you buy Bitcoin puts?",0,[],1.0,https://www.reddit.com/r/CryptoCurrency/comments/uprhgm/as_a_us_investor_where_do_you_buy_bitcoin_puts/,,all_ads,6,1652536998.0,,,dark,self,"{'enabled': False, 'images': [{'id': 'r0TKCNgoc7iXWnglmLAlTjNlZaLMyr891iYsJQ7OHG4', 'resolutions': [{'height': 60, 'url': 'https://external-preview.redd.it/YdlUj13tH57_2aROIuzcLrcwBcTEkPPYojDKj3D0obE.jpg?width=108&amp;crop=smart&amp;auto=webp&amp;s=b33b60056d2fb6fa1eca6552e2c074b7b562d064', 'width': 108}, {'height': 121, 'url': 'https://external-preview.redd.it/YdlUj13tH57_2aROIuzcLrcwBcTEkPPYojDKj3D0obE.jpg?width=216&amp;crop=smart&amp;auto=webp&amp;s=0240856485e381f2a698ecb2812183e9cd798c7d', 'width': 216}, {'height': 179, 'url': 'https://external-preview.redd.it/YdlUj13tH57_2aROIuzcLrcwBcTEkPPYojDKj3D0obE.jpg?width=320&amp;crop=smart&amp;auto=webp&amp;s=918bbd1559d4c4c478f028dd4daafb5368b1c546', 'width': 320}, {'height': 359, 'url': 'https://external-preview.redd.it/YdlUj13tH57_2aROIuzcLrcwBcTEkPPYojDKj3D0obE.jpg?width=640&amp;crop=smart&amp;auto=webp&amp;s=94a2dc97b5a1875745716eefa640ca16363a0c84', 'width': 640}, {'height': 539, 'url': 'https://external-preview.redd.it/YdlUj13tH57_2aROIuzcLrcwBcTEkPPYojDKj3D0obE.jpg?width=960&amp;crop=smart&amp;auto=webp&amp;s=70c1ffc8d5ad6082dda18abd31157c9482a21bdb', 'width': 960}], 'source': {'height': 548, 'url': 'https://external-preview.redd.it/YdlUj13tH57_2aROIuzcLrcwBcTEkPPYojDKj3D0obE.jpg?auto=webp&amp;s=3c16972087fbed74f79ad7351d189a1e0af9869e', 'width': 975}, 'variants': {}}]}",,,,,,,,,,,
116,[],False,Sharp_Tank05,Warning-level2-2,"[{'e': 'text', 't': 'Tin'}]",Tin,richtext,t2_e1ptr4xn,False,False,False,[],False,False,1652565157,self.CryptoCurrency,https://www.reddit.com/r/CryptoCurrency/comments/upra3k/it_seems_terra_might_just_be_one_big_cartel/,{},upra3k,False,True,False,False,False,True,True,False,#5a74cc,PERSPECTIVE,"[{'e': 'text', 't': 'PERSPECTIVE'}]",1b44cdb2-2a6c-11ec-9baf-0aa21184cd0a,PERSPECTIVE,light,richtext,False,False,True,0,0,False,all_ads,/r/CryptoCurrency/comments/upra3k/it_seems_terra_might_just_be_one_big_cartel/,False,6,1652565167,1,"Enough has been said already but just looking at the sequence of communications and proposals over the past few days, it's becoming more and more evident that, even at its best intent, Terra was a big bubble of immaturity, misinformation and a poor blockchain system. IMHO, starting to feel it was one big Ponzi scheme that Terra team was wanting to ride along (instead of a rug pull much sooner) because LUNA just kept mooning.

Over the past week - team kept making assurances as if everything was alright so people could keep buying and holding, when they had a pretty good sense of they were royally screwed. Some of these assurances include:

1) ""Deploying more capital, stay tight lads""

2) ""LFG is coming to rescue"" (where did the BTC go?)

3) ""We are in war room and going to share a plan shortly"" (nothing meaningful came out)

....and many more.

In the hindsight, there seems to be very little reality behind any of these. The BTC reserves has vanished. Team is pushing for fork so they can have LUNA and LUNA 2 and can artificially create market to benefit themselves. Do Kwon said he has not sold any LUNA - hard to trust, he needs to provide the proof.

Their Blockchain was designed for attack and it happened and it got screwed. Thousands of people lost real money. Terra was warned several months ago - but Do Kwon seemed too arrogant to listen. See the tweet below and feel free to dig in on the twitter:

[\(Terra was warned of possibility of such attack in Nov 2021 but Do Kwon was too arrogant to listen\)](https://preview.redd.it/w4rrriadhiz81.png?width=898&amp;format=png&amp;auto=webp&amp;s=33a68017b7429b140808945023b58fea04e042d1)

All in all, way too many red-flag with the credibility of this team. They started with a grand and much needed vision - decentralized money for a decentralized world but it seems the greed and arrogance brought everything down.

Lots of lessons to learn. Hope there is a more honest team that can bring the vision of decentralized money/ algorithmic stable coin to life.

May the force be with all the brothers and sisters who lost life's money in this Ponzi project.

Peace!",True,False,False,CryptoCurrency,t5_2wlj3,4855604,public,new,https://b.thumbs.redditmedia.com/MpWXJdyBI0fyGuawDgV5v_s4raflSRKoUpa7ssRD91A.jpg,"It seems Terra might just be one big cartel - running Ponzi schemes, publishing misleading info, exaggerating the ecosystem, hiding information. Even at its very best intent, it's a highly immature and poorly constructed blockchain system. We (""The Crypto Community"") need to act and teach a lesson!",0,[],1.0,https://www.reddit.com/r/CryptoCurrency/comments/upra3k/it_seems_terra_might_just_be_one_big_cartel/,,all_ads,6,1652536357.0,,,dark,,,85.0,140.0,"{'w4rrriadhiz81': {'e': 'Image', 'id': 'w4rrriadhiz81', 'm': 'image/png', 'p': [{'u': 'https://preview.redd.it/w4rrriadhiz81.png?width=108&amp;crop=smart&amp;auto=webp&amp;s=578c09d0ce63fb5aec68eb8ff25a141cd50454d1', 'x': 108, 'y': 65}, {'u': 'https://preview.redd.it/w4rrriadhiz81.png?width=216&amp;crop=smart&amp;auto=webp&amp;s=3939a973a98e5ffad486a7fd6b01d986ddba5973', 'x': 216, 'y': 131}, {'u': 'https://preview.redd.it/w4rrriadhiz81.png?width=320&amp;crop=smart&amp;auto=webp&amp;s=6b0ced6937a37822c87121f5b69a960450a86eab', 'x': 320, 'y': 195}, {'u': 'https://preview.redd.it/w4rrriadhiz81.png?width=640&amp;crop=smart&amp;auto=webp&amp;s=c1d56e1fba73d41ee9cde25881cbd6a283d83eee', 'x': 640, 'y': 390}], 's': {'u': 'https://preview.redd.it/w4rrriadhiz81.png?width=898&amp;format=png&amp;auto=webp&amp;s=33a68017b7429b140808945023b58fea04e042d1', 'x': 898, 'y': 548}, 'status': 'valid'}}",,,,,,,,
117,[],False,CyberMattSecure,,[],,text,t2_2t9zo9rr,False,False,True,[],False,False,1652564952,i.redd.it,https://www.reddit.com/r/CryptoCurrency/comments/upr7wp/luna_to_the_moona/,{},upr7wp,False,True,False,False,True,True,False,False,#c403f5,COMEDY,"[{'e': 'text', 't': 'COMEDY'}]",5c104cfc-d7c8-11e4-9d14-22000b6902b0,COMEDY,dark,richtext,False,False,True,1,0,True,all_ads,/r/CryptoCurrency/comments/upr7wp/luna_to_the_moona/,False,6,1652564963,1,,True,False,False,CryptoCurrency,t5_2wlj3,4855576,public,new,nsfw,Luna to the moona?,0,[],1.0,https://i.redd.it/yfg445cjiiz81.jpg,https://i.redd.it/yfg445cjiiz81.jpg,promo_adult_nsfw,3,1652536152.0,,,,image,"{'enabled': True, 'images': [{'id': '72eQPbl53Kn3S_HhB8qIod_n28fnPvFE7CqIomqNruU', 'resolutions': [{'height': 27, 'url': 'https://preview.redd.it/yfg445cjiiz81.jpg?width=108&amp;crop=smart&amp;auto=webp&amp;s=d310f9af6832e7df4043b74503c01bc8d397015a', 'width': 108}, {'height': 55, 'url': 'https://preview.redd.it/yfg445cjiiz81.jpg?width=216&amp;crop=smart&amp;auto=webp&amp;s=69372f4cf7f53310a7762895e365ba716c1ef788', 'width': 216}, {'height': 82, 'url': 'https://preview.redd.it/yfg445cjiiz81.jpg?width=320&amp;crop=smart&amp;auto=webp&amp;s=8be326be28652b86d521bd8b4669b816524efe52', 'width': 320}, {'height': 164, 'url': 'https://preview.redd.it/yfg445cjiiz81.jpg?width=640&amp;crop=smart&amp;auto=webp&amp;s=403fdfd7bb2230fb681d70129d52bad1a4e7e7de', 'width': 640}], 'source': {'height': 226, 'url': 'https://preview.redd.it/yfg445cjiiz81.jpg?auto=webp&amp;s=529e5ee26434872d911d7a656deb544df938721f', 'width': 878}, 'variants': {'nsfw': {'resolutions': [{'height': 27, 'url': 'https://preview.redd.it/yfg445cjiiz81.jpg?width=108&amp;crop=smart&amp;blur=10&amp;format=pjpg&amp;auto=webp&amp;s=596158e0f5e926734b4e3477cc946983122928e2', 'width': 108}, {'height': 55, 'url': 'https://preview.redd.it/yfg445cjiiz81.jpg?width=216&amp;crop=smart&amp;blur=21&amp;format=pjpg&amp;auto=webp&amp;s=500eceb24f579ebc5a197ca29c6724b656d164cb', 'width': 216}, {'height': 82, 'url': 'https://preview.redd.it/yfg445cjiiz81.jpg?width=320&amp;crop=smart&amp;blur=32&amp;format=pjpg&amp;auto=webp&amp;s=a9e4ee38489ca5b9dd8ce5a12c388b12b551fd24', 'width': 320}, {'height': 164, 'url': 'https://preview.redd.it/yfg445cjiiz81.jpg?width=640&amp;crop=smart&amp;blur=40&amp;format=pjpg&amp;auto=webp&amp;s=083381ce291eabc1643b33154b2f6d2ef4b185df', 'width': 640}], 'source': {'height': 226, 'url': 'https://preview.redd.it/yfg445cjiiz81.jpg?blur=40&amp;format=pjpg&amp;auto=webp&amp;s=2b164bcfc72343bcec884396c0f8ef0c7c9f1a7f', 'width': 878}}, 'obfuscated': {'resolutions': [{'height': 27, 'url': 'https://preview.redd.it/yfg445cjiiz81.jpg?width=108&amp;crop=smart&amp;blur=10&amp;format=pjpg&amp;auto=webp&amp;s=596158e0f5e926734b4e3477cc946983122928e2', 'width': 108}, {'height': 55, 'url': 'https://preview.redd.it/yfg445cjiiz81.jpg?width=216&amp;crop=smart&amp;blur=21&amp;format=pjpg&amp;auto=webp&amp;s=500eceb24f579ebc5a197ca29c6724b656d164cb', 'width': 216}, {'height': 82, 'url': 'https://preview.redd.it/yfg445cjiiz81.jpg?width=320&amp;crop=smart&amp;blur=32&amp;format=pjpg&amp;auto=webp&amp;s=a9e4ee38489ca5b9dd8ce5a12c388b12b551fd24', 'width': 320}, {'height': 164, 'url': 'https://preview.redd.it/yfg445cjiiz81.jpg?width=640&amp;crop=smart&amp;blur=40&amp;format=pjpg&amp;auto=webp&amp;s=083381ce291eabc1643b33154b2f6d2ef4b185df', 'width': 640}], 'source': {'height': 226, 'url': 'https://preview.redd.it/yfg445cjiiz81.jpg?blur=40&amp;format=pjpg&amp;auto=webp&amp;s=2b164bcfc72343bcec884396c0f8ef0c7c9f1a7f', 'width': 878}}}}]}",36.0,140.0,,,,,,,,,
118,[],False,alexheil,Warning-level2-2,"[{'e': 'text', 't': 'Tin | WebDev 11'}]",Tin | WebDev 11,richtext,t2_fss3u,False,False,False,[],False,False,1652564708,cryptolovesh2o.com,https://www.reddit.com/r/CryptoCurrency/comments/upr56b/heres_what_happened_to_luna_and_ust_and_why_you/,{},upr56b,False,True,False,False,False,True,False,False,#7193ff,DISCUSSION,"[{'e': 'text', 't': 'DISCUSSION'}]",87049662-0882-11e5-82e1-0e9d1a9f7761,DISCUSSION,dark,richtext,False,False,False,0,0,False,all_ads,/r/CryptoCurrency/comments/upr56b/heres_what_happened_to_luna_and_ust_and_why_you/,False,6,1652564719,1,,False,False,False,CryptoCurrency,t5_2wlj3,4855550,public,new,https://b.thumbs.redditmedia.com/D0Csiji1GwkZxuDnUEep0j4mlBQG2NQ-nG3--loBDAs.jpg,Here's What Happened to Luna and UST and Why You Should Be Careful,0,[],1.0,https://www.cryptolovesh2o.com/blog-posts/what-happened-to-terra-luna-luna-and-terrausd-ust,https://www.cryptolovesh2o.com/blog-posts/what-happened-to-terra-luna-luna-and-terrausd-ust,all_ads,6,1652535908.0,,,dark,link,"{'enabled': False, 'images': [{'id': '9FdAZVwTW-aM-BU2NjBTyhRpf4eOfHQbSw-qh7YhUoU', 'resolutions': [{'height': 60, 'url': 'https://external-preview.redd.it/AttJ8R06GPlCum6S-0K_WHn6S5MciUYYRE21A5TpKNY.jpg?width=108&amp;crop=smart&amp;auto=webp&amp;s=94a187c572b10676c505c98f30abbe2d708d1921', 'width': 108}, {'height': 121, 'url': 'https://external-preview.redd.it/AttJ8R06GPlCum6S-0K_WHn6S5MciUYYRE21A5TpKNY.jpg?width=216&amp;crop=smart&amp;auto=webp&amp;s=b607d0ad40f52f14994f4ffb9e4d14da0597f4a1', 'width': 216}, {'height': 180, 'url': 'https://external-preview.redd.it/AttJ8R06GPlCum6S-0K_WHn6S5MciUYYRE21A5TpKNY.jpg?width=320&amp;crop=smart&amp;auto=webp&amp;s=189908e30a45d95957cac725d7ec6014607591c4', 'width': 320}, {'height': 360, 'url': 'https://external-preview.redd.it/AttJ8R06GPlCum6S-0K_WHn6S5MciUYYRE21A5TpKNY.jpg?width=640&amp;crop=smart&amp;auto=webp&amp;s=1fbbedc7ae32a2bd7cb3908b8e595892ff352a3c', 'width': 640}, {'height': 540, 'url': 'https://external-preview.redd.it/AttJ8R06GPlCum6S-0K_WHn6S5MciUYYRE21A5TpKNY.jpg?width=960&amp;crop=smart&amp;auto=webp&amp;s=810986ce37c32f4af8a0f0f0f14a2bb3e9108798', 'width': 960}, {'height': 607, 'url': 'https://external-preview.redd.it/AttJ8R06GPlCum6S-0K_WHn6S5MciUYYRE21A5TpKNY.jpg?width=1080&amp;crop=smart&amp;auto=webp&amp;s=48a3b7bce78fcc539750ab8e118cbf940e865ad3', 'width': 1080}], 'source': {'height': 1080, 'url': 'https://external-preview.redd.it/AttJ8R06GPlCum6S-0K_WHn6S5MciUYYRE21A5TpKNY.jpg?auto=webp&amp;s=f26804b1ef334c44498f27e2e1dbfe8bdf7fbee5', 'width': 1920}, 'variants': {}}]}",78.0,140.0,,,,,,,,,
