162,[],False,Doublea4dayz,,[],,text,t2_xlpzl,False,False,False,[],False,False,1652554808,self.CryptoCurrency,https://www.reddit.com/r/CryptoCurrency/comments/upnwoo/for_us_customers_where_is_luna_still_listed/,{},upnwoo,False,False,False,False,False,False,True,False,#007373,EXCHANGES,"[{'e': 'text', 't': 'EXCHANGES'}]",38a8ac5a-9d5c-11e5-a136-0e9f3a832fc3,EXCHANGES,light,richtext,False,False,True,1,0,False,all_ads,/r/CryptoCurrency/comments/upnwoo/for_us_customers_where_is_luna_still_listed/,False,6,1652554818,1,[removed],True,False,False,CryptoCurrency,t5_2wlj3,4854588,public,,self,"For US customers, where is Luna still listed?",0,[],1.0,https://www.reddit.com/r/CryptoCurrency/comments/upnwoo/for_us_customers_where_is_luna_still_listed/,,all_ads,6,1652526008.0,moderator,,,,,,,,,,,,,,,
163,[],False,-The-Archetype-,,[],,text,t2_jcuk6ada,False,False,False,[],False,False,1652554032,self.CryptoCurrency,https://www.reddit.com/r/CryptoCurrency/comments/upnngo/what_is_the_current_market_cap_of_luna/,{},upnngo,False,False,False,False,False,False,True,False,#00a6a5,METRICS,"[{'e': 'text', 't': 'METRICS'}]",1c0b4b5e-2959-11ec-b004-0aa21184cd0a,METRICS,dark,richtext,False,False,True,1,0,False,all_ads,/r/CryptoCurrency/comments/upnngo/what_is_the_current_market_cap_of_luna/,False,6,1652554043,1,[removed],True,False,False,CryptoCurrency,t5_2wlj3,4854513,public,,self,What is the current market cap of LUNA?,0,[],1.0,https://www.reddit.com/r/CryptoCurrency/comments/upnngo/what_is_the_current_market_cap_of_luna/,,all_ads,6,1652525232.0,moderator,,,,,,,,,,,,,,,
164,[],False,BillySheldy,,[],,text,t2_a0ydjmuu,False,False,False,[],False,False,1652553238,self.CryptoCurrency,https://www.reddit.com/r/CryptoCurrency/comments/upne95/blackrock_and_citadel_are_behind_the_crypto_fall/,{},upne95,False,True,False,False,False,True,True,False,#ff66ac,DEBATE,"[{'e': 'text', 't': 'DEBATE'}]",5b762856-d7c9-11e4-822a-22000b2300b2,DEBATE,light,richtext,False,False,False,0,0,False,all_ads,/r/CryptoCurrency/comments/upne95/blackrock_and_citadel_are_behind_the_crypto_fall/,False,6,1652553249,1,"how to kill a stableCOIN  ... the story behind TerraLuna implosion:

""Blackrock and Citadel borrowed 100K BTC from Gemini (Gemini have just denied apprently on twitter… ). They swapped 25K of that BTC into UST; this was all done quietly in anticipation of the attack.
When the time was right, they called up Do Kwon at Terra Foundation and said they wanted to sell a lot of BTC for UST. As it was a large trade they told him they didn't want to move the market and asked if he would like to buy their large block of BTC at a discount for UST. Do Kwan took the bait. He gave them a huge chunk of UST, thus lowering the UST liquidity significantly. At that point, Blackrock/Citadel dumped all of the BTC and UST causing massive slippage and triggering a cascade of forced selling in both assets. The real problem was Blackrock/Citadel knew that Anchor, which holds a lot of LUNA , was a Ponzi scheme (they offer 20% staking APY for Christsake) and this crash would trigger more withdrawals than Anchor can repay. These forced withdrawals and selling would trigger a massive selloff in Luna, thus further breaking the $1 peg and wrecking the market further.
Blackrock and Citadel can now buy the BTC back cheaply to repay the loan and pocket the difference. Meanwhile, billions of longs and Bitcoin VaR were wiped out.""

At this moment the road to defi is VERY far away .. and it's also a very stupid idea to use bitcoin as an underlying asset for a stable coin...",True,False,False,CryptoCurrency,t5_2wlj3,4854440,public,new,self,Blackrock and Citadel are behind the crypto fall but why?,0,[],1.0,https://www.reddit.com/r/CryptoCurrency/comments/upne95/blackrock_and_citadel_are_behind_the_crypto_fall/,,all_ads,6,1652524438.0,,,,,,,,,,,,,,,,
165,[],False,nammacrypto,Training,"[{'e': 'text', 't': 'Redditor for 6 months.'}]",Redditor for 6 months.,richtext,t2_as34lrzk,False,False,False,[],False,False,1652553227,youtube.com,https://www.reddit.com/r/CryptoCurrency/comments/upne35/luna_important_update_with_free_airdrop_tamilbtc/,{},upne35,False,False,False,True,False,False,False,False,#0aa18f,NEWS,"[{'e': 'text', 't': 'GENERAL-NEWS'}]",f170aab2-246f-11ec-8143-429a193c9848,GENERAL-NEWS,light,richtext,False,False,True,0,0,False,all_ads,/r/CryptoCurrency/comments/upne35/luna_important_update_with_free_airdrop_tamilbtc/,False,6,1652553238,1,,True,False,False,CryptoCurrency,t5_2wlj3,4854439,public,,https://a.thumbs.redditmedia.com/mefEX-_RnGPIY8fCkmoGALt7XeQBeKASIehuYocpAd0.jpg,#Luna Important Update with Free Airdrop | #TamilBTC #NammaCrypto,0,[],1.0,https://youtube.com/watch?v=DgVHV9st2SY&amp;feature=share,https://youtube.com/watch?v=DgVHV9st2SY&amp;feature=share,all_ads,6,1652524427.0,automod_filtered,,dark,rich:video,"{'enabled': False, 'images': [{'id': '5PQnW01zXl3-oMQuEDMt0ebbNu1sq-dmENDwcPxyYtY', 'resolutions': [{'height': 81, 'url': 'https://external-preview.redd.it/fsFEkRIj-ko_tMFr1soyNebH-Dm-0ChE94WQ-7d23AA.jpg?width=108&amp;crop=smart&amp;auto=webp&amp;s=91cce199e0167c5bf422be34bb40100ce7de9f58', 'width': 108}, {'height': 162, 'url': 'https://external-preview.redd.it/fsFEkRIj-ko_tMFr1soyNebH-Dm-0ChE94WQ-7d23AA.jpg?width=216&amp;crop=smart&amp;auto=webp&amp;s=e2abfee21cb58803902b60a4ed5bd5d57b0cf26b', 'width': 216}, {'height': 240, 'url': 'https://external-preview.redd.it/fsFEkRIj-ko_tMFr1soyNebH-Dm-0ChE94WQ-7d23AA.jpg?width=320&amp;crop=smart&amp;auto=webp&amp;s=e0a015c06844f0b9d032094d575deec85595891e', 'width': 320}], 'source': {'height': 360, 'url': 'https://external-preview.redd.it/fsFEkRIj-ko_tMFr1soyNebH-Dm-0ChE94WQ-7d23AA.jpg?auto=webp&amp;s=6e934e4d84d353d61dbc900f72160e143c5f5d18', 'width': 480}, 'variants': {}}]}",105.0,140.0,,,"{'oembed': {'author_name': 'Namma Crypto', 'author_url': 'https://www.youtube.com/c/NammaCrypto', 'height': 200, 'html': '&lt;iframe width=""356"" height=""200"" src=""https://www.youtube.com/embed/DgVHV9st2SY?feature=oembed&amp;enablejsapi=1"" frameborder=""0"" allow=""accelerometer; autoplay; clipboard-write; encrypted-media; gyroscope; picture-in-picture"" allowfullscreen&gt;&lt;/iframe&gt;', 'provider_name': 'YouTube', 'provider_url': 'https://www.youtube.com/', 'thumbnail_height': 360, 'thumbnail_url': 'https://i.ytimg.com/vi/DgVHV9st2SY/hqdefault.jpg', 'thumbnail_width': 480, 'title': '#Luna Important Update with Free Airdrop | #TamilBTC #NammaCrypto', 'type': 'video', 'version': '1.0', 'width': 356}, 'type': 'youtube.com'}","{'content': '&lt;iframe width=""356"" height=""200"" src=""https://www.youtube.com/embed/DgVHV9st2SY?feature=oembed&amp;enablejsapi=1"" frameborder=""0"" allow=""accelerometer; autoplay; clipboard-write; encrypted-media; gyroscope; picture-in-picture"" allowfullscreen&gt;&lt;/iframe&gt;', 'height': 200, 'scrolling': False, 'width': 356}","{'oembed': {'author_name': 'Namma Crypto', 'author_url': 'https://www.youtube.com/c/NammaCrypto', 'height': 200, 'html': '&lt;iframe width=""356"" height=""200"" src=""https://www.youtube.com/embed/DgVHV9st2SY?feature=oembed&amp;enablejsapi=1"" frameborder=""0"" allow=""accelerometer; autoplay; clipboard-write; encrypted-media; gyroscope; picture-in-picture"" allowfullscreen&gt;&lt;/iframe&gt;', 'provider_name': 'YouTube', 'provider_url': 'https://www.youtube.com/', 'thumbnail_height': 360, 'thumbnail_url': 'https://i.ytimg.com/vi/DgVHV9st2SY/hqdefault.jpg', 'thumbnail_width': 480, 'title': '#Luna Important Update with Free Airdrop | #TamilBTC #NammaCrypto', 'type': 'video', 'version': '1.0', 'width': 356}, 'type': 'youtube.com'}","{'content': '&lt;iframe width=""356"" height=""200"" src=""https://www.youtube.com/embed/DgVHV9st2SY?feature=oembed&amp;enablejsapi=1"" frameborder=""0"" allow=""accelerometer; autoplay; clipboard-write; encrypted-media; gyroscope; picture-in-picture"" allowfullscreen&gt;&lt;/iframe&gt;', 'height': 200, 'media_domain_url': 'https://www.redditmedia.com/mediaembed/upne35', 'scrolling': False, 'width': 356}",,,
166,[],False,Serious-Row7621,,[],,text,t2_a84hewe8,False,False,False,[],False,False,1652553057,self.CryptoCurrency,https://www.reddit.com/r/CryptoCurrency/comments/upnc38/ust_and_luna_loss_how_to_report_irs_tax_loss/,{},upnc38,False,False,False,False,False,False,True,False,#46d160,ADVICE,"[{'e': 'text', 't': 'ADVICE'}]",e9570888-9c2a-11e3-809c-12313d1661cc,ADVICE,dark,richtext,False,False,True,1,0,False,all_ads,/r/CryptoCurrency/comments/upnc38/ust_and_luna_loss_how_to_report_irs_tax_loss/,False,6,1652553068,1,[removed],True,False,False,CryptoCurrency,t5_2wlj3,4854424,public,,self,UST and LUNA loss - how to report IRS TAX Loss,0,[],1.0,https://www.reddit.com/r/CryptoCurrency/comments/upnc38/ust_and_luna_loss_how_to_report_irs_tax_loss/,,all_ads,6,1652524257.0,moderator,,,,,,,,,,,,,,,
167,[],False,whiteyfisk46,,"[{'e': 'text', 't': 'Platinum | QC: XLM 267, CC 24, BTC 19 | MANA 12 | r/WSB 18'}]","Platinum | QC: XLM 267, CC 24, BTC 19 | MANA 12 | r/WSB 18",richtext,t2_a2askruj,False,False,True,[],False,False,1652552954,coinnounce.com,https://www.reddit.com/r/CryptoCurrency/comments/upnarv/a_singaporean_lunaust_investor_files_lawsuit/,{},upnarv,False,True,False,False,False,True,False,False,#0aa18f,NEWS,"[{'e': 'text', 't': 'GENERAL-NEWS'}]",f170aab2-246f-11ec-8143-429a193c9848,GENERAL-NEWS,light,richtext,False,False,True,0,0,False,all_ads,/r/CryptoCurrency/comments/upnarv/a_singaporean_lunaust_investor_files_lawsuit/,False,6,1652552965,1,,True,False,False,CryptoCurrency,t5_2wlj3,4854417,public,new,https://b.thumbs.redditmedia.com/LEXCbpRGOguLcuwkhWrr2hWgIpPYBnHsaFjtCiAfj4A.jpg,A Singaporean LUNA/UST Investor Files Lawsuit Against Terra's Do Kwon,0,[],1.0,https://coinnounce.com/a-singaporean-luna-ust-investor-files-lawsuit-against-terras-do-kwon/,https://coinnounce.com/a-singaporean-luna-ust-investor-files-lawsuit-against-terras-do-kwon/,all_ads,6,1652524154.0,,,dark,link,"{'enabled': False, 'images': [{'id': 'a4rWoALieNCx3ayNis_unDib9PSP5tGq4Uz6aedhBps', 'resolutions': [{'height': 60, 'url': 'https://external-preview.redd.it/XtGlKRtSpuS2QzUvp8Wc5TAJDV3rX6OWW3gLJ1XKX74.jpg?width=108&amp;crop=smart&amp;auto=webp&amp;s=dd7fefa25eb129103d7c31634f8c494dc3de557a', 'width': 108}, {'height': 121, 'url': 'https://external-preview.redd.it/XtGlKRtSpuS2QzUvp8Wc5TAJDV3rX6OWW3gLJ1XKX74.jpg?width=216&amp;crop=smart&amp;auto=webp&amp;s=4c99176748b026c0f045e8db77e94b4f1742c2f6', 'width': 216}, {'height': 180, 'url': 'https://external-preview.redd.it/XtGlKRtSpuS2QzUvp8Wc5TAJDV3rX6OWW3gLJ1XKX74.jpg?width=320&amp;crop=smart&amp;auto=webp&amp;s=c83d566e75a32dd4be1a7bafc1680665ad71edcb', 'width': 320}, {'height': 360, 'url': 'https://external-preview.redd.it/XtGlKRtSpuS2QzUvp8Wc5TAJDV3rX6OWW3gLJ1XKX74.jpg?width=640&amp;crop=smart&amp;auto=webp&amp;s=f08d196817dda4a2fe4e30cd39ce4f32f15cb66d', 'width': 640}, {'height': 540, 'url': 'https://external-preview.redd.it/XtGlKRtSpuS2QzUvp8Wc5TAJDV3rX6OWW3gLJ1XKX74.jpg?width=960&amp;crop=smart&amp;auto=webp&amp;s=a02ca8fde4c0a5fa4e8f3d37a6950bc0572914a7', 'width': 960}, {'height': 607, 'url': 'https://external-preview.redd.it/XtGlKRtSpuS2QzUvp8Wc5TAJDV3rX6OWW3gLJ1XKX74.jpg?width=1080&amp;crop=smart&amp;auto=webp&amp;s=6e4220ffa4106d71af5423269a961e05e3fd32ba', 'width': 1080}], 'source': {'height': 675, 'url': 'https://external-preview.redd.it/XtGlKRtSpuS2QzUvp8Wc5TAJDV3rX6OWW3gLJ1XKX74.jpg?auto=webp&amp;s=254c5de3b40f79115da668fc5ec51bb339bf03d3', 'width': 1200}, 'variants': {}}]}",78.0,140.0,,,,,,,,,
168,[],False,BillySheldy,,[],,text,t2_a0ydjmuu,False,False,False,[],False,False,1652552760,self.CryptoCurrency,https://www.reddit.com/r/CryptoCurrency/comments/upn8ii/black_rock_and_citadel_are_behind_the_crypto_fall/,{},upn8ii,False,True,False,False,False,True,True,False,#add2e2,ADVICE,"[{'e': 'text', 't': 'ANALYSIS'}]",c1034ee6-9c2a-11e3-a8c4-12313b0e8e20,ANALYSIS,dark,richtext,False,False,True,0,0,False,all_ads,/r/CryptoCurrency/comments/upn8ii/black_rock_and_citadel_are_behind_the_crypto_fall/,False,6,1652552770,1,"how to kill a stableCOIN  ... the story behind TerraLuna implosion:

""Blackrock and Citadel borrowed 100K BTC from Gemini (Gemini have just denied apprently on twitter… ). They swapped 25K of that BTC into UST; this was all done quietly in anticipation of the attack.
When the time was right, they called up Do Kwon at Terra Foundation and said they wanted to sell a lot of BTC for UST. As it was a large trade they told him they didn't want to move the market and asked if he would like to buy their large block of BTC at a discount for UST. Do Kwan took the bait. He gave them a huge chunk of UST, thus lowering the UST liquidity significantly. At that point, Blackrock/Citadel dumped all of the BTC and UST causing massive slippage and triggering a cascade of forced selling in both assets. The real problem was Blackrock/Citadel knew that Anchor, which holds a lot of LUNA , was a Ponzi scheme (they offer 20% staking APY for Christsake) and this crash would trigger more withdrawals than Anchor can repay. These forced withdrawals and selling would trigger a massive selloff in Luna, thus further breaking the $1 peg and wrecking the market further.
Blackrock and Citadel can now buy the BTC back cheaply to repay the loan and pocket the difference. Meanwhile, billions of longs and Bitcoin VaR were wiped out.""

At this moment the road to defi is VERY far away .. and it's also a very stupid idea to use bitcoin as an underlying asset for a stable coin...",True,False,False,CryptoCurrency,t5_2wlj3,4854398,public,new,self,Black rock and Citadel are behind the crypto fall,0,[],1.0,https://www.reddit.com/r/CryptoCurrency/comments/upn8ii/black_rock_and_citadel_are_behind_the_crypto_fall/,,all_ads,6,1652523960.0,,,,,,,,,,,,,,,,
169,[],False,420DeliveriesBoston,Training,"[{'e': 'text', 't': 'Redditor for 6 months.'}]",Redditor for 6 months.,richtext,t2_axwg3vpg,False,False,False,[],False,False,1652552682,self.CryptoCurrency,https://www.reddit.com/r/CryptoCurrency/comments/upn7kv/now_that_luna_is_up_200_since_yesterday_is_it_a/,{},upn7kv,False,False,False,False,False,False,True,False,#7193ff,DISCUSSION,"[{'e': 'text', 't': 'DISCUSSION'}]",87049662-0882-11e5-82e1-0e9d1a9f7761,DISCUSSION,dark,richtext,False,False,True,1,0,False,all_ads,/r/CryptoCurrency/comments/upn7kv/now_that_luna_is_up_200_since_yesterday_is_it_a/,False,6,1652552693,1,[removed],True,False,False,CryptoCurrency,t5_2wlj3,4854390,public,,self,"Now that LUNA is up 200% since yesterday, is it a good time to start putting a few buck here and here into LUNA?? Lmk what y’all think!",0,[],1.0,https://www.reddit.com/r/CryptoCurrency/comments/upn7kv/now_that_luna_is_up_200_since_yesterday_is_it_a/,,all_ads,6,1652523882.0,moderator,,dark,,,,,,,,,,,,,
170,[],False,Bason2245,,[],,text,t2_3s20xjxg,False,False,False,[],False,False,1652552665,self.CryptoCurrency,https://www.reddit.com/r/CryptoCurrency/comments/upn7cl/bought_075_cents_of_luna_yesterday_its_now_over_40/,{},upn7cl,False,False,False,False,False,False,True,False,#c403f5,COMEDY,"[{'e': 'text', 't': 'COMEDY'}]",5c104cfc-d7c8-11e4-9d14-22000b6902b0,COMEDY,dark,richtext,False,False,True,1,0,False,all_ads,/r/CryptoCurrency/comments/upn7cl/bought_075_cents_of_luna_yesterday_its_now_over_40/,False,6,1652552675,1,[removed],True,False,False,CryptoCurrency,t5_2wlj3,4854388,public,new,self,Bought 0.75 cents of LUNA yesterday. Its now over 40$.,0,[],1.0,https://www.reddit.com/r/CryptoCurrency/comments/upn7cl/bought_075_cents_of_luna_yesterday_its_now_over_40/,,all_ads,6,1652523865.0,moderator,,,,,,,,,,,,,,,
171,[],False,suggestiondude,,"[{'e': 'text', 't': 'Platinum | QC: CC 42 | r/WSB 76'}]",Platinum | QC: CC 42 | r/WSB 76,richtext,t2_6dh3588k,False,False,False,[],False,False,1652552514,self.CryptoCurrency,https://www.reddit.com/r/CryptoCurrency/comments/upn5hc/i_dont_feel_bad_for_anyone_who_lost_their_life/,{},upn5hc,False,True,False,False,False,True,True,False,#7193ff,DISCUSSION,"[{'e': 'text', 't': 'DISCUSSION'}]",87049662-0882-11e5-82e1-0e9d1a9f7761,DISCUSSION,dark,richtext,False,False,True,0,0,False,all_ads,/r/CryptoCurrency/comments/upn5hc/i_dont_feel_bad_for_anyone_who_lost_their_life/,False,6,1652552524,1,"The title says it all. It is sad to see posts about people contemplating suicide or, worse, doing it, and I hope anyone who is thinking of such a thing gets mental help and help for gambling.

Here's why I don't feel bad for them, though. If I go to a casino and turn $1k into $10k and lose it all, no one cares because I was GAMBLING. I was knowingly participating in risky financial behavior, and I have to accept the consequences.

Money is hard to make. People work their ass off for $14 an hour, flipping burgers, and cleaning garbage. If you're lucky, you go to school and get a good paying job where you can buy a property, take care of yourself and your family, and invest some.

These people thought they found an infinite free money hub. Who has ever heard of 20% interest outside of a ponzi scheme? 

It sucks but again, if you put all your money in a risky investment and it goes south, you are to blame. No one forced them. They made a conscious decision and had to accept the consequences. Who here hasn't done the same and felt like shit? 

It sucks but the proposal that Du made that 80% of tokens would go to UST and LUNA holders that held to the end is insane. People who are investing now are keeping this together.",True,False,False,CryptoCurrency,t5_2wlj3,4854370,public,new,self,I don't feel bad for anyone who lost their life savings in LUNA. They were doing very risky gambling.,0,[],1.0,https://www.reddit.com/r/CryptoCurrency/comments/upn5hc/i_dont_feel_bad_for_anyone_who_lost_their_life/,,all_ads,6,1652523714.0,,,dark,,,,,,,,,,,,,
172,[],False,YoJoee,Warning-level1,"[{'e': 'text', 't': '3 - 4 years account age. 200 - 400 comment karma.'}]",3 - 4 years account age. 200 - 400 comment karma.,richtext,t2_ncuyqy6,False,False,False,[],False,False,1652552284,self.CryptoCurrency,https://www.reddit.com/r/CryptoCurrency/comments/upn2mu/kucoin_halted_trading_on_a_luna_short_fund_symbol/,{},upn2mu,False,False,False,False,False,False,True,False,#007373,EXCHANGES,"[{'e': 'text', 't': 'EXCHANGES'}]",38a8ac5a-9d5c-11e5-a136-0e9f3a832fc3,EXCHANGES,light,richtext,False,False,True,1,0,False,all_ads,/r/CryptoCurrency/comments/upn2mu/kucoin_halted_trading_on_a_luna_short_fund_symbol/,False,6,1652552294,1,[removed],True,False,False,CryptoCurrency,t5_2wlj3,4854353,public,,self,KuCoin halted trading on a Luna short fund (Symbol LUNA3S) They halted trading at ~$10 a share. I had 72 shares. They told users to put in a redemption request. This turned my $720 position into less than a penny. Now I can’t get ahold of them.,0,[],1.0,https://www.reddit.com/r/CryptoCurrency/comments/upn2mu/kucoin_halted_trading_on_a_luna_short_fund_symbol/,,all_ads,6,1652523484.0,moderator,,dark,,,,,,,,,,,,,
173,[],False,DArabbb,Warning-level2-2,"[{'e': 'text', 't': 'Tin'}]",Tin,richtext,t2_g15wc,False,False,False,[],False,False,1652552126,self.CryptoCurrency,https://www.reddit.com/r/CryptoCurrency/comments/upn0rc/can_someone_please_eli5_the_burning_process_for/,{},upn0rc,False,True,False,False,False,True,True,False,#7193ff,DISCUSSION,"[{'e': 'text', 't': 'DISCUSSION'}]",87049662-0882-11e5-82e1-0e9d1a9f7761,DISCUSSION,dark,richtext,False,False,True,0,0,False,all_ads,/r/CryptoCurrency/comments/upn0rc/can_someone_please_eli5_the_burning_process_for/,False,6,1652552136,1,"Please be gentle on my angus. I've never been invested with this eco so I'm trying to get a better understanding of it. 

I'm trying to wrap my head around how the team will salvage the ecosystem. Since the 12th, supply went from 377 million to 6.5 trillion LUNA, there have been talks about a fork and pulling up a snapshot to before the de-peg and Do Gone's response on Agora for resetting network back to 1B tokens. 

Does that mean those who were lucky enough to get in at 0.000001-3c and ended up with thousands and millions of Luna could see their bags emptied overnight? And probably the dumbest question all week, which coins are they burning to get the prices back up? both? Seen on twitter they want to burn the rest of UST but with the sudden pump in Luna, will the newly minted trillions face the fire too?",True,False,False,CryptoCurrency,t5_2wlj3,4854338,public,,self,Can someone please ELI5 the burning process for TerraL?,0,[],1.0,https://www.reddit.com/r/CryptoCurrency/comments/upn0rc/can_someone_please_eli5_the_burning_process_for/,,all_ads,6,1652523326.0,,,dark,,,,,,,,,,,,,
174,[],False,WinthorpStrange,,"[{'e': 'text', 't': 'Silver | QC: BTC 58 | CRO 14 | ExchSubs 14'}]",Silver | QC: BTC 58 | CRO 14 | ExchSubs 14,richtext,t2_fe181b6,False,False,False,[],False,False,1652552049,self.CryptoCurrency,https://www.reddit.com/r/CryptoCurrency/comments/upmzu2/after_a_ton_of_research_i_believe_i_have/,{},upmzu2,False,True,False,False,False,True,True,False,#cc8b00,SPECULATION,"[{'e': 'text', 't': 'SPECULATION'}]",ebb30328-94d1-11eb-94d6-0e7d4f551e2d,SPECULATION,light,richtext,False,False,True,0,0,False,all_ads,/r/CryptoCurrency/comments/upmzu2/after_a_ton_of_research_i_believe_i_have/,False,6,1652552059,1,"Like the title says, I believe I have identified the the next meme coin that will rocket when the next bull run arrives.  I’m looking for vastly underrated and undervalued projects on major blockchains during this bear market.  I feel compelled to bring it to everyone’s attention but this is only talking crypto around the water cooler, so please don’t kill me.  I’m merely pointing it out and my logic behind it.  (And I want credit if this takes off).  The coin could do nothing but I’m speculating.  When Shiba INU rocketed, it took off out of no-where.  The people who bought it when it had no attention became multi - millionaires.  I have identified a meme on Cardano (the first meme to launch on Cardano) after smart contracts.  Much like Shiba Inu was in the beginning, it is not on the radar and it’s at it’s lowest point after the drop.

The coin is Hosky Token and it’s on the Cardano blockchain.  My personal belief is that Cardano will eventually be the number 3 coin behind Bitcoin/Ethereum.  It’s the most decentralized layer one.  They have tons of DeFi projects launching, scaling solutions on the horizon, layer 2 solutions, and they have stable coin platforms launching, Djed, Ardana, that will undoubtedly siphon off a lot of the market cap from the Terra Luna crash.  Tons of Cardano will be locked up in DeFi in the future skyrocketing the price eventually, much like it did with Ethereum.  I’m more bullish on Cardano as it remained steady during the dip.  During the next bull run, Cardano will be primed to fly.  

Hosky is the first Meme to launch on Cardano.  It’s NFTs are actually popular in the Cardano community and they have an active Discord.  You can stake their NFTs along with Cardano in stake pools and earn Hosky.  It is the most popular meme coin on Cardano.  Half of the supply is being held in reserve and the speculation is that it will eventually be gifted to Charles Hoskinson when the project gains more notoriety (although nobody truly knows). Most importantly, the volume and market cap are very low, despite being a major Cardano project.  Less than one million market cap, less than $1000 daily volume.  Lower supply than Shiba.  No eyes on this project or Cardano at the moment.  It’s listed on the two major Cardano  Dexs (Minswap/Sundaeswap).  It’s not on a CEX yet. This is a rare opportunity as any significant volume, main stream adoption of Cardano, or Cex listing could make this rocket.  This is a once in a lifetime opportunity in my opinion to get in at the bottom  as the Cardano meme economy is just getting started.  Even the Dogecoin millionaire guy bought a big bag of Hosky because it reminded him of the early days of Doge.",True,False,False,CryptoCurrency,t5_2wlj3,4854331,public,new,self,"After a ton of research, I believe I have identified the next meme coin that will create millionaires, much like Doge/Shiba.",0,[],1.0,https://www.reddit.com/r/CryptoCurrency/comments/upmzu2/after_a_ton_of_research_i_believe_i_have/,,all_ads,6,1652523249.0,,,dark,,,,,,,,,,,,,
