,all_awardings,allow_live_comments,author,author_flair_css_class,author_flair_richtext,author_flair_text,author_flair_type,author_fullname,author_is_blocked,author_patreon_flair,author_premium,awarders,can_mod_post,contest_mode,created_utc,domain,full_link,gildings,id,is_created_from_ads_ui,is_crosspostable,is_meta,is_original_content,is_reddit_media_domain,is_robot_indexable,is_self,is_video,link_flair_background_color,link_flair_css_class,link_flair_richtext,link_flair_template_id,link_flair_text,link_flair_text_color,link_flair_type,locked,media_only,no_follow,num_comments,num_crossposts,over_18,parent_whitelist_status,permalink,pinned,pwls,retrieved_on,score,selftext,send_replies,spoiler,stickied,subreddit,subreddit_id,subreddit_subscribers,subreddit_type,suggested_sort,thumbnail,title,total_awards_received,treatment_tags,upvote_ratio,url,url_overridden_by_dest,whitelist_status,wls,created,removed_by_category,author_flair_background_color,author_flair_text_color,post_hint,preview,thumbnail_height,thumbnail_width,media_metadata,author_cakeday,media,media_embed,secure_media,secure_media_embed,crosspost_parent,crosspost_parent_list,author_flair_template_id
0,[],False,VR-Is-New-Reality,,[],,text,t2_muashout,False,False,False,[],False,False,1652630191,reddit.com,https://www.reddit.com/r/CryptoCurrency/comments/uq90v8/feel_free_to_join_pro_luna_subreddit/,{},uq90v8,False,True,False,False,False,True,False,False,#94e044,PRO-ARGUMENTS,"[{'e': 'text', 't': 'PRO-ARGUMENTS'}]",11935244-a248-11ec-b773-8a67bbaa00f3,PRO-ARGUMENTS,dark,richtext,False,False,False,0,0,False,all_ads,/r/CryptoCurrency/comments/uq90v8/feel_free_to_join_pro_luna_subreddit/,False,6,1652630201,1,,True,False,False,CryptoCurrency,t5_2wlj3,4861298,public,new,default,Feel free to join Pro Luna Sub-Reddit!,0,[],1.0,https://www.reddit.com/r/Terra_Lunatics?utm_medium=android_app&amp;utm_source=share,https://www.reddit.com/r/Terra_Lunatics?utm_medium=android_app&amp;utm_source=share,all_ads,6,1652601391.0,,,,,,,,,,,,,,,,
1,[],False,Individual_Move_2594,,[],,text,t2_acqqn9kl,False,False,False,[],False,False,1652630087,self.Bitcoin,https://www.reddit.com/r/Bitcoin/comments/uq8zlv/luna_and_btc_falled_so_fast/,{},uq8zlv,False,False,False,False,False,False,True,False,,,[],,,dark,text,False,False,True,0,0,False,all_ads,/r/Bitcoin/comments/uq8zlv/luna_and_btc_falled_so_fast/,False,6,1652630097,1,[removed],True,False,False,Bitcoin,t5_2s3qj,4191592,public,,self,luna and btc falled so fast,0,[],1.0,https://www.reddit.com/r/Bitcoin/comments/uq8zlv/luna_and_btc_falled_so_fast/,,all_ads,6,1652601287.0,automod_filtered,,,,,,,,,,,,,,,
2,[],False,Crypto_Fi, Investor,"[{'e': 'text', 't': ' Crypto Evangelist'}]", Crypto Evangelist,richtext,t2_a2vp3mrn,False,False,False,[],False,False,1652629776,self.CryptoCurrency,https://www.reddit.com/r/CryptoCurrency/comments/uq8vtz/current_downturn_which_l1s_have_the_highest/,{},uq8vtz,False,True,False,False,False,True,True,False,#ff66ac,DEBATE,"[{'e': 'text', 't': 'DEBATE'}]",5b762856-d7c9-11e4-822a-22000b2300b2,DEBATE,light,richtext,False,False,True,0,0,False,all_ads,/r/CryptoCurrency/comments/uq8vtz/current_downturn_which_l1s_have_the_highest/,False,6,1652629786,1,"After the recent shakedown I am starting some critical reflection around one of the most competitive segments in crypto: L1s. Many had quite a bull run in 2021 and basically all of them are now substantially down.

Since the demise of Luna and the relatively low prices of the other L1s, that look like a very good investment opportunity at the moment (although I am waiting for a bit more bottom probably….), which chain do you believe will perform the best from here? 

Personally, I am into interoperability plays (some call them L0) such as ATOM and DOT, which I see very promising. 

I am also into AVAX, SOL (I know many in this sub hate it) and NEAR, while I recently exited from FTM: too much DeFi dependent, and with the Luna story I believe TVL-driven chains which offer mainly farming incentives will have problems of trust and sustainability. I also exited ONE, once one of my absolute favourites, since disagreeing with some recent choices that have been done within the ecosystem (and I believe it is too much DFK dependent).

I am eyeing ADA a lot, particularly at this low price. Also I am a longtime fan of ALGO but not fully convinced by tokenomics and institutional focus (I have difficulty in seeing how some of these initiatives like CBDCs and green certificates can translate into retail benefit/price action), even if I believe it has one of the best tech out there. Finally, I am also following EGLD, there are a lot of similiarities with NEAR and it would not make much sense in terms of diversification.

Recap: currently I am in AVAX, SOL, NEAR, DOT, ATOM

Considering: ADA

Undecided: ALGO, EGLD (pls help me changing idea if you have interesting inputs / points of view, particularly if you have an opinion in the NEAR vs. EGLD dilemma) :)",True,False,False,CryptoCurrency,t5_2wlj3,4861246,public,,self,Current downturn - Which L1s have the highest potential (and trust),0,[],1.0,https://www.reddit.com/r/CryptoCurrency/comments/uq8vtz/current_downturn_which_l1s_have_the_highest/,,all_ads,6,1652600976.0,,,dark,,,,,,,,,,,,,
3,[],False,Individual_Move_2594,,[],,text,t2_acqqn9kl,False,False,False,[],False,False,1652629168,self.Bitcoin,https://www.reddit.com/r/Bitcoin/comments/uq8oa6/please_save_me_because_of_luna_and_btc/,{},uq8oa6,False,False,False,False,False,False,True,False,,,[],,,dark,text,False,False,True,0,0,False,all_ads,/r/Bitcoin/comments/uq8oa6/please_save_me_because_of_luna_and_btc/,False,6,1652629179,1,[removed],True,False,False,Bitcoin,t5_2s3qj,4191569,public,,self,please save me because of luna and btc,0,[],1.0,https://www.reddit.com/r/Bitcoin/comments/uq8oa6/please_save_me_because_of_luna_and_btc/,,all_ads,6,1652600368.0,moderator,,,,,,,,,,,,,,,
4,[],False,bone_shadows,Warning-level2-2,"[{'e': 'text', 't': 'Tin'}]",Tin,richtext,t2_1iyedb7z,False,False,False,[],False,False,1652629163,self.CryptoCurrency,https://www.reddit.com/r/CryptoCurrency/comments/uq8o7c/is_anything_tradable_any_more/,{},uq8o7c,False,True,False,False,False,True,True,False,#ff4500,CON-ARGUMENTS,"[{'e': 'text', 't': 'CON-ARGUMENTS'}]",b9bb9300-1454-11ec-a981-ca3aae2a8825,CON-ARGUMENTS,light,richtext,False,False,True,0,0,False,all_ads,/r/CryptoCurrency/comments/uq8o7c/is_anything_tradable_any_more/,False,6,1652629173,1,"This whole luna BS has fucked up the entire trading market technically. I usually short shitcoins, but also long btc/eth from time to time. Now I dont really know what to do.  Cant go short without getting squeezed, and going long is also probably not a good idea since I feel like this is a fundamental problem with crypto itself, Im only bullish on bitcoin and eth, but even that is a stretch. Every alt coin is  essentially trash that has its value based on the value of btc/eth- whos valuation is also at risk right now. I dont care what complicated staking, stock-to-flow or liquidity incentive you tell me about, this is the real truth of it all- If bitcoin and eth crash, all the alts go down with it, period.  However now it is really hard to short after such a long and drastic recent decline.  What are your trades lately? Shorting at resistance? Buying here? just holding tethers?      


Note: ill always be long btc/eth in investment terms, but this post is for the TRADERS of crypto, I dont care about your bags of Dot, safemoon or ADA or whatever the fuck.  you know those people who shall short shit coins until they are 0, any one thats been in this game long enough knows that the chances of getting squeezed are probable, but now they are immense and essentially untradeable. like the volume on LUNA was negative, up 500 percent yesterday, now down 50, what the fuck? I wouldnt touch LUNA with a ten foot pole after what happened but anyone who is trading sees how this affects all the other coins as well.",True,False,False,CryptoCurrency,t5_2wlj3,4861183,public,new,self,"Is anything ""tradable"" any more",0,[],1.0,https://www.reddit.com/r/CryptoCurrency/comments/uq8o7c/is_anything_tradable_any_more/,,all_ads,6,1652600363.0,,,dark,,,,,,,,,,,,,
5,[],False,Sparrow_51425763,,[],,text,t2_hqy6qk01,False,False,False,[],False,False,1652628772,self.CryptoCurrency,https://www.reddit.com/r/CryptoCurrency/comments/uq8jcn/luna/,{},uq8jcn,False,False,False,False,False,False,True,False,#46d160,ADVICE,"[{'e': 'text', 't': 'ADVICE'}]",e9570888-9c2a-11e3-809c-12313d1661cc,ADVICE,dark,richtext,False,False,True,1,0,False,all_ads,/r/CryptoCurrency/comments/uq8jcn/luna/,False,6,1652628782,1,[removed],True,False,False,CryptoCurrency,t5_2wlj3,4861133,public,,self,LUNA,0,[],1.0,https://www.reddit.com/r/CryptoCurrency/comments/uq8jcn/luna/,,all_ads,6,1652599972.0,moderator,,,,,,,,,,,,,,,
6,[],False,Pseudonymous100419,Warning-level2-2,"[{'e': 'text', 't': 'Tin | CRO 8'}]",Tin | CRO 8,richtext,t2_3yin4wvt,False,False,False,[],False,False,1652628261,self.CryptoCurrency,https://www.reddit.com/r/CryptoCurrency/comments/uq8d3t/luna_risks/,{},uq8d3t,False,True,False,False,False,True,True,False,#cc8b00,SPECULATION,"[{'e': 'text', 't': 'SPECULATION'}]",ebb30328-94d1-11eb-94d6-0e7d4f551e2d,SPECULATION,light,richtext,False,False,True,1,0,False,all_ads,/r/CryptoCurrency/comments/uq8d3t/luna_risks/,False,6,1652628272,1,"With all the gambling in luna recently, I feel the need to explain why the luna rugpull is not over. As of the time of this post, the validators and Do Kwon have banded together to shut down the ability to mint Luna coins by burning UST. This is why the supply of Luna is not increasing.

There is no mention of this being a permanent change. These people turned off the function without any voting and at their own discretion without consulting other Luna holders so they can easily turn on this function as well. When that happens, 11 trillion of UST coins will be converted to Luna and we can watch Luna marketcap collapse again.

UST is currently trading at 0.15 at Kraken. These people could easily purchase large amounts of UST. Turn on the swap function then swap their UST for Luna and make a 5x profit on their USTs.",True,False,False,CryptoCurrency,t5_2wlj3,4861071,public,,self,Luna risks,0,[],1.0,https://www.reddit.com/r/CryptoCurrency/comments/uq8d3t/luna_risks/,,all_ads,6,1652599461.0,,,dark,,,,,,,,,,,,,
7,[],False,Mellow-stock,,[],,text,t2_a2j3xh0n,False,False,False,[],False,False,1652628152,i.redd.it,https://www.reddit.com/r/CryptoCurrency/comments/uq8bse/lets_get_luna_to_a_1lunatics/,{},uq8bse,False,True,False,False,True,True,False,False,#bbbdbf,STRATEGY,"[{'e': 'text', 't': 'STRATEGY'}]",8f527258-dc39-11eb-b1ee-0eae9aa8a335,STRATEGY,dark,richtext,False,False,True,1,0,False,all_ads,/r/CryptoCurrency/comments/uq8bse/lets_get_luna_to_a_1lunatics/,False,6,1652628163,1,,True,False,False,CryptoCurrency,t5_2wlj3,4861061,public,new,https://b.thumbs.redditmedia.com/X1VDT7OWy1JEYWmO4ZIJ8BDBxUfFwlDwF7mnVsVkX6U.jpg,Lets get luna to a $1🚀🚀Lunatics,0,[],1.0,https://i.redd.it/aulpespgqnz81.jpg,https://i.redd.it/aulpespgqnz81.jpg,all_ads,6,1652599352.0,,,,image,"{'enabled': True, 'images': [{'id': 'xJuLaxKTBNl1xxRClhShaIRWldb3pvGd2tFXyiFZ4Yg', 'resolutions': [{'height': 181, 'url': 'https://preview.redd.it/aulpespgqnz81.jpg?width=108&amp;crop=smart&amp;auto=webp&amp;s=13a310aa33eaea89730476daef92edf7adbce672', 'width': 108}, {'height': 362, 'url': 'https://preview.redd.it/aulpespgqnz81.jpg?width=216&amp;crop=smart&amp;auto=webp&amp;s=da73a966ccca7dcdfa4056a2a416cb3a9a855470', 'width': 216}, {'height': 537, 'url': 'https://preview.redd.it/aulpespgqnz81.jpg?width=320&amp;crop=smart&amp;auto=webp&amp;s=54e060b2b8726834ebe9772fa9e0725218ae1329', 'width': 320}, {'height': 1075, 'url': 'https://preview.redd.it/aulpespgqnz81.jpg?width=640&amp;crop=smart&amp;auto=webp&amp;s=366bcb430fae9d6c55bd633fbd80597ad3716788', 'width': 640}], 'source': {'height': 1391, 'url': 'https://preview.redd.it/aulpespgqnz81.jpg?auto=webp&amp;s=8c54843ec123990bb18e5e06f1d5987d35d2a328', 'width': 828}, 'variants': {}}]}",140.0,140.0,,,,,,,,,
8,[],False,walsrus,,[],,text,t2_wr9cw,False,False,False,[],False,False,1652627367,i.redd.it,https://www.reddit.com/r/CryptoCurrency/comments/uq82m2/what_is_this_i_swapped_10k_wluna_to_luna_via/,{},uq82m2,False,True,False,False,True,True,False,False,#7193ff,DISCUSSION,"[{'e': 'text', 't': 'DISCUSSION'}]",87049662-0882-11e5-82e1-0e9d1a9f7761,DISCUSSION,dark,richtext,False,False,True,1,0,False,all_ads,/r/CryptoCurrency/comments/uq82m2/what_is_this_i_swapped_10k_wluna_to_luna_via/,False,6,1652627378,1,,True,False,False,CryptoCurrency,t5_2wlj3,4860980,public,new,https://b.thumbs.redditmedia.com/edIe3o_Zq14KNjhu5TUwuKBzicIAuGYl6BuY2cZliBs.jpg,What is this? I swapped 10k WLUNA to LUNA via uniswap and it shows a $38 TRILLION dollar transaction.,0,[],1.0,https://i.redd.it/pqoafnm4onz81.jpg,https://i.redd.it/pqoafnm4onz81.jpg,all_ads,6,1652598567.0,,,,image,"{'enabled': True, 'images': [{'id': 'lVsftUXAVS5wVHm8N0-jl3MaClTCt1iAzNc0sGtsZA4', 'resolutions': [{'height': 216, 'url': 'https://preview.redd.it/pqoafnm4onz81.jpg?width=108&amp;crop=smart&amp;auto=webp&amp;s=5c94bc6761717f3ea4e509747861e2b7c2495c86', 'width': 108}, {'height': 432, 'url': 'https://preview.redd.it/pqoafnm4onz81.jpg?width=216&amp;crop=smart&amp;auto=webp&amp;s=e9c83880b153c82c04a5ddb4ba697698a1e760a3', 'width': 216}, {'height': 640, 'url': 'https://preview.redd.it/pqoafnm4onz81.jpg?width=320&amp;crop=smart&amp;auto=webp&amp;s=6d40a8ab70c10af10b996025ed43e580b20e31fe', 'width': 320}, {'height': 1280, 'url': 'https://preview.redd.it/pqoafnm4onz81.jpg?width=640&amp;crop=smart&amp;auto=webp&amp;s=c0c9f9b65aada7bfaaf39865aa74b0a56ca3188c', 'width': 640}, {'height': 1920, 'url': 'https://preview.redd.it/pqoafnm4onz81.jpg?width=960&amp;crop=smart&amp;auto=webp&amp;s=f57265ea5930f7718b875550bcfed77e08ec1eb9', 'width': 960}, {'height': 2160, 'url': 'https://preview.redd.it/pqoafnm4onz81.jpg?width=1080&amp;crop=smart&amp;auto=webp&amp;s=d98b5a3a9235d76bce3bf79860382dd8854e412b', 'width': 1080}], 'source': {'height': 2778, 'url': 'https://preview.redd.it/pqoafnm4onz81.jpg?auto=webp&amp;s=4bb1156d46032b957312ad8d24d6b66411048e48', 'width': 1284}, 'variants': {}}]}",140.0,140.0,,,,,,,,,
9,[],False,Brave_is_Great,,"[{'e': 'text', 't': 'Silver | QC: BAT 75, CC 20, r/CCs. 18 | NANO 84'}]","Silver | QC: BAT 75, CC 20, r/CCs. 18 | NANO 84",richtext,t2_e17rgl64,False,False,False,[],False,False,1652626487,self.CryptoCurrency,https://www.reddit.com/r/CryptoCurrency/comments/uq7rr3/what_lay_reactions_to_the_luna_crash_tell_us/,{},uq7rr3,False,True,False,False,False,True,True,False,#7193ff,DISCUSSION,"[{'e': 'text', 't': 'DISCUSSION'}]",87049662-0882-11e5-82e1-0e9d1a9f7761,DISCUSSION,dark,richtext,False,False,False,0,0,False,all_ads,/r/CryptoCurrency/comments/uq7rr3/what_lay_reactions_to_the_luna_crash_tell_us/,False,6,1652626497,1,"As the dust is settling down, I think it is interesting to analyze people's reactions to the recent Luna meltdown, especially among external observers.

From a quick look on the Internet, I can identify a few subgroups.

At a first glance, you have the cynical ones, those who are just *Haha!-*ing the ""stupid plebs"" getting scammed by rich assh\_les: they are mostly against crypto but not really informed about it. 

Somewhat deeper, you get the preachy ones, including those who hate common people entering crypto because how dare the peasants try and escape their three jobs and crippling debt by taking a shortcut? This group tends to include wealthier individuals, and people with at least some experience in investments and trading.

Finally, you have the compassionate ones, those that correctly see that our economies are so broken that these scammy projects are becoming many people's hail Mary attempts to escape mounting medical debt or increasing poverty: this analysis seems to be more common in progressive/leftist circles.

Truth be told, seeing a shoutout to mental health helplines on this very sub is... a lot.

To wrap it up, the Luna crash is making very clear what different subsets of ""laypeople"" think about crypto and those who are involved in it.

Does it resonate with you? How do you feel about this whole situation?",True,False,False,CryptoCurrency,t5_2wlj3,4860869,public,new,self,"What ""lay"" reactions to the Luna crash tell us average joes' views on people dabbling in crypto",0,[],1.0,https://www.reddit.com/r/CryptoCurrency/comments/uq7rr3/what_lay_reactions_to_the_luna_crash_tell_us/,,all_ads,6,1652597687.0,,,dark,,,,,,,,,,,,,
10,[],False,Dry_Tortuga_Island,Warning-level1-1,"[{'e': 'text', 't': 'Bronze'}]",Bronze,richtext,t2_a8uydb9v,False,False,False,[],False,False,1652626386,self.CryptoCurrency,https://www.reddit.com/r/CryptoCurrency/comments/uq7qk7/anyone_else_think_maybe_liz_warren_was_right_i_am/,{},uq7qk7,False,True,False,False,False,True,True,False,#720469,POLITICS,"[{'e': 'text', 't': 'POLITICS'}]",efdba982-5d89-11e8-9598-0ee79d121028,POLITICS,light,richtext,False,False,True,0,0,False,all_ads,/r/CryptoCurrency/comments/uq7qk7/anyone_else_think_maybe_liz_warren_was_right_i_am/,False,6,1652626397,1,"Yeah, I know.  Get your downvotes ready.

About ten days ago, [Liz Warren was getting blasted](https://www.reddit.com/r/CryptoCurrency/comments/uj4z6g/elizabeth_warrens_obsession_with_crypto_continues/) on every crypto sub for saying, "" **Investing in cryptocurrencies is a risky and speculative gamble""** and suggesting that perhaps we don't allow people to idiotically allow their life savings into risky projects .  Projects that could go to zero in a short period of time - you know, like how about 2 days?

Enter the Luna/Terra disaster.  And here I am thinking, maybe... just maybe... this woman who taught commercial and bankruptcy law classes at UPenn and Harvard might be on to something.  She is, by the way, a consistent fighter on behalf of the poor and middle class.  

But instead of her, we idolize guys like Elon who manipulate his fanboys for personal profit on a regular basis while sitting on billions and billions of dollars, avoiding taxes the whole way, and offering to fix global hunger with his money - but doesn't - and instead does shit like buying Twitter.  Which, as an aside, is [just a money-making scheme wherein he takes the company private only to pump it and dump it on the public idiots via IPO.](https://www.wsj.com/articles/elon-musk-plans-to-take-twitter-public-again-later-sources-say-11651609707)

And honestly, I am so fucking sick of the idiotic, skin-deep ""thinking"" of crypto libertarians.  

I get it.  You hate the government.  And taxes.  And helping people who aren't related to you.  Because you just bootstrapped yourself up with ZERO help from anyone, right??  For example:

1. You didn't attend school to learn anything via taxpayer dollars.  You're entirely self taught.
2. You built your own roads and use your own electrical and water infrastructure.
3. You don't use any of the safety net programs like unemployment, preferring to starve to fucking death in your cold, dark underpass where you live whilst unemployed.
4. You definitely aren't taking government insurance help or Medicare as an old person, preferring to be left to the whims of our for-profit health care system that will *definitely* use market forces to drive down costs, not just ask you to pay all your money for [lifesaving healthcare](https://healthcostinstitute.org/emergency-room/ouch-new-data-reveals-er-spending-increased-by-52-from-2012-2019-with-patient-out-of-pocket-payments-increasing-by-88).

Ok, sarcastic rant over.  Let me make my actual point clear here:

I understand that not everything Liz Warren says about crypto is accurate, but we need to get people like her on board and helping make this work.  Crypto has the chance to free people from many of the same people that she views as the enemy: 

* Big banks that charge exorbitant fees for sending money, changing currencies, etc.
* Investment houses and brokerages that manipulate our markets
* Corporations like Visa and Mastercard that make huge % on every purchase 
* Insurance companies that spend billions of dollars on advertising to get us to buy their shitty projects that might help, but maybe not
* Fraudsters that sell fake products 

Crypto has the chance to democratize so many things about our financial systems, taking the power away from profit-driven corporations that will just milk it, bankrupt it, and start it over.   But we aren't going to get there by fighting the government (wherever you may be), dodging our fair share of taxes, and leading people into a wild-west shit show of scammers, insane fees (looking at you, eth), and utter confusion and chaos. 

**We need to help guide the regulation, maturation, and mainstream integration of crypto.**  And people like Liz Warren, Bernie Sanders, and other progressives are the right people to help do it.  YES, we need to convince them of the validity of the concept.  YES, they are partially just advocating for dollar hegemony because it benefits the USA and gives us incredibly leverage over the rest of the world.  But the core concepts of benefiting regular people and providing us access to genuinely democratic, safe, and transparent finances are not antithetical to progressivism; they should be allies, not enemies.",False,False,False,CryptoCurrency,t5_2wlj3,4860863,public,new,self,Anyone else think maybe LIZ WARREN WAS RIGHT? I am so tired of the idiotic crypto libertarianism. We need crypto PROGRESSIVISM.,0,[],1.0,https://www.reddit.com/r/CryptoCurrency/comments/uq7qk7/anyone_else_think_maybe_liz_warren_was_right_i_am/,,all_ads,6,1652597586.0,,,dark,self,"{'enabled': False, 'images': [{'id': '4LwtBa2ZzVsKG7VVsfysTPeLRk3JuR4fcaMnQDTj0mc', 'resolutions': [{'height': 54, 'url': 'https://external-preview.redd.it/-KJ5dD04TfZI6Zgz4xWL39DOjBgZ2LHBO7LLPcnOvBA.jpg?width=108&amp;crop=smart&amp;auto=webp&amp;s=d6fefa5e85ed10c376669f4e7c420d07e1717d40', 'width': 108}, {'height': 108, 'url': 'https://external-preview.redd.it/-KJ5dD04TfZI6Zgz4xWL39DOjBgZ2LHBO7LLPcnOvBA.jpg?width=216&amp;crop=smart&amp;auto=webp&amp;s=8985252ba40011b8752ee29c2012083b5fc7322a', 'width': 216}, {'height': 160, 'url': 'https://external-preview.redd.it/-KJ5dD04TfZI6Zgz4xWL39DOjBgZ2LHBO7LLPcnOvBA.jpg?width=320&amp;crop=smart&amp;auto=webp&amp;s=8065dbceb28d1d79055841d72d8938580824fa4f', 'width': 320}, {'height': 320, 'url': 'https://external-preview.redd.it/-KJ5dD04TfZI6Zgz4xWL39DOjBgZ2LHBO7LLPcnOvBA.jpg?width=640&amp;crop=smart&amp;auto=webp&amp;s=d56f30656813fdd1381edd3b79edab511657fa49', 'width': 640}, {'height': 480, 'url': 'https://external-preview.redd.it/-KJ5dD04TfZI6Zgz4xWL39DOjBgZ2LHBO7LLPcnOvBA.jpg?width=960&amp;crop=smart&amp;auto=webp&amp;s=94699f94a1d6f19264c0c424a0e7d630a0947274', 'width': 960}, {'height': 540, 'url': 'https://external-preview.redd.it/-KJ5dD04TfZI6Zgz4xWL39DOjBgZ2LHBO7LLPcnOvBA.jpg?width=1080&amp;crop=smart&amp;auto=webp&amp;s=2d1faa6d95da23e8b066c02540afc7acbfec977f', 'width': 1080}], 'source': {'height': 640, 'url': 'https://external-preview.redd.it/-KJ5dD04TfZI6Zgz4xWL39DOjBgZ2LHBO7LLPcnOvBA.jpg?auto=webp&amp;s=c6fdf0961e8c7c17284248109739fa4de881ef33', 'width': 1280}, 'variants': {}}]}",,,,,,,,,,,
11,[],False,Training_Influence49,Warning-level2-2,"[{'e': 'text', 't': 'Tin'}]",Tin,richtext,t2_9uydj65d,False,False,False,[],False,False,1652626163,self.CryptoCurrency,https://www.reddit.com/r/CryptoCurrency/comments/uq7nx8/luna_founders_wife_under_emergency_protection/,{},uq7nx8,False,True,False,False,False,True,True,False,#7193ff,DISCUSSION,"[{'e': 'text', 't': 'DISCUSSION'}]",87049662-0882-11e5-82e1-0e9d1a9f7761,DISCUSSION,dark,richtext,False,False,True,0,0,False,all_ads,/r/CryptoCurrency/comments/uq7nx8/luna_founders_wife_under_emergency_protection/,False,6,1652626174,1,"“As TerraUST founder Do Kwon fought to salvage the failing stablecoin, his wife reportedly sought police protection in the latest blow to a cryptocurrency some fear may trigger a ‘Lehman moment’ for the market.  On Friday, South Korean media outlet MoneyToday wrote an unidentified person broke into her apartment building, rang the doorbell to ask if Kwon was home, before leaving the premises after she said he wasn’t.  Kwon’s wife has now been provided with security after she requested emergency protection, police in Seoul’s Seongdong-gu district told Forkast.  The developments come amid a wipeout in the value of Luna, a coin that served to prop up and maintain TerraUST’s dollar peg.  Some investors who had owned Luna posted on Reddit that people were suicidal after losing everything.  Kwon, who developed a reputation for belittling and attacking critics of his project, has now been likened to Elizabeth Holmes, found guilty of fraud for her Theranos deception.  TerraUST was designed to trade at a one-to-one ratio to the greenback, but without some form of actual collateral that should underpin its value, as is the case with Tether.”  Wow!! Jizzz chrizzz! Shits getting cereal",True,False,False,CryptoCurrency,t5_2wlj3,4860840,public,new,self,Luna founder’s wife under emergency protection after crypto market death spiral plunges coin to $0,0,[],1.0,https://www.reddit.com/r/CryptoCurrency/comments/uq7nx8/luna_founders_wife_under_emergency_protection/,,all_ads,6,1652597363.0,,,dark,,,,,,,,,,,,,
