,all_awardings,allow_live_comments,author,author_flair_css_class,author_flair_richtext,author_flair_text,author_flair_type,author_fullname,author_is_blocked,author_patreon_flair,author_premium,awarders,can_mod_post,contest_mode,created_utc,domain,full_link,gildings,id,is_created_from_ads_ui,is_crosspostable,is_meta,is_original_content,is_reddit_media_domain,is_robot_indexable,is_self,is_video,link_flair_background_color,link_flair_css_class,link_flair_richtext,link_flair_template_id,link_flair_text,link_flair_text_color,link_flair_type,locked,media_only,no_follow,num_comments,num_crossposts,over_18,parent_whitelist_status,permalink,pinned,pwls,retrieved_on,score,selftext,send_replies,spoiler,stickied,subreddit,subreddit_id,subreddit_subscribers,subreddit_type,suggested_sort,thumbnail,title,total_awards_received,treatment_tags,upvote_ratio,url,url_overridden_by_dest,whitelist_status,wls,created,post_hint,preview,thumbnail_height,thumbnail_width,author_flair_background_color,author_flair_text_color,removed_by_category,author_flair_template_id,media,media_embed,secure_media,secure_media_embed
0,[],False,KlausTooth,,[],,text,t2_j88u6fh8,False,False,False,[],False,False,1652975864,reddit.com,https://www.reddit.com/r/CryptoCurrency/comments/ut6k2x/do_kwon_fears_for_his_safety_following_terra_luna/,{},ut6k2x,False,True,False,False,False,True,False,False,#5a74cc,PERSPECTIVE,"[{'e': 'text', 't': 'PERSPECTIVE'}]",1b44cdb2-2a6c-11ec-9baf-0aa21184cd0a,PERSPECTIVE,light,richtext,False,False,True,0,0,False,all_ads,/r/CryptoCurrency/comments/ut6k2x/do_kwon_fears_for_his_safety_following_terra_luna/,False,6,1652975875,1,,True,False,False,CryptoCurrency,t5_2wlj3,4888931,public,new,default,Do Kwon fears for his safety following Terra (LUNA) implosion,0,[],1.0,https://www.reddit.com/r/CryptoCurrency/comments/ut6eov/do_kwon_fears_for_his_safety_following_terra_luna/,https://www.reddit.com/r/CryptoCurrency/comments/ut6eov/do_kwon_fears_for_his_safety_following_terra_luna/,all_ads,6,1652947064.0,,,,,,,,,,,,
1,[],False,NurseThrillkill,,[],,text,t2_nbf1ylnm,False,False,False,[],False,False,1652975243,cryptoslate.com,https://www.reddit.com/r/CryptoCurrency/comments/ut6cag/do_kwon_fears_for_his_safety_following_terra_luna/,{},ut6cag,False,True,False,False,False,True,False,False,,PRIVACY,"[{'e': 'text', 't': '🟢 PRIVACY'}]",,🟢 PRIVACY,dark,richtext,False,False,True,0,0,False,all_ads,/r/CryptoCurrency/comments/ut6cag/do_kwon_fears_for_his_safety_following_terra_luna/,False,6,1652975254,1,,True,False,False,CryptoCurrency,t5_2wlj3,4888881,public,new,https://b.thumbs.redditmedia.com/1MGiWxPUabfQtl3BJy8h9SL6TsL8KShnCwIfSH9HEuw.jpg,Do Kwon fears for his safety following Terra (LUNA) implosion,0,[],1.0,https://cryptoslate.com/do-kwon-fears-for-his-safety-following-terra-luna-implosion/,https://cryptoslate.com/do-kwon-fears-for-his-safety-following-terra-luna-implosion/,all_ads,6,1652946443.0,link,"{'enabled': False, 'images': [{'id': 'UZVj9SXvZ5NKH5QYxZzYNpjWFZIs47OeRV8zX24-DK8', 'resolutions': [{'height': 56, 'url': 'https://external-preview.redd.it/Vuux3aAOaxt56oKCBNJ3VJQz4A1y9v_2wR3oVTVRods.jpg?width=108&amp;crop=smart&amp;auto=webp&amp;s=e44248a2ea7cd79205996e0dc67cfa6de34117aa', 'width': 108}, {'height': 113, 'url': 'https://external-preview.redd.it/Vuux3aAOaxt56oKCBNJ3VJQz4A1y9v_2wR3oVTVRods.jpg?width=216&amp;crop=smart&amp;auto=webp&amp;s=cdfb60ef8562b9ba0770bf6b9454febc4d4b74a3', 'width': 216}, {'height': 168, 'url': 'https://external-preview.redd.it/Vuux3aAOaxt56oKCBNJ3VJQz4A1y9v_2wR3oVTVRods.jpg?width=320&amp;crop=smart&amp;auto=webp&amp;s=b0486facb75a0c997462586a4439dbf05108d527', 'width': 320}, {'height': 336, 'url': 'https://external-preview.redd.it/Vuux3aAOaxt56oKCBNJ3VJQz4A1y9v_2wR3oVTVRods.jpg?width=640&amp;crop=smart&amp;auto=webp&amp;s=5a7b495c9b9ffd25279ed54023624b666859b8dd', 'width': 640}, {'height': 504, 'url': 'https://external-preview.redd.it/Vuux3aAOaxt56oKCBNJ3VJQz4A1y9v_2wR3oVTVRods.jpg?width=960&amp;crop=smart&amp;auto=webp&amp;s=c5b1b9e00b10e852d61f8decb2ce1863e1eb3ef7', 'width': 960}, {'height': 567, 'url': 'https://external-preview.redd.it/Vuux3aAOaxt56oKCBNJ3VJQz4A1y9v_2wR3oVTVRods.jpg?width=1080&amp;crop=smart&amp;auto=webp&amp;s=6693e50d4a29b0e329c48876ae6bc40ca4426490', 'width': 1080}], 'source': {'height': 630, 'url': 'https://external-preview.redd.it/Vuux3aAOaxt56oKCBNJ3VJQz4A1y9v_2wR3oVTVRods.jpg?auto=webp&amp;s=c41b456c2b8d9010048d1bb6ec81b70c78e55c6d', 'width': 1200}, 'variants': {}}]}",73.0,140.0,,,,,,,,
2,[],False,PaperProfit,Warning-level2-2,"[{'e': 'text', 't': 'Tin'}]",Tin,richtext,t2_5xfhjzfw,False,False,False,[],False,False,1652973835,self.CryptoCurrency,https://www.reddit.com/r/CryptoCurrency/comments/ut5u8r/what_happens_to_terra_luna_after_the_fork/,{},ut5u8r,False,False,False,False,False,False,True,False,#add2e2,ADVICE,"[{'e': 'text', 't': 'ANALYSIS'}]",c1034ee6-9c2a-11e3-a8c4-12313b0e8e20,ANALYSIS,dark,richtext,False,False,True,1,0,False,all_ads,/r/CryptoCurrency/comments/ut5u8r/what_happens_to_terra_luna_after_the_fork/,False,6,1652973846,1,[removed],True,False,False,CryptoCurrency,t5_2wlj3,4888805,public,new,self,What happens to TERRA (LUNA) after the fork?,0,[],1.0,https://www.reddit.com/r/CryptoCurrency/comments/ut5u8r/what_happens_to_terra_luna_after_the_fork/,,all_ads,6,1652945035.0,,,,,,dark,moderator,,,,,
3,[],False,madmoonboy,Warning-level2-2,"[{'e': 'text', 't': 'Tin | r/WSB 20'}]",Tin | r/WSB 20,richtext,t2_ay5qnjxb,False,False,False,[],False,False,1652972107,self.CryptoCurrency,https://www.reddit.com/r/CryptoCurrency/comments/ut586v/bullish_on_crypto_long_term_but_worried_short_term/,{},ut586v,False,True,False,False,False,True,True,False,#7193ff,DISCUSSION,"[{'e': 'text', 't': 'DISCUSSION'}]",87049662-0882-11e5-82e1-0e9d1a9f7761,DISCUSSION,dark,richtext,False,False,True,0,0,False,all_ads,/r/CryptoCurrency/comments/ut586v/bullish_on_crypto_long_term_but_worried_short_term/,False,6,1652972118,1,"Yo homies!!! How's everyone doing today? I'll try to keep this as short as possible but long enough that this post won't get taken down lol 


Soooo, I am extremely bullish on cryptocurrency as a whole and I will continue to invest in this space until the wheels fall off I guess... I've been here since 2020 and I've seen a bull run and that just got me hooked (who doesn't like watching a 30% gain in a day) 

I have ETH, AVAX, SHIB, BTC AND APE in my portfolio currently... With AVAX being my second biggest holding. My question is ... 

Do you think AVAX will survive this bear market?

I did alot of research and I think the tokenomics are great and the project has alot of potential BUT this -80% drop has been hard on the soul. Plus the tie to Terra Luna makes me really nervous.  I know alot of coins die in bear markets and only few survive.  


WILL AVAX SURVIVE THIS BEAR MARKET? SHOULD I CONTINUE TO DCA OR COUNT MY LOSSES AND CONVERT INTO ETH? 

thank you",True,False,False,CryptoCurrency,t5_2wlj3,4888682,public,new,self,bullish on crypto long term but worried short term,0,[],1.0,https://www.reddit.com/r/CryptoCurrency/comments/ut586v/bullish_on_crypto_long_term_but_worried_short_term/,,all_ads,6,1652943307.0,,,,,,dark,,,,,,
4,[],False,sportifynews,Warning-level1,"[{'e': 'text', 't': '1 - 2 years account age. 100 - 200 comment karma.'}]",1 - 2 years account age. 100 - 200 comment karma.,richtext,t2_81vkr2em,False,False,False,[],False,False,1652964789,bigthinkbuzz.com,https://www.reddit.com/r/CryptoCurrency/comments/ut2ro4/terra_revival_plan_receives_early_support_from/,{},ut2ro4,False,True,False,False,False,True,False,False,#7193ff,DISCUSSION,"[{'e': 'text', 't': 'DISCUSSION'}]",87049662-0882-11e5-82e1-0e9d1a9f7761,DISCUSSION,dark,richtext,False,False,True,0,0,False,all_ads,/r/CryptoCurrency/comments/ut2ro4/terra_revival_plan_receives_early_support_from/,False,6,1652964800,1,,True,False,False,CryptoCurrency,t5_2wlj3,4888183,public,new,default,Terra Revival Plan Receives Early Support From LUNA Holders in Proposal Vote,0,[],1.0,https://bigthinkbuzz.com/terra-revival-plan-receives-early-support-from-luna-holders-in-proposal-vote/,https://bigthinkbuzz.com/terra-revival-plan-receives-early-support-from-luna-holders-in-proposal-vote/,all_ads,6,1652935989.0,,,,,,dark,,,,,,
5,[],False,trrrring,,"[{'e': 'text', 't': 'Platinum | QC: CC 174'}]",Platinum | QC: CC 174,richtext,t2_5l34ukzy,False,False,False,[],False,False,1652954570,businesstoday.in,https://www.reddit.com/r/CryptoCurrency/comments/ut00qv/why_is_burnluna_trending_how_will_it_help_the/,{},ut00qv,False,False,False,False,False,False,False,False,#0aa18f,NEWS,"[{'e': 'text', 't': 'GENERAL-NEWS'}]",f170aab2-246f-11ec-8143-429a193c9848,GENERAL-NEWS,light,richtext,False,False,True,0,0,False,all_ads,/r/CryptoCurrency/comments/ut00qv/why_is_burnluna_trending_how_will_it_help_the/,False,6,1652954580,1,,True,False,False,CryptoCurrency,t5_2wlj3,4887691,public,,default,Why is #BurnLuna trending? How will it help the Terra ecosystem?,0,[],1.0,https://www.businesstoday.in/crypto/story/why-is-burnluna-trending-how-will-it-help-the-terra-ecosystem-334238-2022-05-19,https://www.businesstoday.in/crypto/story/why-is-burnluna-trending-how-will-it-help-the-terra-ecosystem-334238-2022-05-19,all_ads,6,1652925770.0,,,,,,dark,automod_filtered,,,,,
6,[],False,Bpool91,,"[{'e': 'text', 't': 'Silver | QC: CC 286, ALGO 17 | CRO 61 | ExchSubs 61'}]","Silver | QC: CC 286, ALGO 17 | CRO 61 | ExchSubs 61",richtext,t2_5cv2by07,False,False,False,[],False,False,1652953187,self.CryptoCurrency,https://www.reddit.com/r/CryptoCurrency/comments/uszpfh/billionaire_founder_of_crypto_exchange_binance/,{},uszpfh,False,True,False,False,False,True,True,False,#0aa18f,NEWS,"[{'e': 'text', 't': 'GENERAL-NEWS'}]",f170aab2-246f-11ec-8143-429a193c9848,GENERAL-NEWS,light,richtext,False,False,True,0,0,False,all_ads,/r/CryptoCurrency/comments/uszpfh/billionaire_founder_of_crypto_exchange_binance/,False,6,1652953198,1,"Crypto exchange Binance's founder Changpeng Zhao tweeted ""poor again"" after crypto-token luna crashed.

Binance's holdings of the coin were once worth $1.6 billion but are now worth about $2,200.

According to Bloomberg estimates, Zhao is still a billionaire and Binance is the world's largest crypto exchange.

Chanpeng Zhao, the wealthy founder of crypto exchange Binance, joked on Tuesday that he was ""poor again"" after the exchange's investments in the luna cryptocurrency crashed from $1.6 billion just a month ago to about $2,200 this week.

In a tweet on Monday, Zhao said that Binance, the world's largest crypto exchange, held 15 million luna tokens. Binance received these tokens in exchange for its $3 million investment in 2018 into the Terra network that luna is based on. Its luna tokens were ""never moved or sold"" as of Monday, according to Zhao.

Insider has reached out to Zhao for comment.

Binance's luna holdings were worth $1.6 billion in early April when the token hit its peak price. But its recent crash saw that value shrink to about $2,200 this week. The coin is trading at about $0.0001468 as of Thursday.

Luna's value has rapidly plunged in the past two weeks.

Its implosion started when its sister token, TerraUSD, lost its peg to the US dollar two weeks ago. The two tokens' valuations are tied to each other. When TerraUSD's price fell, investors rushed to dump their holdings of that token in a scenario similar to a bank run. TerraUSD's plunge, in turn, dragged down luna's price.

The two tokens' free fall was estimated to have wiped out more than $50 billion in paper value, Insider reported on Sunday.

Zhao on Monday urged the Terra team to reimburse its retail investors first. ""To lead by example on PROTECTING USERS, Binance will let this go and ask the Terra project team to compensate the retail users first, Binance last, if ever,"" he tweeted.

Despite his comments, Zhao, 45, definitely isn't broke. He has a net worth of about $14.8 billion as of Thursday, based on Bloomberg's estimates. The majority of his wealth likely comes from his estimated 70% stake in Binance, according to Forbes.

Binance's market value is estimated to be six times that of its nearest competitor, Coinbase, Forbes reported in March. Binance took in about $14.6 billion in trading fees last year, according to MarketWatch, which quoted a report published by financial-services consultancy Opimas.

[Link to article](https://finance.yahoo.com/news/billionaire-founder-crypto-exchange-binance-053545416.html?guce_referrer=aHR0cHM6Ly93d3cuZ29vZ2xlLmNvbS8&amp;guce_referrer_sig=AQAAALFH3L7c43bliGkj2pzGQ2bnmwZkhZOUw8wOODnWP7rOug-rVdmlNVXr5iOV5LR0hw2eJphkCcJlULvX8xJrZR95Vhf8qxh_w7y0_vKxyOzkAFMWPL3T33lFviMttSiPYrensst7LnyZva_aeyA8GBlu_m7BkH4mLKJaEUQ736LF)",True,False,False,CryptoCurrency,t5_2wlj3,4887620,public,,self,"Billionaire founder of crypto exchange Binance says he's 'poor again' after its luna holdings — once worth $1.6 billion — crashed and are now worth just $2,200",0,[],1.0,https://www.reddit.com/r/CryptoCurrency/comments/uszpfh/billionaire_founder_of_crypto_exchange_binance/,,all_ads,6,1652924387.0,self,"{'enabled': False, 'images': [{'id': '7IXs2kmGOi0FAsQMy8gMX5Ez3HRwXG04Pztq29g2JmA', 'resolutions': [{'height': 81, 'url': 'https://external-preview.redd.it/FhrAscbjPbKLyS8mIAluyY5ISL7CahI7Ka9kiOQmrtc.jpg?width=108&amp;crop=smart&amp;auto=webp&amp;s=54b7528e979495d236c4350873421ce3be5a9562', 'width': 108}, {'height': 162, 'url': 'https://external-preview.redd.it/FhrAscbjPbKLyS8mIAluyY5ISL7CahI7Ka9kiOQmrtc.jpg?width=216&amp;crop=smart&amp;auto=webp&amp;s=32e66cd85f9af9c22ecd5757d16203ad1e34ad3e', 'width': 216}, {'height': 240, 'url': 'https://external-preview.redd.it/FhrAscbjPbKLyS8mIAluyY5ISL7CahI7Ka9kiOQmrtc.jpg?width=320&amp;crop=smart&amp;auto=webp&amp;s=049a1b5ea0bed80380e3f296e7b1e9a52b5ff728', 'width': 320}, {'height': 480, 'url': 'https://external-preview.redd.it/FhrAscbjPbKLyS8mIAluyY5ISL7CahI7Ka9kiOQmrtc.jpg?width=640&amp;crop=smart&amp;auto=webp&amp;s=6bd2e38e1178cfa6dc3ae12f9c5c68e610d47291', 'width': 640}, {'height': 720, 'url': 'https://external-preview.redd.it/FhrAscbjPbKLyS8mIAluyY5ISL7CahI7Ka9kiOQmrtc.jpg?width=960&amp;crop=smart&amp;auto=webp&amp;s=807fbd5ea99d6409c08cbd402994806c8f845e7c', 'width': 960}, {'height': 810, 'url': 'https://external-preview.redd.it/FhrAscbjPbKLyS8mIAluyY5ISL7CahI7Ka9kiOQmrtc.jpg?width=1080&amp;crop=smart&amp;auto=webp&amp;s=be07fbd4923581082d02aeb0860b79e97849448d', 'width': 1080}], 'source': {'height': 900, 'url': 'https://external-preview.redd.it/FhrAscbjPbKLyS8mIAluyY5ISL7CahI7Ka9kiOQmrtc.jpg?auto=webp&amp;s=6064865ba94123986bed0471d595208f2c543c0a', 'width': 1200}, 'variants': {}}]}",,,,dark,,,,,,
7,[],False,Lewis_0683,,"[{'e': 'text', 't': 'Platinum | QC: CC 254, BTC 37 | ADA 5'}]","Platinum | QC: CC 254, BTC 37 | ADA 5",richtext,t2_a7vr0963,False,False,False,[],False,False,1652950093,coingape.com,https://www.reddit.com/r/CryptoCurrency/comments/usz166/luna_ust_volatility_spikes_as_voting_on_terra/,{},usz166,False,False,False,False,False,False,False,False,#014980,UPDATE,"[{'e': 'text', 't': 'PROJECT-UPDATE'}]",0de51794-8fa8-11eb-8c8b-0e387731294b,PROJECT-UPDATE,light,richtext,False,False,True,0,0,False,all_ads,/r/CryptoCurrency/comments/usz166/luna_ust_volatility_spikes_as_voting_on_terra/,False,6,1652950103,1,,True,False,False,CryptoCurrency,t5_2wlj3,4887488,public,,default,"LUNA, UST Volatility Spikes As Voting On Terra Fork Begins",0,[],1.0,https://coingape.com/luna-ust-volatility-spikes-as-voting-on-terra-fork-begins/,https://coingape.com/luna-ust-volatility-spikes-as-voting-on-terra-fork-begins/,all_ads,6,1652921293.0,,,,,,dark,reddit,,,,,
8,[],False,rexkoner,Transitioning,"[{'e': 'text', 't': ' '}]", ,richtext,t2_mpstk,False,False,False,[],False,False,1652949088,xangle.io,https://www.reddit.com/r/CryptoCurrency/comments/usyti1/the_terra_exodus_c2x_considering_mainnet_migration/,{},usyti1,False,True,False,False,False,True,False,False,#0aa18f,NEWS,"[{'e': 'text', 't': 'GENERAL-NEWS'}]",f170aab2-246f-11ec-8143-429a193c9848,GENERAL-NEWS,light,richtext,False,False,True,0,0,False,all_ads,/r/CryptoCurrency/comments/usyti1/the_terra_exodus_c2x_considering_mainnet_migration/,False,6,1652949098,1,,True,False,False,CryptoCurrency,t5_2wlj3,4887443,public,,default,The Terra Exodus? C2X Considering Mainnet Migration,0,[],1.0,https://xangle.io/en/research/62835b7c62e90309da6c5366,https://xangle.io/en/research/62835b7c62e90309da6c5366,all_ads,6,1652920288.0,,,,,,dark,,,,,,
9,[],False,CrackDonald,Warning-level2-2,"[{'e': 'text', 't': 'Tin'}]",Tin,richtext,t2_xnjto,False,False,False,[],False,False,1652946991,news.bitcoin.com,https://www.reddit.com/r/CryptoCurrency/comments/usyd2y/after_getting_a_luna_tatoo_on_his_body/,{},usyd2y,False,True,False,False,False,True,False,False,#cc8b00,ANECDOTAL,"[{'e': 'text', 't': 'ANECDOTAL'}]",613cabf0-1d90-11e4-953d-12313b0eb482,ANECDOTAL,light,richtext,False,False,True,0,0,False,all_ads,/r/CryptoCurrency/comments/usyd2y/after_getting_a_luna_tatoo_on_his_body/,False,6,1652947002,1,,True,False,False,CryptoCurrency,t5_2wlj3,4887332,public,,https://b.thumbs.redditmedia.com/n9nBSOQHa3ghrtw1HWc0orjpnFCKJO8upKxkEBR3BdM.jpg,After getting a LUNA Tatoo on his Body: Billionaire Investor and Galaxy Digital CEO Mike Novogratz Addresses the Terra LUNA and UST Fallout,0,[],1.0,https://news.bitcoin.com/billionaire-investor-and-galaxy-digital-ceo-mike-novogratz-addresses-the-terra-luna-and-ust-fallout/?fbclid=IwAR36u-Vqzsd8AqaoXcqEVsfv8neVIGCszVNved8xDq3Ah8ZBh2tDPP0JeWs,https://news.bitcoin.com/billionaire-investor-and-galaxy-digital-ceo-mike-novogratz-addresses-the-terra-luna-and-ust-fallout/?fbclid=IwAR36u-Vqzsd8AqaoXcqEVsfv8neVIGCszVNved8xDq3Ah8ZBh2tDPP0JeWs,all_ads,6,1652918191.0,link,"{'enabled': False, 'images': [{'id': 'q4Ytok0CMYTtJxnT8y5RGCnqkJSRtS1VDs3Oi5CK5aM', 'resolutions': [{'height': 60, 'url': 'https://external-preview.redd.it/vYlDvjrQ6JAKtik92TqhGFeCRw6fIspIltxkNs-Q-Rk.jpg?width=108&amp;crop=smart&amp;auto=webp&amp;s=4cc0828135c817bd5a47cf357d7f6c9e04c8b1a3', 'width': 108}, {'height': 121, 'url': 'https://external-preview.redd.it/vYlDvjrQ6JAKtik92TqhGFeCRw6fIspIltxkNs-Q-Rk.jpg?width=216&amp;crop=smart&amp;auto=webp&amp;s=85e339823e6ca06e8df81de4f8cfeedecf6ecb8b', 'width': 216}, {'height': 180, 'url': 'https://external-preview.redd.it/vYlDvjrQ6JAKtik92TqhGFeCRw6fIspIltxkNs-Q-Rk.jpg?width=320&amp;crop=smart&amp;auto=webp&amp;s=dc5b5ee68f40a9a4e58aaf8f65f96a8db420c0fe', 'width': 320}, {'height': 360, 'url': 'https://external-preview.redd.it/vYlDvjrQ6JAKtik92TqhGFeCRw6fIspIltxkNs-Q-Rk.jpg?width=640&amp;crop=smart&amp;auto=webp&amp;s=cba14eedf1324920a70328652c23ec399e08a3de', 'width': 640}, {'height': 540, 'url': 'https://external-preview.redd.it/vYlDvjrQ6JAKtik92TqhGFeCRw6fIspIltxkNs-Q-Rk.jpg?width=960&amp;crop=smart&amp;auto=webp&amp;s=5224eb21e15cbc3f973cae0e405499e42ac514f6', 'width': 960}, {'height': 607, 'url': 'https://external-preview.redd.it/vYlDvjrQ6JAKtik92TqhGFeCRw6fIspIltxkNs-Q-Rk.jpg?width=1080&amp;crop=smart&amp;auto=webp&amp;s=71899ce2197098a4ccf15e7cfc0f5e005039c602', 'width': 1080}], 'source': {'height': 720, 'url': 'https://external-preview.redd.it/vYlDvjrQ6JAKtik92TqhGFeCRw6fIspIltxkNs-Q-Rk.jpg?auto=webp&amp;s=a96db5aeb7757a90c844c2f8787af6cdb4c92a44', 'width': 1280}, 'variants': {}}]}",78.0,140.0,,dark,,,,,,
10,[],False,spinningfinger,Warning-level2-2,"[{'e': 'text', 't': 'Tin | VET 44'}]",Tin | VET 44,richtext,t2_4egmzxr,False,False,False,[],False,False,1652935136,self.CryptoCurrency,https://www.reddit.com/r/CryptoCurrency/comments/usvgrz/terra_lunas_market_cap_is_still_a_billion_dollars/,{},usvgrz,False,False,False,False,False,False,True,False,#5a74cc,PERSPECTIVE,"[{'e': 'text', 't': 'PERSPECTIVE'}]",1b44cdb2-2a6c-11ec-9baf-0aa21184cd0a,PERSPECTIVE,light,richtext,False,False,True,1,0,False,all_ads,/r/CryptoCurrency/comments/usvgrz/terra_lunas_market_cap_is_still_a_billion_dollars/,False,6,1652935146,1,[removed],True,False,False,CryptoCurrency,t5_2wlj3,4886711,public,,self,"Terra Luna's market cap is still a billion dollars, which is about a billion dollars more in market cap than like 3/5th of my portfolio",0,[],1.0,https://www.reddit.com/r/CryptoCurrency/comments/usvgrz/terra_lunas_market_cap_is_still_a_billion_dollars/,,all_ads,6,1652906336.0,,,,,,dark,moderator,,,,,
11,[],False,GabeSter,,"[{'e': 'text', 't': 'Platinum | QC: DOGE 2465, CC 701'}]","Platinum | QC: DOGE 2465, CC 701",richtext,t2_6sqq4,False,False,True,[],False,False,1652933508,self.CryptoCurrency,https://www.reddit.com/r/CryptoCurrency/comments/usv0oh/everything_you_didnt_want_to_know_about_terra_but/,{},usv0oh,False,False,False,False,False,False,True,False,#7193ff,DISCUSSION,"[{'e': 'text', 't': 'DISCUSSION'}]",87049662-0882-11e5-82e1-0e9d1a9f7761,DISCUSSION,dark,richtext,False,False,True,2,0,False,all_ads,/r/CryptoCurrency/comments/usv0oh/everything_you_didnt_want_to_know_about_terra_but/,False,6,1652933519,1,[removed],True,False,False,CryptoCurrency,t5_2wlj3,4886625,public,,self,Everything you didn't want to know about Terra but probably should know (since my last update),0,[],1.0,https://www.reddit.com/r/CryptoCurrency/comments/usv0oh/everything_you_didnt_want_to_know_about_terra_but/,,all_ads,6,1652904708.0,self,"{'enabled': False, 'images': [{'id': 'NIxlUHo3kRE2aY70B_O2p0PsyTNQl7wVXGzNNJTF7wg', 'resolutions': [{'height': 108, 'url': 'https://external-preview.redd.it/uFjrY9x5UUCySWekH2Xqs8AoGfe6n5uvwEG185RsGcc.jpg?width=108&amp;crop=smart&amp;auto=webp&amp;s=f8fe3bf5dab3441a2f30b57151da87f277007b04', 'width': 108}], 'source': {'height': 140, 'url': 'https://external-preview.redd.it/uFjrY9x5UUCySWekH2Xqs8AoGfe6n5uvwEG185RsGcc.jpg?auto=webp&amp;s=9ee0fbecdcd0e7fd651f9f6f277e068727045d99', 'width': 140}, 'variants': {}}]}",,,,dark,moderator,,,,,
12,[],False,sportifynews,Warning-level1,"[{'e': 'text', 't': '1 - 2 years account age. 100 - 200 comment karma.'}]",1 - 2 years account age. 100 - 200 comment karma.,richtext,t2_81vkr2em,False,False,False,[],False,False,1652932581,bigthinkbuzz.com,https://www.reddit.com/r/CryptoCurrency/comments/usuqzw/terra_luna_founder_do_kwon_faces_78m_fine_for_tax/,{},usuqzw,False,True,False,False,False,True,False,False,#7193ff,DISCUSSION,"[{'e': 'text', 't': 'DISCUSSION'}]",87049662-0882-11e5-82e1-0e9d1a9f7761,DISCUSSION,dark,richtext,False,False,True,1,0,False,all_ads,/r/CryptoCurrency/comments/usuqzw/terra_luna_founder_do_kwon_faces_78m_fine_for_tax/,False,6,1652932591,1,,True,False,False,CryptoCurrency,t5_2wlj3,4886579,public,,default,Terra (LUNA) Founder Do Kwon Faces $78M Fine For Tax Evasion,0,[],1.0,https://bigthinkbuzz.com/terra-luna-founder-do-kwon-faces-78m-fine-for-tax-evasion/,https://bigthinkbuzz.com/terra-luna-founder-do-kwon-faces-78m-fine-for-tax-evasion/,all_ads,6,1652903781.0,,,,,,dark,,,,,,
13,[],False,HomieApathy, Monero,[],,text,t2_biay7,False,False,False,[],False,False,1652930683,news.bitcoin.com,https://www.reddit.com/r/CryptoCurrency/comments/usu6sd/billionaire_investor_and_galaxy_digital_ceo_mike/,{},usu6sd,False,True,False,False,False,True,False,False,#0aa18f,NEWS,"[{'e': 'text', 't': 'GENERAL-NEWS'}]",f170aab2-246f-11ec-8143-429a193c9848,GENERAL-NEWS,light,richtext,False,False,True,0,0,False,all_ads,/r/CryptoCurrency/comments/usu6sd/billionaire_investor_and_galaxy_digital_ceo_mike/,False,6,1652930693,1,,True,False,False,CryptoCurrency,t5_2wlj3,4886469,public,new,https://b.thumbs.redditmedia.com/n9nBSOQHa3ghrtw1HWc0orjpnFCKJO8upKxkEBR3BdM.jpg,Billionaire Investor and Galaxy Digital CEO Mike Novogratz Addresses the Terra LUNA and UST Fallout – Bitcoin News,0,[],1.0,https://news.bitcoin.com/billionaire-investor-and-galaxy-digital-ceo-mike-novogratz-addresses-the-terra-luna-and-ust-fallout/,https://news.bitcoin.com/billionaire-investor-and-galaxy-digital-ceo-mike-novogratz-addresses-the-terra-luna-and-ust-fallout/,all_ads,6,1652901883.0,link,"{'enabled': False, 'images': [{'id': 'q4Ytok0CMYTtJxnT8y5RGCnqkJSRtS1VDs3Oi5CK5aM', 'resolutions': [{'height': 60, 'url': 'https://external-preview.redd.it/vYlDvjrQ6JAKtik92TqhGFeCRw6fIspIltxkNs-Q-Rk.jpg?width=108&amp;crop=smart&amp;auto=webp&amp;s=4cc0828135c817bd5a47cf357d7f6c9e04c8b1a3', 'width': 108}, {'height': 121, 'url': 'https://external-preview.redd.it/vYlDvjrQ6JAKtik92TqhGFeCRw6fIspIltxkNs-Q-Rk.jpg?width=216&amp;crop=smart&amp;auto=webp&amp;s=85e339823e6ca06e8df81de4f8cfeedecf6ecb8b', 'width': 216}, {'height': 180, 'url': 'https://external-preview.redd.it/vYlDvjrQ6JAKtik92TqhGFeCRw6fIspIltxkNs-Q-Rk.jpg?width=320&amp;crop=smart&amp;auto=webp&amp;s=dc5b5ee68f40a9a4e58aaf8f65f96a8db420c0fe', 'width': 320}, {'height': 360, 'url': 'https://external-preview.redd.it/vYlDvjrQ6JAKtik92TqhGFeCRw6fIspIltxkNs-Q-Rk.jpg?width=640&amp;crop=smart&amp;auto=webp&amp;s=cba14eedf1324920a70328652c23ec399e08a3de', 'width': 640}, {'height': 540, 'url': 'https://external-preview.redd.it/vYlDvjrQ6JAKtik92TqhGFeCRw6fIspIltxkNs-Q-Rk.jpg?width=960&amp;crop=smart&amp;auto=webp&amp;s=5224eb21e15cbc3f973cae0e405499e42ac514f6', 'width': 960}, {'height': 607, 'url': 'https://external-preview.redd.it/vYlDvjrQ6JAKtik92TqhGFeCRw6fIspIltxkNs-Q-Rk.jpg?width=1080&amp;crop=smart&amp;auto=webp&amp;s=71899ce2197098a4ccf15e7cfc0f5e005039c602', 'width': 1080}], 'source': {'height': 720, 'url': 'https://external-preview.redd.it/vYlDvjrQ6JAKtik92TqhGFeCRw6fIspIltxkNs-Q-Rk.jpg?auto=webp&amp;s=a96db5aeb7757a90c844c2f8787af6cdb4c92a44', 'width': 1280}, 'variants': {}}]}",78.0,140.0,,dark,,,,,,
