23,[],False,bc7915dawg,,"[{'e': 'text', 't': 'Silver | QC: CC 52 | NANO 982'}]",Silver | QC: CC 52 | NANO 982,richtext,t2_9wmstfej,False,False,False,[],False,False,1652894964,coinjournal.net,https://www.reddit.com/r/CryptoCurrency/comments/usi5a2/uk_enroute_to_legalize_stable_coins_following/,{},usi5a2,False,True,False,False,False,True,False,False,#7193ff,DISCUSSION,"[{'e': 'text', 't': 'DISCUSSION'}]",87049662-0882-11e5-82e1-0e9d1a9f7761,DISCUSSION,dark,richtext,False,False,True,0,0,False,all_ads,/r/CryptoCurrency/comments/usi5a2/uk_enroute_to_legalize_stable_coins_following/,False,6,1652894974,1,,True,False,False,CryptoCurrency,t5_2wlj3,4884120,public,new,https://b.thumbs.redditmedia.com/qVBh1GaDCZQBNTlb4WxysCl3Kn1zbjytOfxobWHS-Do.jpg,UK en-route to legalize stable coins following Terra collapse,0,[],1.0,https://coinjournal.net/news/uk-en-route-to-legalize-stable-coins-following-terra-collapse/,https://coinjournal.net/news/uk-en-route-to-legalize-stable-coins-following-terra-collapse/,all_ads,6,1652866164.0,link,"{'enabled': False, 'images': [{'id': 'ZXyeJlBWQ1O3sibl8JzJgN75qKh1nK8kaYr5jUWU1m0', 'resolutions': [{'height': 71, 'url': 'https://external-preview.redd.it/6tRo_GdznZ7gl_LxFBeEYtMP4geu1qmOyH7yjpsvR1c.jpg?width=108&amp;crop=smart&amp;auto=webp&amp;s=582b6ee03cce049b93174db0b45224ae799ea58e', 'width': 108}, {'height': 143, 'url': 'https://external-preview.redd.it/6tRo_GdznZ7gl_LxFBeEYtMP4geu1qmOyH7yjpsvR1c.jpg?width=216&amp;crop=smart&amp;auto=webp&amp;s=a9123eb29ca6ee86de39c4c20ae5602c7c3da12e', 'width': 216}, {'height': 212, 'url': 'https://external-preview.redd.it/6tRo_GdznZ7gl_LxFBeEYtMP4geu1qmOyH7yjpsvR1c.jpg?width=320&amp;crop=smart&amp;auto=webp&amp;s=c60bcf3ebd0adeb1e2b56890c0f38cf57e2c513c', 'width': 320}, {'height': 425, 'url': 'https://external-preview.redd.it/6tRo_GdznZ7gl_LxFBeEYtMP4geu1qmOyH7yjpsvR1c.jpg?width=640&amp;crop=smart&amp;auto=webp&amp;s=9cb181a249e729a43fb4fabe800058b5a5253431', 'width': 640}, {'height': 638, 'url': 'https://external-preview.redd.it/6tRo_GdznZ7gl_LxFBeEYtMP4geu1qmOyH7yjpsvR1c.jpg?width=960&amp;crop=smart&amp;auto=webp&amp;s=18dc7e1d1308ad5a27f843574c7e2381809d33b9', 'width': 960}, {'height': 718, 'url': 'https://external-preview.redd.it/6tRo_GdznZ7gl_LxFBeEYtMP4geu1qmOyH7yjpsvR1c.jpg?width=1080&amp;crop=smart&amp;auto=webp&amp;s=e685a0e5e4d3948c5cf1cb1449ca02929851fe2b', 'width': 1080}], 'source': {'height': 895, 'url': 'https://external-preview.redd.it/6tRo_GdznZ7gl_LxFBeEYtMP4geu1qmOyH7yjpsvR1c.jpg?auto=webp&amp;s=44e2d1aced784dd85ac59b9cd7c4f5a17607e2ef', 'width': 1345}, 'variants': {}}]}",93.0,140.0,,dark,,,,,,
24,[],False,AdLoose1615,,[],,text,t2_fo2w7wkt,False,False,False,[],False,False,1652894403,youtu.be,https://www.reddit.com/r/CryptoCurrency/comments/ushy1l/terra_luna_updated_revival_plan_honest_thoughts/,{},ushy1l,False,True,False,False,False,True,False,False,#0dd3bb,VIDEOS,"[{'e': 'text', 't': 'VIDEOS'}]",fee6c918-f3e4-11e5-8172-0ecf7e00c6db,VIDEOS,dark,richtext,False,False,True,0,0,False,all_ads,/r/CryptoCurrency/comments/ushy1l/terra_luna_updated_revival_plan_honest_thoughts/,False,6,1652894413,1,,True,False,False,CryptoCurrency,t5_2wlj3,4884079,public,new,https://b.thumbs.redditmedia.com/lcWpBFzzhyfdgs8IbcmgYNDN_0Z_x6gdKMEwfrOWIvY.jpg,TERRA LUNA - UPDATED REVIVAL PLAN! Honest Thoughts?,0,[],1.0,https://youtu.be/NCEOBgITKmI,https://youtu.be/NCEOBgITKmI,all_ads,6,1652865603.0,rich:video,"{'enabled': False, 'images': [{'id': 'u4KCtATtWZ2DUZZgbd9x-op1nOnaIZx-RblWKF4WeZI', 'resolutions': [{'height': 81, 'url': 'https://external-preview.redd.it/h31f1zCSPiR626JcTsBRTBsmctmHlGkKvvdee4N8HD0.jpg?width=108&amp;crop=smart&amp;auto=webp&amp;s=e79349043bb4fd7fb684ff165c6adb0040975a8a', 'width': 108}, {'height': 162, 'url': 'https://external-preview.redd.it/h31f1zCSPiR626JcTsBRTBsmctmHlGkKvvdee4N8HD0.jpg?width=216&amp;crop=smart&amp;auto=webp&amp;s=5793251c747bf61ab9e39fdf3524ab91e3ed688e', 'width': 216}, {'height': 240, 'url': 'https://external-preview.redd.it/h31f1zCSPiR626JcTsBRTBsmctmHlGkKvvdee4N8HD0.jpg?width=320&amp;crop=smart&amp;auto=webp&amp;s=da4bf8621854d37077ff830c552d69f8ac1cdbd7', 'width': 320}], 'source': {'height': 360, 'url': 'https://external-preview.redd.it/h31f1zCSPiR626JcTsBRTBsmctmHlGkKvvdee4N8HD0.jpg?auto=webp&amp;s=2abb3df9ca21f14f528d8f6798e7e14ad9a24871', 'width': 480}, 'variants': {}}]}",105.0,140.0,,,,,"{'oembed': {'author_name': 'CryptoKing Tokenomics', 'author_url': 'https://www.youtube.com/channel/UC7om99rCdGSyDNvkPnLlfpQ', 'height': 200, 'html': '&lt;iframe width=""356"" height=""200"" src=""https://www.youtube.com/embed/NCEOBgITKmI?feature=oembed&amp;enablejsapi=1"" frameborder=""0"" allow=""accelerometer; autoplay; clipboard-write; encrypted-media; gyroscope; picture-in-picture"" allowfullscreen&gt;&lt;/iframe&gt;', 'provider_name': 'YouTube', 'provider_url': 'https://www.youtube.com/', 'thumbnail_height': 360, 'thumbnail_url': 'https://i.ytimg.com/vi/NCEOBgITKmI/hqdefault.jpg', 'thumbnail_width': 480, 'title': 'TERRA LUNA - NEW UPDATED REVIVAL PLAN! This Is UNREAL!', 'type': 'video', 'version': '1.0', 'width': 356}, 'type': 'youtube.com'}","{'content': '&lt;iframe width=""356"" height=""200"" src=""https://www.youtube.com/embed/NCEOBgITKmI?feature=oembed&amp;enablejsapi=1"" frameborder=""0"" allow=""accelerometer; autoplay; clipboard-write; encrypted-media; gyroscope; picture-in-picture"" allowfullscreen&gt;&lt;/iframe&gt;', 'height': 200, 'scrolling': False, 'width': 356}","{'oembed': {'author_name': 'CryptoKing Tokenomics', 'author_url': 'https://www.youtube.com/channel/UC7om99rCdGSyDNvkPnLlfpQ', 'height': 200, 'html': '&lt;iframe width=""356"" height=""200"" src=""https://www.youtube.com/embed/NCEOBgITKmI?feature=oembed&amp;enablejsapi=1"" frameborder=""0"" allow=""accelerometer; autoplay; clipboard-write; encrypted-media; gyroscope; picture-in-picture"" allowfullscreen&gt;&lt;/iframe&gt;', 'provider_name': 'YouTube', 'provider_url': 'https://www.youtube.com/', 'thumbnail_height': 360, 'thumbnail_url': 'https://i.ytimg.com/vi/NCEOBgITKmI/hqdefault.jpg', 'thumbnail_width': 480, 'title': 'TERRA LUNA - NEW UPDATED REVIVAL PLAN! This Is UNREAL!', 'type': 'video', 'version': '1.0', 'width': 356}, 'type': 'youtube.com'}","{'content': '&lt;iframe width=""356"" height=""200"" src=""https://www.youtube.com/embed/NCEOBgITKmI?feature=oembed&amp;enablejsapi=1"" frameborder=""0"" allow=""accelerometer; autoplay; clipboard-write; encrypted-media; gyroscope; picture-in-picture"" allowfullscreen&gt;&lt;/iframe&gt;', 'height': 200, 'media_domain_url': 'https://www.redditmedia.com/mediaembed/ushy1l', 'scrolling': False, 'width': 356}"
25,[],False,AncestralMano, Moon,"[{'e': 'text', 't': ' call me Moon Samurai'}]", call me Moon Samurai,richtext,t2_5tvm4e09,False,False,False,[],False,False,1652894196,coindesk.com,https://www.reddit.com/r/CryptoCurrency/comments/ushvep/let_terra_die/,{},ushvep,False,False,False,False,False,False,False,False,,GENERAL-NEWS,"[{'e': 'text', 't': '🟢 GENERAL-NEWS'}]",,🟢 GENERAL-NEWS,dark,richtext,False,False,True,1,0,False,all_ads,/r/CryptoCurrency/comments/ushvep/let_terra_die/,False,6,1652894207,1,,False,False,False,CryptoCurrency,t5_2wlj3,4884067,public,new,https://b.thumbs.redditmedia.com/pFwWedWSZOzqoz_4t-ZEcxLuvJGWYW8UZ94WBbYnN8k.jpg,Let Terra Die,0,[],1.0,https://www.coindesk.com/layer2/2022/05/18/let-terra-die/,https://www.coindesk.com/layer2/2022/05/18/let-terra-die/,all_ads,6,1652865396.0,link,"{'enabled': False, 'images': [{'id': 'd673KD7HAcVuVoySasVKZwE3WC2ShNi7Ti306tkZaqA', 'resolutions': [{'height': 56, 'url': 'https://external-preview.redd.it/m-7eviq_-aEuzvD9UOXtPSduKRPxq3NQbMPus0Oo_fs.jpg?width=108&amp;crop=smart&amp;auto=webp&amp;s=542858f9c1311746fd819fb5bafb04f654ec1b65', 'width': 108}, {'height': 113, 'url': 'https://external-preview.redd.it/m-7eviq_-aEuzvD9UOXtPSduKRPxq3NQbMPus0Oo_fs.jpg?width=216&amp;crop=smart&amp;auto=webp&amp;s=2af9131fdc02dd7be5eba6792bee2a414b1a4cd1', 'width': 216}, {'height': 167, 'url': 'https://external-preview.redd.it/m-7eviq_-aEuzvD9UOXtPSduKRPxq3NQbMPus0Oo_fs.jpg?width=320&amp;crop=smart&amp;auto=webp&amp;s=2685dc4e622c5e7bcd8aa6717d39a7cf0dfdcb52', 'width': 320}, {'height': 334, 'url': 'https://external-preview.redd.it/m-7eviq_-aEuzvD9UOXtPSduKRPxq3NQbMPus0Oo_fs.jpg?width=640&amp;crop=smart&amp;auto=webp&amp;s=927bd43692b5d310b94be007fc515157bb80ba91', 'width': 640}, {'height': 502, 'url': 'https://external-preview.redd.it/m-7eviq_-aEuzvD9UOXtPSduKRPxq3NQbMPus0Oo_fs.jpg?width=960&amp;crop=smart&amp;auto=webp&amp;s=f09a12612ef6f3beb40921f353d7aa000da0cfe5', 'width': 960}, {'height': 565, 'url': 'https://external-preview.redd.it/m-7eviq_-aEuzvD9UOXtPSduKRPxq3NQbMPus0Oo_fs.jpg?width=1080&amp;crop=smart&amp;auto=webp&amp;s=862c44ee3e76a37888ef42f703b26f7948ff28a9', 'width': 1080}], 'source': {'height': 628, 'url': 'https://external-preview.redd.it/m-7eviq_-aEuzvD9UOXtPSduKRPxq3NQbMPus0Oo_fs.jpg?auto=webp&amp;s=7d921bc672f883886ac31e37dab1a2e2eee0cdf1', 'width': 1200}, 'variants': {}}]}",73.0,140.0,,dark,moderator,,,,,
26,[],False,infinit9,,[],,text,t2_15nabi,False,False,False,[],False,False,1652893878,i.redd.it,https://www.reddit.com/r/CryptoCurrency/comments/ushres/sorry_im_confused_this_isnt_lunaterra_but_another/,{},ushres,False,False,False,False,True,False,False,False,#7193ff,DISCUSSION,"[{'e': 'text', 't': 'DISCUSSION'}]",87049662-0882-11e5-82e1-0e9d1a9f7761,DISCUSSION,dark,richtext,False,False,True,2,0,False,all_ads,/r/CryptoCurrency/comments/ushres/sorry_im_confused_this_isnt_lunaterra_but_another/,False,6,1652893889,1,,True,False,False,CryptoCurrency,t5_2wlj3,4884044,public,new,https://b.thumbs.redditmedia.com/yzfT44vUlNoxjnc4MLfK-VVR0ka81codZoz26woH6lw.jpg,"Sorry, I'm confused. This isn't Luna-Terra, but another Luna Coin not related to the crash?",0,[],1.0,https://i.redd.it/erq5i6rlo9091.jpg,https://i.redd.it/erq5i6rlo9091.jpg,all_ads,6,1652865078.0,image,"{'enabled': True, 'images': [{'id': 'ODUYTC-vpLRNvVPBURLn5i55ngIdQjNlvNpg9ARcZhM', 'resolutions': [{'height': 216, 'url': 'https://preview.redd.it/erq5i6rlo9091.jpg?width=108&amp;crop=smart&amp;auto=webp&amp;s=4cbbb51e61589f67a150f53ba4caa09a0972d1db', 'width': 108}, {'height': 432, 'url': 'https://preview.redd.it/erq5i6rlo9091.jpg?width=216&amp;crop=smart&amp;auto=webp&amp;s=9c33974693623c3b20379368c23465e55844ac5f', 'width': 216}, {'height': 640, 'url': 'https://preview.redd.it/erq5i6rlo9091.jpg?width=320&amp;crop=smart&amp;auto=webp&amp;s=da97d41f3adae9efe513a2cbf2932db2007b13eb', 'width': 320}, {'height': 1280, 'url': 'https://preview.redd.it/erq5i6rlo9091.jpg?width=640&amp;crop=smart&amp;auto=webp&amp;s=3a54d7598847e049323586ad5ede1f7728f2d611', 'width': 640}, {'height': 1920, 'url': 'https://preview.redd.it/erq5i6rlo9091.jpg?width=960&amp;crop=smart&amp;auto=webp&amp;s=a16c334364da29dbe1150e27bed829955f4f18aa', 'width': 960}, {'height': 2160, 'url': 'https://preview.redd.it/erq5i6rlo9091.jpg?width=1080&amp;crop=smart&amp;auto=webp&amp;s=e0b2efb004baf32cb92c7e287a72dc3a07195aed', 'width': 1080}], 'source': {'height': 2532, 'url': 'https://preview.redd.it/erq5i6rlo9091.jpg?auto=webp&amp;s=47f2a4f4e3baf18360192a4eb83f60ae3f216bab', 'width': 1170}, 'variants': {}}]}",140.0,140.0,,,moderator,,,,,
27,[],False,Bread_addict,Warning-level2-2,"[{'e': 'text', 't': 'Tin | BANANO 9'}]",Tin | BANANO 9,richtext,t2_1d7un4jl,False,False,False,[],False,False,1652892796,self.CryptoCurrency,https://www.reddit.com/r/CryptoCurrency/comments/ushd51/what_about_stablecoins_a_brief_breakdown_of_the/,{},ushd51,False,True,False,False,False,True,True,False,#646d73,TECHNOLOGY,"[{'e': 'text', 't': 'TECHNOLOGY'}]",2cb47a9c-3cc9-11ec-8857-7e7f5686f7de,TECHNOLOGY,dark,richtext,False,False,True,0,0,False,all_ads,/r/CryptoCurrency/comments/ushd51/what_about_stablecoins_a_brief_breakdown_of_the/,False,6,1652892807,1,"I've read alot of uninformed comments and posts regarding stablecoins in the last few days since the UST collapse. In the following breakdown I will shortly summarize the nature and composition of collateral of the top 10 USD pegged stablecoins by marketcap. Feel free to correct me in case of mistakes.

# Top 10 Stablecoins

1. **USDT (Tether):** the largest stablecoin by marketcap is a centralized asset-backed stablecoin operated and issued by Tether Holdings which is registered in the British Virgin Islands. Tether reports that each coin is backed 1:1 by reserves equivalent to it's value in dollar, the last report of their assets by an independent accountant dates back to **December 31, 2021**. Their own reserves breakdown shows that only **6,36%** of their assets are cash reserves, but supposedly **83,74%** of their assets are held in short-term deposits, cash or equivalents and commercial papers. Interestingly they claim to have **6,38%** of their assets invested into vague ""other investments"" including digital tokens. We don't know if USDT is backed 1:1 and even if the claims about their assets are true the collateral is partly illiquid and a small percentage is even backed-up by risky assets.
2. **USDC(USD Coin):** Another centralized asset-backed stablecoin that is operated and issued by Centre a consortium founded by Circle and Coinbase. Circle is in charge of the public operations and like Tether claims that each coin is backed 1:1 by reserves equivalent to it's value in dollar, they are subject to regular audits. The latest attestation conducted by Grant Thornton LLP and denominates all reserves through **March 31, 2022.** They attest that USDC is indeed backed up 1:1 or more. As of **May 13** Circle claims **22,9%** of USDC's collateral is in Cash  and the other **77,1%** in U.S. Treasuries. In conclusion if Circles claims are true USDC is also partly backed-up by illiquid assets. (they might be able to take short-time loans against these assets in case of a bank run since U.S. Treasuries are very safe)
3. **BUSD(Binance USD):** This is a special case that also includes **9. USDP(Paxos Standard)**. Those two coins are centralized asset-backed stablecoins operated by Paxos Trust company, BUSD is issued by Binance and USDP by Paxos themselves. Paxos prides themselves with offering an regulated stablecoin overseen by the NY State Department of financial services. Paxos claims that both stablecoins are fully backed by cash or equivalents. Both coins are subject to monthly audits, the last one was conducted for **April 29, 2022**. The audit attests that both coins are **100%** backed-up by cash and cash equivalents. Thus these coins can be seen as ""true"" stablecoins regarding liquidity. 
4. **DAI:** A decentralized, asset-backed stablecoin that is developed by the MakerDAO project. DAI's are minted when enough collateral is placed into a smart contract on the Ethereum network, which means DAI is created through loans and subsequently burned when these loans are paid back or get liquidated. The composition of collateral is thus [completely transparent at all times](https://makerburn.com/#/rundown). The loan based creation of DAI leads the asset to being heavily overcollateralized being backed up **177%** by various crypto- and a small amount of real world-assets. Nontheless DAI is heavily backed-up by centralized assets like USDC and USDP to remain it's peg which sparks the question if DAI can truly be called decentralized when almost half of it's value comes from cenralized stablecoins. 
5. **MIM(Magic Internet Money):**  is a asset-backed stablecoin minted by the decentralized platform [Abracadabra.money](https://Abracadabra.money). In principle MIM works similar to DAI only MIM's goal is to turn illiquid assets liquid and allows to borrow against previously locked up collateral. This makes MIM more decentralized than DAI as it does not rely on centralized stablecoins to hold it's peg, but it is yet to be seen how the asset will react to a bank run. 
6. **FRAX:** a fractional algorithmic stablecoin developed by frax finance which is registered in the cayman islands. The coin works alongside it's governance Token **FXS.** FRAX begun being **100%** backed by the centralized stablecoin USDC and from there on loosened and tightenend it's collateral policy based on demand. If the price of FRAX goes above 1$ this acts as a signal for the protocol to relax it's collateralization ratio(CR), e.g. if FRAX goes up to 1,01$ 98 cents and the 2 cents equal of **FXS** are needed to mint 1 FRAX, redemption is the same but inverse. When the price of FRAX falls, the CR tightens again. Thus the stablecoin acts similarly to a decentralized central bank. Unlike UST FRAX also managed to hold it's peg under extreme Market conditions. But like DAI it is heavily reliant on the centralized stablecoin USDC.
7. **TUSD(True USD):** is a centralized asset-backed stablecoin by TrustToken. It was born out of the perceived need for a trustworthy fully audited stablecoin as a contrast to tether. The company collabarates with banking partners that handle the underlying funds directly. TUSD is **100%** backed in cash and equivalents which is [audited in real time](https://real-time-attest.trustexplorer.io/truecurrencies). Thus TUSD can also be seen as a ""true"" stable coin regarding liquidity
8. **UST(Terra USD):** is a centralized algorithmic ""stablecoin"" by Terraform labs. It was supposed to hold it's peg through burning and minting of **LUNA** the currency of the blockchain UST works on. The extreme selling pressure on both assets led to a death spiral in which the protocol desperatly printed LUNA to hold the peg of UST further detoriating the value of LUNA and thus it's ability to back UST. The Luna Foundation Guard, a reserve that was supposed to help UST keep it's peg under extreme conditons did not suceed in it's mission. 

   10. **USDN(Neutrino Dollar):** is a decentralized asset-backed algorithmic stablecoin on the Waves   
blockchain the **WAVES** token also acts as collateral for USDN. When the price for USDN drops   
below 1$ **NSBT**, the governance token of the Neutrino system is sold to users at a cheaper price   
by the  Mechanism, reversly the contract puts tokens into a reserve fund when the price rises   
above 1$. This concept has not proven to be resilient enough under high selling pressure and   
USDN also lost it's peg in the latest crash and has not been able to regain it as of now.",True,False,False,CryptoCurrency,t5_2wlj3,4883966,public,new,self,What about Stablecoins? - a brief breakdown of the largest stablecoins,0,[],1.0,https://www.reddit.com/r/CryptoCurrency/comments/ushd51/what_about_stablecoins_a_brief_breakdown_of_the/,,all_ads,6,1652863996.0,,,,,,dark,,,,,,
28,[],False,viko_dock,,[],,text,t2_k0lyayp8,False,False,False,[],False,False,1652891508,self.CryptoCurrency,https://www.reddit.com/r/CryptoCurrency/comments/usgwix/fork_or_burn_what_should_terra_do/,{},usgwix,False,False,False,False,False,False,True,False,#7193ff,DISCUSSION,"[{'e': 'text', 't': 'DISCUSSION'}]",87049662-0882-11e5-82e1-0e9d1a9f7761,DISCUSSION,dark,richtext,False,False,True,1,0,False,all_ads,/r/CryptoCurrency/comments/usgwix/fork_or_burn_what_should_terra_do/,False,6,1652891519,1,[removed],True,False,False,CryptoCurrency,t5_2wlj3,4883874,public,,self,FORK or BURN? What should Terra do?,0,[],1.0,https://www.reddit.com/r/CryptoCurrency/comments/usgwix/fork_or_burn_what_should_terra_do/,,all_ads,6,1652862708.0,,,,,,,moderator,,,,,
29,[],False,viko_dock,,[],,text,t2_k0lyayp8,False,False,False,[],False,False,1652891464,self.CryptoCurrency,https://www.reddit.com/r/CryptoCurrency/comments/usgvy9/fork_or_burn_what_should_terra_do/,{},usgvy9,False,False,False,False,False,False,True,False,#7193ff,DISCUSSION,"[{'e': 'text', 't': 'DISCUSSION'}]",87049662-0882-11e5-82e1-0e9d1a9f7761,DISCUSSION,dark,richtext,False,False,True,1,0,False,all_ads,/r/CryptoCurrency/comments/usgvy9/fork_or_burn_what_should_terra_do/,False,6,1652891474,1,[removed],True,False,False,CryptoCurrency,t5_2wlj3,4883871,public,new,https://b.thumbs.redditmedia.com/ko0PFUvGY9IaZl3rgCMnRhUUD5jXLrXLf2Ite_gKGPU.jpg,FORK or BURN? What should Terra do?,0,[],1.0,https://www.reddit.com/r/CryptoCurrency/comments/usgvy9/fork_or_burn_what_should_terra_do/,,all_ads,6,1652862664.0,,,115.0,140.0,,,moderator,,,,,
