14,[],False,crypto_currency_77,,[],,text,t2_hubpqrkp,False,False,False,[],False,False,1652928713,cryptocurrencysimple.com,https://www.reddit.com/r/CryptoCurrency/comments/ustlb5/terra_luna_shines_amid_wider_crypto_market_doom/,{},ustlb5,False,False,False,False,False,False,False,False,#646d73,TECHNOLOGY,"[{'e': 'text', 't': 'TECHNOLOGY'}]",2cb47a9c-3cc9-11ec-8857-7e7f5686f7de,TECHNOLOGY,dark,richtext,False,False,True,0,0,False,all_ads,/r/CryptoCurrency/comments/ustlb5/terra_luna_shines_amid_wider_crypto_market_doom/,False,6,1652928724,1,,False,False,False,CryptoCurrency,t5_2wlj3,4886371,public,,https://b.thumbs.redditmedia.com/R7OKD7VArEgq-5aNSrnTOmGatQ2zLwv5mBiIXLR_Qbw.jpg,"Terra Luna Shines Amid Wider Crypto Market Doom, Up 42 Percent In 5 Days in 2022",0,[],1.0,https://cryptocurrencysimple.com/all-about-terra-luna-price-move-2022/?feed_id=22607&amp;_unique_id=6285b0c9a40d0,https://cryptocurrencysimple.com/all-about-terra-luna-price-move-2022/?feed_id=22607&amp;_unique_id=6285b0c9a40d0,all_ads,6,1652899913.0,link,"{'enabled': False, 'images': [{'id': 'JmI89t_vqHcsu763o3SrL9ImGpdG_ayc0YNmAYLQCbM', 'resolutions': [{'height': 65, 'url': 'https://external-preview.redd.it/4rQBv_cuTUBLPaHPU9ZOmol6KvyGn_o19YaJL8j1PbI.jpg?width=108&amp;crop=smart&amp;auto=webp&amp;s=08facf67bef189f94747d2023fac15b505427c43', 'width': 108}, {'height': 131, 'url': 'https://external-preview.redd.it/4rQBv_cuTUBLPaHPU9ZOmol6KvyGn_o19YaJL8j1PbI.jpg?width=216&amp;crop=smart&amp;auto=webp&amp;s=c82014732847ecab9987d55a9aced7f592a9d029', 'width': 216}, {'height': 195, 'url': 'https://external-preview.redd.it/4rQBv_cuTUBLPaHPU9ZOmol6KvyGn_o19YaJL8j1PbI.jpg?width=320&amp;crop=smart&amp;auto=webp&amp;s=5995a8b85f562c48346c4030e135e5e0f9d1bbdc', 'width': 320}, {'height': 390, 'url': 'https://external-preview.redd.it/4rQBv_cuTUBLPaHPU9ZOmol6KvyGn_o19YaJL8j1PbI.jpg?width=640&amp;crop=smart&amp;auto=webp&amp;s=c7a9adc4893acd673718b34ef6e84c5d09b8e04f', 'width': 640}, {'height': 585, 'url': 'https://external-preview.redd.it/4rQBv_cuTUBLPaHPU9ZOmol6KvyGn_o19YaJL8j1PbI.jpg?width=960&amp;crop=smart&amp;auto=webp&amp;s=4e6d2ae5791fa3e1a1307fa05bd6bba242f06834', 'width': 960}], 'source': {'height': 624, 'url': 'https://external-preview.redd.it/4rQBv_cuTUBLPaHPU9ZOmol6KvyGn_o19YaJL8j1PbI.jpg?auto=webp&amp;s=2392227a1a30ed46ca7ae3b47c350c33e7cda673', 'width': 1024}, 'variants': {}}]}",85.0,140.0,,,reddit,,,,,
15,[],False,autisticgrapes,,[],,text,t2_al6r69cn,False,False,False,[],False,False,1652921468,self.CryptoCurrency,https://www.reddit.com/r/CryptoCurrency/comments/usrcgx/eli5_where_does_the_money_go_to_in_luna_terra/,{},usrcgx,False,False,False,False,False,False,True,False,#add2e2,ADVICE,"[{'e': 'text', 't': 'ANALYSIS'}]",c1034ee6-9c2a-11e3-a8c4-12313b0e8e20,ANALYSIS,dark,richtext,False,False,True,1,0,False,all_ads,/r/CryptoCurrency/comments/usrcgx/eli5_where_does_the_money_go_to_in_luna_terra/,False,6,1652921478,1,[removed],True,False,False,CryptoCurrency,t5_2wlj3,4885952,public,,self,ELI5 where does the money go to in Luna Terra crash,0,[],1.0,https://www.reddit.com/r/CryptoCurrency/comments/usrcgx/eli5_where_does_the_money_go_to_in_luna_terra/,,all_ads,6,1652892668.0,,,,,,,moderator,,,,,
16,[],False,mr-zillionaire,Warning-level2-2,"[{'e': 'text', 't': 'Tin | 4 months old'}]",Tin | 4 months old,richtext,t2_i93w3dbz,False,False,False,[],False,False,1652910008,self.CryptoCurrency,https://www.reddit.com/r/CryptoCurrency/comments/usnjg0/whales_eat_all_the_fish_lunaust/,{},usnjg0,False,True,False,False,False,True,True,False,#c403f5,COMEDY,"[{'e': 'text', 't': 'COMEDY'}]",5c104cfc-d7c8-11e4-9d14-22000b6902b0,COMEDY,dark,richtext,False,False,True,0,0,False,all_ads,/r/CryptoCurrency/comments/usnjg0/whales_eat_all_the_fish_lunaust/,False,6,1652910019,1,"So. whales. They own a large share of LUNA/UST.  before the collapse 7/5/2022.
Then they sold it (for purchase offers and 3 billion $ of BTC reserves)...
they can Collect the ashes before the 2nd date 5.27 

The result... they took billions of $ ... and now they get a huge percentage in the new LUNS (for things they actually sold)... rudeness

Definitions:

• “Pre-attack” snapshot to be taken at at Terra Classic block 7544910 (2022.05.07 23:00:04+08:00)

• “Post-attack” snapshot to be taken at Terra Classic block 7790000 (2022.05.27 03:59:51+08:00)


https://agora.terra.money/t/terra-ecosystem-revival-plan-2-updated-and-final/18498",True,False,False,CryptoCurrency,t5_2wlj3,4885259,public,new,self,whales eat all the fish... LUNA/UST,0,[],1.0,https://www.reddit.com/r/CryptoCurrency/comments/usnjg0/whales_eat_all_the_fish_lunaust/,,all_ads,6,1652881208.0,self,"{'enabled': False, 'images': [{'id': 'XfMwKoiPYfOqd4PAkrwy3ghvCMHeo7culD97x4f18aM', 'resolutions': [{'height': 108, 'url': 'https://external-preview.redd.it/ZkxigoFxlIdswUY9H_3zWuJQH0XoK2lhYUC73SxgS-o.jpg?width=108&amp;crop=smart&amp;auto=webp&amp;s=cfbd7e585e05cb8dd11e3d0c6a2e5bfcbb350d56', 'width': 108}, {'height': 216, 'url': 'https://external-preview.redd.it/ZkxigoFxlIdswUY9H_3zWuJQH0XoK2lhYUC73SxgS-o.jpg?width=216&amp;crop=smart&amp;auto=webp&amp;s=5fb46438116a95fd436230c9976cf5f502f043fd', 'width': 216}, {'height': 320, 'url': 'https://external-preview.redd.it/ZkxigoFxlIdswUY9H_3zWuJQH0XoK2lhYUC73SxgS-o.jpg?width=320&amp;crop=smart&amp;auto=webp&amp;s=d984d230cfe8f309f4d0d418ba25058cb57fc623', 'width': 320}], 'source': {'height': 600, 'url': 'https://external-preview.redd.it/ZkxigoFxlIdswUY9H_3zWuJQH0XoK2lhYUC73SxgS-o.jpg?auto=webp&amp;s=ce98dfe2b2aa79deaca4561829dee2e91d3f8bbd', 'width': 600}, 'variants': {}}]}",,,,dark,,,,,,
17,[],False,goof1992,Warning-level2-2,"[{'e': 'text', 't': 'Tin'}]",Tin,richtext,t2_ok7d6,False,False,False,[],False,False,1652904712,i.redd.it,https://www.reddit.com/r/CryptoCurrency/comments/uslmta/terra_station_proposal_to_fork_chain_appears_like/,{},uslmta,False,True,False,False,True,True,False,False,#014980,UPDATE,"[{'e': 'text', 't': 'PROJECT-UPDATE'}]",0de51794-8fa8-11eb-8c8b-0e387731294b,PROJECT-UPDATE,light,richtext,False,False,True,1,0,False,all_ads,/r/CryptoCurrency/comments/uslmta/terra_station_proposal_to_fork_chain_appears_like/,False,6,1652904723,1,,True,False,False,CryptoCurrency,t5_2wlj3,4884842,public,,https://b.thumbs.redditmedia.com/7AFPObOJcgL9Taf35LUjwbXxh37kzlRetwzeUZsW_Mc.jpg,Terra Station - Proposal to fork chain appears like it will pass,0,[],1.0,https://i.redd.it/g8mghajtka091.jpg,https://i.redd.it/g8mghajtka091.jpg,all_ads,6,1652875912.0,image,"{'enabled': True, 'images': [{'id': 'Etm4YwufAdwlLGyWncliID0YKH5ABBT8k_BWacMQjL8', 'resolutions': [{'height': 161, 'url': 'https://preview.redd.it/g8mghajtka091.jpg?width=108&amp;crop=smart&amp;auto=webp&amp;s=40f18c73819884a33de6b4a9dbb8e22556cbed5b', 'width': 108}, {'height': 323, 'url': 'https://preview.redd.it/g8mghajtka091.jpg?width=216&amp;crop=smart&amp;auto=webp&amp;s=1d0c0053cfc3adbc11af9d1339c10df2963a294f', 'width': 216}, {'height': 478, 'url': 'https://preview.redd.it/g8mghajtka091.jpg?width=320&amp;crop=smart&amp;auto=webp&amp;s=a645db53c34bdc0e2fc57dc68487030532ec6099', 'width': 320}, {'height': 957, 'url': 'https://preview.redd.it/g8mghajtka091.jpg?width=640&amp;crop=smart&amp;auto=webp&amp;s=1114b6046afc4f8811f4fe771001113075495b26', 'width': 640}, {'height': 1435, 'url': 'https://preview.redd.it/g8mghajtka091.jpg?width=960&amp;crop=smart&amp;auto=webp&amp;s=2c990059cba955416fc7eafeb60666bf76793000', 'width': 960}, {'height': 1615, 'url': 'https://preview.redd.it/g8mghajtka091.jpg?width=1080&amp;crop=smart&amp;auto=webp&amp;s=eeb0258f2bc47dccc2a609120ccaa37e8f3f7590', 'width': 1080}], 'source': {'height': 1615, 'url': 'https://preview.redd.it/g8mghajtka091.jpg?auto=webp&amp;s=0e1c283639ac8d6dbde49ef1677648e04c22bde1', 'width': 1080}, 'variants': {}}]}",140.0,140.0,,dark,,,,,,
18,[],False,jes1118,,[],,text,t2_naw56ofi,False,False,False,[],False,False,1652901672,self.CryptoCurrency,https://www.reddit.com/r/CryptoCurrency/comments/uskk8p/thoughts_on_digital_asset_backed_stable_coins/,{},uskk8p,False,True,False,False,False,True,True,False,#0aa18f,NEWS,"[{'e': 'text', 't': 'GENERAL-NEWS'}]",f170aab2-246f-11ec-8143-429a193c9848,GENERAL-NEWS,light,richtext,False,False,True,0,0,False,all_ads,/r/CryptoCurrency/comments/uskk8p/thoughts_on_digital_asset_backed_stable_coins/,False,6,1652901683,1," 

 [Why the Crypto Market Crashed: The Attack on UST Stable Coin (venturetime.co)](https://www.venturetime.co/p/why-the-crypto-market-crashed-the?s=w) 

UST from Terra Labs crashed as you know - does anyone see a way for other similar stable coins to avoid attacks while still backing their coin with On-Chain digital assets? I've done some research on the attack on the link attached, curious to hear your thoughts.

Terra was one of the first issuers to back their stable coin, UST, with on-chain digital assets, using their token Luna. It is important to note that Terra also had several billion dollars in Bitcoin collateral on the side. Their stable coin UST was pegged at $1, but in periods of demand for stable coins, the price might rise to $1.01. At this point, investors in Luna can convert their Luna for UST. This increases the supply of UST, which will help bring down the market price back to $1. The investor can then sell the UST at $1.01, making 1% on the transaction. The brilliance of the TerraUST/Luna conversion is that investors are incentivized with an arbitrage opportunity to regulate and maintain the stable coin’s price. In the Terra ecosystem, no issuing body increases or decreases the supply of UST; rather the market does so itself. Investors trust that this self-correcting cycle will hold up their stable coin.

On May 10th, the price of UST fell from $1 to $0.62, a shock to the cryptocurrency community. In the following days, it fell further to less than a cent. For the last six months, crypto lending platform Anchor offered a 20% yield to investors who bought UST and lent it on the Anchor protocol. This move was meant to be a marketing campaign by Terra, hoping to draw in new customers. Such a high return led to countless investors flocking to UST, hoping to be rewarded with such a high yield. This opened the door for a dramatic attack, being likened to George Soros’ attack on the Bank of England.

Terra held several billion dollars worth of Bitcoin in collateral for its UST stable coin. An attacker borrowed $3 billion in Bitcoin and bought about $1 billion in UST. The attacker then started selling the UST very quickly, destabilizing UST and dropping it below the $1 peg. Terra sold more and more Bitcoin as the price of UST dropped, hoping to restabilize the price. However, this caused the Bitcoin market to tank as well, with so many coins entering the market. The attacker then bought back their Bitcoin, essentially “short selling” Bitcoin for a huge profit. As a result of the attacker dumping $1 billion in UST on the open market, other market participants lost faith in the stable coin and their promised 20% yield, causing a massive bank-run on UST, with almost all holders attempting to sell. As a result, the attacking party made off with a huge gain on their short sale of Bitcoin. UST and Luna are now worth practically nothing, as investors lost faith in the tokens.

While on-chain collateral for stable coins was a widely anticipated development for the crypto community, the Terra attack shows two important lessons for investors. First, the attacker relied on the widespread panic and subsequent bank run on UST once its price was low enough that investors lost faith. Stable coins with larger market caps, and therefore larger liquidity pools, are harder to manipulate. While no stable coin issuer can simply increase their market cap at will, investors and issuers alike should see the benefits of more established projects, understanding that smaller cap projects are riskier investments, as they are prone to similar attacks. Second, the irresponsibility of Do Kwan, founder of Terra, is greatly responsible for the bank run that occurred on his token. Kwan, an energetic and eccentric entrepreneur, is also a shady businessman, who began his career with an algorithmic stable coin project named Basis Cash in 2020, which also failed to maintain its $1 peg. Kwan’s 20% yield Anchor marketing campaign was unsustainable from the start and was designed to be a Ponzi scheme. Kwan paid investors their 20% yield with money from new investors, taking advantage of investors for his own company’s gain. The unrealistic expectations of investors led to their exaggerated fear when the coin dropped, causing the bank run and crash of UST. Investors need to be wary of unrealistic returns and conduct research on the individuals they are trusting with their money.",True,False,False,CryptoCurrency,t5_2wlj3,4884608,public,,self,Thoughts on Digital Asset backed Stable coins?,0,[],1.0,https://www.reddit.com/r/CryptoCurrency/comments/uskk8p/thoughts_on_digital_asset_backed_stable_coins/,,all_ads,6,1652872872.0,self,"{'enabled': False, 'images': [{'id': 'cP-EcBWy187bbliTzMeyK6nfykydgAyTSf_XqCEDhx4', 'resolutions': [{'height': 108, 'url': 'https://external-preview.redd.it/b_EMzmzZaSVj7okrlYD8yFnqqjfd7jMBHv9DPYw8Dr4.jpg?width=108&amp;crop=smart&amp;auto=webp&amp;s=34937e5e630e3e42da54d7e7a04032e714644e41', 'width': 108}, {'height': 216, 'url': 'https://external-preview.redd.it/b_EMzmzZaSVj7okrlYD8yFnqqjfd7jMBHv9DPYw8Dr4.jpg?width=216&amp;crop=smart&amp;auto=webp&amp;s=d367126dc9aa21c13b335e934923a910c51bfaac', 'width': 216}, {'height': 320, 'url': 'https://external-preview.redd.it/b_EMzmzZaSVj7okrlYD8yFnqqjfd7jMBHv9DPYw8Dr4.jpg?width=320&amp;crop=smart&amp;auto=webp&amp;s=f293a2d92ce03e09182e6130322b603f442e1203', 'width': 320}], 'source': {'height': 600, 'url': 'https://external-preview.redd.it/b_EMzmzZaSVj7okrlYD8yFnqqjfd7jMBHv9DPYw8Dr4.jpg?auto=webp&amp;s=5adbd6b9d2e5a7a510d11e599729405bab8af607', 'width': 600}, 'variants': {}}]}",,,,,,,,,,
19,[],False,R0B0TPARTY,Warning-level2-2,"[{'e': 'text', 't': 'Tin | r/SSB 5'}]",Tin | r/SSB 5,richtext,t2_cur9ly6,False,False,False,[],False,False,1652900683,self.CryptoCurrency,https://www.reddit.com/r/CryptoCurrency/comments/usk7h6/terra_luna_subreddit_now_banning_dissenters_while/,{},usk7h6,False,False,False,False,False,False,True,False,#014980,UPDATE,"[{'e': 'text', 't': 'PROJECT-UPDATE'}]",0de51794-8fa8-11eb-8c8b-0e387731294b,PROJECT-UPDATE,light,richtext,False,False,True,0,0,False,all_ads,/r/CryptoCurrency/comments/usk7h6/terra_luna_subreddit_now_banning_dissenters_while/,False,6,1652900693,1,[removed],True,False,False,CryptoCurrency,t5_2wlj3,4884536,public,,self,Terra Luna subreddit now banning “dissenters” while manipulating votes,0,[],1.0,https://www.reddit.com/r/CryptoCurrency/comments/usk7h6/terra_luna_subreddit_now_banning_dissenters_while/,,all_ads,6,1652871883.0,,,,,,dark,automod_filtered,,,,,
20,[],False,drhuehue,noflair,"[{'e': 'text', 't': 'Silver'}]",Silver,richtext,t2_8emrc,False,False,False,[],False,False,1652898189,self.CryptoCurrency,https://www.reddit.com/r/CryptoCurrency/comments/usjbag/do_kwon_is_managing_to_push_through_a_hard_fork/,{},usjbag,False,True,False,False,False,True,True,False,#7193ff,DISCUSSION,"[{'e': 'text', 't': 'DISCUSSION'}]",87049662-0882-11e5-82e1-0e9d1a9f7761,DISCUSSION,dark,richtext,False,False,True,0,0,False,all_ads,/r/CryptoCurrency/comments/usjbag/do_kwon_is_managing_to_push_through_a_hard_fork/,False,6,1652898200,1,"After the collapse of LUNA/UST, Do Kwon came out with a proposal to hard fork the chain to a previous snapshot and reallocate LUNA back to a 1b supply.

Through the last few days, it has become clear that the overwhelming majority of luna holders are against Do Kwon's proposal to hard fork the chain with a reversion to a previous snapshot. A simple look at the Terra agora forum + its subreddits + crypto twitter would confirm this.

However, official voting on the proposal has begun today and the validators (who have close ties to Do Kwon, presumably) are voting overwhelmingly in favor of Do Kwon's proposal, against the wishes of the community at large.

If Do Kwon manages to force through his hard fork because of his relationships with the validators that run the governance process, does this reveal a massive fundamental flaw in these smaller POS chains? It is not hard to imagine central foundations of other chains being able to force through forks and things against the wishes of small holders by simply being buddy buddy with the small number of operators who run validator nodes.",True,False,False,CryptoCurrency,t5_2wlj3,4884354,public,,self,Do Kwon is managing to push through a hard fork to the TerraLuna blockchain against the wishes of the overwhelming majority of the community. Does this reveal a flaw in proof of stake blockchains?,0,[],1.0,https://www.reddit.com/r/CryptoCurrency/comments/usjbag/do_kwon_is_managing_to_push_through_a_hard_fork/,,all_ads,6,1652869389.0,,,,,,dark,,261fc174-1507-11e4-8375-12313d224df5,,,,
21,[],False,cryptomon,noflair,[],,text,t2_5bp0z71,False,False,False,[],False,False,1652896105,youtu.be,https://www.reddit.com/r/CryptoCurrency/comments/usijtc/if_you_think_terra_crashing_is_bad_wtf_happens_if/,{},usijtc,False,True,False,False,False,True,False,False,#cc8b00,SPECULATION,"[{'e': 'text', 't': 'SPECULATION'}]",ebb30328-94d1-11eb-94d6-0e7d4f551e2d,SPECULATION,light,richtext,False,False,True,0,0,False,all_ads,/r/CryptoCurrency/comments/usijtc/if_you_think_terra_crashing_is_bad_wtf_happens_if/,False,6,1652896116,1,,False,False,False,CryptoCurrency,t5_2wlj3,4884205,public,new,https://b.thumbs.redditmedia.com/HxP9-PSbC35Qa5Aylp-7yXS8tD34vywhtu1FqukOidE.jpg,"If you think Terra crashing is bad, wtf happens if Tether crashes?",0,[],1.0,https://youtu.be/bVIqZ2MhUvU,https://youtu.be/bVIqZ2MhUvU,all_ads,6,1652867305.0,rich:video,"{'enabled': False, 'images': [{'id': 'ojQGhbbouCTTLLDhLLK3N0zUQClnd8J4BF5maAYPDoU', 'resolutions': [{'height': 81, 'url': 'https://external-preview.redd.it/cP_ADENKMzp8KmhajWYIdtpqAspZ1n7RdAR_dxg1N0g.jpg?width=108&amp;crop=smart&amp;auto=webp&amp;s=2cd912002284a9306c78cebe3f5c8ec64da396c8', 'width': 108}, {'height': 162, 'url': 'https://external-preview.redd.it/cP_ADENKMzp8KmhajWYIdtpqAspZ1n7RdAR_dxg1N0g.jpg?width=216&amp;crop=smart&amp;auto=webp&amp;s=a9f1fe3774b63afbd67778c5fdf4544f610756f2', 'width': 216}, {'height': 240, 'url': 'https://external-preview.redd.it/cP_ADENKMzp8KmhajWYIdtpqAspZ1n7RdAR_dxg1N0g.jpg?width=320&amp;crop=smart&amp;auto=webp&amp;s=ce3ab873e0e4c46ed35775d69de892f5e7bcca2a', 'width': 320}], 'source': {'height': 360, 'url': 'https://external-preview.redd.it/cP_ADENKMzp8KmhajWYIdtpqAspZ1n7RdAR_dxg1N0g.jpg?auto=webp&amp;s=2802acf262f8a21a34419f15a00ea7f024d131a2', 'width': 480}, 'variants': {}}]}",105.0,140.0,,dark,,261fc174-1507-11e4-8375-12313d224df5,"{'oembed': {'author_name': 'Digital Spaceport', 'author_url': 'https://www.youtube.com/c/DigitalSpaceport', 'height': 200, 'html': '&lt;iframe width=""356"" height=""200"" src=""https://www.youtube.com/embed/bVIqZ2MhUvU?feature=oembed&amp;enablejsapi=1"" frameborder=""0"" allow=""accelerometer; autoplay; clipboard-write; encrypted-media; gyroscope; picture-in-picture"" allowfullscreen&gt;&lt;/iframe&gt;', 'provider_name': 'YouTube', 'provider_url': 'https://www.youtube.com/', 'thumbnail_height': 360, 'thumbnail_url': 'https://i.ytimg.com/vi/bVIqZ2MhUvU/hqdefault.jpg', 'thumbnail_width': 480, 'title': 'Will Crypto Crash? Terra, Luna, TETHER and Crypto Mining Eth, BTC and Chia Predictions', 'type': 'video', 'version': '1.0', 'width': 356}, 'type': 'youtube.com'}","{'content': '&lt;iframe width=""356"" height=""200"" src=""https://www.youtube.com/embed/bVIqZ2MhUvU?feature=oembed&amp;enablejsapi=1"" frameborder=""0"" allow=""accelerometer; autoplay; clipboard-write; encrypted-media; gyroscope; picture-in-picture"" allowfullscreen&gt;&lt;/iframe&gt;', 'height': 200, 'scrolling': False, 'width': 356}","{'oembed': {'author_name': 'Digital Spaceport', 'author_url': 'https://www.youtube.com/c/DigitalSpaceport', 'height': 200, 'html': '&lt;iframe width=""356"" height=""200"" src=""https://www.youtube.com/embed/bVIqZ2MhUvU?feature=oembed&amp;enablejsapi=1"" frameborder=""0"" allow=""accelerometer; autoplay; clipboard-write; encrypted-media; gyroscope; picture-in-picture"" allowfullscreen&gt;&lt;/iframe&gt;', 'provider_name': 'YouTube', 'provider_url': 'https://www.youtube.com/', 'thumbnail_height': 360, 'thumbnail_url': 'https://i.ytimg.com/vi/bVIqZ2MhUvU/hqdefault.jpg', 'thumbnail_width': 480, 'title': 'Will Crypto Crash? Terra, Luna, TETHER and Crypto Mining Eth, BTC and Chia Predictions', 'type': 'video', 'version': '1.0', 'width': 356}, 'type': 'youtube.com'}","{'content': '&lt;iframe width=""356"" height=""200"" src=""https://www.youtube.com/embed/bVIqZ2MhUvU?feature=oembed&amp;enablejsapi=1"" frameborder=""0"" allow=""accelerometer; autoplay; clipboard-write; encrypted-media; gyroscope; picture-in-picture"" allowfullscreen&gt;&lt;/iframe&gt;', 'height': 200, 'media_domain_url': 'https://www.redditmedia.com/mediaembed/usijtc', 'scrolling': False, 'width': 356}"
22,[],False,Bourneser,,[],,text,t2_gi0jkjjz,False,False,False,[],False,False,1652895230,self.CryptoCurrency,https://www.reddit.com/r/CryptoCurrency/comments/usi8pf/terra_luna_and_ust_collapse_stable_coin/,{},usi8pf,False,True,False,False,False,True,True,False,#7193ff,DISCUSSION,"[{'e': 'text', 't': 'DISCUSSION'}]",87049662-0882-11e5-82e1-0e9d1a9f7761,DISCUSSION,dark,richtext,False,False,False,0,0,False,all_ads,/r/CryptoCurrency/comments/usi8pf/terra_luna_and_ust_collapse_stable_coin/,False,6,1652895240,1,"Following the previous collapse of the stable coin, terra luna by 96%, the UST current collapse still sends shockwaves through the crypto market. USDT, USBC, and BUSD seem to be the next stable coins lined up for traders to invest in.

 As cryptocurrencies have also gone through their share of crumbling, what with BTC falling below its usual $40,000 mark but now seems to be recovering, albeit slowly, and is seemingly revolving around a $30,000 point.

According to https://www.coindesk.com/markets/2022/05/17/first-mover-asia-usdc-hasnt-flippened-usdt-but-trader-preferences-are-changing-cryptos-rise-despite-bearishness/ cryptocurrency market continues to recover and solidify bit by bit from the surge and hopefully not temporarily. BTC has been recently trading at a price over $30,500 with ether up by 3%, CRO, ALGO rose over 3%, and SLC over 1% in the past 24 hours.

Furthermore, the current UST, terraUSD, a decentralized algorithmic stable coin that is supposed to help curb volatility in the crypto market was moving at a $1 peg but now plunged as low as 26 cents. Other popular stable coins like USDT, USDC, and BUSD are causing a crisis due to changes in traders' need for a better stable coin. Although USDT remains the most popular stable coin with a supply of around $7.5 billion,  a growing USDC is just behind with $2.6 billion. 

Is there a chance of USDC “flippening” tether, USDT in the future?",True,False,False,CryptoCurrency,t5_2wlj3,4884136,public,new,self,Terra Luna and UST collapse– stable coin preferences tilt as other coins come into play with USDC close enough to “Flippen” popular USDT tether.,0,[],1.0,https://www.reddit.com/r/CryptoCurrency/comments/usi8pf/terra_luna_and_ust_collapse_stable_coin/,,all_ads,6,1652866430.0,self,"{'enabled': False, 'images': [{'id': '3hCBOBwFQqLB8YhJK3Mxn1Pjnb0z6RWniC8MWQbDQHU', 'resolutions': [{'height': 56, 'url': 'https://external-preview.redd.it/AYCd1dOgze8vS7ztri1jjUyz1ucMtRl2bbPeM3YyHdw.jpg?width=108&amp;crop=smart&amp;auto=webp&amp;s=63168b65fe0f36e5a20e610b7278627f1ab07c69', 'width': 108}, {'height': 113, 'url': 'https://external-preview.redd.it/AYCd1dOgze8vS7ztri1jjUyz1ucMtRl2bbPeM3YyHdw.jpg?width=216&amp;crop=smart&amp;auto=webp&amp;s=c87f87cee1b3c571c5db33cb7237848eb757ed14', 'width': 216}, {'height': 167, 'url': 'https://external-preview.redd.it/AYCd1dOgze8vS7ztri1jjUyz1ucMtRl2bbPeM3YyHdw.jpg?width=320&amp;crop=smart&amp;auto=webp&amp;s=fa022b9a0a99f9055cb3dd3c328314667bd909c0', 'width': 320}, {'height': 334, 'url': 'https://external-preview.redd.it/AYCd1dOgze8vS7ztri1jjUyz1ucMtRl2bbPeM3YyHdw.jpg?width=640&amp;crop=smart&amp;auto=webp&amp;s=000b1ac7460116932d7077a31f9b450b42b8a3b7', 'width': 640}, {'height': 502, 'url': 'https://external-preview.redd.it/AYCd1dOgze8vS7ztri1jjUyz1ucMtRl2bbPeM3YyHdw.jpg?width=960&amp;crop=smart&amp;auto=webp&amp;s=2ac66c5a4f117b6ea0d6b1ba806ef2341d3c2276', 'width': 960}, {'height': 565, 'url': 'https://external-preview.redd.it/AYCd1dOgze8vS7ztri1jjUyz1ucMtRl2bbPeM3YyHdw.jpg?width=1080&amp;crop=smart&amp;auto=webp&amp;s=3f5540b75f1fff9f73dc5715fa07cfde5373968f', 'width': 1080}], 'source': {'height': 628, 'url': 'https://external-preview.redd.it/AYCd1dOgze8vS7ztri1jjUyz1ucMtRl2bbPeM3YyHdw.jpg?auto=webp&amp;s=533944a043ba2f4556906f64e2a546e430a6793b', 'width': 1200}, 'variants': {}}]}",,,,,,,,,,
