37,[],False,0xb032cff11,,,[],,,text,t2_f2nl31xo,False,False,False,[],False,False,1653162247,self.CryptoCurrency,https://www.reddit.com/r/CryptoCurrency/comments/uuugkf/discussion_accumulating_usdc_btc_w_bitwage_worth/,{},uuugkf,False,True,False,False,False,True,True,False,#7193ff,DISCUSSION,"[{'e': 'text', 't': 'DISCUSSION'}]",87049662-0882-11e5-82e1-0e9d1a9f7761,DISCUSSION,dark,richtext,False,False,True,0,0,False,all_ads,/r/CryptoCurrency/comments/uuugkf/discussion_accumulating_usdc_btc_w_bitwage_worth/,False,,,6,,1653162257,1,"Hi everyone. I’ve been thinking long and hard about getting the most out of my savings during market downturns and a recession. I’m weighing around my options and would love to have a discussion with everyone about this.

Backstory: I recently graduated with my B.S. and I have a reliable job. I currently do not need to pay for rent, only a car payment + insurance and phone bills. Monthly expenses are minimal right now. I save all my cryptocurrency on my Ledger Nano X. 

Dilemma: The obvious and wise decision is to save money in a savings account. But I know USDC pays higher yields and I still strongly believe BTC will reach $100k by 2024 when markets are expected to recover and BTC will enter its next halving phase. But there are obvious risks associated by making such a big bet on cryptocurrency. 

Risks: USDC is centralized and I’m sure you all know about the Terra LUNA drama. I’m weighing what the risks are of USDC failing. I know USDC is backed by hard assets but still I know a potential catalyst exists where USDC could fail if everyone panics all at once and exits. 

Question: Do all of you believe this is a wise decision to use BitWage to take 15% BTC and 15% USDC and store it on my Ledger Nano X? I have BitWage premium for the year, and would love to hear all of your thoughts.",True,False,False,CryptoCurrency,t5_2wlj3,4899767,public,self,,,[Discussion] Accumulating USDC &amp; BTC w/ BitWage - Worth the Risk?,0,[],1.0,https://www.reddit.com/r/CryptoCurrency/comments/uuugkf/discussion_accumulating_usdc_btc_w_bitwage_worth/,,all_ads,6,1653133447.0,,,,,,,,
38,[],False,cascading_disruption,,,[],,,text,t2_a4ssb7tg,False,False,False,[],False,False,1653159246,self.CryptoCurrency,https://www.reddit.com/r/CryptoCurrency/comments/uuthwn/honestly_the_exchanges_the_centralized_ones_need/,{},uuthwn,False,True,False,True,False,True,True,False,#46d160,ADVICE,"[{'e': 'text', 't': 'ADVICE'}]",e9570888-9c2a-11e3-809c-12313d1661cc,ADVICE,dark,richtext,False,False,True,0,0,False,all_ads,/r/CryptoCurrency/comments/uuthwn/honestly_the_exchanges_the_centralized_ones_need/,False,,,6,,1653159257,1,"Once Luna boys decided to switch off  the network Solana style they canceled themselves as no transactions  were possible. If the group of validators can come together and decided  to halt a network then it's time to make that big ass centralized call.

I'm  kinda done with this centralized permissioned bullshit, if there's no  attack on the network and your gang decided to switch it off and pause  it then just call it quits and GTFO.

Solana  is also one bad day away from going to zero, how many more resets  before it goes to zero?  The switch on-off VC backed chains Solanas and  Lunas and similar shit networks like BSC who have their own limited list  of validators. I'm amazed that anything Binance, Solana is actually in  the top 10.

People used to laugh  at XRP Ledger for being ""centralized and permissioned"" cause most  validators simply copy&amp;paste the nodes list kept up to date by  Ripple instead of adding their own choices of validators but goddamn  compared to these VC backed fucked up chains it's like one of the most  decentralized shit on the planet.

The  only 3 chains in the top 10 that never had a fucking reboot are  Bitcoin, Ethereum and Cardano and if the recent events told you anything  is there's a fucking reason why decentralization is important.",True,False,False,CryptoCurrency,t5_2wlj3,4899613,public,self,,,"Honestly, the exchanges (the centralized ones) need to step up and save lunatics from damaging themselves even further and close any trading on UST or Luna",0,[],1.0,https://www.reddit.com/r/CryptoCurrency/comments/uuthwn/honestly_the_exchanges_the_centralized_ones_need/,,all_ads,6,1653130446.0,,,,,,,,
39,[],False,EddieStarr,,Warning-level2-2,"[{'e': 'text', 't': 'Tin | SHIB 22 | Technology 11'}]",Tin | SHIB 22 | Technology 11,dark,richtext,t2_362z9,False,False,True,[],False,False,1653158900,self.CryptoCurrency,https://www.reddit.com/r/CryptoCurrency/comments/uutdu1/renewed_faith_in_luna/,{},uutdu1,False,True,False,False,False,True,True,False,#7193ff,DISCUSSION,"[{'e': 'text', 't': 'DISCUSSION'}]",87049662-0882-11e5-82e1-0e9d1a9f7761,DISCUSSION,dark,richtext,False,False,True,0,0,False,all_ads,/r/CryptoCurrency/comments/uutdu1/renewed_faith_in_luna/,False,,,6,,1653158910,1,"
The Market Cap for Terra (LUNA) has re-entered +701M territory.
    Just because a coin crashes doesn’t mean it gets taken out of circulation. I’ve been buying it up every day since it crashed  at a Huge-Ly Discounted Rate
Considering it was @ 117.00 a token last month and crashed to .00013xx
I only see positive momentum in the future IF the market cap keeps slowly rising.  Right after the crash, the MC was 200M so, 500M+ (701M Total) is a sign of a slow recovery but once the Crypto market recovers , LUNA could easily reach .01+ and beyond 

OR nothing could happen and it continues to collapse, I’m here for the ride.",True,False,False,CryptoCurrency,t5_2wlj3,4899597,public,self,,,Renewed Faith in LUNA,0,[],1.0,https://www.reddit.com/r/CryptoCurrency/comments/uutdu1/renewed_faith_in_luna/,,all_ads,6,1653130100.0,,,,,,,,
40,[],False,333Crypto,,Warning-level3,"[{'e': 'text', 't': '1 - 2 years account age. -15 - 35 comment karma.'}]",1 - 2 years account age. -15 - 35 comment karma.,dark,richtext,t2_a1upju1u,False,False,False,[],False,False,1653158741,youtube.com,https://www.reddit.com/r/CryptoCurrency/comments/uutbyx/no_burn_for_terra_luna_tokens_terra_owns_less/,{},uutbyx,False,True,False,False,False,True,False,False,#0dd3bb,VIDEOS,"[{'e': 'text', 't': 'VIDEOS'}]",fee6c918-f3e4-11e5-8172-0ecf7e00c6db,VIDEOS,dark,richtext,False,False,True,1,0,False,all_ads,/r/CryptoCurrency/comments/uutbyx/no_burn_for_terra_luna_tokens_terra_owns_less/,False,rich:video,"{'enabled': False, 'images': [{'id': 'k6qQNje7-nQaFF82IAWDuGUVDB_WSqiNg8S86z_ZwFQ', 'resolutions': [{'height': 81, 'url': 'https://external-preview.redd.it/gCmwPJfyhCtwPgw7C3pgq4XVmw7CrO87W6-z5L9nInE.jpg?width=108&amp;crop=smart&amp;auto=webp&amp;s=5a92bea19bb0398466c53af99f8440447d533cc5', 'width': 108}, {'height': 162, 'url': 'https://external-preview.redd.it/gCmwPJfyhCtwPgw7C3pgq4XVmw7CrO87W6-z5L9nInE.jpg?width=216&amp;crop=smart&amp;auto=webp&amp;s=94c8a2935b7dec7db135070a6a0a561b5eabcf43', 'width': 216}, {'height': 240, 'url': 'https://external-preview.redd.it/gCmwPJfyhCtwPgw7C3pgq4XVmw7CrO87W6-z5L9nInE.jpg?width=320&amp;crop=smart&amp;auto=webp&amp;s=c77afc4ed02bf6ca3ae1c63568fd37634758907d', 'width': 320}], 'source': {'height': 360, 'url': 'https://external-preview.redd.it/gCmwPJfyhCtwPgw7C3pgq4XVmw7CrO87W6-z5L9nInE.jpg?auto=webp&amp;s=f0c1a376f446c5da58dbb757a2f1b6858fdd56a8', 'width': 480}, 'variants': {}}]}",6,,1653158752,1,,True,False,False,CryptoCurrency,t5_2wlj3,4899590,public,https://b.thumbs.redditmedia.com/dr3-EfhhMIFvcRh_doSJOyy4ExC-WQHG7p-s0EQxKMg.jpg,105.0,140.0,NO BURN for Terra (LUNA) tokens! Terra owns less than 0.1%,0,[],1.0,https://youtube.com/watch?v=StsjCnvZsXs&amp;feature=share,https://youtube.com/watch?v=StsjCnvZsXs&amp;feature=share,all_ads,6,1653129941.0,,,,,"{'oembed': {'author_name': '333 Crypto', 'author_url': 'https://www.youtube.com/channel/UCmJ3yraAAsFlewGAu5K4nYA', 'height': 200, 'html': '&lt;iframe width=""356"" height=""200"" src=""https://www.youtube.com/embed/StsjCnvZsXs?feature=oembed&amp;enablejsapi=1"" frameborder=""0"" allow=""accelerometer; autoplay; clipboard-write; encrypted-media; gyroscope; picture-in-picture"" allowfullscreen&gt;&lt;/iframe&gt;', 'provider_name': 'YouTube', 'provider_url': 'https://www.youtube.com/', 'thumbnail_height': 360, 'thumbnail_url': 'https://i.ytimg.com/vi/StsjCnvZsXs/hqdefault.jpg', 'thumbnail_width': 480, 'title': 'NO BURN for Terra (LUNA) tokens! Terra owns less than 0.1%', 'type': 'video', 'version': '1.0', 'width': 356}, 'type': 'youtube.com'}","{'content': '&lt;iframe width=""356"" height=""200"" src=""https://www.youtube.com/embed/StsjCnvZsXs?feature=oembed&amp;enablejsapi=1"" frameborder=""0"" allow=""accelerometer; autoplay; clipboard-write; encrypted-media; gyroscope; picture-in-picture"" allowfullscreen&gt;&lt;/iframe&gt;', 'height': 200, 'scrolling': False, 'width': 356}","{'oembed': {'author_name': '333 Crypto', 'author_url': 'https://www.youtube.com/channel/UCmJ3yraAAsFlewGAu5K4nYA', 'height': 200, 'html': '&lt;iframe width=""356"" height=""200"" src=""https://www.youtube.com/embed/StsjCnvZsXs?feature=oembed&amp;enablejsapi=1"" frameborder=""0"" allow=""accelerometer; autoplay; clipboard-write; encrypted-media; gyroscope; picture-in-picture"" allowfullscreen&gt;&lt;/iframe&gt;', 'provider_name': 'YouTube', 'provider_url': 'https://www.youtube.com/', 'thumbnail_height': 360, 'thumbnail_url': 'https://i.ytimg.com/vi/StsjCnvZsXs/hqdefault.jpg', 'thumbnail_width': 480, 'title': 'NO BURN for Terra (LUNA) tokens! Terra owns less than 0.1%', 'type': 'video', 'version': '1.0', 'width': 356}, 'type': 'youtube.com'}","{'content': '&lt;iframe width=""356"" height=""200"" src=""https://www.youtube.com/embed/StsjCnvZsXs?feature=oembed&amp;enablejsapi=1"" frameborder=""0"" allow=""accelerometer; autoplay; clipboard-write; encrypted-media; gyroscope; picture-in-picture"" allowfullscreen&gt;&lt;/iframe&gt;', 'height': 200, 'media_domain_url': 'https://www.redditmedia.com/mediaembed/uutbyx', 'scrolling': False, 'width': 356}"
41,[],False,Wonzky,,,"[{'e': 'text', 't': 'Platinum | QC: CC 864'}]",Platinum | QC: CC 864,dark,richtext,t2_15g8bh,False,False,False,[],False,False,1653158415,u.today,https://www.reddit.com/r/CryptoCurrency/comments/uut87b/terra_luna_network_dropped_by_coinbase_cloud/,{},uut87b,False,False,False,False,False,False,False,False,#007373,EXCHANGES,"[{'e': 'text', 't': 'EXCHANGES'}]",38a8ac5a-9d5c-11e5-a136-0e9f3a832fc3,EXCHANGES,light,richtext,False,False,True,0,0,False,all_ads,/r/CryptoCurrency/comments/uut87b/terra_luna_network_dropped_by_coinbase_cloud/,False,link,"{'enabled': False, 'images': [{'id': 'LHeiO_6IQOgomp4zs9bSfnz2F-Qhj__geYwfoxAbGic', 'resolutions': [{'height': 81, 'url': 'https://external-preview.redd.it/s4tNetz0mlokXo3i5KeepEA-YRCX2R3TKtX6qkyH1hU.jpg?width=108&amp;crop=smart&amp;auto=webp&amp;s=85742b7f670aff250c8003c2ef2202138df30fa2', 'width': 108}, {'height': 162, 'url': 'https://external-preview.redd.it/s4tNetz0mlokXo3i5KeepEA-YRCX2R3TKtX6qkyH1hU.jpg?width=216&amp;crop=smart&amp;auto=webp&amp;s=c79c99001ba9387f9eb425cfc34161a81209e034', 'width': 216}, {'height': 240, 'url': 'https://external-preview.redd.it/s4tNetz0mlokXo3i5KeepEA-YRCX2R3TKtX6qkyH1hU.jpg?width=320&amp;crop=smart&amp;auto=webp&amp;s=8cf797c4573e0cf1881411c127877771e6dde021', 'width': 320}, {'height': 480, 'url': 'https://external-preview.redd.it/s4tNetz0mlokXo3i5KeepEA-YRCX2R3TKtX6qkyH1hU.jpg?width=640&amp;crop=smart&amp;auto=webp&amp;s=0aef3964dcadca9d93027b8e98965f50d013ecfa', 'width': 640}, {'height': 720, 'url': 'https://external-preview.redd.it/s4tNetz0mlokXo3i5KeepEA-YRCX2R3TKtX6qkyH1hU.jpg?width=960&amp;crop=smart&amp;auto=webp&amp;s=b4695b8660df482b301f5183784de92d3bc558eb', 'width': 960}, {'height': 810, 'url': 'https://external-preview.redd.it/s4tNetz0mlokXo3i5KeepEA-YRCX2R3TKtX6qkyH1hU.jpg?width=1080&amp;crop=smart&amp;auto=webp&amp;s=3b9764c7d8c7ec6176337a3c737d3edef570642f', 'width': 1080}], 'source': {'height': 900, 'url': 'https://external-preview.redd.it/s4tNetz0mlokXo3i5KeepEA-YRCX2R3TKtX6qkyH1hU.jpg?auto=webp&amp;s=86a4f8a8d162a0d46b600141eeab84242afc958c', 'width': 1200}, 'variants': {}}]}",6,moderator,1653158426,1,,False,False,False,CryptoCurrency,t5_2wlj3,4899573,public,https://b.thumbs.redditmedia.com/nQgGoLxjnlmVzXNV0CO5gqAgh1ioRk9D24Mtmo_L09o.jpg,105.0,140.0,Terra (LUNA) Network Dropped by Coinbase Cloud Service,0,[],1.0,https://u.today/terra-luna-network-dropped-by-coinbase-cloud-service,https://u.today/terra-luna-network-dropped-by-coinbase-cloud-service,all_ads,6,1653129615.0,,,,,,,,
42,[],False,suckitliu518,,,[],,,text,t2_caxq68lp,False,False,False,[],False,False,1653155733,i.redd.it,https://www.reddit.com/r/CryptoCurrency/comments/uusci7/do_kwon_few_minutes_ago_shared_luna_burn_address/,{},uusci7,False,True,False,False,True,True,False,False,#7193ff,DISCUSSION,"[{'e': 'text', 't': 'DISCUSSION'}]",87049662-0882-11e5-82e1-0e9d1a9f7761,DISCUSSION,dark,richtext,False,False,True,1,0,False,all_ads,/r/CryptoCurrency/comments/uusci7/do_kwon_few_minutes_ago_shared_luna_burn_address/,False,image,"{'enabled': True, 'images': [{'id': '7GcVmRTgwq9awlNcgkT_g3a5gaVvU4QJrA-gxtOmglc', 'resolutions': [{'height': 216, 'url': 'https://preview.redd.it/7xc0hq28bv091.jpg?width=108&amp;crop=smart&amp;auto=webp&amp;s=6d89866cc4ef203ff1138d182234d36c47f4138c', 'width': 108}, {'height': 432, 'url': 'https://preview.redd.it/7xc0hq28bv091.jpg?width=216&amp;crop=smart&amp;auto=webp&amp;s=ffe1ccf7a4e42859ff182ea29b2927042b577143', 'width': 216}, {'height': 640, 'url': 'https://preview.redd.it/7xc0hq28bv091.jpg?width=320&amp;crop=smart&amp;auto=webp&amp;s=119a151eaffde46e07dbb9b572056e281e20c31d', 'width': 320}, {'height': 1280, 'url': 'https://preview.redd.it/7xc0hq28bv091.jpg?width=640&amp;crop=smart&amp;auto=webp&amp;s=85fb49d6d71409816d64a9842b238d0f8cf00d88', 'width': 640}], 'source': {'height': 1792, 'url': 'https://preview.redd.it/7xc0hq28bv091.jpg?auto=webp&amp;s=55946813bf7291fba3bfb3ed5983a3a0bb3902ce', 'width': 828}, 'variants': {}}]}",6,,1653155744,1,,False,False,False,CryptoCurrency,t5_2wlj3,4899401,public,https://a.thumbs.redditmedia.com/PmEOZpZQED0ptxCzYrKmURy8MfGjq-JPNLWY_GyzpY4.jpg,140.0,140.0,Do Kwon few minutes ago shared Luna burn address. terra1mg5q9fmmmu2tg2akw07m0vt62ru7cks5svpzt3,0,[],1.0,https://i.redd.it/7xc0hq28bv091.jpg,https://i.redd.it/7xc0hq28bv091.jpg,all_ads,6,1653126933.0,,,,,,,,
43,[],False,crypto_currency_77,,,[],,,text,t2_hubpqrkp,False,False,False,[],False,False,1653154768,cryptocurrencysimple.com,https://www.reddit.com/r/CryptoCurrency/comments/uus190/loop_finance_amazing_review_the_first_multichain/,{},uus190,False,False,False,False,False,False,False,False,#646d73,TECHNOLOGY,"[{'e': 'text', 't': 'TECHNOLOGY'}]",2cb47a9c-3cc9-11ec-8857-7e7f5686f7de,TECHNOLOGY,dark,richtext,False,False,True,0,0,False,all_ads,/r/CryptoCurrency/comments/uus190/loop_finance_amazing_review_the_first_multichain/,False,link,"{'enabled': False, 'images': [{'id': 'Q1WxASORm425t3q8bSE9E6wgRdraWFzkykCgZznqc0s', 'resolutions': [{'height': 60, 'url': 'https://external-preview.redd.it/2F6ndt56ZxCJpaJn4nLA9NXPCWcAOcOBGPxSKwKmoqo.jpg?width=108&amp;crop=smart&amp;auto=webp&amp;s=a4f0f0239a23b7ff5d4cd21baff0ace5a24f96dd', 'width': 108}, {'height': 121, 'url': 'https://external-preview.redd.it/2F6ndt56ZxCJpaJn4nLA9NXPCWcAOcOBGPxSKwKmoqo.jpg?width=216&amp;crop=smart&amp;auto=webp&amp;s=397743e307367947fe11d4ebf6020da73f4e2ce9', 'width': 216}, {'height': 180, 'url': 'https://external-preview.redd.it/2F6ndt56ZxCJpaJn4nLA9NXPCWcAOcOBGPxSKwKmoqo.jpg?width=320&amp;crop=smart&amp;auto=webp&amp;s=375ac8eb98c534c4726cc1bec19ea8235040fd9c', 'width': 320}, {'height': 360, 'url': 'https://external-preview.redd.it/2F6ndt56ZxCJpaJn4nLA9NXPCWcAOcOBGPxSKwKmoqo.jpg?width=640&amp;crop=smart&amp;auto=webp&amp;s=6d87d2656a834c2bdf3d5da7c8da7eba9af3d5d9', 'width': 640}, {'height': 540, 'url': 'https://external-preview.redd.it/2F6ndt56ZxCJpaJn4nLA9NXPCWcAOcOBGPxSKwKmoqo.jpg?width=960&amp;crop=smart&amp;auto=webp&amp;s=f7245e34d74d9c7cdc59f6ab775c009623da9b72', 'width': 960}, {'height': 607, 'url': 'https://external-preview.redd.it/2F6ndt56ZxCJpaJn4nLA9NXPCWcAOcOBGPxSKwKmoqo.jpg?width=1080&amp;crop=smart&amp;auto=webp&amp;s=09d3b9d79bac7109a406b6f4d04c994656d09196', 'width': 1080}], 'source': {'height': 720, 'url': 'https://external-preview.redd.it/2F6ndt56ZxCJpaJn4nLA9NXPCWcAOcOBGPxSKwKmoqo.jpg?auto=webp&amp;s=f3d0db9047a886249d14b1dbb4368ea86da86dc5', 'width': 1280}, 'variants': {}}]}",6,reddit,1653154779,1,,False,False,False,CryptoCurrency,t5_2wlj3,4899348,public,https://b.thumbs.redditmedia.com/wN0MZk7X9McAXIH_lymbat7pDAzxvMC-ch99AWsBWiE.jpg,78.0,140.0,Loop Finance Amazing Review- The First MultiChain DEX on the Terra (LUNA) Network (2022),0,[],1.0,https://cryptocurrencysimple.com/loop-finance-amazing-review-the-first-multichain-dex-on-the-terra-luna-network-2022/?feed_id=23057&amp;_unique_id=628923d019991,https://cryptocurrencysimple.com/loop-finance-amazing-review-the-first-multichain-dex-on-the-terra-luna-network-2022/?feed_id=23057&amp;_unique_id=628923d019991,all_ads,6,1653125968.0,,,,,,,,
44,[],False,kayden_8,,Warning-level2-2,"[{'e': 'text', 't': 'Tin | 4 months old'}]",Tin | 4 months old,dark,richtext,t2_i4vjdckk,False,False,False,[],False,False,1653153870,self.CryptoCurrency,https://www.reddit.com/r/CryptoCurrency/comments/uurqg1/ramp_defi_may_community_updates/,{},uurqg1,False,True,False,False,False,True,True,False,#7193ff,DISCUSSION,"[{'e': 'text', 't': 'DISCUSSION'}]",87049662-0882-11e5-82e1-0e9d1a9f7761,DISCUSSION,dark,richtext,False,False,True,0,0,False,all_ads,/r/CryptoCurrency/comments/uurqg1/ramp_defi_may_community_updates/,False,,,6,,1653153881,1," 1) A Review of rUSD Following Recent Events

The recent LUNA/UST collapse was highly unfortunate for DeFi investors and users. In light of this event, it is important for users to understand that rUSD, which is **overcollateralized**, does not contain any of the same risks faced by UST.

rUSD is minted using a wide range of collateral, including BTC, ETH, BNB, CAKE, RAMP and more. In times of stress, and using liquidations where necessary, the RAMP protocol has since inception, ensured that rUSD remains fully collateralized in value.

Going forward, we expect the general environment to remain challenging for collateralized stablecoins, due to (i) increased risks for LPs as a result of highly imbalanced liquidity pools, (ii) constant LP reward emissions in the face of a market contraction and (iii) growing regulatory scrutiny by global governments.

The transition of RAMP to Lever Finance is expected to play a positive role in mitigating these headwinds for the protocol, team and community.

2) Reaffirming Our Commitment to BUIDL

Notwithstanding the broad market fluctuations, Galaxia Labs’ focus on driving financial innovation and building new user-centric products has not changed. Funding has been secured with sufficient project runway to get through the next few Bitcoin halvings, bull and bear markets, and beyond.

Galaxia Labs team reaffirms out commitment to build and develop innovative solutions for the Web3 community, starting with Lever Finance, and will subsequently expand to include Web3 infrastructure, user tools, NFTs, GameFi and SocialFi.

We believe that our unwavering focus to build, even in the midst of market contractions, will eventually bear fruit once macro conditions inevitably recover.

Subject to future market conditions, new products may be launched as token projects or simply as fee-generating utility solutions (non-token), with value to be accrued towards token holders in the form of airdrops, token buybacks, incentives and more.

https://preview.redd.it/52todngo5v091.jpg?width=1400&amp;format=pjpg&amp;auto=webp&amp;s=43b796abc30c2f88226b09e96bf97eeae7330729",True,False,False,CryptoCurrency,t5_2wlj3,4899286,public,https://b.thumbs.redditmedia.com/EF-IXhMA-8SQwVLOfRk1Clbnf9x5XBJaFcF9ToUDjxs.jpg,78.0,140.0,Ramp DeFi May Community Updates,0,[],1.0,https://www.reddit.com/r/CryptoCurrency/comments/uurqg1/ramp_defi_may_community_updates/,,all_ads,6,1653125070.0,,"{'52todngo5v091': {'e': 'Image', 'id': '52todngo5v091', 'm': 'image/jpg', 'p': [{'u': 'https://preview.redd.it/52todngo5v091.jpg?width=108&amp;crop=smart&amp;auto=webp&amp;s=30628cfe22a3c82722cba19702987982dec70de2', 'x': 108, 'y': 60}, {'u': 'https://preview.redd.it/52todngo5v091.jpg?width=216&amp;crop=smart&amp;auto=webp&amp;s=8278f7c2ad8e27f946547dd8f654b19dd2291d3e', 'x': 216, 'y': 121}, {'u': 'https://preview.redd.it/52todngo5v091.jpg?width=320&amp;crop=smart&amp;auto=webp&amp;s=8d46dad810463c2841f69aed87291be759db780c', 'x': 320, 'y': 179}, {'u': 'https://preview.redd.it/52todngo5v091.jpg?width=640&amp;crop=smart&amp;auto=webp&amp;s=68a44fa27d77db8fcc5593a144ae547914164b24', 'x': 640, 'y': 359}, {'u': 'https://preview.redd.it/52todngo5v091.jpg?width=960&amp;crop=smart&amp;auto=webp&amp;s=c97cd1902d30a613e1f6ffcfa54c86332fa93178', 'x': 960, 'y': 539}, {'u': 'https://preview.redd.it/52todngo5v091.jpg?width=1080&amp;crop=smart&amp;auto=webp&amp;s=ea90b61d17625933846c51b8477e38b268f19747', 'x': 1080, 'y': 607}], 's': {'u': 'https://preview.redd.it/52todngo5v091.jpg?width=1400&amp;format=pjpg&amp;auto=webp&amp;s=43b796abc30c2f88226b09e96bf97eeae7330729', 'x': 1400, 'y': 787}, 'status': 'valid'}}",,,,,,
45,[],False,doallstuff,,,[],,,text,t2_m8zi6nc,False,False,False,[],False,False,1653153418,self.CryptoCurrency,https://www.reddit.com/r/CryptoCurrency/comments/uurl65/eli5_lunas_market_cap_visible_on_coinmarketcap_is/,{},uurl65,False,True,False,False,False,True,True,False,#7193ff,DISCUSSION,"[{'e': 'text', 't': 'DISCUSSION'}]",87049662-0882-11e5-82e1-0e9d1a9f7761,DISCUSSION,dark,richtext,False,False,True,0,0,False,all_ads,/r/CryptoCurrency/comments/uurl65/eli5_lunas_market_cap_visible_on_coinmarketcap_is/,False,,,6,,1653153429,1,"Disclaimer: I am pretty new to crypto

I have been following the recent collapse of UST/Luna and it's been pretty instructive. One of the things I do not understand at all is Luna's current market cap. How come it's so high when all the trust has evaporated?

Controlling the whole Luna's supply surely must not be worth than idk, 10m+? Is the only basis of the current valuation brand recognition mixed with some hope that ""stonks go up""?

&amp;#x200B;

soo.. the current luna's market cap, as seen on coinmarketcap, is 690M USD. Is that real?",True,False,False,CryptoCurrency,t5_2wlj3,4899268,public,self,,,ELI5: Luna's market cap visible on coinmarketcap is 690M USD. Is that real?,0,[],1.0,https://www.reddit.com/r/CryptoCurrency/comments/uurl65/eli5_lunas_market_cap_visible_on_coinmarketcap_is/,,all_ads,6,1653124618.0,,,,,,,,
46,[],False,ksing_king,,Warning-level2-2,"[{'e': 'text', 't': 'Tin'}]",Tin,dark,richtext,t2_r9ivnmk,False,False,False,[],False,False,1653152479,self.CryptoCurrency,https://www.reddit.com/r/CryptoCurrency/comments/uur9qo/how_much_was_lost_on_the_whole_terra_luna_fiasco/,{},uur9qo,False,True,False,False,False,True,True,False,#f08f1a,LEGACY,"[{'e': 'text', 't': 'LEGACY'}]",118ffec0-a22f-11e5-a5a1-0ef58894b98d,LEGACY,light,richtext,False,False,True,0,0,False,all_ads,/r/CryptoCurrency/comments/uur9qo/how_much_was_lost_on_the_whole_terra_luna_fiasco/,False,,,6,,1653152490,1,"I think it's important to be honest not just about our victories, but also about our losses. It helps keep us in reality so that we will remember the losses and be humbled for next investments. We all hear about those who became millionaires from crypto but never the ones who suffered losses. This had a market cap of $50B, a lot of people surely lost a lot of money.  

This isn't meant to rub salt in the wounds, but to share stories to understand how to do better next time. How much did you lose in this whole gongshow?",True,False,False,CryptoCurrency,t5_2wlj3,4899206,public,self,,,How much was lost on the whole terra luna fiasco,0,[],1.0,https://www.reddit.com/r/CryptoCurrency/comments/uur9qo/how_much_was_lost_on_the_whole_terra_luna_fiasco/,,all_ads,6,1653123679.0,,,,,,,,
47,[],False,marshall_mathers_2k,,,[],,,text,t2_45la5kp0,False,False,False,[],False,False,1653149838,self.CryptoCurrency,https://www.reddit.com/r/CryptoCurrency/comments/uuqel3/terra_20_is_live_on_pancakeswap_join_the_ride_for/,{},uuqel3,False,False,False,False,False,False,True,False,#646d73,MOONS,"[{'e': 'text', 't': 'MOONS 🌕'}]",1e195abc-f3e5-11e5-8899-0e1af474c431,MOONS 🌕,light,richtext,False,False,True,0,0,False,all_ads,/r/CryptoCurrency/comments/uuqel3/terra_20_is_live_on_pancakeswap_join_the_ride_for/,False,self,"{'enabled': False, 'images': [{'id': 'omqR4reicR5CCExYz1vAZCENFV8YG5TY76q-Xii4Xow', 'resolutions': [{'height': 108, 'url': 'https://external-preview.redd.it/XOAxlO8gYgf46d9IcO8Ww00iklkKkb9wBdQQ5wZZvLg.jpg?width=108&amp;crop=smart&amp;auto=webp&amp;s=7a4bed2c3f3564abba2ec24f34cf46970de9b5dd', 'width': 108}, {'height': 216, 'url': 'https://external-preview.redd.it/XOAxlO8gYgf46d9IcO8Ww00iklkKkb9wBdQQ5wZZvLg.jpg?width=216&amp;crop=smart&amp;auto=webp&amp;s=6cab0c6567412a971af26268d4ee24c0f20e58db', 'width': 216}, {'height': 320, 'url': 'https://external-preview.redd.it/XOAxlO8gYgf46d9IcO8Ww00iklkKkb9wBdQQ5wZZvLg.jpg?width=320&amp;crop=smart&amp;auto=webp&amp;s=ff81bd46e5d0d55afd73a24804c5d910f6c0ce3b', 'width': 320}], 'source': {'height': 320, 'url': 'https://external-preview.redd.it/XOAxlO8gYgf46d9IcO8Ww00iklkKkb9wBdQQ5wZZvLg.jpg?auto=webp&amp;s=4d2ca7a4df4e6efbc39b941884e22181639e2433', 'width': 320}, 'variants': {}}]}",6,moderator,1653149849,1,[removed],True,False,False,CryptoCurrency,t5_2wlj3,4899039,public,self,,,Terra 2.0 is Live on Pancakeswap | Join The Ride for 100x of Upside | Hodl for 24 Hours and you will rewarded with Luna Coin,0,[],1.0,https://www.reddit.com/r/CryptoCurrency/comments/uuqel3/terra_20_is_live_on_pancakeswap_join_the_ride_for/,,all_ads,6,1653121038.0,,,,,,,,
