,all_awardings,allow_live_comments,author,author_flair_background_color,author_flair_css_class,author_flair_richtext,author_flair_text,author_flair_text_color,author_flair_type,author_fullname,author_is_blocked,author_patreon_flair,author_premium,awarders,can_mod_post,contest_mode,created_utc,domain,full_link,gildings,id,is_created_from_ads_ui,is_crosspostable,is_meta,is_original_content,is_reddit_media_domain,is_robot_indexable,is_self,is_video,link_flair_background_color,link_flair_css_class,link_flair_richtext,link_flair_template_id,link_flair_text,link_flair_text_color,link_flair_type,locked,media_only,no_follow,num_comments,num_crossposts,over_18,parent_whitelist_status,permalink,pinned,post_hint,preview,pwls,removed_by_category,retrieved_on,score,selftext,send_replies,spoiler,stickied,subreddit,subreddit_id,subreddit_subscribers,subreddit_type,thumbnail,thumbnail_height,thumbnail_width,title,total_awards_received,treatment_tags,upvote_ratio,url,url_overridden_by_dest,whitelist_status,wls,created,author_flair_template_id,media_metadata,crosspost_parent,crosspost_parent_list,media,media_embed,secure_media,secure_media_embed
0,[],False,TLDRking1,,Warning-level2-2,"[{'e': 'text', 't': 'Tin | 3 months old'}]",Tin | 3 months old,dark,richtext,t2_jdxstwmx,False,False,False,[],False,False,1653234750,u.today,https://www.reddit.com/r/CryptoCurrency/comments/uvdpnc/binance_ceo_luna_and_ust_was_just_stupid/,{},uvdpnc,False,False,False,False,False,False,False,False,#0aa18f,NEWS,"[{'e': 'text', 't': 'GENERAL-NEWS'}]",f170aab2-246f-11ec-8143-429a193c9848,GENERAL-NEWS,light,richtext,False,False,True,0,0,False,all_ads,/r/CryptoCurrency/comments/uvdpnc/binance_ceo_luna_and_ust_was_just_stupid/,False,link,"{'enabled': False, 'images': [{'id': 'dRJtSfbKI5plP-LBYxV5Rdy4xu6lpt7MxEGbxo4eEgs', 'resolutions': [{'height': 81, 'url': 'https://external-preview.redd.it/Zz6REC4tO6iOTov0eRFRU_UK8oyHUf-NzWCHUbjpjsQ.jpg?width=108&amp;crop=smart&amp;auto=webp&amp;s=967b15fc2766be8e0667b192896e7466765ab24d', 'width': 108}, {'height': 162, 'url': 'https://external-preview.redd.it/Zz6REC4tO6iOTov0eRFRU_UK8oyHUf-NzWCHUbjpjsQ.jpg?width=216&amp;crop=smart&amp;auto=webp&amp;s=a2704fdfc1d278d92733e05ec4438eb449a813b1', 'width': 216}, {'height': 240, 'url': 'https://external-preview.redd.it/Zz6REC4tO6iOTov0eRFRU_UK8oyHUf-NzWCHUbjpjsQ.jpg?width=320&amp;crop=smart&amp;auto=webp&amp;s=114b32b9b3581b10d754797da728619a56c2e3d3', 'width': 320}, {'height': 480, 'url': 'https://external-preview.redd.it/Zz6REC4tO6iOTov0eRFRU_UK8oyHUf-NzWCHUbjpjsQ.jpg?width=640&amp;crop=smart&amp;auto=webp&amp;s=ac0e15d7d8b7c815235c8a1c1c4df0f57000947c', 'width': 640}, {'height': 720, 'url': 'https://external-preview.redd.it/Zz6REC4tO6iOTov0eRFRU_UK8oyHUf-NzWCHUbjpjsQ.jpg?width=960&amp;crop=smart&amp;auto=webp&amp;s=baf62185ebf89bc34b2c072e3e7ec0811f44516c', 'width': 960}, {'height': 810, 'url': 'https://external-preview.redd.it/Zz6REC4tO6iOTov0eRFRU_UK8oyHUf-NzWCHUbjpjsQ.jpg?width=1080&amp;crop=smart&amp;auto=webp&amp;s=8033c81eb2fad3af7c45a049df73908c1d6ed1b4', 'width': 1080}], 'source': {'height': 900, 'url': 'https://external-preview.redd.it/Zz6REC4tO6iOTov0eRFRU_UK8oyHUf-NzWCHUbjpjsQ.jpg?auto=webp&amp;s=6905f2e67c6c5042ab843b42f6e64ce7c8c1c734', 'width': 1200}, 'variants': {}}]}",6,moderator,1653234761,1,,True,False,False,CryptoCurrency,t5_2wlj3,4903415,public,https://b.thumbs.redditmedia.com/-wFAVxv3rJfdSAdOo_F_oZOgUoFoK5JVu9n1YG-gVbI.jpg,105.0,140.0,"Binance CEO: Luna and UST ""Was Just Stupid""",0,[],1.0,https://u.today/binance-ceo-luna-and-ust-was-just-stupid,https://u.today/binance-ceo-luna-and-ust-was-just-stupid,all_ads,6,1653205950.0,,,,,,,,
1,[],False,RuralDisturbance,,noflair,"[{'e': 'text', 't': 'Silver | QC: BTC 22, ExchSubs 6'}]","Silver | QC: BTC 22, ExchSubs 6",dark,richtext,t2_mhktj,False,False,False,[],False,False,1653233305,i.redd.it,https://www.reddit.com/r/CryptoCurrency/comments/uvd940/i_sodl_luna_and_eth/,{},uvd940,False,True,False,False,True,True,False,False,#5a74cc,PERSPECTIVE,"[{'e': 'text', 't': 'PERSPECTIVE'}]",1b44cdb2-2a6c-11ec-9baf-0aa21184cd0a,PERSPECTIVE,light,richtext,False,False,True,1,0,False,all_ads,/r/CryptoCurrency/comments/uvd940/i_sodl_luna_and_eth/,False,image,"{'enabled': True, 'images': [{'id': 'TJ-0BOrWDP51siYTZgvja8ZJq2bLfakO1nnr3JxVF1Y', 'resolutions': [{'height': 15, 'url': 'https://preview.redd.it/j8jo60kkp1191.png?width=108&amp;crop=smart&amp;auto=webp&amp;s=62ff29f02c4bf940c7402456d705b7c9f6c81dfe', 'width': 108}, {'height': 30, 'url': 'https://preview.redd.it/j8jo60kkp1191.png?width=216&amp;crop=smart&amp;auto=webp&amp;s=866b29e86fda7037243f5410a2ee9bead5144c59', 'width': 216}, {'height': 44, 'url': 'https://preview.redd.it/j8jo60kkp1191.png?width=320&amp;crop=smart&amp;auto=webp&amp;s=9f782c47ad0ae7038134fbf8719ce452f68d84d1', 'width': 320}, {'height': 89, 'url': 'https://preview.redd.it/j8jo60kkp1191.png?width=640&amp;crop=smart&amp;auto=webp&amp;s=cafb8e687636e4c4da28dbdec3901d01534e5e8b', 'width': 640}, {'height': 134, 'url': 'https://preview.redd.it/j8jo60kkp1191.png?width=960&amp;crop=smart&amp;auto=webp&amp;s=eb3281d6e35e739af58edd06a119c8d3a0128672', 'width': 960}, {'height': 150, 'url': 'https://preview.redd.it/j8jo60kkp1191.png?width=1080&amp;crop=smart&amp;auto=webp&amp;s=0bd69983697209b5c638228465638f33657a3112', 'width': 1080}], 'source': {'height': 398, 'url': 'https://preview.redd.it/j8jo60kkp1191.png?auto=webp&amp;s=8487faf3cb1b7ddd83b5a6ae367786b386782eda', 'width': 2848}, 'variants': {}}]}",6,,1653233316,1,,True,False,False,CryptoCurrency,t5_2wlj3,4903317,public,https://b.thumbs.redditmedia.com/Oiu-xE2YZYER-ti-Q-HJhqv3kceLZXX11DWLtMQFOzw.jpg,19.0,140.0,I SODL LUNA and ETH,0,[],1.0,https://i.redd.it/j8jo60kkp1191.png,https://i.redd.it/j8jo60kkp1191.png,all_ads,6,1653204505.0,261fc174-1507-11e4-8375-12313d224df5,,,,,,,
2,[],False,WhiskeyTangoTrotfox,,,"[{'e': 'text', 't': ' Never Say Die'}]", Never Say Die,dark,richtext,t2_a0o33g08,False,False,False,[],False,False,1653233161,self.CryptoCurrency,https://www.reddit.com/r/CryptoCurrency/comments/uvd7eo/bears_arent_so_scary_if_you_zoom_out/,{},uvd7eo,False,True,False,False,False,True,True,False,#add2e2,ADVICE,"[{'e': 'text', 't': 'ANALYSIS'}]",c1034ee6-9c2a-11e3-a8c4-12313b0e8e20,ANALYSIS,dark,richtext,False,False,False,0,0,False,all_ads,/r/CryptoCurrency/comments/uvd7eo/bears_arent_so_scary_if_you_zoom_out/,False,,,6,,1653233172,2,"I saw this chart posted in another sub I’m fond of, and I think it’s helpful perspective, especially for those of us who forget to zoom out or consider the historical, cyclical nature of markets. 

[For the S&amp;P, bear markets are short-lived, compared to bull markets](https://preview.redd.it/xk5eocbjh1191.png?width=2000&amp;format=png&amp;auto=webp&amp;s=7e203fbf5503f918c79bbf77ca3dc9aef0ded19a)

# Argument

  
While this period of bearishness might last a few years or longer even, compared to bull market time frames, there's many more good days ahead to look forward to. And given crypto's correlation of late to equities markets, there's reason to be optimistic in the longer term, despite all the negative sentiment in the near term. But that also requires you, me, and everyone else to not only hang tight while things go down, but to also consider the idea of dollar cost averaging. Because the other truth is that while those drawdowns are short, if your investment in coin X drops by 50% you don't just need 50% recovery to be back in the black, you need 100% returns to return even, and you need more to profit again, so brining your average buys down can help achieve this profitability goal post closer, rather than keeping it farther away.

To be fair and accurate, the chart above is a measure of the S&amp;P 500 since, roughly, the Second Great War. And while I understand these markets are apples and oranges—cryptocurrency, the S&amp;P 500, and others—my point in this comparison is to give some healthy perspective into the way that markets, though they crash, do also historically recover. And those crashes tend to be much shorter than the bull markets that follow them. Furthermore, cryptocurrencies, especially of late, have tended to correlate rather closely with the equities markets, as evidenced by this second chart, as more and more institutional money enters the space. 

[BTC, ETH, the Dow, the S&amp;P, &amp; the NASDAQ](https://preview.redd.it/6g13gc4gi1191.png?width=1566&amp;format=png&amp;auto=webp&amp;s=a0325356ec951edd0339ede3db773ab4068c695a)

# Counter Argument

Again, I recognize that these markets are not all the same. And that it's not necessarily true that these assets will always directly correlate. And I also understand that—especially for those who are giga-bullish among us—the whole damn thing (crypto) could go the way of LUNA or Bitconnect, but I tend to also think that this is hyperbolic. I don't think crypto is going to zero. Sure, none of us can predict the future: up, down, sideways, or spiraling loops of insanity. But it would be nothing short of miraculous to see the whole industry to dark. Realistically, I do think that as this recessionary environment continues to take it's toll across the board, so too will crypto continue to correlate downwards. As u/katiecharm mentioned in recent post, 

&gt;It should be a possibility on your mental list that crypto might be about to experience it’s first *true* crash, and it will seem like an extinction level event. 

It would be naïve to not consider the mental possibility that your whole portfolio of internet coins could, for whatever reason, nuke catastrophically downward. Just like any major economic black swan event or recession or whatever could send your brokerage account or 401(k) to Goblin Town. Nevertheless, as I've tried to point out, all markets are cyclical, and despite u/katiecharm's warning that we should all be prepared for an ""extinction level"" crash, they also pointed out that they are—like myself—""a crypto maximalist."" And while things may seem awful right now, as most folks are down bad or feeling the red across their entire portfolios, this too shall pass—also, congrats if you're new to crypto and enjoying some gains. Luck always favors the beginner, some say. As Ray Dalio (former manager of the world's largest hedge fund, Bridgewater Associates) has said about the cyclical nature of markets,  

&gt;The biggest mistake that most people make is to judge what will be good by what has been good lately . . . So if a market has gone up a lot, they think that’s a good market, rather than it’s more expensive.

Conversely, during times like these, when things are bearish, Dalio notes that folks tend to think, 

&gt;That’s a bad market, and I don’t want any of it.

But the reality is that every period of major downturn, historically, has been followed by a typically longer period of prosperity. The hurt locker doesn't last forever. And while some folks won't make it out alive, as is true of any market, crypto or otherwise, the reward often comes to those who can push forward, confidently, with conviction in what they're investing in, and a willingness to not only hold, but continue investing, long term, in those investments that offer real value. 

So prepare for the worst. That's prudent. Be aware that near term could be a whole lot of not much fun, if you only get enjoyment out of the excitement of bullish periods. But also consider that this is the time everyone was clamoring for when prices were higher. This is the time to really average down. There's plenty fun to be had in Goblin Town. Everything is a fire sale. Just be sure you've got the stomach for playing hot potato.",False,False,False,CryptoCurrency,t5_2wlj3,4903304,public,https://b.thumbs.redditmedia.com/OSJ3n0ujYff62W4WoOFBFiQDcErFJBpSFDZYziv5ywY.jpg,108.0,140.0,"Bears Aren’t so Scary, if you Zoom Out",0,[],1.0,https://www.reddit.com/r/CryptoCurrency/comments/uvd7eo/bears_arent_so_scary_if_you_zoom_out/,,all_ads,6,1653204361.0,,"{'6g13gc4gi1191': {'e': 'Image', 'id': '6g13gc4gi1191', 'm': 'image/png', 'p': [{'u': 'https://preview.redd.it/6g13gc4gi1191.png?width=108&amp;crop=smart&amp;auto=webp&amp;s=56e4ed836e937e277e4afc3e7cdd5fd8036f0a3d', 'x': 108, 'y': 60}, {'u': 'https://preview.redd.it/6g13gc4gi1191.png?width=216&amp;crop=smart&amp;auto=webp&amp;s=346080fb2df715f6f974a63ae9211f2c6a42ed56', 'x': 216, 'y': 121}, {'u': 'https://preview.redd.it/6g13gc4gi1191.png?width=320&amp;crop=smart&amp;auto=webp&amp;s=0b89f95a761caf2e8f47cb4b68c140596b9c0a34', 'x': 320, 'y': 179}, {'u': 'https://preview.redd.it/6g13gc4gi1191.png?width=640&amp;crop=smart&amp;auto=webp&amp;s=dc6cccbf28a61571c5d916698fe07c1d2fc75d1d', 'x': 640, 'y': 359}, {'u': 'https://preview.redd.it/6g13gc4gi1191.png?width=960&amp;crop=smart&amp;auto=webp&amp;s=8325d59a035474dd197f12542cbfb42709ed7bfb', 'x': 960, 'y': 538}, {'u': 'https://preview.redd.it/6g13gc4gi1191.png?width=1080&amp;crop=smart&amp;auto=webp&amp;s=678d158a22dbff892591643e643134324688aabd', 'x': 1080, 'y': 606}], 's': {'u': 'https://preview.redd.it/6g13gc4gi1191.png?width=1566&amp;format=png&amp;auto=webp&amp;s=a0325356ec951edd0339ede3db773ab4068c695a', 'x': 1566, 'y': 879}, 'status': 'valid'}, 'xk5eocbjh1191': {'e': 'Image', 'id': 'xk5eocbjh1191', 'm': 'image/png', 'p': [{'u': 'https://preview.redd.it/xk5eocbjh1191.png?width=108&amp;crop=smart&amp;auto=webp&amp;s=014d7ed26d0acc6d3d3e79252a6f603369a76fdc', 'x': 108, 'y': 83}, {'u': 'https://preview.redd.it/xk5eocbjh1191.png?width=216&amp;crop=smart&amp;auto=webp&amp;s=01870309431b006f5ac8cefb0b143e028fee23bf', 'x': 216, 'y': 166}, {'u': 'https://preview.redd.it/xk5eocbjh1191.png?width=320&amp;crop=smart&amp;auto=webp&amp;s=21168218b4b38f8c20249e9dadb2c5424e8c9268', 'x': 320, 'y': 247}, {'u': 'https://preview.redd.it/xk5eocbjh1191.png?width=640&amp;crop=smart&amp;auto=webp&amp;s=94df10cf7403e0c070354fba601720349de73834', 'x': 640, 'y': 494}, {'u': 'https://preview.redd.it/xk5eocbjh1191.png?width=960&amp;crop=smart&amp;auto=webp&amp;s=40ba7421d8f29dfa84fe04ce11aee94b93a76605', 'x': 960, 'y': 741}, {'u': 'https://preview.redd.it/xk5eocbjh1191.png?width=1080&amp;crop=smart&amp;auto=webp&amp;s=f71b87c01c4ecdd06aa2e154f3807fcc5d26a1af', 'x': 1080, 'y': 834}], 's': {'u': 'https://preview.redd.it/xk5eocbjh1191.png?width=2000&amp;format=png&amp;auto=webp&amp;s=7e203fbf5503f918c79bbf77ca3dc9aef0ded19a', 'x': 2000, 'y': 1545}, 'status': 'valid'}}",,,,,,
3,[],False,user13958,,,"[{'e': 'text', 't': 'Platinum | QC: CC 53 | DayTrading 8 | Unpop.Opin. 47'}]",Platinum | QC: CC 53 | DayTrading 8 | Unpop.Opin. 47,dark,richtext,t2_3c91gx5s,False,False,False,[],False,False,1653231434,self.CryptoCurrency,https://www.reddit.com/r/CryptoCurrency/comments/uvcn29/im_buying_a_tiny_bit_of_wluna_wrapped_terra_luna/,{},uvcn29,False,True,False,False,False,True,True,False,#5a74cc,PERSPECTIVE,"[{'e': 'text', 't': 'PERSPECTIVE'}]",1b44cdb2-2a6c-11ec-9baf-0aa21184cd0a,PERSPECTIVE,light,richtext,False,False,True,0,0,False,all_ads,/r/CryptoCurrency/comments/uvcn29/im_buying_a_tiny_bit_of_wluna_wrapped_terra_luna/,False,,,6,,1653231445,1,"This coin obviously failed us and hurt many people, but holy shit it's literally 1/100th of a penny inn value right now.. I threw a tiny bit of cash into it. Also, I know, we don't like coinbase, but whatever it is easy to use. 

Why?? I'm so dumb? Well I feel like it's just like buying a lottery ticket. I'm likely going to lose it all, but if somehow they turn things around and recover it's proper functioning uses again, and we even get back to a $1 value (peak was &gt;$100$), I'll have seen my investment go up 1000x or 100,000% gains. 

Turning $10 to $10,000 isn't a bad bet considering that $10 is less than a cocktail at most restaurants in my city. 

Tell me why I'm an idiot please? Is there a 0% chance they can recover from this absolute screw up?",True,False,False,CryptoCurrency,t5_2wlj3,4903192,public,self,,,I'm buying a tiny bit of WLUNA (wrapped terra Luna) token on Coinbase,0,[],1.0,https://www.reddit.com/r/CryptoCurrency/comments/uvcn29/im_buying_a_tiny_bit_of_wluna_wrapped_terra_luna/,,all_ads,6,1653202634.0,,,,,,,,
4,[],False,___v0id___,,,"[{'e': 'text', 't': 'Platinum | QC: CC 557 | r/SSB 6'}]",Platinum | QC: CC 557 | r/SSB 6,dark,richtext,t2_8m25xt6f,False,False,False,[],False,False,1653231169,support.mexc.com,https://www.reddit.com/r/CryptoCurrency/comments/uvck2t/mexc_x_luna_recovery_plan_vote_to_decide_luna/,{},uvck2t,False,False,False,False,False,False,False,False,#0aa18f,NEWS,"[{'e': 'text', 't': 'GENERAL-NEWS'}]",f170aab2-246f-11ec-8143-429a193c9848,GENERAL-NEWS,light,richtext,False,False,True,0,0,False,all_ads,/r/CryptoCurrency/comments/uvck2t/mexc_x_luna_recovery_plan_vote_to_decide_luna/,False,,,6,reddit,1653231180,1,,False,False,False,CryptoCurrency,t5_2wlj3,4903173,public,default,,,MEXC x LUNA Recovery Plan: Vote to Decide LUNA Burn by Utilising LUNA Trading Fees on MEXC,0,[],1.0,https://support.mexc.com/hc/en-001/articles/6813981113625-MEXC-x-LUNA-Recovery-Plan-Vote-to-Decide-LUNA-Burn-by-Utilising-LUNA-Trading-Fees-on-MEXC,https://support.mexc.com/hc/en-001/articles/6813981113625-MEXC-x-LUNA-Recovery-Plan-Vote-to-Decide-LUNA-Burn-by-Utilising-LUNA-Trading-Fees-on-MEXC,all_ads,6,1653202369.0,,,,,,,,
5,[],False,GearLord0511,,Warning-level1-1,"[{'e': 'text', 't': 'Bronze | ADA 8 | Apple 36'}]",Bronze | ADA 8 | Apple 36,dark,richtext,t2_5w061041,False,False,False,[],False,False,1653228087,self.CryptoCurrency,https://www.reddit.com/r/CryptoCurrency/comments/uvbkn6/a_proposal_to_try_to_restore_some_value_in_lunas/,{},uvbkn6,False,True,False,False,False,True,True,False,#7193ff,DISCUSSION,"[{'e': 'text', 't': 'DISCUSSION'}]",87049662-0882-11e5-82e1-0e9d1a9f7761,DISCUSSION,dark,richtext,False,False,False,0,0,False,all_ads,/r/CryptoCurrency/comments/uvbkn6/a_proposal_to_try_to_restore_some_value_in_lunas/,False,,,6,,1653228098,1,"

I am no expert in any way but I have an idea that I have been thinking about in the last days. It’s a mental experiment and I am interested on opinions on why this could or couldn’t work, at least partially.
To try to restore at least a part of the Luna ecosystem it’s necessary to reduce the supply of Luna and pay back the UST holders. It’s easier said than done, I know, but there is nothing to lose since LUNC will probably die if nothing is implemented.
So my idea has 2 steps: 
1) introduce a small tax on transfers (1% for example). 
2) allow every day/ X period of time to convert UST to Luna BUT with a max cap equal to 66% (or another percentage) of the total luna burned during the day/ arbitrary time interval. First arrival first served.
So for example if in day one 100 million of Luna are burned, UST holders can convert their UST until 66 new millions Luna are created. 
Optional: Additionally it could be implemented a better conversation rate (for example 1 UST = 1.05 dollars worth of Luna) to compensate the UST holders for their trouble. This could also create buying pressure for UST.
Optional: give priority to the small holders for the conversation, similarly to FatMan’s proposal.
Why this could work?
If this mechanism is implemented the supply of Luna and UST could be decreased and this could create buying pressure. If this takes enough momentum, it could create a positive feedback loop that could accelerate the process (higher price of Luna because of the burning——&gt; less Luna to mint to pay back the UST tokens ——-&gt; more UST payed back——-&gt; more faith in the system——-&gt; more buying pressure for Luna).
So basically the opposite of the death spiral that we witnessed in the last days.
This would benefit everyone: UST holder and Luna holders, both old and new.
Conclusions:
it is clear that there is a lot of people that are willing to take a gamble and continue to buy Luna as a speculative investment providing liquidity. This won’t last forever and it’s a good idea to seize the opportunity now. This provides buying pressure and usage of the network that could be exploited to “restore” Luna’s value. 
There is nothing to lose at this point.
The question is it seems too easy. What am I missing?

Edit: grammar",True,False,False,CryptoCurrency,t5_2wlj3,4902958,public,self,,,A proposal to try to restore some value in Luna’s ecosystem without buybacks,0,[],1.0,https://www.reddit.com/r/CryptoCurrency/comments/uvbkn6/a_proposal_to_try_to_restore_some_value_in_lunas/,,all_ads,6,1653199287.0,,,,,,,,
6,[],False,Candlestick_,,Warning-level2-2,"[{'e': 'text', 't': 'Tin'}]",Tin,dark,richtext,t2_ysttm,False,False,False,[],False,False,1653227060,self.CryptoCurrency,https://www.reddit.com/r/CryptoCurrency/comments/uvb9j2/listen_to_the_crypto_ogs_or_you_will_be_burned/,{},uvb9j2,False,True,False,False,False,True,True,False,#46d160,ADVICE,"[{'e': 'text', 't': 'ADVICE'}]",e9570888-9c2a-11e3-809c-12313d1661cc,ADVICE,dark,richtext,False,False,True,0,0,False,all_ads,/r/CryptoCurrency/comments/uvb9j2/listen_to_the_crypto_ogs_or_you_will_be_burned/,False,,,6,,1653227070,1,"I always see the OGs getting flack and downvoted to shit just for being realistic. I entered the scene when a lot of new guys did back in 2020, and of course everyone was having fun when it was nothing but green and up until the collapse of Terra/Luna most of my peers still had the “to the moon mindset”. 

I am glad that I’ve gotten to enjoy multiple trading environments and even in this bearish cycle I am learning how to navigate a new space, but none of that would be possible without learning from the crypto elders. 

Message to the new guys: What you might see as a btc oldhead who will only “dca btc/eth” are veterans in this space. A lot of them have been trading for years, and they act the way they do because of their experiences. They have felt the tremors of markets downturn before, and the reason they are still around because they stick to a trading plan and realistically invest what they can.

Listen to the OGs they have experienced the best and worst of cryptos, and take what they say with consideration to protect yourself/investments.",True,False,False,CryptoCurrency,t5_2wlj3,4902902,public,self,,,Listen to the crypto OGs or you will be burned,0,[],1.0,https://www.reddit.com/r/CryptoCurrency/comments/uvb9j2/listen_to_the_crypto_ogs_or_you_will_be_burned/,,all_ads,6,1653198260.0,,,,,,,,
7,[],False,Glittering_Waltz5086,,,[],,,text,t2_kclirs21,False,False,False,[],False,False,1653226698,reddit.com,https://www.reddit.com/r/CryptoCurrency/comments/uvb5ov/youtubers_mocked_fans_for_not_buying_luna_and/,{},uvb5ov,False,True,False,False,False,True,False,False,#c403f5,COMEDY,"[{'e': 'text', 't': 'COMEDY'}]",5c104cfc-d7c8-11e4-9d14-22000b6902b0,COMEDY,dark,richtext,False,False,False,0,0,False,all_ads,/r/CryptoCurrency/comments/uvb5ov/youtubers_mocked_fans_for_not_buying_luna_and/,False,link,"{'enabled': False, 'images': [{'id': 'CLnqcrWigXKyMYptRFFAfK1w_p-AUNc-EKsxvpdrMhU', 'resolutions': [{'height': 60, 'url': 'https://external-preview.redd.it/B801CrJMiMMXH_4gcTQPWlk1CrYa4QK3n6U49Z_3wOM.png?width=108&amp;crop=smart&amp;auto=webp&amp;s=99dd597248f0685c482dc85c2b6f90cf00f59cb4', 'width': 108}, {'height': 121, 'url': 'https://external-preview.redd.it/B801CrJMiMMXH_4gcTQPWlk1CrYa4QK3n6U49Z_3wOM.png?width=216&amp;crop=smart&amp;auto=webp&amp;s=cc7a4413a81f2ef97985bb16593841f978e458f0', 'width': 216}, {'height': 180, 'url': 'https://external-preview.redd.it/B801CrJMiMMXH_4gcTQPWlk1CrYa4QK3n6U49Z_3wOM.png?width=320&amp;crop=smart&amp;auto=webp&amp;s=9139ac31bdbf20c4f5e42a4e5db5defa7ced79ed', 'width': 320}, {'height': 360, 'url': 'https://external-preview.redd.it/B801CrJMiMMXH_4gcTQPWlk1CrYa4QK3n6U49Z_3wOM.png?width=640&amp;crop=smart&amp;auto=webp&amp;s=df6c6319c78c0d5ed30eb875cc84a3e40ecbd496', 'width': 640}, {'height': 540, 'url': 'https://external-preview.redd.it/B801CrJMiMMXH_4gcTQPWlk1CrYa4QK3n6U49Z_3wOM.png?width=960&amp;crop=smart&amp;auto=webp&amp;s=33ebb9652ea755c0fae18eed4b7cf475c19c1286', 'width': 960}, {'height': 607, 'url': 'https://external-preview.redd.it/B801CrJMiMMXH_4gcTQPWlk1CrYa4QK3n6U49Z_3wOM.png?width=1080&amp;crop=smart&amp;auto=webp&amp;s=43ca944f7449c8c7da38d7e8b2e0ad168bb669b2', 'width': 1080}], 'source': {'height': 720, 'url': 'https://external-preview.redd.it/B801CrJMiMMXH_4gcTQPWlk1CrYa4QK3n6U49Z_3wOM.png?auto=webp&amp;s=701c4ba2bb1d552e4985f7747d7503e7cb6bcb26', 'width': 1280}, 'variants': {}}]}",6,,1653226709,1,,True,False,False,CryptoCurrency,t5_2wlj3,4902866,public,https://b.thumbs.redditmedia.com/eakCsZ_7zLiVQUX2z8VXXllpb1iSEEroFxvsTTKux5g.jpg,78.0,140.0,Youtubers mocked fans for not buying Luna and then they got rekted.,0,[],1.0,https://www.reddit.com/r/JustKiddingNews/comments/uq50e8/the_chronicles_of_justkiddingnews_luna_saga/?utm_source=share&amp;utm_medium=ios_app&amp;utm_name=iossmf,https://www.reddit.com/r/JustKiddingNews/comments/uq50e8/the_chronicles_of_justkiddingnews_luna_saga/?utm_source=share&amp;utm_medium=ios_app&amp;utm_name=iossmf,all_ads,6,1653197898.0,,,,,,,,
