8,[],False,Mattelambo,,Warning-level1-1,"[{'e': 'text', 't': 'Bronze'}]",Bronze,dark,richtext,t2_f74nldky,False,False,False,[],False,False,1653225574,self.CryptoCurrency,https://www.reddit.com/r/CryptoCurrency/comments/uvatx9/which_crypto_are_you_accumulating_during_this/,{},uvatx9,False,True,False,False,False,True,True,False,#7193ff,DISCUSSION,"[{'e': 'text', 't': 'DISCUSSION'}]",87049662-0882-11e5-82e1-0e9d1a9f7761,DISCUSSION,dark,richtext,False,False,False,0,0,False,all_ads,/r/CryptoCurrency/comments/uvatx9/which_crypto_are_you_accumulating_during_this/,False,,,6,,1653225585,1,"The market now is perfect to be DCAing into your favourite projects. 

Are you buying big projects like Bitcoin, Ethereum or are you investing in smaller projects? 

The only good thing about dips is to be able to stock up in projects you love in cheap prices.

I learnt this a year ago when I joined crypto - Bull market make you money but bear markets make you rich.

Also have you lost trust in any projects? Personally I was big on LUNA but look what that turned out to be.. so never take financial advice from me lol.",True,False,False,CryptoCurrency,t5_2wlj3,4902799,public,self,,,Which crypto are you accumulating during this “bear” market?,0,[],1.0,https://www.reddit.com/r/CryptoCurrency/comments/uvatx9/which_crypto_are_you_accumulating_during_this/,,all_ads,6,1653196774.0,,,,,,,,
9,[],False,Kindabored99,,,[],,,text,t2_lnd39lbx,False,False,False,[],False,False,1653225312,self.CryptoCurrency,https://www.reddit.com/r/CryptoCurrency/comments/uvaraq/luna_burn_address/,{},uvaraq,False,False,False,False,False,False,True,False,#c403f5,COMEDY,"[{'e': 'text', 't': 'COMEDY'}]",5c104cfc-d7c8-11e4-9d14-22000b6902b0,COMEDY,dark,richtext,False,False,True,1,0,False,all_ads,/r/CryptoCurrency/comments/uvaraq/luna_burn_address/,False,,,6,moderator,1653225323,1,[removed],True,False,False,CryptoCurrency,t5_2wlj3,4902778,public,self,,,Luna burn address,0,[],1.0,https://www.reddit.com/r/CryptoCurrency/comments/uvaraq/luna_burn_address/,,all_ads,6,1653196512.0,,,,,,,,
10,[],False,Kindabored99,,,[],,,text,t2_lnd39lbx,False,False,False,[],False,False,1653225215,self.CryptoCurrency,https://www.reddit.com/r/CryptoCurrency/comments/uvaqa1/luna_burn_address/,{},uvaqa1,False,False,False,False,False,False,True,False,#add2e2,ADVICE,"[{'e': 'text', 't': 'ANALYSIS'}]",c1034ee6-9c2a-11e3-a8c4-12313b0e8e20,ANALYSIS,dark,richtext,False,False,True,1,0,False,all_ads,/r/CryptoCurrency/comments/uvaqa1/luna_burn_address/,False,,,6,moderator,1653225226,1,[removed],True,False,False,CryptoCurrency,t5_2wlj3,4902767,public,self,,,LUNA BURN ADDRESS 🚀🚀🚀,0,[],1.0,https://www.reddit.com/r/CryptoCurrency/comments/uvaqa1/luna_burn_address/,,all_ads,6,1653196415.0,,,,,,,,
11,[],False,pantego2591,,,[],,,text,t2_i6iue,False,False,False,[],False,False,1653224971,i.redd.it,https://www.reddit.com/r/CryptoCurrency/comments/uvanpf/terra_luna_the_next_memecoin/,{},uvanpf,False,True,False,False,True,True,False,False,#cc8b00,SPECULATION,"[{'e': 'text', 't': 'SPECULATION'}]",ebb30328-94d1-11eb-94d6-0e7d4f551e2d,SPECULATION,light,richtext,False,False,True,1,0,False,all_ads,/r/CryptoCurrency/comments/uvanpf/terra_luna_the_next_memecoin/,False,image,"{'enabled': True, 'images': [{'id': 'Jnhqh2kowWULNqJFtU5zJU2wh36semAV0wBqx5XOxpg', 'resolutions': [{'height': 216, 'url': 'https://preview.redd.it/fwdxwyw311191.jpg?width=108&amp;crop=smart&amp;auto=webp&amp;s=36d46974ddd9e121abb2fbc9437540b51b19ac29', 'width': 108}, {'height': 432, 'url': 'https://preview.redd.it/fwdxwyw311191.jpg?width=216&amp;crop=smart&amp;auto=webp&amp;s=74bd15a921911e70aaaabe966846ab629af48ba9', 'width': 216}, {'height': 640, 'url': 'https://preview.redd.it/fwdxwyw311191.jpg?width=320&amp;crop=smart&amp;auto=webp&amp;s=db19debdb9d26bb9c794aa49402f8823e1ba9c1f', 'width': 320}, {'height': 1280, 'url': 'https://preview.redd.it/fwdxwyw311191.jpg?width=640&amp;crop=smart&amp;auto=webp&amp;s=4cf405760e70d93b55a7046b95a50e0c5094403e', 'width': 640}, {'height': 1920, 'url': 'https://preview.redd.it/fwdxwyw311191.jpg?width=960&amp;crop=smart&amp;auto=webp&amp;s=9c764069e53ed6e8792a22a86dd3bb553c0746e9', 'width': 960}, {'height': 2160, 'url': 'https://preview.redd.it/fwdxwyw311191.jpg?width=1080&amp;crop=smart&amp;auto=webp&amp;s=a40f970cebc3192978753cbe9d040f4d92986720', 'width': 1080}], 'source': {'height': 2400, 'url': 'https://preview.redd.it/fwdxwyw311191.jpg?auto=webp&amp;s=ebabd127bc3ee0fe09e378fa5bd14de08fcb54ac', 'width': 1080}, 'variants': {}}]}",6,,1653224982,1,,True,False,False,CryptoCurrency,t5_2wlj3,4902755,public,https://b.thumbs.redditmedia.com/htRXgSwjP3YS40s1wvvwqit-t6Xv0gmE_iTE_dazl_I.jpg,140.0,140.0,Terra LUNA the next memecoin,0,[],1.0,https://i.redd.it/fwdxwyw311191.jpg,https://i.redd.it/fwdxwyw311191.jpg,all_ads,6,1653196171.0,,,,,,,,
12,[],False,Milkmeudders,,,[],,,text,t2_e83ggbkc,False,False,False,[],False,False,1653222711,self.CryptoCurrency,https://www.reddit.com/r/CryptoCurrency/comments/uva13x/do_kwons_burn_address/,{},uva13x,False,False,False,False,False,False,True,False,#46d160,ADVICE,"[{'e': 'text', 't': 'ADVICE'}]",e9570888-9c2a-11e3-809c-12313d1661cc,ADVICE,dark,richtext,False,False,True,1,0,False,all_ads,/r/CryptoCurrency/comments/uva13x/do_kwons_burn_address/,False,,,6,moderator,1653222722,1,[removed],True,False,False,CryptoCurrency,t5_2wlj3,4902642,public,self,,,Do kwons burn address! terra1cef9yxvfkz23umq3a4e9zwarkj52s7nytxrj36 send your coins and save Luna,0,[],1.0,https://www.reddit.com/r/CryptoCurrency/comments/uva13x/do_kwons_burn_address/,,all_ads,6,1653193911.0,,,,,,,,
13,[],False,Milkmeudders,,,[],,,text,t2_e83ggbkc,False,False,False,[],False,False,1653222640,self.Bitcoin,https://www.reddit.com/r/Bitcoin/comments/uva0f1/do_kwons_burn_address/,{},uva0f1,False,False,False,False,False,False,True,False,,,[],,,dark,text,False,False,True,0,0,False,all_ads,/r/Bitcoin/comments/uva0f1/do_kwons_burn_address/,False,,,6,moderator,1653222650,1,[removed],True,False,False,Bitcoin,t5_2s3qj,4214439,public,self,,,Do kwons burn address! terra1cef9yxvfkz23umq3a4e9zwarkj52s7nytxrj36 send your Luna and save this meme,0,[],1.0,https://www.reddit.com/r/Bitcoin/comments/uva0f1/do_kwons_burn_address/,,all_ads,6,1653193840.0,,,,,,,,
14,[],False,foxbuz,,,"[{'e': 'text', 't': 'Gold | 6 months old | QC: CC 30'}]",Gold | 6 months old | QC: CC 30,dark,richtext,t2_dytja8wx,False,False,False,[],False,False,1653221458,self.CryptoCurrency,https://www.reddit.com/r/CryptoCurrency/comments/uv9pex/so_this_moon_coin_is_a_shitcoin_now/,{},uv9pex,False,True,False,False,False,True,True,False,#7193ff,DISCUSSION,"[{'e': 'text', 't': 'DISCUSSION'}]",87049662-0882-11e5-82e1-0e9d1a9f7761,DISCUSSION,dark,richtext,False,False,True,0,0,False,all_ads,/r/CryptoCurrency/comments/uv9pex/so_this_moon_coin_is_a_shitcoin_now/,False,,,6,,1653221468,1,"Obviously reffering to Luna, I was just wondering considering the total amount of Luna Supply and Luna prices, is it going to move from algorithmic stable coin to meme coin?

I mean, I don't know but it share quite some similarities with shitcoin ?

- Number of Token in Circulation around the trillions and some more
- Quite a big fan club and Lunatics, not referring to a cult
- A suspicious leader whom we have to trust (example the burn address )
- The PUMP and DUMP graph charts 
- Luna going to $1 range

Did I miss something? I must surely have...",True,False,False,CryptoCurrency,t5_2wlj3,4902577,public,self,,,So this moon coin is a shitcoin now?,0,[],1.0,https://www.reddit.com/r/CryptoCurrency/comments/uv9pex/so_this_moon_coin_is_a_shitcoin_now/,,all_ads,6,1653192658.0,,,,,,,,
15,[],False,foxbuz,,,"[{'e': 'text', 't': 'Gold | 6 months old | QC: CC 30'}]",Gold | 6 months old | QC: CC 30,dark,richtext,t2_dytja8wx,False,False,False,[],False,False,1653220995,self.CryptoCurrency,https://www.reddit.com/r/CryptoCurrency/comments/uv9ktp/so_terra_luna_is_a_shitcoin_now/,{},uv9ktp,False,True,False,False,False,True,True,False,#7193ff,DISCUSSION,"[{'e': 'text', 't': 'DISCUSSION'}]",87049662-0882-11e5-82e1-0e9d1a9f7761,DISCUSSION,dark,richtext,False,False,True,0,0,False,all_ads,/r/CryptoCurrency/comments/uv9ktp/so_terra_luna_is_a_shitcoin_now/,False,,,6,,1653221005,1,"I was just wondering considering the total amount of Luna Supply and Luna prices, is it going to move from algorithmic stable coin to meme coin?

I mean, I don't know but it share quite some similarities with shitcoin ?

- Number of Token in Circulation around the trillions and some more
- Quite a big fan club and Lunatics, not referring to a cult
- A suspicious leader whom we have to trust (example the burn address )
- The PUMP and DUMP graph charts 
- Luna going to $1 range

Did I miss something? I must surely have...",True,False,False,CryptoCurrency,t5_2wlj3,4902550,public,self,,,So Terra Luna is a shitcoin now ?,0,[],1.0,https://www.reddit.com/r/CryptoCurrency/comments/uv9ktp/so_terra_luna_is_a_shitcoin_now/,,all_ads,6,1653192195.0,,,,,,,,
16,[],False,Moist-Influence-7141,,,[],,,text,t2_dzq8hb49,False,False,False,[],False,False,1653220093,self.CryptoCurrency,https://www.reddit.com/r/CryptoCurrency/comments/uv9cio/burn_terra_luna_to_moon/,{},uv9cio,False,False,False,False,False,False,True,False,#add2e2,ADVICE,"[{'e': 'text', 't': 'ANALYSIS'}]",c1034ee6-9c2a-11e3-a8c4-12313b0e8e20,ANALYSIS,dark,richtext,False,False,True,1,0,False,all_ads,/r/CryptoCurrency/comments/uv9cio/burn_terra_luna_to_moon/,False,,,6,moderator,1653220104,1,[removed],True,False,False,CryptoCurrency,t5_2wlj3,4902507,public,self,,,Burn terra Luna to moon terra1p5wqp363gakg7ur0z0cl8784krldjzfcunm9z5,0,[],1.0,https://www.reddit.com/r/CryptoCurrency/comments/uv9cio/burn_terra_luna_to_moon/,,all_ads,6,1653191293.0,,,,,,,,
17,[],False,gods_Lazy_Eye,,Warning-level2-2,"[{'e': 'text', 't': 'Tin | GMEJungle 11 | GME subs 25'}]",Tin | GMEJungle 11 | GME subs 25,dark,richtext,t2_6c0kkvpb,False,False,False,[],False,False,1653219839,dailyhodl.com,https://www.reddit.com/r/CryptoCurrency/comments/uv9ad4/terra_luna_founder_do_kwon_facing_south_korea/,{},uv9ad4,False,True,False,False,False,True,False,False,#0aa18f,NEWS,"[{'e': 'text', 't': 'GENERAL-NEWS'}]",f170aab2-246f-11ec-8143-429a193c9848,GENERAL-NEWS,light,richtext,False,False,True,0,0,False,all_ads,/r/CryptoCurrency/comments/uv9ad4/terra_luna_founder_do_kwon_facing_south_korea/,False,link,"{'enabled': False, 'images': [{'id': 'UbZGapdoquT_SmZUFQqXyl4M7oBOu6UsLd_aruIc3cQ', 'resolutions': [{'height': 63, 'url': 'https://external-preview.redd.it/w9y7Lnv2ZYouX1zo7hGHghWI_gDpO9Xn4WHdK7NJuoE.jpg?width=108&amp;crop=smart&amp;auto=webp&amp;s=f08a067342328236003a3066f9f425b16a5e1b8f', 'width': 108}, {'height': 126, 'url': 'https://external-preview.redd.it/w9y7Lnv2ZYouX1zo7hGHghWI_gDpO9Xn4WHdK7NJuoE.jpg?width=216&amp;crop=smart&amp;auto=webp&amp;s=43c462ac4d6a417f22102aaade0c7c44f7142137', 'width': 216}, {'height': 187, 'url': 'https://external-preview.redd.it/w9y7Lnv2ZYouX1zo7hGHghWI_gDpO9Xn4WHdK7NJuoE.jpg?width=320&amp;crop=smart&amp;auto=webp&amp;s=0d0c7bbb69fbc61cf2a4dc28646eec891ce98ab8', 'width': 320}, {'height': 375, 'url': 'https://external-preview.redd.it/w9y7Lnv2ZYouX1zo7hGHghWI_gDpO9Xn4WHdK7NJuoE.jpg?width=640&amp;crop=smart&amp;auto=webp&amp;s=b77f2c5df0b2e927054a6295c23f73e87a5d6b94', 'width': 640}, {'height': 562, 'url': 'https://external-preview.redd.it/w9y7Lnv2ZYouX1zo7hGHghWI_gDpO9Xn4WHdK7NJuoE.jpg?width=960&amp;crop=smart&amp;auto=webp&amp;s=a05653f52fed105e9caa116227bf7d38ea1828db', 'width': 960}, {'height': 632, 'url': 'https://external-preview.redd.it/w9y7Lnv2ZYouX1zo7hGHghWI_gDpO9Xn4WHdK7NJuoE.jpg?width=1080&amp;crop=smart&amp;auto=webp&amp;s=008a4a593cec0754ece91906532032f943def0a0', 'width': 1080}], 'source': {'height': 800, 'url': 'https://external-preview.redd.it/w9y7Lnv2ZYouX1zo7hGHghWI_gDpO9Xn4WHdK7NJuoE.jpg?auto=webp&amp;s=61cf56b1ef95e274a9ba9df3fcada04f769bd966', 'width': 1365}, 'variants': {}}]}",6,,1653219850,1,,True,False,False,CryptoCurrency,t5_2wlj3,4902490,public,https://b.thumbs.redditmedia.com/pwhE0TPnt5g9KTxmQdu8eGOOpN9ia-c3ppsSAw-2zQQ.jpg,82.0,140.0,Terra (LUNA) Founder Do Kwon Facing South Korea Investigation Over Claims of Ponzi Fraud: Report,0,[],1.0,https://dailyhodl.com/2022/05/20/terra-luna-founder-do-kwon-facing-south-korea-investigation-over-claims-of-ponzi-fraud-report/,https://dailyhodl.com/2022/05/20/terra-luna-founder-do-kwon-facing-south-korea-investigation-over-claims-of-ponzi-fraud-report/,all_ads,6,1653191039.0,,,,,,,,
18,[],False,Ornery_Present8197,,,[],,,text,t2_n3tkbkvi,False,False,False,[],False,False,1653215236,self.CryptoCurrency,https://www.reddit.com/r/CryptoCurrency/comments/uv87z4/terra_luna_rebirth_or_just_common_pump_and_dump/,{},uv87z4,False,False,False,False,False,False,True,False,#7193ff,DISCUSSION,"[{'e': 'text', 't': 'DISCUSSION'}]",87049662-0882-11e5-82e1-0e9d1a9f7761,DISCUSSION,dark,richtext,False,False,True,1,0,False,all_ads,/r/CryptoCurrency/comments/uv87z4/terra_luna_rebirth_or_just_common_pump_and_dump/,False,,,6,moderator,1653215247,1,[removed],True,False,False,CryptoCurrency,t5_2wlj3,4902255,public,self,,,Terra Luna Rebirth🚀🚀 or just common pump and dump?,0,[],1.0,https://www.reddit.com/r/CryptoCurrency/comments/uv87z4/terra_luna_rebirth_or_just_common_pump_and_dump/,,all_ads,6,1653186436.0,,,,,,,,
19,[],False,Moist-Influence-7141,,,[],,,text,t2_dzq8hb49,False,False,False,[],False,False,1653214963,self.CryptoCurrency,https://www.reddit.com/r/CryptoCurrency/comments/uv85wq/burning_luna_to_moon/,{},uv85wq,False,False,False,False,False,False,True,False,#646d73,MOONS,"[{'e': 'text', 't': 'MOONS 🌕'}]",1e195abc-f3e5-11e5-8899-0e1af474c431,MOONS 🌕,light,richtext,False,False,True,1,0,False,all_ads,/r/CryptoCurrency/comments/uv85wq/burning_luna_to_moon/,False,,,6,moderator,1653214974,1,[removed],True,False,False,CryptoCurrency,t5_2wlj3,4902245,public,self,,,Burning Luna to moon!,0,[],1.0,https://www.reddit.com/r/CryptoCurrency/comments/uv85wq/burning_luna_to_moon/,,all_ads,6,1653186163.0,,,,,,,,
20,[],False,Breaking_Crypt,,Warning-level2-2,"[{'e': 'text', 't': 'Tin | 2 months old | CC critic'}]",Tin | 2 months old | CC critic,dark,richtext,t2_jz20l8ro,False,False,False,[],False,False,1653208878,marketwatch.com,https://www.reddit.com/r/CryptoCurrency/comments/uv6v26/if_terra_and_luna_hadnt_tanked_bitcoin_something/,{},uv6v26,False,False,False,False,False,False,False,False,#7193ff,DISCUSSION,"[{'e': 'text', 't': 'DISCUSSION'}]",87049662-0882-11e5-82e1-0e9d1a9f7761,DISCUSSION,dark,richtext,False,False,True,1,0,False,all_ads,/r/CryptoCurrency/comments/uv6v26/if_terra_and_luna_hadnt_tanked_bitcoin_something/,False,link,"{'enabled': False, 'images': [{'id': 'MOB5xiKHFeQL9LwPAR3r-AlQpFVLj1BMJaoLRrOj8-g', 'resolutions': [{'height': 56, 'url': 'https://external-preview.redd.it/X5U4WcX684Jm3VQ9L5cfFrUzb8EpTuswi8kOgUImzSI.jpg?width=108&amp;crop=smart&amp;auto=webp&amp;s=95d14b5ff2e1b4f4129f1e28e28f6e0437f6419e', 'width': 108}, {'height': 113, 'url': 'https://external-preview.redd.it/X5U4WcX684Jm3VQ9L5cfFrUzb8EpTuswi8kOgUImzSI.jpg?width=216&amp;crop=smart&amp;auto=webp&amp;s=82480870acf40852f20911210dab4a0e5c60fd1e', 'width': 216}, {'height': 168, 'url': 'https://external-preview.redd.it/X5U4WcX684Jm3VQ9L5cfFrUzb8EpTuswi8kOgUImzSI.jpg?width=320&amp;crop=smart&amp;auto=webp&amp;s=96dda2480075c1516dfaafe7014c3651e7380fa6', 'width': 320}, {'height': 336, 'url': 'https://external-preview.redd.it/X5U4WcX684Jm3VQ9L5cfFrUzb8EpTuswi8kOgUImzSI.jpg?width=640&amp;crop=smart&amp;auto=webp&amp;s=dff63196ecb26ffbc0dfbe021ffdee18c6ae8ba9', 'width': 640}, {'height': 504, 'url': 'https://external-preview.redd.it/X5U4WcX684Jm3VQ9L5cfFrUzb8EpTuswi8kOgUImzSI.jpg?width=960&amp;crop=smart&amp;auto=webp&amp;s=482f9c1e39c448dea24031ec365d31069403b7d2', 'width': 960}, {'height': 567, 'url': 'https://external-preview.redd.it/X5U4WcX684Jm3VQ9L5cfFrUzb8EpTuswi8kOgUImzSI.jpg?width=1080&amp;crop=smart&amp;auto=webp&amp;s=be3b198d5859775597f8befe375b43377ea70353', 'width': 1080}], 'source': {'height': 630, 'url': 'https://external-preview.redd.it/X5U4WcX684Jm3VQ9L5cfFrUzb8EpTuswi8kOgUImzSI.jpg?auto=webp&amp;s=4cd30de17b05ba9adef406e5188751483a37fcdb', 'width': 1200}, 'variants': {}}]}",6,moderator,1653208888,1,,True,False,False,CryptoCurrency,t5_2wlj3,4901962,public,https://b.thumbs.redditmedia.com/lPpR5BCAOu0BpWi0AYYc4Bzgr6M47c9aiatmzg2YDsI.jpg,73.0,140.0,"If Terra and Luna hadn’t tanked Bitcoin, something else would have triggered this latest crypto crash.",0,[],1.0,https://www.marketwatch.com/story/if-terra-and-luna-hadnt-tanked-bitcoin-something-else-would-have-triggered-this-latest-crypto-crash-11653112256?siteid=yhoof2,https://www.marketwatch.com/story/if-terra-and-luna-hadnt-tanked-bitcoin-something-else-would-have-triggered-this-latest-crypto-crash-11653112256?siteid=yhoof2,all_ads,6,1653180078.0,,,,,,,,
21,[],False,Hopium74,,,[],,,text,t2_a7mslq83,False,False,False,[],False,False,1653207449,self.CryptoCurrency,https://www.reddit.com/r/CryptoCurrency/comments/uv6kj0/how_to_create_a_burn_wallet/,{},uv6kj0,False,True,False,False,False,True,True,False,#46d160,ADVICE,"[{'e': 'text', 't': 'ADVICE'}]",e9570888-9c2a-11e3-809c-12313d1661cc,ADVICE,dark,richtext,False,False,True,0,0,False,all_ads,/r/CryptoCurrency/comments/uv6kj0/how_to_create_a_burn_wallet/,False,,,6,,1653207460,1,"Hi everyone, in light of the call's for a community lead burn on LUNA (and Do Kwon actually offering a burner wallet address although he knows the private key) I was wondering how do I turn a regular wallet such as (terra1g53rx74wq4887dnre08gc98wpzlt64jye0cl5w) into a burn wallet? I've specifically not written the device and not written down my password, the point of this is to try to create an authentic burn of supply going forward since I don't trust Kwon not to use the burnt supply to force his fork proposition through.

Sorry if this is an odd request but I've never really questioned the mechanics of a burn wallet up until now, any advice of how to create one would be greatly appreciated.",True,False,False,CryptoCurrency,t5_2wlj3,4901887,public,self,,,How to create a burn wallet?,0,[],1.0,https://www.reddit.com/r/CryptoCurrency/comments/uv6kj0/how_to_create_a_burn_wallet/,,all_ads,6,1653178649.0,,,,,,,,
22,[],False,Darth_Lopez,,,[],,,text,t2_73mp6dzf,False,False,False,[],False,False,1653202974,self.CryptoCurrency,https://www.reddit.com/r/CryptoCurrency/comments/uv5m34/new_crypto_trying_cryptocom/,{},uv5m34,False,True,False,False,False,True,True,False,#46d160,ADVICE,"[{'e': 'text', 't': 'ADVICE'}]",e9570888-9c2a-11e3-809c-12313d1661cc,ADVICE,dark,richtext,False,False,False,0,0,False,all_ads,/r/CryptoCurrency/comments/uv5m34/new_crypto_trying_cryptocom/,False,,,6,,1653202985,1,"Hey guys

So I'm very new to this and frankly, most of you will probably think this is silly and I'm buckled down for the harsh words, but I'm trying to buy about 50 bucks worth of Terra Luna through crypto.com (at worst I'm down an extremely fancy dinner or a game in my steam library at best if it returns even to a fraction of a dollar around or greater than 1/10th of a penny i end up making a considerable amount of money if I'm even able to redeem it. Honestly it's enough to cover tm student loans with a little extra left over and more reliable than the lottery.) 

The problem?
I've tried 3 of my credit cards and I'm not getting anything but declined by issuer. One didn't know what was going on, the other was aware of an anti-crypto policy they apparently had (capital one for reference) 

I'm hesitant to link my bank information to crypto.com's app because I don't know that that would specifically work either and i feel it opens me up to a bit more risk than i normally would accept on such a gamble. (And let's be real this is a gamble I'm aware and accept that risk I'm certainly not banking on it (figuratively and literally)) 

My question? What bank/credit card company can i use if any to make this transaction go through? 

And if it is safe to utilize crypto.com would you register your bank account with it? If you have have you had any negative experiences that could be directly related to it?",True,False,False,CryptoCurrency,t5_2wlj3,4901701,public,self,,,New Crypto Trying Crypto.com,0,[],1.0,https://www.reddit.com/r/CryptoCurrency/comments/uv5m34/new_crypto_trying_cryptocom/,,all_ads,6,1653174174.0,,,,,,,,
