,all_awardings,allow_live_comments,author,author_flair_css_class,author_flair_richtext,author_flair_text,author_flair_type,author_fullname,author_is_blocked,author_patreon_flair,author_premium,awarders,can_mod_post,contest_mode,created_utc,domain,full_link,gildings,id,is_created_from_ads_ui,is_crosspostable,is_meta,is_original_content,is_reddit_media_domain,is_robot_indexable,is_self,is_video,link_flair_background_color,link_flair_css_class,link_flair_richtext,link_flair_template_id,link_flair_text,link_flair_text_color,link_flair_type,locked,media_only,no_follow,num_comments,num_crossposts,over_18,parent_whitelist_status,permalink,pinned,pwls,removed_by_category,retrieved_on,score,selftext,send_replies,spoiler,stickied,subreddit,subreddit_id,subreddit_subscribers,subreddit_type,thumbnail,title,total_awards_received,treatment_tags,upvote_ratio,url,whitelist_status,wls,created,author_flair_background_color,author_flair_text_color
0,[],False,BurningLunaToken,,[],,text,t2_kojejw0h,False,False,False,[],False,False,1653214359,self.CryptoCurrency,https://www.reddit.com/r/CryptoCurrency/comments/uv814g/burn_terraluna_to_the_moon/,{},uv814g,False,False,False,False,False,False,True,False,#7193ff,STAKING,"[{'e': 'text', 't': 'STAKING'}]",e3cef78c-d01a-11eb-b75b-0eda6f21cfc9,STAKING,dark,richtext,False,False,True,1,0,False,all_ads,/r/CryptoCurrency/comments/uv814g/burn_terraluna_to_the_moon/,False,6,moderator,1653214370,1,[removed],True,False,False,CryptoCurrency,t5_2wlj3,4902218,public,self,BURN TERRALUNA TO THE MOON!!!!!!,0,[],1.0,https://www.reddit.com/r/CryptoCurrency/comments/uv814g/burn_terraluna_to_the_moon/,all_ads,6,1653185559.0,,
1,[],False,Popbusterz,Warning-level2-2,"[{'e': 'text', 't': 'Tin'}]",Tin,richtext,t2_5bfc778w,False,False,False,[],False,False,1653171811,self.CryptoCurrency,https://www.reddit.com/r/CryptoCurrency/comments/uuxhem/results_from_the_survey_of_luna_holder/,{},uuxhem,False,True,False,False,False,True,True,False,#add2e2,ADVICE,"[{'e': 'text', 't': 'ANALYSIS'}]",c1034ee6-9c2a-11e3-a8c4-12313b0e8e20,ANALYSIS,dark,richtext,False,False,True,0,0,False,all_ads,/r/CryptoCurrency/comments/uuxhem/results_from_the_survey_of_luna_holder/,False,6,,1653171822,1,"So, I launched a survey yesterday and the results are in that surprised me very much:

Only post-attack luna holders make almost 2/3 rd of total current luna holders (65%).

Of total voters, only 21% are those who held any luna coin pre attack (with or without post attack).

9% are those that held any pre attack UST (irrespective of if they hold UST post attack or not).

Here is the link to the poll: [https://www.reddit.com/r/terraluna/comments/uu82yj/survey\_of\_current\_luna\_bag\_holders/](https://www.reddit.com/r/terraluna/comments/uu82yj/survey_of_current_luna_bag_holders/)",True,False,False,CryptoCurrency,t5_2wlj3,4900283,public,self,Results from the survey of Luna holder demographics on Terra Luna reddit,0,[],1.0,https://www.reddit.com/r/CryptoCurrency/comments/uuxhem/results_from_the_survey_of_luna_holder/,all_ads,6,1653143011.0,,dark
