,all_awardings,allow_live_comments,author,author_flair_background_color,author_flair_css_class,author_flair_richtext,author_flair_text,author_flair_text_color,author_flair_type,author_fullname,author_is_blocked,author_patreon_flair,author_premium,awarders,can_mod_post,contest_mode,created_utc,domain,full_link,gildings,id,is_created_from_ads_ui,is_crosspostable,is_meta,is_original_content,is_reddit_media_domain,is_robot_indexable,is_self,is_video,link_flair_background_color,link_flair_css_class,link_flair_richtext,link_flair_template_id,link_flair_text,link_flair_text_color,link_flair_type,locked,media_only,no_follow,num_comments,num_crossposts,over_18,parent_whitelist_status,permalink,pinned,post_hint,preview,pwls,removed_by_category,retrieved_on,score,selftext,send_replies,spoiler,stickied,subreddit,subreddit_id,subreddit_subscribers,subreddit_type,thumbnail,thumbnail_height,thumbnail_width,title,total_awards_received,treatment_tags,upvote_ratio,url,url_overridden_by_dest,whitelist_status,wls,created,media_metadata
0,[],False,TLDRking1,,Warning-level2-2,"[{'e': 'text', 't': 'Tin | 3 months old'}]",Tin | 3 months old,dark,richtext,t2_jdxstwmx,False,False,False,[],False,False,1653234750,u.today,https://www.reddit.com/r/CryptoCurrency/comments/uvdpnc/binance_ceo_luna_and_ust_was_just_stupid/,{},uvdpnc,False,False,False,False,False,False,False,False,#0aa18f,NEWS,"[{'e': 'text', 't': 'GENERAL-NEWS'}]",f170aab2-246f-11ec-8143-429a193c9848,GENERAL-NEWS,light,richtext,False,False,True,0,0,False,all_ads,/r/CryptoCurrency/comments/uvdpnc/binance_ceo_luna_and_ust_was_just_stupid/,False,link,"{'enabled': False, 'images': [{'id': 'dRJtSfbKI5plP-LBYxV5Rdy4xu6lpt7MxEGbxo4eEgs', 'resolutions': [{'height': 81, 'url': 'https://external-preview.redd.it/Zz6REC4tO6iOTov0eRFRU_UK8oyHUf-NzWCHUbjpjsQ.jpg?width=108&amp;crop=smart&amp;auto=webp&amp;s=967b15fc2766be8e0667b192896e7466765ab24d', 'width': 108}, {'height': 162, 'url': 'https://external-preview.redd.it/Zz6REC4tO6iOTov0eRFRU_UK8oyHUf-NzWCHUbjpjsQ.jpg?width=216&amp;crop=smart&amp;auto=webp&amp;s=a2704fdfc1d278d92733e05ec4438eb449a813b1', 'width': 216}, {'height': 240, 'url': 'https://external-preview.redd.it/Zz6REC4tO6iOTov0eRFRU_UK8oyHUf-NzWCHUbjpjsQ.jpg?width=320&amp;crop=smart&amp;auto=webp&amp;s=114b32b9b3581b10d754797da728619a56c2e3d3', 'width': 320}, {'height': 480, 'url': 'https://external-preview.redd.it/Zz6REC4tO6iOTov0eRFRU_UK8oyHUf-NzWCHUbjpjsQ.jpg?width=640&amp;crop=smart&amp;auto=webp&amp;s=ac0e15d7d8b7c815235c8a1c1c4df0f57000947c', 'width': 640}, {'height': 720, 'url': 'https://external-preview.redd.it/Zz6REC4tO6iOTov0eRFRU_UK8oyHUf-NzWCHUbjpjsQ.jpg?width=960&amp;crop=smart&amp;auto=webp&amp;s=baf62185ebf89bc34b2c072e3e7ec0811f44516c', 'width': 960}, {'height': 810, 'url': 'https://external-preview.redd.it/Zz6REC4tO6iOTov0eRFRU_UK8oyHUf-NzWCHUbjpjsQ.jpg?width=1080&amp;crop=smart&amp;auto=webp&amp;s=8033c81eb2fad3af7c45a049df73908c1d6ed1b4', 'width': 1080}], 'source': {'height': 900, 'url': 'https://external-preview.redd.it/Zz6REC4tO6iOTov0eRFRU_UK8oyHUf-NzWCHUbjpjsQ.jpg?auto=webp&amp;s=6905f2e67c6c5042ab843b42f6e64ce7c8c1c734', 'width': 1200}, 'variants': {}}]}",6,moderator,1653234761,1,,True,False,False,CryptoCurrency,t5_2wlj3,4903415,public,https://b.thumbs.redditmedia.com/-wFAVxv3rJfdSAdOo_F_oZOgUoFoK5JVu9n1YG-gVbI.jpg,105.0,140.0,"Binance CEO: Luna and UST ""Was Just Stupid""",0,[],1.0,https://u.today/binance-ceo-luna-and-ust-was-just-stupid,https://u.today/binance-ceo-luna-and-ust-was-just-stupid,all_ads,6,1653205950.0,
1,[],False,GearLord0511,,Warning-level1-1,"[{'e': 'text', 't': 'Bronze | ADA 8 | Apple 36'}]",Bronze | ADA 8 | Apple 36,dark,richtext,t2_5w061041,False,False,False,[],False,False,1653228087,self.CryptoCurrency,https://www.reddit.com/r/CryptoCurrency/comments/uvbkn6/a_proposal_to_try_to_restore_some_value_in_lunas/,{},uvbkn6,False,True,False,False,False,True,True,False,#7193ff,DISCUSSION,"[{'e': 'text', 't': 'DISCUSSION'}]",87049662-0882-11e5-82e1-0e9d1a9f7761,DISCUSSION,dark,richtext,False,False,False,0,0,False,all_ads,/r/CryptoCurrency/comments/uvbkn6/a_proposal_to_try_to_restore_some_value_in_lunas/,False,,,6,,1653228098,1,"

I am no expert in any way but I have an idea that I have been thinking about in the last days. It’s a mental experiment and I am interested on opinions on why this could or couldn’t work, at least partially.
To try to restore at least a part of the Luna ecosystem it’s necessary to reduce the supply of Luna and pay back the UST holders. It’s easier said than done, I know, but there is nothing to lose since LUNC will probably die if nothing is implemented.
So my idea has 2 steps: 
1) introduce a small tax on transfers (1% for example). 
2) allow every day/ X period of time to convert UST to Luna BUT with a max cap equal to 66% (or another percentage) of the total luna burned during the day/ arbitrary time interval. First arrival first served.
So for example if in day one 100 million of Luna are burned, UST holders can convert their UST until 66 new millions Luna are created. 
Optional: Additionally it could be implemented a better conversation rate (for example 1 UST = 1.05 dollars worth of Luna) to compensate the UST holders for their trouble. This could also create buying pressure for UST.
Optional: give priority to the small holders for the conversation, similarly to FatMan’s proposal.
Why this could work?
If this mechanism is implemented the supply of Luna and UST could be decreased and this could create buying pressure. If this takes enough momentum, it could create a positive feedback loop that could accelerate the process (higher price of Luna because of the burning——&gt; less Luna to mint to pay back the UST tokens ——-&gt; more UST payed back——-&gt; more faith in the system——-&gt; more buying pressure for Luna).
So basically the opposite of the death spiral that we witnessed in the last days.
This would benefit everyone: UST holder and Luna holders, both old and new.
Conclusions:
it is clear that there is a lot of people that are willing to take a gamble and continue to buy Luna as a speculative investment providing liquidity. This won’t last forever and it’s a good idea to seize the opportunity now. This provides buying pressure and usage of the network that could be exploited to “restore” Luna’s value. 
There is nothing to lose at this point.
The question is it seems too easy. What am I missing?

Edit: grammar",True,False,False,CryptoCurrency,t5_2wlj3,4902958,public,self,,,A proposal to try to restore some value in Luna’s ecosystem without buybacks,0,[],1.0,https://www.reddit.com/r/CryptoCurrency/comments/uvbkn6/a_proposal_to_try_to_restore_some_value_in_lunas/,,all_ads,6,1653199287.0,
2,[],False,naji102,,,"[{'e': 'text', 't': ' Joined for quick profits now a long term HODLER'}]", Joined for quick profits now a long term HODLER,dark,richtext,t2_17ia5o,False,False,False,[],False,False,1653203938,portaldobitcoin.uol.com.br,https://www.reddit.com/r/CryptoCurrency/comments/uv5tmz/a_brazillian_cryptocurrency_exchange_has_refunded/,{},uv5tmz,False,True,False,False,False,True,False,False,#007373,EXCHANGES,"[{'e': 'text', 't': 'EXCHANGES'}]",38a8ac5a-9d5c-11e5-a136-0e9f3a832fc3,EXCHANGES,light,richtext,False,False,True,0,0,False,all_ads,/r/CryptoCurrency/comments/uv5tmz/a_brazillian_cryptocurrency_exchange_has_refunded/,False,link,"{'enabled': False, 'images': [{'id': '3s0zBV6y7kXC1AP7zZgWmp9EQ4ERsPL6m5XvD76RNu4', 'resolutions': [{'height': 62, 'url': 'https://external-preview.redd.it/TF3Axh2XHA1E1IqUajC3zolXZrLcaUV2XtpD8fFmoW4.jpg?width=108&amp;crop=smart&amp;auto=webp&amp;s=42bac29aa1e7588b7cd8045bbc5556958b4a4b0d', 'width': 108}, {'height': 124, 'url': 'https://external-preview.redd.it/TF3Axh2XHA1E1IqUajC3zolXZrLcaUV2XtpD8fFmoW4.jpg?width=216&amp;crop=smart&amp;auto=webp&amp;s=1dfb454f1d89bfbbd6ca81e7f75f6f144d61c303', 'width': 216}, {'height': 184, 'url': 'https://external-preview.redd.it/TF3Axh2XHA1E1IqUajC3zolXZrLcaUV2XtpD8fFmoW4.jpg?width=320&amp;crop=smart&amp;auto=webp&amp;s=2a37c2fae071123a70fb6f7a30faf632821dc578', 'width': 320}, {'height': 368, 'url': 'https://external-preview.redd.it/TF3Axh2XHA1E1IqUajC3zolXZrLcaUV2XtpD8fFmoW4.jpg?width=640&amp;crop=smart&amp;auto=webp&amp;s=169a403c0c76b15d5e0d54f4975638635ff2e259', 'width': 640}, {'height': 552, 'url': 'https://external-preview.redd.it/TF3Axh2XHA1E1IqUajC3zolXZrLcaUV2XtpD8fFmoW4.jpg?width=960&amp;crop=smart&amp;auto=webp&amp;s=ba55d45be745385b06c1521417ed5b50ffb21802', 'width': 960}, {'height': 621, 'url': 'https://external-preview.redd.it/TF3Axh2XHA1E1IqUajC3zolXZrLcaUV2XtpD8fFmoW4.jpg?width=1080&amp;crop=smart&amp;auto=webp&amp;s=0d111a088722b5dac5273252873d6dbce5cb2fd2', 'width': 1080}], 'source': {'height': 690, 'url': 'https://external-preview.redd.it/TF3Axh2XHA1E1IqUajC3zolXZrLcaUV2XtpD8fFmoW4.jpg?auto=webp&amp;s=de477c41e5ebd6c61de60482cf309bc3ebb2892c', 'width': 1200}, 'variants': {}}]}",6,,1653203949,1,,True,False,False,CryptoCurrency,t5_2wlj3,4901743,public,https://b.thumbs.redditmedia.com/r9x-1F2RjbpPGs8lq-jOsl9XP2rYZwNsx2-Q5P1khnk.jpg,80.0,140.0,A Brazillian cryptocurrency exchange has refunded all UST holders at a 1:1 rate with USDT. [Article in Portuguese],0,[],1.0,https://portaldobitcoin.uol.com.br/corretora-brasileira-vai-gastar-r-620-mil-para-ressarcir-investidores-afetados-pelo-derretimento-da-stablecoin-ust/,https://portaldobitcoin.uol.com.br/corretora-brasileira-vai-gastar-r-620-mil-para-ressarcir-investidores-afetados-pelo-derretimento-da-stablecoin-ust/,all_ads,6,1653175138.0,
3,[],False,MyzMyz1995,,Warning-level2-2,"[{'e': 'text', 't': 'Tin | CRO 10 | ExchSubs 10'}]",Tin | CRO 10 | ExchSubs 10,dark,richtext,t2_3abixt7x,False,False,False,[],False,False,1653198364,self.CryptoCurrency,https://www.reddit.com/r/CryptoCurrency/comments/uv4l3s/dont_get_swept_in_the_hype_and_buy_the_dipcrash/,{},uv4l3s,False,True,False,False,False,True,True,False,#46d160,ADVICE,"[{'e': 'text', 't': 'ADVICE'}]",e9570888-9c2a-11e3-809c-12313d1661cc,ADVICE,dark,richtext,False,False,True,0,0,False,all_ads,/r/CryptoCurrency/comments/uv4l3s/dont_get_swept_in_the_hype_and_buy_the_dipcrash/,False,,,6,,1653198374,1,"I'm not your financial advisor, but any advisor with an ounce of brain cell will tell you that you shouldn't be investing your life saving all in on risky investments. Look at what happened to UST, which was supposed to be a ''low risk'' crypto asset or even ETH/BTC  which are while still solid, down over 60% from ATH. 

There's a reason advisors and planners have to make you do a quiz and depending on said quiz they'll offer you different products, it's to test your risk tolerance and also to see how much you can afford to lose. If you're living pay check to pay check it's not smart to invest everything you have into a volatile asset.

Don't put anything in crypto you can't afford to lose, I understand some people want to get ahead in life, but diversifying your assets (not only crypto, but index 500 stocks for long term and low returns but no risk accounts for some emergency money alongside riskier assets like single stocks and crypto) is how you'll get ahead in life and become comfortable. 

I won't even bother saying ''this is not financial advice'' because everyone knows people writing this shit are full of bs.",True,False,False,CryptoCurrency,t5_2wlj3,4901473,public,self,,,Don't get swept in the hype and buy the dip/crash if you can't afford it.,0,[],1.0,https://www.reddit.com/r/CryptoCurrency/comments/uv4l3s/dont_get_swept_in_the_hype_and_buy_the_dipcrash/,,all_ads,6,1653169564.0,
4,[],False,SnooWoofers5376,, Analyst,[],,dark,text,t2_7rdxiqjl,False,False,False,[],False,False,1653188315,beincrypto.com,https://www.reddit.com/r/CryptoCurrency/comments/uv255u/brazilian_crypto_exchange_refunds_terrausd_ust_at/,{},uv255u,False,True,False,False,False,True,False,False,#0aa18f,NEWS,"[{'e': 'text', 't': 'GENERAL-NEWS'}]",f170aab2-246f-11ec-8143-429a193c9848,GENERAL-NEWS,light,richtext,False,False,True,0,0,False,all_ads,/r/CryptoCurrency/comments/uv255u/brazilian_crypto_exchange_refunds_terrausd_ust_at/,False,link,"{'enabled': False, 'images': [{'id': 'OZROlD5KQHC0N7FDIzhHVcEQoXKUJBTyaLhUIEl3wAc', 'resolutions': [{'height': 60, 'url': 'https://external-preview.redd.it/p6ps496D4ZvVO5QJHF7iHDIQVvMHatmtLreXkUATtEU.jpg?width=108&amp;crop=smart&amp;auto=webp&amp;s=fadf24fa2a6bd0c2153f13a73a613fdbca00f27d', 'width': 108}, {'height': 121, 'url': 'https://external-preview.redd.it/p6ps496D4ZvVO5QJHF7iHDIQVvMHatmtLreXkUATtEU.jpg?width=216&amp;crop=smart&amp;auto=webp&amp;s=c59cffdf6181fe9a68903bd9025cbc5459daaef6', 'width': 216}, {'height': 180, 'url': 'https://external-preview.redd.it/p6ps496D4ZvVO5QJHF7iHDIQVvMHatmtLreXkUATtEU.jpg?width=320&amp;crop=smart&amp;auto=webp&amp;s=1a0ce45c2a7dfdc9e278bbd85f29aa8dceb725b4', 'width': 320}, {'height': 360, 'url': 'https://external-preview.redd.it/p6ps496D4ZvVO5QJHF7iHDIQVvMHatmtLreXkUATtEU.jpg?width=640&amp;crop=smart&amp;auto=webp&amp;s=032da59ea8f19c9f68198bfbaeb2788db64d4328', 'width': 640}, {'height': 540, 'url': 'https://external-preview.redd.it/p6ps496D4ZvVO5QJHF7iHDIQVvMHatmtLreXkUATtEU.jpg?width=960&amp;crop=smart&amp;auto=webp&amp;s=afdaf285803289b227894fdeeb9df80ec22ef586', 'width': 960}, {'height': 607, 'url': 'https://external-preview.redd.it/p6ps496D4ZvVO5QJHF7iHDIQVvMHatmtLreXkUATtEU.jpg?width=1080&amp;crop=smart&amp;auto=webp&amp;s=535563050b31d7754fd7c9e3a32ca02db9663163', 'width': 1080}], 'source': {'height': 720, 'url': 'https://external-preview.redd.it/p6ps496D4ZvVO5QJHF7iHDIQVvMHatmtLreXkUATtEU.jpg?auto=webp&amp;s=9610dedef6fe86359d7ba90383f87fda28769c38', 'width': 1280}, 'variants': {}}]}",6,,1653188325,1,,True,False,False,CryptoCurrency,t5_2wlj3,4901016,public,https://b.thumbs.redditmedia.com/6SfVyw5CdMAVQr5MgQtpVYDlfclh9Muft9USxbjX1do.jpg,78.0,140.0,"Brazilian Crypto Exchange Refunds TerraUSD (UST) at $1 for Customers, a New Precedent Set?",0,[],1.0,https://beincrypto.com/brazilian-crypto-exchange-refunds-ust-at-1-for-customers/,https://beincrypto.com/brazilian-crypto-exchange-refunds-ust-at-1-for-customers/,all_ads,6,1653159515.0,
5,[],False,ln28909,,Warning-level2-2,"[{'e': 'text', 't': 'Tin'}]",Tin,dark,richtext,t2_5854vm5x,False,False,False,[],False,False,1653185505,self.CryptoCurrency,https://www.reddit.com/r/CryptoCurrency/comments/uv1ehg/if_you_dont_know_where_the_yield_is_coming_from/,{},uv1ehg,False,True,False,False,False,True,True,False,#7193ff,DISCUSSION,"[{'e': 'text', 't': 'DISCUSSION'}]",87049662-0882-11e5-82e1-0e9d1a9f7761,DISCUSSION,dark,richtext,False,False,True,1,0,False,all_ads,/r/CryptoCurrency/comments/uv1ehg/if_you_dont_know_where_the_yield_is_coming_from/,False,self,"{'enabled': False, 'images': [{'id': 'SPbaredP2w22Eyiz5IamTKRoq5B6xUpPOKpTyWa-0Hs', 'resolutions': [{'height': 49, 'url': 'https://external-preview.redd.it/OJNmKntMuZ9pXtRKgmtSDZ1wMLKOT2T4_3sqGxlmhsY.jpg?width=108&amp;crop=smart&amp;auto=webp&amp;s=abbad7b3cb5718c808489b42ed2c83662aa29df2', 'width': 108}], 'source': {'height': 64, 'url': 'https://external-preview.redd.it/OJNmKntMuZ9pXtRKgmtSDZ1wMLKOT2T4_3sqGxlmhsY.jpg?auto=webp&amp;s=97bc97fb69631a459e1cb1cc3cbc7c9b56ad4041', 'width': 140}, 'variants': {}}]}",6,,1653185515,1,"As per title, know where the yield is coming from before investing in a project, I've been seeing a lot of threads like this of people claiming to be victims of ust without taking themselves accountable

https://twitter.com/FatManTerra/status/1527912106355576834

People here claiming that they put money in ust as their native currency is unstable, well why don't you put your money into other usd stablecoin, there's literally so many of them, the reason you put it into ust is because you wanted that high yield, there's no other reason why you choose ust over usd stable otherwise

Now how does investing in usd make you the yield

When there is a strong buy pressure on ust, it will push ust slightly above peg and make it profitable for arbitragers to buy luna, burn, redeem, sell ust to make a profit. Therefore, strong buy pressure on ust increase demand for luna and thereby increases its price

Now, where does yield from anchor comes from. They come from TFL selling luna in its reserve to the market in exchange for ust. The higher luna price the lower the amount of luna in the reserve needs to be sold hence the ponzi can be keep alive for longer

So by buying ust, you're increasing luna price, which is where you yield comes from, so buying ust make you the yield and thus the crash

Furthermore, even if your goal is to keep usd as your native currency is unstable, you should keep them in a basket of usd stables instead of relying solely on 1 

So yeah, sucks to lose your money, but when you don't know that you are the yield, it is very easy to lose it",True,False,False,CryptoCurrency,t5_2wlj3,4900887,public,self,,,"If you don't know where the yield is coming from, you are the yield",0,[],1.0,https://www.reddit.com/r/CryptoCurrency/comments/uv1ehg/if_you_dont_know_where_the_yield_is_coming_from/,,all_ads,6,1653156705.0,
6,[],False,altranger9000,,Warning-level2-2,"[{'e': 'text', 't': 'Tin'}]",Tin,dark,richtext,t2_c4c6y2gg,False,False,False,[],False,False,1653175732,self.CryptoCurrency,https://www.reddit.com/r/CryptoCurrency/comments/uuyo0u/so_youve_made_a_fortune_in_crypto_now_what/,{},uuyo0u,False,True,False,False,False,True,True,False,#7193ff,DISCUSSION,"[{'e': 'text', 't': 'DISCUSSION'}]",87049662-0882-11e5-82e1-0e9d1a9f7761,DISCUSSION,dark,richtext,False,False,True,0,0,False,all_ads,/r/CryptoCurrency/comments/uuyo0u/so_youve_made_a_fortune_in_crypto_now_what/,False,,,6,,1653175743,1,"All of us dream of making a fortune on our crypto investment ; be it a million, 100k, it all depends on your situation. But what would you do if that were to actually happen?

Would you go all into fiat? Partially take profit &amp; leave the rest running? Reinvest? Be your own bank cold-wallet-style? Invest a chunk into crypto savings? Diversify into stocks or real estate? Quit crypto altogether? Cash it all and buy a house by the beach? Fire your boss and start your own 80% APY ponzi?

Might seem like an easy question, but the so called ""Dogecoin millionaire"" who turned $100k to $3m never took profit and his investment is now close to turning negative. Those who made it big on Luna and decided to stake the gains in UST are down to virtually zero. Even the CEO of Binance took a whopping 60 billion haircut on his net worth due to market volatility.

None of them expected any of it.

So what would you do if you were to become crypto rich?

Run for the hills and secure your stash, or take another shot at the crypto casino?",True,False,False,CryptoCurrency,t5_2wlj3,4900475,public,self,,,So you've made a fortune in crypto... now what?,0,[],1.0,https://www.reddit.com/r/CryptoCurrency/comments/uuyo0u/so_youve_made_a_fortune_in_crypto_now_what/,,all_ads,6,1653146932.0,
7,[],False,gimmedatcrypto,,Warning-level2-2,"[{'e': 'text', 't': 'Tin'}]",Tin,dark,richtext,t2_f1tz9maa,False,False,False,[],False,False,1653175245,self.CryptoCurrency,https://www.reddit.com/r/CryptoCurrency/comments/uuyixr/do_kwon_taking_steps_to_reimburse_small_wallets/,{},uuyixr,False,True,False,False,False,True,True,False,#5a74cc,PERSPECTIVE,"[{'e': 'text', 't': 'PERSPECTIVE'}]",1b44cdb2-2a6c-11ec-9baf-0aa21184cd0a,PERSPECTIVE,light,richtext,False,False,True,0,0,False,all_ads,/r/CryptoCurrency/comments/uuyixr/do_kwon_taking_steps_to_reimburse_small_wallets/,False,,,6,,1653175255,1,"Say what you will about the guy but he is answering questions and actively trying to find a solution to mitigating some of the losses experienced buy supporters. Since whales have already made out okay as is my understanding, this next phase; Kwon alleges smaller UST holders precrash will be reimbursed up to the tune of 50k each. There is still a considerable amount of LFG funds due to Kwon not liquidating AVAX and a substantial amount of BTC.  I never took part in this project but I hope this comes to fruition for those of you who were really burnt. Hell...if most of the little guys end up getting paid back Kwon may be able to save his reputation.",True,False,False,CryptoCurrency,t5_2wlj3,4900447,public,self,,,Do Kwon taking steps to reimburse small wallets for UST holders,0,[],1.0,https://www.reddit.com/r/CryptoCurrency/comments/uuyixr/do_kwon_taking_steps_to_reimburse_small_wallets/,,all_ads,6,1653146445.0,
8,[],False,Maxipp9001,,Warning-level2-2,"[{'e': 'text', 't': 'Tin'}]",Tin,dark,richtext,t2_475rqc2q,False,False,False,[],False,False,1653174287,self.CryptoCurrency,https://www.reddit.com/r/CryptoCurrency/comments/uuy8is/why_do_kwon_is_not_held_accountable_for/,{},uuy8is,False,True,False,False,False,True,True,False,#ff66ac,DEBATE,"[{'e': 'text', 't': 'DEBATE'}]",5b762856-d7c9-11e4-822a-22000b2300b2,DEBATE,light,richtext,False,False,True,0,0,False,all_ads,/r/CryptoCurrency/comments/uuy8is/why_do_kwon_is_not_held_accountable_for/,False,,,6,,1653174297,1,"How is crypto different from wall street if Do Kwon can walk free from evaporating 60 billion dollars in 3 days?
Bitcoin was a reaction to the financial crisis of 2008, a few years later crypto is doing the same to the people that it claimed it came to save.

Reading through letters of victims of anchor and Luna is so disheartening, many lives were destroyed because of the arrogance of one man!!!

Where's the so called decentralization when one person can control everything, gamble with billions then lose it and after that he just forks it and it's done!! 
Are you kidding me? How can people trust anything related to crypto after what happened to Luna and UST?

I know many other rugs and scams have happened, but not on this scale.. more than 40 billions of dollars were lost, that's more than the budget of so many countries !

Crypto people need to step up and be against this fork, then sue Do kown and put him behind bars where he belongs like the little gambler heHow is crypto different from wall street if Do Kwon can walk free from evaporating 60 billion dollars in 3 days?
Bitcoin was a reaction to the financial crisis of 2008, a few years later crypto is doing the same to the people that it claimed it came to save.

Reading through letters of victims of anchor and Luna is so disheartening, many lives were destroyed because of the arrogance of one man!!!

Where's the so called decentralization when one person can control everything, gamble with billions then lose it and after that he just forks it and it's done!! 
Are you kidding me? How can people trust anything related to crypto after what happened to Luna and UST?

I know many other rugs and scams have happened, but not on this scale.. more than 40 billions of dollars were lost, that's more than the budget of so many countries !

Crypto people need to step up and be against this fork, then sue Do kown and put him behind bars where he belongs like the little gambler he is..  is..",True,False,False,CryptoCurrency,t5_2wlj3,4900405,public,self,,,Why Do Kwon is not held accountable for destroying the lives of many people?,0,[],1.0,https://www.reddit.com/r/CryptoCurrency/comments/uuy8is/why_do_kwon_is_not_held_accountable_for/,,all_ads,6,1653145487.0,
9,[],False,Popbusterz,,Warning-level2-2,"[{'e': 'text', 't': 'Tin'}]",Tin,dark,richtext,t2_5bfc778w,False,False,False,[],False,False,1653171811,self.CryptoCurrency,https://www.reddit.com/r/CryptoCurrency/comments/uuxhem/results_from_the_survey_of_luna_holder/,{},uuxhem,False,True,False,False,False,True,True,False,#add2e2,ADVICE,"[{'e': 'text', 't': 'ANALYSIS'}]",c1034ee6-9c2a-11e3-a8c4-12313b0e8e20,ANALYSIS,dark,richtext,False,False,True,0,0,False,all_ads,/r/CryptoCurrency/comments/uuxhem/results_from_the_survey_of_luna_holder/,False,,,6,,1653171822,1,"So, I launched a survey yesterday and the results are in that surprised me very much:

Only post-attack luna holders make almost 2/3 rd of total current luna holders (65%).

Of total voters, only 21% are those who held any luna coin pre attack (with or without post attack).

9% are those that held any pre attack UST (irrespective of if they hold UST post attack or not).

Here is the link to the poll: [https://www.reddit.com/r/terraluna/comments/uu82yj/survey\_of\_current\_luna\_bag\_holders/](https://www.reddit.com/r/terraluna/comments/uu82yj/survey_of_current_luna_bag_holders/)",True,False,False,CryptoCurrency,t5_2wlj3,4900283,public,self,,,Results from the survey of Luna holder demographics on Terra Luna reddit,0,[],1.0,https://www.reddit.com/r/CryptoCurrency/comments/uuxhem/results_from_the_survey_of_luna_holder/,,all_ads,6,1653143011.0,
