10,[],False,ChickiWahWah-Splat,,,"[{'e': 'text', 't': 'Platinum | QC: CC 568'}]",Platinum | QC: CC 568,dark,richtext,t2_823hf,False,False,False,[],False,False,1653167717,bitcoinist.com,https://www.reddit.com/r/CryptoCurrency/comments/uuw7kn/binance_ceo_shares_lessons_from_the_crash_of_luna/,{},uuw7kn,False,True,False,False,False,True,False,False,,ANALYSIS,"[{'e': 'text', 't': '🟢 ANALYSIS'}]",,🟢 ANALYSIS,dark,richtext,False,False,True,0,0,False,all_ads,/r/CryptoCurrency/comments/uuw7kn/binance_ceo_shares_lessons_from_the_crash_of_luna/,False,link,"{'enabled': False, 'images': [{'id': 'BOmCnSRYDyEItsKmmiV8BikgIG549XlwIPLqUeu8NQg', 'resolutions': [{'height': 67, 'url': 'https://external-preview.redd.it/wIvo6-Cu8tbLY_o2MaSyQeM9KDg5tXj00YJ5FEuovmM.jpg?width=108&amp;crop=smart&amp;auto=webp&amp;s=485e41da7eb9abcc99bb4e809d68d3cda538c889', 'width': 108}, {'height': 135, 'url': 'https://external-preview.redd.it/wIvo6-Cu8tbLY_o2MaSyQeM9KDg5tXj00YJ5FEuovmM.jpg?width=216&amp;crop=smart&amp;auto=webp&amp;s=fea1eb4d77cbaa32cc478a37806dadbd571bdccf', 'width': 216}, {'height': 200, 'url': 'https://external-preview.redd.it/wIvo6-Cu8tbLY_o2MaSyQeM9KDg5tXj00YJ5FEuovmM.jpg?width=320&amp;crop=smart&amp;auto=webp&amp;s=c14cd0369edec20c89eb54bdc69e9d25676beb9d', 'width': 320}, {'height': 400, 'url': 'https://external-preview.redd.it/wIvo6-Cu8tbLY_o2MaSyQeM9KDg5tXj00YJ5FEuovmM.jpg?width=640&amp;crop=smart&amp;auto=webp&amp;s=b52583da4337d2333545f4e49a21255ef891eeb2', 'width': 640}, {'height': 600, 'url': 'https://external-preview.redd.it/wIvo6-Cu8tbLY_o2MaSyQeM9KDg5tXj00YJ5FEuovmM.jpg?width=960&amp;crop=smart&amp;auto=webp&amp;s=529df4ef6fc397466568326cd930d8f1c55e18a3', 'width': 960}, {'height': 675, 'url': 'https://external-preview.redd.it/wIvo6-Cu8tbLY_o2MaSyQeM9KDg5tXj00YJ5FEuovmM.jpg?width=1080&amp;crop=smart&amp;auto=webp&amp;s=0e47de54dd0bb6dd2faaeaab7b0358310c0ec2a2', 'width': 1080}], 'source': {'height': 1200, 'url': 'https://external-preview.redd.it/wIvo6-Cu8tbLY_o2MaSyQeM9KDg5tXj00YJ5FEuovmM.jpg?auto=webp&amp;s=c164c2e0df8c832ed090b22bad5b2c7542e39e19', 'width': 1920}, 'variants': {}}]}",6,,1653167728,1,,True,False,False,CryptoCurrency,t5_2wlj3,4900069,public,https://b.thumbs.redditmedia.com/vcDIC3eTyTILVjHhPTNAH_VYBUblyHEQ9tz1zlKTG4g.jpg,87.0,140.0,"Binance CEO Shares Lessons From The Crash Of LUNA, UST Coin",0,[],1.0,https://bitcoinist.com/binance-ceo-shares-lessons-from-the-crash-of-luna-ust-coin/,https://bitcoinist.com/binance-ceo-shares-lessons-from-the-crash-of-luna-ust-coin/,all_ads,6,1653138917.0,
11,[],False,DankOcean,,Warning-level2-2,"[{'e': 'text', 't': 'Tin'}]",Tin,dark,richtext,t2_gi5bn,False,False,False,[],False,False,1653167358,self.CryptoCurrency,https://www.reddit.com/r/CryptoCurrency/comments/uuw3ib/kashappio_ust_off_ramp/,{},uuw3ib,False,False,False,False,False,False,True,False,#46d160,ADVICE,"[{'e': 'text', 't': 'ADVICE'}]",e9570888-9c2a-11e3-809c-12313d1661cc,ADVICE,dark,richtext,False,False,True,1,0,False,all_ads,/r/CryptoCurrency/comments/uuw3ib/kashappio_ust_off_ramp/,False,,,6,moderator,1653167369,1,[removed],True,False,False,CryptoCurrency,t5_2wlj3,4900060,public,self,,,Kash.app.io UST off ramp,0,[],1.0,https://www.reddit.com/r/CryptoCurrency/comments/uuw3ib/kashappio_ust_off_ramp/,,all_ads,6,1653138558.0,
12,[],False,coiiiii,,,"[{'e': 'text', 't': 'Platinum | QC: CC 79'}]",Platinum | QC: CC 79,dark,richtext,t2_22putrkv,False,False,False,[],False,False,1653166258,self.CryptoCurrency,https://www.reddit.com/r/CryptoCurrency/comments/uuvqck/so_which_reputable_project_can_possibly_be_the/,{},uuvqck,False,True,False,False,False,True,True,False,#ff66ac,DEBATE,"[{'e': 'text', 't': 'DEBATE'}]",5b762856-d7c9-11e4-822a-22000b2300b2,DEBATE,light,richtext,False,False,True,0,0,False,all_ads,/r/CryptoCurrency/comments/uuvqck/so_which_reputable_project_can_possibly_be_the/,False,,,6,,1653166269,1,"I’m not gonna lie, but the whole Luna/Terra/UST situation was a terrible reminder on how fragile things can be and how things can change from one day to another. A lot of people literally lost everything thinking that their investments were secure under the bulletproof Terra Foundation economics, hype and track record. And then boom! Doomsdays happened and we were on the first row watching everything fall apart.
Now the question is: Is there any other reputable and serious project that can have a similar end? I’m talking about big projects like Avalanche, Polkadot, Algorand, Polygon… or maybe stable coins like USDC, DAI, USDT (yeah, we all know about USDT…) Projects like that, big names that can implode from one day to another thanks to problematic fundamentals, bugs, hacks, security problems, etc.
I would love if people can share their thoughts about some flaws on any project that can lead to a big crash.

Of course we are not talking about random projects like any Elon/Baby/Safe tokens)",True,False,False,CryptoCurrency,t5_2wlj3,4899996,public,self,,,"So, which reputable project can possibly be the next Terra/Luna/UST situation?",0,[],1.0,https://www.reddit.com/r/CryptoCurrency/comments/uuvqck/so_which_reputable_project_can_possibly_be_the/,,all_ads,6,1653137458.0,
13,[],False,cascading_disruption,,,[],,,text,t2_a4ssb7tg,False,False,False,[],False,False,1653159246,self.CryptoCurrency,https://www.reddit.com/r/CryptoCurrency/comments/uuthwn/honestly_the_exchanges_the_centralized_ones_need/,{},uuthwn,False,True,False,True,False,True,True,False,#46d160,ADVICE,"[{'e': 'text', 't': 'ADVICE'}]",e9570888-9c2a-11e3-809c-12313d1661cc,ADVICE,dark,richtext,False,False,True,0,0,False,all_ads,/r/CryptoCurrency/comments/uuthwn/honestly_the_exchanges_the_centralized_ones_need/,False,,,6,,1653159257,1,"Once Luna boys decided to switch off  the network Solana style they canceled themselves as no transactions  were possible. If the group of validators can come together and decided  to halt a network then it's time to make that big ass centralized call.

I'm  kinda done with this centralized permissioned bullshit, if there's no  attack on the network and your gang decided to switch it off and pause  it then just call it quits and GTFO.

Solana  is also one bad day away from going to zero, how many more resets  before it goes to zero?  The switch on-off VC backed chains Solanas and  Lunas and similar shit networks like BSC who have their own limited list  of validators. I'm amazed that anything Binance, Solana is actually in  the top 10.

People used to laugh  at XRP Ledger for being ""centralized and permissioned"" cause most  validators simply copy&amp;paste the nodes list kept up to date by  Ripple instead of adding their own choices of validators but goddamn  compared to these VC backed fucked up chains it's like one of the most  decentralized shit on the planet.

The  only 3 chains in the top 10 that never had a fucking reboot are  Bitcoin, Ethereum and Cardano and if the recent events told you anything  is there's a fucking reason why decentralization is important.",True,False,False,CryptoCurrency,t5_2wlj3,4899613,public,self,,,"Honestly, the exchanges (the centralized ones) need to step up and save lunatics from damaging themselves even further and close any trading on UST or Luna",0,[],1.0,https://www.reddit.com/r/CryptoCurrency/comments/uuthwn/honestly_the_exchanges_the_centralized_ones_need/,,all_ads,6,1653130446.0,
14,[],False,Material-Welcome7928,,,[],,,text,t2_glo8832o,False,False,False,[],False,False,1653158782,self.CryptoCurrency,https://www.reddit.com/r/CryptoCurrency/comments/uutcfx/help_with_ust/,{},uutcfx,False,False,False,False,False,False,True,False,#46d160,ADVICE,"[{'e': 'text', 't': 'ADVICE'}]",e9570888-9c2a-11e3-809c-12313d1661cc,ADVICE,dark,richtext,False,False,True,1,0,False,all_ads,/r/CryptoCurrency/comments/uutcfx/help_with_ust/,False,,,6,moderator,1653158793,1,[removed],True,False,False,CryptoCurrency,t5_2wlj3,4899592,public,self,,,Help with UST,0,[],1.0,https://www.reddit.com/r/CryptoCurrency/comments/uutcfx/help_with_ust/,,all_ads,6,1653129982.0,
15,[],False,chuloreddit,,,"[{'e': 'text', 't': 'Platinum | QC: CC 91 | BANANO 9'}]",Platinum | QC: CC 91 | BANANO 9,dark,richtext,t2_70b31,False,False,False,[],False,False,1653157116,thecryptobasic.com,https://www.reddit.com/r/CryptoCurrency/comments/uust40/burn_the_remaining_terra_usd_ust_vote_passed_but/,{},uust40,False,False,False,False,False,False,False,False,#c403f5,COMEDY,"[{'e': 'text', 't': 'COMEDY'}]",5c104cfc-d7c8-11e4-9d14-22000b6902b0,COMEDY,dark,richtext,False,False,True,0,0,False,all_ads,/r/CryptoCurrency/comments/uust40/burn_the_remaining_terra_usd_ust_vote_passed_but/,False,link,"{'enabled': False, 'images': [{'id': 'IsIXqw04dRtykflsw1zVai5DOWhjs3oD9bif6HaAFG0', 'resolutions': [{'height': 58, 'url': 'https://external-preview.redd.it/2snhOha_CZv96wnWTaFkvdlnEgJ0qPJF4BmC4QMcN6s.jpg?width=108&amp;crop=smart&amp;auto=webp&amp;s=2bd69b9743c2e55f28873ea53ccdf22f149ea248', 'width': 108}, {'height': 117, 'url': 'https://external-preview.redd.it/2snhOha_CZv96wnWTaFkvdlnEgJ0qPJF4BmC4QMcN6s.jpg?width=216&amp;crop=smart&amp;auto=webp&amp;s=598931fc3ce6ee6051d37bea45818571ac7cd641', 'width': 216}, {'height': 174, 'url': 'https://external-preview.redd.it/2snhOha_CZv96wnWTaFkvdlnEgJ0qPJF4BmC4QMcN6s.jpg?width=320&amp;crop=smart&amp;auto=webp&amp;s=c44c29bdbad7b7300d2fe58337f6abd7f47afaa3', 'width': 320}, {'height': 348, 'url': 'https://external-preview.redd.it/2snhOha_CZv96wnWTaFkvdlnEgJ0qPJF4BmC4QMcN6s.jpg?width=640&amp;crop=smart&amp;auto=webp&amp;s=0ddc420c6b3fa92f3463be57f184244678d84f93', 'width': 640}], 'source': {'height': 410, 'url': 'https://external-preview.redd.it/2snhOha_CZv96wnWTaFkvdlnEgJ0qPJF4BmC4QMcN6s.jpg?auto=webp&amp;s=3067a622c044b057372675caac0237cd15899af3', 'width': 752}, 'variants': {}}]}",6,moderator,1653157127,1,,True,False,False,CryptoCurrency,t5_2wlj3,4899483,public,https://b.thumbs.redditmedia.com/5bnfbA4XLmdXWrO3pXokj7g1J9xRKTMMvnbmd_plhpw.jpg,76.0,140.0,Burn The Remaining Terra USD (UST) Vote Passed But Failed to Execute Due to Technical Issues,0,[],1.0,https://thecryptobasic.com/2022/05/21/burn-the-remaining-terra-usd-ust-vote-passed-but-failed-to-execute-due-to-technical-issues/?utm_source=thecryptoapp,https://thecryptobasic.com/2022/05/21/burn-the-remaining-terra-usd-ust-vote-passed-but-failed-to-execute-due-to-technical-issues/?utm_source=thecryptoapp,all_ads,6,1653128316.0,
16,[],False,Meltdownmyself,,Warning-level2-2,"[{'e': 'text', 't': 'Tin'}]",Tin,dark,richtext,t2_c0gxjj32,False,False,False,[],False,False,1653156640,cryptoslate.com,https://www.reddit.com/r/CryptoCurrency/comments/uusnfx/brazilian_crypto_exchange_called_nox_bitcoin/,{},uusnfx,False,True,False,False,False,True,False,False,,GENERAL-NEWS,"[{'e': 'text', 't': '🟢 GENERAL-NEWS'}]",,🟢 GENERAL-NEWS,dark,richtext,False,False,True,0,0,False,all_ads,/r/CryptoCurrency/comments/uusnfx/brazilian_crypto_exchange_called_nox_bitcoin/,False,link,"{'enabled': False, 'images': [{'id': 'tB6CztNTL-fSXs2UYTaiylX64ero5Xc2KSpHoD5Wby0', 'resolutions': [{'height': 56, 'url': 'https://external-preview.redd.it/D3otOe0cEmoXaonOi73G_d0uNWs8bJKw1wA0JoiDYR0.jpg?width=108&amp;crop=smart&amp;auto=webp&amp;s=5175a0ce971d41847d790d49d1ae0bb6cb5750c0', 'width': 108}, {'height': 113, 'url': 'https://external-preview.redd.it/D3otOe0cEmoXaonOi73G_d0uNWs8bJKw1wA0JoiDYR0.jpg?width=216&amp;crop=smart&amp;auto=webp&amp;s=a77686aacdd482c5b20cd17c8294a400ad46b182', 'width': 216}, {'height': 168, 'url': 'https://external-preview.redd.it/D3otOe0cEmoXaonOi73G_d0uNWs8bJKw1wA0JoiDYR0.jpg?width=320&amp;crop=smart&amp;auto=webp&amp;s=6a655e1acaf3c4e1bcedc8c4b83e9f5dabbfbbf8', 'width': 320}, {'height': 336, 'url': 'https://external-preview.redd.it/D3otOe0cEmoXaonOi73G_d0uNWs8bJKw1wA0JoiDYR0.jpg?width=640&amp;crop=smart&amp;auto=webp&amp;s=d9d637a0e32a27cdd1e38de835309e5cbc4542bf', 'width': 640}, {'height': 504, 'url': 'https://external-preview.redd.it/D3otOe0cEmoXaonOi73G_d0uNWs8bJKw1wA0JoiDYR0.jpg?width=960&amp;crop=smart&amp;auto=webp&amp;s=3b52d45b7d3a3822990f9055e44f45cb497c8316', 'width': 960}, {'height': 567, 'url': 'https://external-preview.redd.it/D3otOe0cEmoXaonOi73G_d0uNWs8bJKw1wA0JoiDYR0.jpg?width=1080&amp;crop=smart&amp;auto=webp&amp;s=f2cc92c5424f5e7dc4f36143e2b64b4c7bf9033c', 'width': 1080}], 'source': {'height': 630, 'url': 'https://external-preview.redd.it/D3otOe0cEmoXaonOi73G_d0uNWs8bJKw1wA0JoiDYR0.jpg?auto=webp&amp;s=ed41d31369990ef850dbdd952329d821320cf16c', 'width': 1200}, 'variants': {}}]}",6,,1653156651,1,,True,False,False,CryptoCurrency,t5_2wlj3,4899463,public,https://a.thumbs.redditmedia.com/sq1Jz9QJZAppRgrwk_XNY5UgrmRhzcH6xflD0LpQzj4.jpg,73.0,140.0,"Brazilian Crypto Exchange, Called Nox Bitcoin, Refunds All UST Holders 1:1",0,[],1.0,https://cryptoslate.com/brazilian-crypto-exchange-refunds-all-ust-holders-11/,https://cryptoslate.com/brazilian-crypto-exchange-refunds-all-ust-holders-11/,all_ads,6,1653127840.0,
17,[],False,SirEffKay,,,"[{'e': 'text', 't': 'Silver | QC: CC 41 | CAKE 48'}]",Silver | QC: CC 41 | CAKE 48,dark,richtext,t2_a30xdsql,False,False,True,[],False,False,1653153941,cryptoslate.com,https://www.reddit.com/r/CryptoCurrency/comments/uurrbj/brazilian_crypto_exchange_refunds_all_ust_holders/,{},uurrbj,False,True,False,False,False,True,False,False,,GENERAL-NEWS,"[{'e': 'text', 't': '🟢 GENERAL-NEWS'}]",,🟢 GENERAL-NEWS,dark,richtext,False,False,True,0,0,False,all_ads,/r/CryptoCurrency/comments/uurrbj/brazilian_crypto_exchange_refunds_all_ust_holders/,False,link,"{'enabled': False, 'images': [{'id': 'tB6CztNTL-fSXs2UYTaiylX64ero5Xc2KSpHoD5Wby0', 'resolutions': [{'height': 56, 'url': 'https://external-preview.redd.it/D3otOe0cEmoXaonOi73G_d0uNWs8bJKw1wA0JoiDYR0.jpg?width=108&amp;crop=smart&amp;auto=webp&amp;s=5175a0ce971d41847d790d49d1ae0bb6cb5750c0', 'width': 108}, {'height': 113, 'url': 'https://external-preview.redd.it/D3otOe0cEmoXaonOi73G_d0uNWs8bJKw1wA0JoiDYR0.jpg?width=216&amp;crop=smart&amp;auto=webp&amp;s=a77686aacdd482c5b20cd17c8294a400ad46b182', 'width': 216}, {'height': 168, 'url': 'https://external-preview.redd.it/D3otOe0cEmoXaonOi73G_d0uNWs8bJKw1wA0JoiDYR0.jpg?width=320&amp;crop=smart&amp;auto=webp&amp;s=6a655e1acaf3c4e1bcedc8c4b83e9f5dabbfbbf8', 'width': 320}, {'height': 336, 'url': 'https://external-preview.redd.it/D3otOe0cEmoXaonOi73G_d0uNWs8bJKw1wA0JoiDYR0.jpg?width=640&amp;crop=smart&amp;auto=webp&amp;s=d9d637a0e32a27cdd1e38de835309e5cbc4542bf', 'width': 640}, {'height': 504, 'url': 'https://external-preview.redd.it/D3otOe0cEmoXaonOi73G_d0uNWs8bJKw1wA0JoiDYR0.jpg?width=960&amp;crop=smart&amp;auto=webp&amp;s=3b52d45b7d3a3822990f9055e44f45cb497c8316', 'width': 960}, {'height': 567, 'url': 'https://external-preview.redd.it/D3otOe0cEmoXaonOi73G_d0uNWs8bJKw1wA0JoiDYR0.jpg?width=1080&amp;crop=smart&amp;auto=webp&amp;s=f2cc92c5424f5e7dc4f36143e2b64b4c7bf9033c', 'width': 1080}], 'source': {'height': 630, 'url': 'https://external-preview.redd.it/D3otOe0cEmoXaonOi73G_d0uNWs8bJKw1wA0JoiDYR0.jpg?auto=webp&amp;s=ed41d31369990ef850dbdd952329d821320cf16c', 'width': 1200}, 'variants': {}}]}",6,,1653153952,1,,True,False,False,CryptoCurrency,t5_2wlj3,4899287,public,https://a.thumbs.redditmedia.com/sq1Jz9QJZAppRgrwk_XNY5UgrmRhzcH6xflD0LpQzj4.jpg,73.0,140.0,Brazilian crypto exchange refunds all UST holders 1:1 | CryptoSlate,0,[],1.0,https://cryptoslate.com/brazilian-crypto-exchange-refunds-all-ust-holders-11/,https://cryptoslate.com/brazilian-crypto-exchange-refunds-all-ust-holders-11/,all_ads,6,1653125141.0,
18,[],False,kayden_8,,Warning-level2-2,"[{'e': 'text', 't': 'Tin | 4 months old'}]",Tin | 4 months old,dark,richtext,t2_i4vjdckk,False,False,False,[],False,False,1653153870,self.CryptoCurrency,https://www.reddit.com/r/CryptoCurrency/comments/uurqg1/ramp_defi_may_community_updates/,{},uurqg1,False,True,False,False,False,True,True,False,#7193ff,DISCUSSION,"[{'e': 'text', 't': 'DISCUSSION'}]",87049662-0882-11e5-82e1-0e9d1a9f7761,DISCUSSION,dark,richtext,False,False,True,0,0,False,all_ads,/r/CryptoCurrency/comments/uurqg1/ramp_defi_may_community_updates/,False,,,6,,1653153881,1," 1) A Review of rUSD Following Recent Events

The recent LUNA/UST collapse was highly unfortunate for DeFi investors and users. In light of this event, it is important for users to understand that rUSD, which is **overcollateralized**, does not contain any of the same risks faced by UST.

rUSD is minted using a wide range of collateral, including BTC, ETH, BNB, CAKE, RAMP and more. In times of stress, and using liquidations where necessary, the RAMP protocol has since inception, ensured that rUSD remains fully collateralized in value.

Going forward, we expect the general environment to remain challenging for collateralized stablecoins, due to (i) increased risks for LPs as a result of highly imbalanced liquidity pools, (ii) constant LP reward emissions in the face of a market contraction and (iii) growing regulatory scrutiny by global governments.

The transition of RAMP to Lever Finance is expected to play a positive role in mitigating these headwinds for the protocol, team and community.

2) Reaffirming Our Commitment to BUIDL

Notwithstanding the broad market fluctuations, Galaxia Labs’ focus on driving financial innovation and building new user-centric products has not changed. Funding has been secured with sufficient project runway to get through the next few Bitcoin halvings, bull and bear markets, and beyond.

Galaxia Labs team reaffirms out commitment to build and develop innovative solutions for the Web3 community, starting with Lever Finance, and will subsequently expand to include Web3 infrastructure, user tools, NFTs, GameFi and SocialFi.

We believe that our unwavering focus to build, even in the midst of market contractions, will eventually bear fruit once macro conditions inevitably recover.

Subject to future market conditions, new products may be launched as token projects or simply as fee-generating utility solutions (non-token), with value to be accrued towards token holders in the form of airdrops, token buybacks, incentives and more.

https://preview.redd.it/52todngo5v091.jpg?width=1400&amp;format=pjpg&amp;auto=webp&amp;s=43b796abc30c2f88226b09e96bf97eeae7330729",True,False,False,CryptoCurrency,t5_2wlj3,4899286,public,https://b.thumbs.redditmedia.com/EF-IXhMA-8SQwVLOfRk1Clbnf9x5XBJaFcF9ToUDjxs.jpg,78.0,140.0,Ramp DeFi May Community Updates,0,[],1.0,https://www.reddit.com/r/CryptoCurrency/comments/uurqg1/ramp_defi_may_community_updates/,,all_ads,6,1653125070.0,"{'52todngo5v091': {'e': 'Image', 'id': '52todngo5v091', 'm': 'image/jpg', 'p': [{'u': 'https://preview.redd.it/52todngo5v091.jpg?width=108&amp;crop=smart&amp;auto=webp&amp;s=30628cfe22a3c82722cba19702987982dec70de2', 'x': 108, 'y': 60}, {'u': 'https://preview.redd.it/52todngo5v091.jpg?width=216&amp;crop=smart&amp;auto=webp&amp;s=8278f7c2ad8e27f946547dd8f654b19dd2291d3e', 'x': 216, 'y': 121}, {'u': 'https://preview.redd.it/52todngo5v091.jpg?width=320&amp;crop=smart&amp;auto=webp&amp;s=8d46dad810463c2841f69aed87291be759db780c', 'x': 320, 'y': 179}, {'u': 'https://preview.redd.it/52todngo5v091.jpg?width=640&amp;crop=smart&amp;auto=webp&amp;s=68a44fa27d77db8fcc5593a144ae547914164b24', 'x': 640, 'y': 359}, {'u': 'https://preview.redd.it/52todngo5v091.jpg?width=960&amp;crop=smart&amp;auto=webp&amp;s=c97cd1902d30a613e1f6ffcfa54c86332fa93178', 'x': 960, 'y': 539}, {'u': 'https://preview.redd.it/52todngo5v091.jpg?width=1080&amp;crop=smart&amp;auto=webp&amp;s=ea90b61d17625933846c51b8477e38b268f19747', 'x': 1080, 'y': 607}], 's': {'u': 'https://preview.redd.it/52todngo5v091.jpg?width=1400&amp;format=pjpg&amp;auto=webp&amp;s=43b796abc30c2f88226b09e96bf97eeae7330729', 'x': 1400, 'y': 787}, 'status': 'valid'}}"
19,[],False,Theoneandonlybigmoe,, Observer,"[{'e': 'text', 't': ' Titanium | Analyst '}]", Titanium | Analyst ,dark,richtext,t2_a1ekmy3r,False,False,False,[],False,False,1653153512,self.CryptoCurrency,https://www.reddit.com/r/CryptoCurrency/comments/uurm9g/has_enough_been_said_about_terraform_labs/,{},uurm9g,False,True,False,False,False,True,True,False,#ff66ac,DEBATE,"[{'e': 'text', 't': 'DEBATE'}]",5b762856-d7c9-11e4-822a-22000b2300b2,DEBATE,light,richtext,False,False,True,0,0,False,all_ads,/r/CryptoCurrency/comments/uurm9g/has_enough_been_said_about_terraform_labs/,False,,,6,,1653153523,1,"
I know. Old news. I get it. But what can we actually take away and learn from this experience. Is it okay to beat a dead horse? I mean seriously, how can we trust Terraform Labs any further? Even their in-house legal team has resigned. . . or, for that matter and as a side bar how do we trust ANY project moving forward. 

The sentiment seems clear. But what about accountability? Now it appears that they have moved to outside counsel for their legal matters. 

To make matters even worse, Do Kwon, the CEO is actually trying to fork and revive to build a new block chain? 

A spokesperson of the company was reported to have said “The vast majority of team members remain steadfastly committed to carrying out the project’s mission. Terra is more than UST, with an incredibly passionate community and a clear vision on how to rebuild. Our focus is now on executing our plan to revive the Terra ecosystem.”

Who says this after a major collapse? 

Where does your trust lay? What makes you say “hey, I’ve done the best research and DD that I can do, I trust this project to put my hard earned fiat to work.”?

Or is crypto seriously a casino with the nefarious leading the blind? Don’t get me wrong. I came for the tech and stayed for the potential earnings. But it is getting more difficult to discern what’s real versus the next potential rug pull. 

Wishing you all the very best. 

-the Analyst",True,False,False,CryptoCurrency,t5_2wlj3,4899270,public,self,,,Has enough been said about Terraform Labs?,0,[],1.0,https://www.reddit.com/r/CryptoCurrency/comments/uurm9g/has_enough_been_said_about_terraform_labs/,,all_ads,6,1653124712.0,
20,[],False,doallstuff,,,[],,,text,t2_m8zi6nc,False,False,False,[],False,False,1653153418,self.CryptoCurrency,https://www.reddit.com/r/CryptoCurrency/comments/uurl65/eli5_lunas_market_cap_visible_on_coinmarketcap_is/,{},uurl65,False,True,False,False,False,True,True,False,#7193ff,DISCUSSION,"[{'e': 'text', 't': 'DISCUSSION'}]",87049662-0882-11e5-82e1-0e9d1a9f7761,DISCUSSION,dark,richtext,False,False,True,0,0,False,all_ads,/r/CryptoCurrency/comments/uurl65/eli5_lunas_market_cap_visible_on_coinmarketcap_is/,False,,,6,,1653153429,1,"Disclaimer: I am pretty new to crypto

I have been following the recent collapse of UST/Luna and it's been pretty instructive. One of the things I do not understand at all is Luna's current market cap. How come it's so high when all the trust has evaporated?

Controlling the whole Luna's supply surely must not be worth than idk, 10m+? Is the only basis of the current valuation brand recognition mixed with some hope that ""stonks go up""?

&amp;#x200B;

soo.. the current luna's market cap, as seen on coinmarketcap, is 690M USD. Is that real?",True,False,False,CryptoCurrency,t5_2wlj3,4899268,public,self,,,ELI5: Luna's market cap visible on coinmarketcap is 690M USD. Is that real?,0,[],1.0,https://www.reddit.com/r/CryptoCurrency/comments/uurl65/eli5_lunas_market_cap_visible_on_coinmarketcap_is/,,all_ads,6,1653124618.0,
