,all_awardings,allow_live_comments,author,author_flair_background_color,author_flair_css_class,author_flair_richtext,author_flair_text,author_flair_text_color,author_flair_type,author_fullname,author_is_blocked,author_patreon_flair,author_premium,awarders,can_mod_post,contest_mode,created_utc,domain,full_link,gildings,id,is_created_from_ads_ui,is_crosspostable,is_meta,is_original_content,is_reddit_media_domain,is_robot_indexable,is_self,is_video,link_flair_background_color,link_flair_css_class,link_flair_richtext,link_flair_template_id,link_flair_text,link_flair_text_color,link_flair_type,locked,media_only,no_follow,num_comments,num_crossposts,over_18,parent_whitelist_status,permalink,pinned,post_hint,preview,pwls,retrieved_on,score,selftext,send_replies,spoiler,stickied,subreddit,subreddit_id,subreddit_subscribers,subreddit_type,thumbnail,thumbnail_height,thumbnail_width,title,total_awards_received,treatment_tags,upvote_ratio,url,url_overridden_by_dest,whitelist_status,wls,created,suggested_sort,removed_by_category
0,[],False,ipetgoat1984,,,"[{'e': 'text', 't': 'Platinum | QC: CC 220'}]",Platinum | QC: CC 220,dark,richtext,t2_dz8todsa,False,False,True,[],False,False,1653911648,en.ethereumworldnews.com,https://www.reddit.com/r/CryptoCurrency/comments/v0yj7c/south_korean_prosecutors_launch_investigation_on/,{},v0yj7c,False,True,False,False,False,True,False,False,#0aa18f,NEWS,"[{'e': 'text', 't': 'GENERAL-NEWS'}]",f170aab2-246f-11ec-8143-429a193c9848,GENERAL-NEWS,light,richtext,False,False,True,0,0,False,all_ads,/r/CryptoCurrency/comments/v0yj7c/south_korean_prosecutors_launch_investigation_on/,False,link,"{'enabled': False, 'images': [{'id': 'VPOorHlACvtFB3UzRUlDYbfmfOSW4F2DkXRBSV44FmE', 'resolutions': [{'height': 66, 'url': 'https://external-preview.redd.it/U3rtctyMegFDtRZb0lsyEgUYsLmNrOB8c5qq3B6ReqQ.jpg?width=108&amp;crop=smart&amp;auto=webp&amp;s=f9a848e197af59799f17a718290ccc17053b6bd8', 'width': 108}, {'height': 133, 'url': 'https://external-preview.redd.it/U3rtctyMegFDtRZb0lsyEgUYsLmNrOB8c5qq3B6ReqQ.jpg?width=216&amp;crop=smart&amp;auto=webp&amp;s=9878a9ae7c95daff4a040b5bbe6f3e5833e7a527', 'width': 216}, {'height': 197, 'url': 'https://external-preview.redd.it/U3rtctyMegFDtRZb0lsyEgUYsLmNrOB8c5qq3B6ReqQ.jpg?width=320&amp;crop=smart&amp;auto=webp&amp;s=c54b2a512f4fe41d09d6d0f095669c19be4cc1fb', 'width': 320}, {'height': 395, 'url': 'https://external-preview.redd.it/U3rtctyMegFDtRZb0lsyEgUYsLmNrOB8c5qq3B6ReqQ.jpg?width=640&amp;crop=smart&amp;auto=webp&amp;s=72bef0c65d498f8e7c9c21fe2d3c9db9b715d344', 'width': 640}, {'height': 592, 'url': 'https://external-preview.redd.it/U3rtctyMegFDtRZb0lsyEgUYsLmNrOB8c5qq3B6ReqQ.jpg?width=960&amp;crop=smart&amp;auto=webp&amp;s=37c95c4879c7e64da4ce4848a7ade71adc318e47', 'width': 960}, {'height': 666, 'url': 'https://external-preview.redd.it/U3rtctyMegFDtRZb0lsyEgUYsLmNrOB8c5qq3B6ReqQ.jpg?width=1080&amp;crop=smart&amp;auto=webp&amp;s=956f9020d46eb67f6b289922ff4162c432287d10', 'width': 1080}], 'source': {'height': 988, 'url': 'https://external-preview.redd.it/U3rtctyMegFDtRZb0lsyEgUYsLmNrOB8c5qq3B6ReqQ.jpg?auto=webp&amp;s=b3a3ce5c582deab516363727a36eec4550694f59', 'width': 1600}, 'variants': {}}]}",6,1653911658,1,,True,False,False,CryptoCurrency,t5_2wlj3,4936795,public,https://b.thumbs.redditmedia.com/nUW49iCW5--Bps_FEWrMhj2Knf0QVXUQoFKoXP8Pxug.jpg,86.0,140.0,South Korean Prosecutors Launch Investigation on All Terraform Labs Employees Following UST Collapse,0,[],1.0,https://en.ethereumworldnews.com/terraform-labs-under-radar/,https://en.ethereumworldnews.com/terraform-labs-under-radar/,all_ads,6,1653882848.0,,
1,[],False,youanus,,,[],,,text,t2_fksc12dj,False,False,False,[],False,False,1653904587,cnbc.com,https://www.reddit.com/r/CryptoCurrency/comments/v0wr1o/some_investors_got_rich_before_ust_implosion/,{},v0wr1o,False,True,False,False,False,True,False,False,,GENERAL-NEWS,"[{'e': 'text', 't': '🟢 GENERAL-NEWS'}]",,🟢 GENERAL-NEWS,dark,richtext,False,False,False,0,0,False,all_ads,/r/CryptoCurrency/comments/v0wr1o/some_investors_got_rich_before_ust_implosion/,False,link,"{'enabled': False, 'images': [{'id': 'Ru4EvIiX_dC8v4fV-sDJrbAc5S5zF4XActOH17pF5Lg', 'resolutions': [{'height': 60, 'url': 'https://external-preview.redd.it/hRq5tYSwB7eRcOI9AXedIabPdBaTVuBnoXwmpx0hq0s.jpg?width=108&amp;crop=smart&amp;auto=webp&amp;s=7a1c1deefc3e5d748b96292728619b2718ec0a7f', 'width': 108}, {'height': 121, 'url': 'https://external-preview.redd.it/hRq5tYSwB7eRcOI9AXedIabPdBaTVuBnoXwmpx0hq0s.jpg?width=216&amp;crop=smart&amp;auto=webp&amp;s=904c3988bda37631df87f7b317d8f48bfc92a193', 'width': 216}, {'height': 180, 'url': 'https://external-preview.redd.it/hRq5tYSwB7eRcOI9AXedIabPdBaTVuBnoXwmpx0hq0s.jpg?width=320&amp;crop=smart&amp;auto=webp&amp;s=11f8bf04a127e2eed760cdda8a0badb6293399e3', 'width': 320}, {'height': 360, 'url': 'https://external-preview.redd.it/hRq5tYSwB7eRcOI9AXedIabPdBaTVuBnoXwmpx0hq0s.jpg?width=640&amp;crop=smart&amp;auto=webp&amp;s=91d0e3b3c7d23b9c14fc903e1fba7b7e36077f5c', 'width': 640}, {'height': 540, 'url': 'https://external-preview.redd.it/hRq5tYSwB7eRcOI9AXedIabPdBaTVuBnoXwmpx0hq0s.jpg?width=960&amp;crop=smart&amp;auto=webp&amp;s=e1f6f0d3c7c2b19539fb6d25caacb523ec372eb3', 'width': 960}, {'height': 607, 'url': 'https://external-preview.redd.it/hRq5tYSwB7eRcOI9AXedIabPdBaTVuBnoXwmpx0hq0s.jpg?width=1080&amp;crop=smart&amp;auto=webp&amp;s=6a3f561dd1da695adefb649b7040de89e73143a4', 'width': 1080}], 'source': {'height': 1080, 'url': 'https://external-preview.redd.it/hRq5tYSwB7eRcOI9AXedIabPdBaTVuBnoXwmpx0hq0s.jpg?auto=webp&amp;s=dceb4d8708ef46ab41dddd7ace14ed68dc7a9603', 'width': 1920}, 'variants': {}}]}",6,1653904598,1,,True,False,False,CryptoCurrency,t5_2wlj3,4936497,public,https://a.thumbs.redditmedia.com/jqOCZIGEqFRz_Z26RMJeH_c0P6LsL3gFHdm0iePdJA4.jpg,78.0,140.0,"Some investors got rich before UST implosion, erasing $60 billion in value",0,[],1.0,https://www.cnbc.com/2022/05/29/who-got-rich-before-terra-stablecoin-collapsed.html,https://www.cnbc.com/2022/05/29/who-got-rich-before-terra-stablecoin-collapsed.html,all_ads,6,1653875787.0,new,
2,[],False,sery0401,,Warning-level1-1,"[{'e': 'text', 't': 'Bronze | QC: CC 19'}]",Bronze | QC: CC 19,dark,richtext,t2_j3a55,False,False,False,[],False,False,1653899909,thecryptobasic.com,https://www.reddit.com/r/CryptoCurrency/comments/v0vpfh/terra_ceo_do_kwon_is_now_under_new_investigation/,{},v0vpfh,False,False,False,False,False,False,False,False,#0aa18f,NEWS,"[{'e': 'text', 't': 'GENERAL-NEWS'}]",f170aab2-246f-11ec-8143-429a193c9848,GENERAL-NEWS,light,richtext,False,False,True,0,0,False,all_ads,/r/CryptoCurrency/comments/v0vpfh/terra_ceo_do_kwon_is_now_under_new_investigation/,False,link,"{'enabled': False, 'images': [{'id': 'kWeOIjjnfPH7_Z6-FJjj7Ou8NYY3WNQq3rn1BfMGpjw', 'resolutions': [{'height': 60, 'url': 'https://external-preview.redd.it/xzu33SCwUT8H4Y9a0MgEO0lUgq2UqQgluWTVzKsY9Gc.jpg?width=108&amp;crop=smart&amp;auto=webp&amp;s=a7fa8771ee78741020e2b4cc4f5ad40ecd494d8d', 'width': 108}, {'height': 120, 'url': 'https://external-preview.redd.it/xzu33SCwUT8H4Y9a0MgEO0lUgq2UqQgluWTVzKsY9Gc.jpg?width=216&amp;crop=smart&amp;auto=webp&amp;s=dd89b6bb1ce43fe8cc4df9f50fbc13104591001d', 'width': 216}, {'height': 177, 'url': 'https://external-preview.redd.it/xzu33SCwUT8H4Y9a0MgEO0lUgq2UqQgluWTVzKsY9Gc.jpg?width=320&amp;crop=smart&amp;auto=webp&amp;s=1b8694f88db77f2c38ae74eb9ca23cb41bc27443', 'width': 320}], 'source': {'height': 233, 'url': 'https://external-preview.redd.it/xzu33SCwUT8H4Y9a0MgEO0lUgq2UqQgluWTVzKsY9Gc.jpg?auto=webp&amp;s=4e74e354a6e09101bdc237f4ad504588807a89e4', 'width': 419}, 'variants': {}}]}",6,1653899920,1,,False,False,False,CryptoCurrency,t5_2wlj3,4936314,public,https://b.thumbs.redditmedia.com/XODAoeBYFlS8HD1l7wh6CKE2nJLVntDUN7sEdMy5VwQ.jpg,77.0,140.0,Terra CEO Do Kwon Is Now Under New Investigation of Alleged Price Manipulation of LUNA and UST,0,[],1.0,https://thecryptobasic.com/2022/05/30/terra-ceo-is-now-under-investigation-of-alleged-price-manipulation-of-luna-and-ust/,https://thecryptobasic.com/2022/05/30/terra-ceo-is-now-under-investigation-of-alleged-price-manipulation-of-luna-and-ust/,all_ads,6,1653871109.0,,moderator
3,[],False,Pezzonovante__,,Warning-level2-2,"[{'e': 'text', 't': 'Tin'}]",Tin,dark,richtext,t2_6aax8en8,False,False,False,[],False,False,1653879591,self.CryptoCurrency,https://www.reddit.com/r/CryptoCurrency/comments/v0qo6o/investing_in_crypto_is_like_playing_minesweeper/,{},v0qo6o,False,True,False,False,False,True,True,False,#7193ff,DISCUSSION,"[{'e': 'text', 't': 'DISCUSSION'}]",87049662-0882-11e5-82e1-0e9d1a9f7761,DISCUSSION,dark,richtext,False,False,True,1,0,False,all_ads,/r/CryptoCurrency/comments/v0qo6o/investing_in_crypto_is_like_playing_minesweeper/,False,,,6,1653879602,1,"Disclaimer: Read to the end because this post takes a turn you probably wouldn’t expect, it’s not about losing money, but about where the space can go. This is also a discussion, so there’s no wrong speculation or ideas. 

You guys remember the whole “You can play Bitcoin Minesweeper and win Bitcoin” thing? Well, we obviously have crypto games and literal gambling, but what if we used this logic when it comes to investing in crypto? 

Sure, Bitcoin is the Titan of all crypto currencies right now, but let’s look at alts to see some reasoning. Dozens of projects have evaporated leaving investors with nearly nothing, Clover being my favorite example. The real clover project was booming when there was a scam under a similar name, that’s what I mean when I say it’s very difficult to not step on mines when you’re investing in crypto. We can all talk about UST/LUNA, but it’s beating a dead horse. We can list tons of projects, but you get the point. 

With everything on the market having terrible macros right now, we can see that some of us have stepped on a mine in the market, but where are the “safe spots”? With crypto being incredibly risky and you kind of have to have balls to ape into anything we have to assess assets like it’s a website or a rudimentary program in 2009. People saw the potential of growing and developing websites and expanding on what we know, and fast forward 13 years, we have quantum computing in sight, so where do the big projects land if QC takes off? 

QC has genuine potential to rival even the fastest and lowest cost projects, so let’s think 15+ years from now: Will we see all of the strongest projects utilizing quantum mechanics and leaving speculation in the past? Let me know what you think about the end game of processing and development for the crypto space.",True,False,False,CryptoCurrency,t5_2wlj3,4935560,public,self,,,Investing in crypto is like playing Minesweeper,0,[],1.0,https://www.reddit.com/r/CryptoCurrency/comments/v0qo6o/investing_in_crypto_is_like_playing_minesweeper/,,all_ads,6,1653850791.0,new,
4,[],False,chuck_portis,,,"[{'e': 'text', 't': 'Platinum | QC: BTC 257, CC 16 | r/WSB 370'}]","Platinum | QC: BTC 257, CC 16 | r/WSB 370",dark,richtext,t2_30d5b0y2,False,False,False,[],False,False,1653851195,self.CryptoCurrency,https://www.reddit.com/r/CryptoCurrency/comments/v0i0fb/exploring_how_luna_defrauded_postattack_investors/,{},v0i0fb,False,True,False,False,False,True,True,False,#7193ff,DISCUSSION,"[{'e': 'text', 't': 'DISCUSSION'}]",87049662-0882-11e5-82e1-0e9d1a9f7761,DISCUSSION,dark,richtext,False,False,True,0,0,False,all_ads,/r/CryptoCurrency/comments/v0i0fb/exploring_how_luna_defrauded_postattack_investors/,False,self,"{'enabled': False, 'images': [{'id': 'NxMXdcm5y934bc5TY4ExZIregchWEslzkQnRcWHtIDE', 'resolutions': [{'height': 81, 'url': 'https://external-preview.redd.it/QnkU8QzMhiXdAxdG_hrO_FiXnFW357dbyWqoV2rgiLU.jpg?width=108&amp;crop=smart&amp;auto=webp&amp;s=e02b7076c3896747084afea907bef17adee26361', 'width': 108}, {'height': 162, 'url': 'https://external-preview.redd.it/QnkU8QzMhiXdAxdG_hrO_FiXnFW357dbyWqoV2rgiLU.jpg?width=216&amp;crop=smart&amp;auto=webp&amp;s=a199c93c54d8428eb69e2838b0d3638ef16f228d', 'width': 216}, {'height': 240, 'url': 'https://external-preview.redd.it/QnkU8QzMhiXdAxdG_hrO_FiXnFW357dbyWqoV2rgiLU.jpg?width=320&amp;crop=smart&amp;auto=webp&amp;s=ed4200e63a67d0e6751819cb6f2534f28e8f698e', 'width': 320}], 'source': {'height': 360, 'url': 'https://external-preview.redd.it/QnkU8QzMhiXdAxdG_hrO_FiXnFW357dbyWqoV2rgiLU.jpg?auto=webp&amp;s=62d588e8b7294e9a9d87e1831aef5f3954dd3c2c', 'width': 480}, 'variants': {}}]}",6,1653851205,1," 

Hey folks...

I made a video which outlines specifically how Do Kwon / LUNA project defrauded ""post-snapshot"" or ""post-attack"" investors. Let us recall that during the epic collapse of UST, LUNA was crashing even faster.  That was because the team decided the answer to the problem was to sell virtually infinite amounts of LUNA until eventually the outstanding UST supply became manageable.

This required new investors to purchase the newly minted LUNA.  The underlying value proposition in this case is that the new investors would have a much larger stake than previous investors.  They took on massive risk, the vast majority took huge losses on their purchase of LUNA.  The LUNA team then compounded their losses by essentially diluting them further by giving them a 10% allocation in the continuation of the project (versus a 35% allocation to ""pre-attack"" holders).

Essentially, they split LUNA tokens into two different classes of tokens with an arbitrary cutoff date (May 7). This was not communicated to new investors.  The team directly sold these new tokens to the public.  They even went so far as to increase the speed of the printing of new LUNA tokens, meaning they explicitly approved the sale of new LUNA to new investors and viewed it as imperative to saving the project.

In my mind, this amounts to fraud.

Full video: [https://www.youtube.com/watch?v=dV0saFaIsEA](https://www.youtube.com/watch?v=dV0saFaIsEA)",True,False,False,CryptoCurrency,t5_2wlj3,4934286,public,self,,,"Exploring How LUNA Defrauded ""Post-Attack"" Investors",0,[],1.0,https://www.reddit.com/r/CryptoCurrency/comments/v0i0fb/exploring_how_luna_defrauded_postattack_investors/,,all_ads,6,1653822395.0,,
5,[],False,chuloreddit,,,"[{'e': 'text', 't': 'Platinum | QC: CC 87 | BANANO 9'}]",Platinum | QC: CC 87 | BANANO 9,dark,richtext,t2_70b31,False,False,False,[],False,False,1653846425,vitalik.ca,https://www.reddit.com/r/CryptoCurrency/comments/v0gegi/vitalik_buterin_reveals_how_to_identify_a_ustlike/,{},v0gegi,False,True,False,False,False,True,False,False,#7193ff,DISCUSSION,"[{'e': 'text', 't': 'DISCUSSION'}]",87049662-0882-11e5-82e1-0e9d1a9f7761,DISCUSSION,dark,richtext,False,False,True,0,0,False,all_ads,/r/CryptoCurrency/comments/v0gegi/vitalik_buterin_reveals_how_to_identify_a_ustlike/,False,,,6,1653846435,1,,True,False,False,CryptoCurrency,t5_2wlj3,4934008,public,default,,,Vitalik Buterin Reveals How To Identify A UST-Like Algorithmic Stablecoin,0,[],1.0,https://vitalik.ca/general/2022/05/25/stable.html,https://vitalik.ca/general/2022/05/25/stable.html,all_ads,6,1653817625.0,,
6,[],False,chuloreddit,,,"[{'e': 'text', 't': 'Platinum | QC: CC 87 | BANANO 9'}]",Platinum | QC: CC 87 | BANANO 9,dark,richtext,t2_70b31,False,False,False,[],False,False,1653846346,zycrypto.com,https://www.reddit.com/r/CryptoCurrency/comments/v0gdiy/vitalik_buterin_reveals_how_to_identify_a_ustlike/,{},v0gdiy,False,True,False,False,False,True,False,False,#7193ff,DISCUSSION,"[{'e': 'text', 't': 'DISCUSSION'}]",87049662-0882-11e5-82e1-0e9d1a9f7761,DISCUSSION,dark,richtext,False,False,True,0,0,False,all_ads,/r/CryptoCurrency/comments/v0gdiy/vitalik_buterin_reveals_how_to_identify_a_ustlike/,False,link,"{'enabled': False, 'images': [{'id': '50SSw-MIUhWJPn9oaASIwIP5xiIbhpzUlTYKXd7AZsY', 'resolutions': [{'height': 63, 'url': 'https://external-preview.redd.it/8nAJRjFQUNGCDplPfXoDD_U-fcqhtEHYe-T219mwI4c.jpg?width=108&amp;crop=smart&amp;auto=webp&amp;s=e2481f360b7332a93117f6a1b45b3a9158786283', 'width': 108}, {'height': 126, 'url': 'https://external-preview.redd.it/8nAJRjFQUNGCDplPfXoDD_U-fcqhtEHYe-T219mwI4c.jpg?width=216&amp;crop=smart&amp;auto=webp&amp;s=56a17ddad15cb322b834361aed1baa09b417b809', 'width': 216}, {'height': 186, 'url': 'https://external-preview.redd.it/8nAJRjFQUNGCDplPfXoDD_U-fcqhtEHYe-T219mwI4c.jpg?width=320&amp;crop=smart&amp;auto=webp&amp;s=190e94866dad656a9d92bc3f21b6c8704de027b3', 'width': 320}, {'height': 373, 'url': 'https://external-preview.redd.it/8nAJRjFQUNGCDplPfXoDD_U-fcqhtEHYe-T219mwI4c.jpg?width=640&amp;crop=smart&amp;auto=webp&amp;s=a71a0c22fbe71b89ccb63fae02a0d054312b7d4f', 'width': 640}, {'height': 560, 'url': 'https://external-preview.redd.it/8nAJRjFQUNGCDplPfXoDD_U-fcqhtEHYe-T219mwI4c.jpg?width=960&amp;crop=smart&amp;auto=webp&amp;s=c02c786c4d4f20f44ca783f03be1085ffe5ebd57', 'width': 960}, {'height': 630, 'url': 'https://external-preview.redd.it/8nAJRjFQUNGCDplPfXoDD_U-fcqhtEHYe-T219mwI4c.jpg?width=1080&amp;crop=smart&amp;auto=webp&amp;s=55b2ab65240cdc04164a9056b4b7df39c9a31ad1', 'width': 1080}], 'source': {'height': 700, 'url': 'https://external-preview.redd.it/8nAJRjFQUNGCDplPfXoDD_U-fcqhtEHYe-T219mwI4c.jpg?auto=webp&amp;s=cd228f715960fc620f7df26a36f4717fd6be8397', 'width': 1200}, 'variants': {}}]}",6,1653846360,1,,True,False,False,CryptoCurrency,t5_2wlj3,4934000,public,https://b.thumbs.redditmedia.com/8clx5_rC5jeO7NWGGYExTxrmOzrn5WGbb2JB6cgC2cY.jpg,81.0,140.0,Vitalik Buterin Reveals How To Identify A UST-Like Algorithmic Stablecoin,0,[],1.0,https://zycrypto.com/vitalik-buterin-reveals-how-to-identify-a-ust-like-algorithmic-stablecoin-following-terras-collapse/,https://zycrypto.com/vitalik-buterin-reveals-how-to-identify-a-ust-like-algorithmic-stablecoin-following-terras-collapse/,all_ads,6,1653817546.0,,
7,[],False,litlee,,Warning-level2-2,"[{'e': 'text', 't': 'Tin'}]",Tin,dark,richtext,t2_13j8mc,False,False,False,[],False,False,1653840241,self.CryptoCurrency,https://www.reddit.com/r/CryptoCurrency/comments/v0ea6j/binance_cz_we_accept_full_responsibility_for/,{},v0ea6j,False,True,False,False,False,True,True,False,#c403f5,COMEDY,"[{'e': 'text', 't': 'COMEDY'}]",5c104cfc-d7c8-11e4-9d14-22000b6902b0,COMEDY,dark,richtext,False,False,False,0,0,False,all_ads,/r/CryptoCurrency/comments/v0ea6j/binance_cz_we_accept_full_responsibility_for/,False,,,6,1653840252,1,"Binance CEO Changpeng Zhao has accepted that it was the responsibility of his platform, Binance, to ensure that investors money was safe in the volatile crypto space. 

""These people did not know what they were putting their money into""

He sympathetically remarked

""Binance should not be listing any cryptocurrencies which have the potential to crash to zero""

He has since headed full enquiries into all other cryptocurrencies on the platform 

""Results [of the enquiries] have been extremely disturbing."" 

He went on to say:

""All crypto could potentially go to zero due to outside factors which could potentially happen at amy time""

This disturbing news comes as crypto is in a precarious position with even the biggest crypto celebrity, Bitcoin, heading for its 9th red week in a row.

""We have decided to refund all investors in Luna and UST as long as they can prove that they did not know what they were investing in when they purchased these currencies on our platform""

He went into further detail about what would constitute ""proof"" mentioning such criteria as:


Previous investment in safemoon or doge

Twitter pictures with lazer eyes of any colour

Any post march 2020 ""investment"" in GME

Any ADA purchases over $2 

Repeated comments along the lines of ""this is the way"" or ""HODL""

Any comments in the last 2 months claiming crypto is in a bull market

He then announced that he would be checking the comment section on various platforms to approve other ""proof"" of uninformed investment and welcomes all suggestions.

Great news for all r/cryptocurrency subscribers!",True,False,False,CryptoCurrency,t5_2wlj3,4933702,public,self,,,"Binance CZ: ""We accept full responsibility for listing unsafe Luna and UST, We will refund all purchases on our platform dating back to first listing""",0,[],1.0,https://www.reddit.com/r/CryptoCurrency/comments/v0ea6j/binance_cz_we_accept_full_responsibility_for/,,all_ads,6,1653811441.0,,
